File,product_name,brand,usage_type,category,ingredients,image_url,product_url
1801-2000.csv,"Eucerin Anti Age Night Cream, Hyaluron 3x+ Filler, 50 mL",Eucerin,Anti-Aging/Anti-Wrinkle,Anti-Aging,"1,2-Hexanediol, Acrylates/C10-30 Alkyl Acrylate Crosspolymer, Aqua, Butylene Glycol, Butyrospermum Parkii Butter, Caprylic/Capric Triglyceride, Caprylyl Glycol, Carbomer, Cetyl Alcohol, Citric Acid, Dexpanthenol, Dimethicone, Glycerin, Glyceryl Stearate Citrate, Glycine Soja Germ Extract, Hydrogenated Coco-Glycerides, Isopropyl Palmitate, Methyl Methacrylate Crosspolymer, Octyldodecanol, Panthenol, Pantolactone, Parfum, Phenoxyethanol, Sodium Hyaluronate, Sodium Hydroxide, Stearyl Alcohol, Tocopherol, Trisodium Edta",https://cdn1.skinsafeproducts.com/photo/F7AB52D9F712A8/large_1709369860.pngpng?1709369860,https://www.skinsafeproducts.com/eucerin-anti-age-night-cream-hyaluron-3x-filler-50-ml
1801-2000.csv,"Eucerin pH5 Advanced Repair Body Cream, 450 mL",Eucerin,Body,Creams,"Alanine, Aqua, Arginine Hcl, Butyrospermum Parkii Butter, Caprylic-Capric-Triglyceride, Carnitine, Ceramide Np, Cetearyl Alcohol, Cholesterol, Chondrus Crispus Extract, Decylene Glycol, Dicaprylyl Ether, Dimethicone, Ethylhexyl Cocoate, Glycerin, Glyceryl Glucoside, Glyceryl Stearate Se, Glycine, Helianthus Annuus Seed Oil, Hydrogenated Coco-Glycerides, Lactic Acid, Methyl Benzoate, Octyldodecanol, Parfum, Pentylene Glycol, Phenoxyethanol, Sodium Cetearyl Sulfate, Sodium Chloride, Sodium Lactate, Sodium Pca, Tapioca Starch, Tocopherol, Urea",https://cdn1.skinsafeproducts.com/photo/B0A49EF37A34B2/large_1705041996.pngpng?1705041996,https://www.skinsafeproducts.com/eucerin-ph5-advanced-repair-body-cream-450-ml
1801-2000.csv,"Eucerin Ultra Protection Glowing Uv Serum, SPF 50+ PA++, 30 mL",Eucerin,Face,Moisturizers with SPF,"Acrylates Copolymer, Aluminum Hydroxide, Aqua, Bis-Ethylhexyloxyphenol Methoxyphenyl Triazine, Butylene Glycol, Butyloctyl Salicylate, Caprylyl Glycol, Cellulose Gum, Cetearyl Olivate, Cetyl Alcohol, Dibutyl Adipate, Diethylamino Hydroxybenzoyl Hexyl Benzoate, Disodium Edta, Ethylhexyl Salicylate, Ethylhexylglycerin, Glycyrrhiza Glabra Root Extract, Hexylene Glycol, Hydrogenated Lecithin, Isohexadecane, Niacinamide, Panthenol, Polyglyceryl-10 Oleate, Polysorbate 80, Titanium Dioxide",https://cdn1.skinsafeproducts.com/photo/6A1C8E1DFE49D8/large_1705404373.pngpng?1705404373,https://www.skinsafeproducts.com/eucerin-ultra-protection-glowing-uv-serum-spf-50-pa-30-ml
1801-2000.csv,"Eucerin Dermato Clean Cleansing Gel, Sensitive Skin, 200 mL",Eucerin,Facial Cleansers,Facial Gels,"Acrylates/C10-30 Alkyl Acrylate Crosspolymer, Aqua, Coco-Betaine, Coco-Glucoside, Glycerin, Glyceryl Glucoside, Sodium Benzoate, Sodium Chloride, Sodium Hyaluronate, Trisodium Edta",https://cdn1.skinsafeproducts.com/photo/B79FE6A7F3D6D5/large_1705300805.pngpng?1705300805,https://www.skinsafeproducts.com/eucerin-dermato-clean-cleansing-gel-sensitive-skin-200-ml
1801-2000.csv,"Eucerin Anti - Pigment Ultra - Light Serum, 30 mL",Eucerin,Skin Treatments,Serums,"Alcohol Denat, Aqua, Caprylic/Capric Triglyceride, Carbomer, Cetyl Alcohol, Dibutyl Adipate, Dicaprylyl Carbonate, Ethylhexylglycerin, Glycerin, Isobutylamido Thiazolyl Resorcinol, Parfum, Phenoxyethanol, Propylheptyl Caprylate, Sodium Chloride, Sodium Hyaluronate, Sodium Hydroxide, Sodium Stearoyl Glutamate, Trisodium Edta",https://cdn1.skinsafeproducts.com/photo/C82CFC69B250B9/large_1703583000.pngpng?1703583000,https://www.skinsafeproducts.com/eucerin-anti-pigment-ultra-light-serum-30-ml
1801-2000.csv,"Eucerin Ultra Sensitive Dry Skin Soothing Care, 50 mL",Eucerin,Body,Creams,"4-T-Butylcyclohexanol, Aqua, Arginine Hcl, Butyrospermum Parkii Butter, Caprylyl Glycol, Cetyl Palmitate, Glycerin, Methyl Palmitate, Methylpropanediol, Olus Oil, Panthenol, Pentylene Glycol, Sodium Polyacrylate",https://cdn1.skinsafeproducts.com/photo/981504FA643B78/large_1701941494.pngpng?1701941494,https://www.skinsafeproducts.com/eucerin-ultra-sensitive-dry-skin-soothing-care-50-ml
1801-2000.csv,"Eucerin Face Fluid Dermo Purifier Oil Control, SPF 30, 50 mL",Eucerin,Skin Care,Acne Care (OTC),"Alcohol Denat, Aqua, Bis-Ethylhexyloxyphenol Methoxyphenyl Triazine, Butyl Methoxydibenzoylmethane, Butylene Glycol Dicaprylate/Dicaprate, C12-15 Alkyl Benzoate, Carnitine, Carrageenan, Cetearyl Alcohol, Copernicia Cerifera Cera, Decylene Glycol, Dibutyl Adipate, Diethylamino Hydroxybenzoyl Hexyl Benzoate, Dimethicone, Ethylhexyl Triazone, Ethylhexylglycerin, Glycerin, Glycyrrhiza Inflata Root Extract, Hydroxyacetophenone, Hydroxypropyl Methylcellulose, Phenoxyethanol, Phenylbenzimidazole Sulfonic Acid, Silica, Silica Dimethyl Silylate, Sodium Chloride, Sodium Hydroxide, Sodium Stearoyl Glutamate, Trisodium Edta, Xanthan Gum",https://cdn1.skinsafeproducts.com/photo/7422D35215A8C6/large_1701425088.pngpng?1701425088,https://www.skinsafeproducts.com/eucerin-face-fluid-dermo-purifier-oil-control-spf-30-50-ml
1801-2000.csv,"Eucerin Aquaphor Skin Soothing Balm, 45 mL",Eucerin,Body,"Balms, Ointments & Salves","Bisabolol, Cera Microcristallina/Hydrogenated Microcrystalline Wax, Ceresin, Glycerin, Lanolin Alcohol, Panthenol, Paraffinum Liquidum",https://cdn1.skinsafeproducts.com/photo/7A9566C12D0E45/large_1700567324.pngpng?1700567324,https://www.skinsafeproducts.com/eucerin-aquaphor-skin-soothing-balm-45-ml
1801-2000.csv,"Eucerin Lip Active, SPF 20, 4.8 g",Eucerin,Lip Care,"Lip Balms, Gels, Moisturizers & Oils","Aqua, Aroma, Ascorbyl Palmitate, Bis-Diglyceryl Polyacyladipate-2, Butyl Methoxydibenzoylmethane, Butyrospermum Parkii Butter, Cera Alba, Citric Acid, Ethylhexyl Triazone, Helianthus Annuus Seed Cera, Helianthus Annuus Seed Oil, Hydrogenated Castor Oil, Octyldodecanol, Panthenol, Pantolactone, Polyglyceryl-4 Isostearate, Ricinus Communis Seed Oil, Simmondsia Chinensis Seed Oil, Sodium Citrate, Tocopherol, Tocopheryl Acetate",https://cdn1.skinsafeproducts.com/photo/029D12B85F875E/large_1695098154.pngpng?1695098154,https://www.skinsafeproducts.com/eucerin-lip-active-spf-20-4-8-g
1801-2000.csv,"Eucerin AtopiControl Body Lotion, 400 mL",Eucerin,Body,Lotions,"1,2-Hexanediol, Aqua, Ascorbyl Palmitate, Bht, Ceramide Np, Citric Acid, Dimethicone, Glycerin, Glycyrrhiza Inflata Root Extract, Hydrogenated Castor Oil, Magnesium Sulfate, Methoxy Peg-22/Dodecyl Glycol Copolymer, Octyldodecanol, Oenothera Biennis Oil, Ozokerite, Paraffinum Liquidum, Peg-2 Hydrogenated Castor Oil, Peg-45 Dodecyl Glycol Copolymer, Peg-7 Hydrogenated Castor Oil, Phenoxyethanol, Potassium Sorbate, Sodium Citrate, Sorbitan Isostearate, Tocopherol, Vitis Vinifera Seed Oil",https://cdn1.skinsafeproducts.com/photo/09049C17908B46/large_1694682778.pngPNG?1694682778,https://www.skinsafeproducts.com/eucerin-atopicontrol-body-lotion-400-ml
1801-2000.csv,"Eucerin Face Skin Balance Facial Night Cream, 1.7 oz/48 g",Eucerin,Face,Nighttime Moisturizers,"4-T-Butylcyclohexanol, Arginine Hcl, Butyrospermum Parkii (Shea) Butter, Caprylyl Glycol, Cetyl Palmitate, Citric Acid, Glycerin, Methyl Palmitate, Methylpropanediol, Panthenol, Pantolactone, Pentylene Glycol, Sodium Hydroxide, Sodium Polyacrylate, Vegetable Oil, Water",https://cdn1.skinsafeproducts.com/photo/2AA77EC81D1B6D/large_1671088516.pngpng?1671088516,https://www.skinsafeproducts.com/eucerin-face-skin-balance-facial-night-cream-1-7-oz-48-g
1801-2000.csv,"Eucerin Spotless Brightening Gentle Cleansing Foam, 150 g",Eucerin,Facial Cleansers,Facial Foaming Cleansers,"Aqua, Bht, Bisabolol, Cera Alba, Disodium Edta, Glycerin, Glyceryl Stearate, Octadecenedioic Acid, Parfum, Peg-150, Peg-8, Potassium Laurate, Potassium Myristate, Potassium Stearate, Propylene Glycol, Sodium Methyl Cocoyl Taurate",https://cdn1.skinsafeproducts.com/photo/834A07F3EB2147/large_1661415614.pngPNG?1661415614,https://www.skinsafeproducts.com/eucerin-spotless-brightening-gentle-cleansing-foam-150-g
1801-2000.csv,"Eucerin Hyaluron Filler + Elasticity 3D Serum, 30 mL",Eucerin,Skin Treatments,Serums,"Alcohol Denat, Aqua, Arctium Lappa Fruit Extract, Butyl Methoxydibenzoylmethane, Cetearyl Isononanoate, Dimethicone, Distarch Phosphate, Glucosylrutin, Glycerin, Glyceryl Stearate, Glycyrrhiza Inflata Root Extract, Isobutylamido Thiazolyl Resorcinol, Isopropyl Palmitate, Isoquercitrin, Methylpropanediol, Octocrylene, Parfum, Pentaerythrityl Tetra-Di-T-Butyl Hydroxyhydrocinnamate, Phenoxyethanol, Sodium Chloride, Sodium Hyaluronate, Sodium Polyacrylate, Sodium Stearoyl Glutamate, Tocopherol, Trisodium Edta",https://cdn1.skinsafeproducts.com/photo/52523D53130E1F/large_1651812398.pngpng?1651812398,https://www.skinsafeproducts.com/eucerin-hyaluron-filler-elasticity-3d-serum-30-ml
1801-2000.csv,"Eucerin Skin Balance Facial Day Cream, Tri-Balance Complex, 1.7 oz/48 g",Eucerin,Face,Creams,"4-T-Butylcyclohexanol, Butyrospermum Parkii (Shea) Butter, Caprylyl Glycol, Cetyl Palmitate, Citric Acid, Glycerin, Glycyrrhiza Inflata Root Extract, Methyl Palmitate, Methylpropanediol, Panthenol, Pantolactone, Pentylene Glycol, Sodium Hydroxide, Sodium Polyacrylate, Vegetable Oil, Water",https://cdn1.skinsafeproducts.com/photo/66434215A5456C/large_1650528228.jpeg?1650528228,https://www.skinsafeproducts.com/eucerin-skin-balance-facial-day-cream-tri-balance-complex-1-7-oz-48-g
1801-2000.csv,"Eucerin Ph5 Lotion, Dry Sensitive Skin, 400 ml",Eucerin,Body,Lotions,"Aqua, Benzyl Alcohol, Bht, C15-19 Alkane, Caprylic Capric Triglyceride, Caprylyl Glycol, Carbomer, Cetyl Alcohol, Cetyl Palmitate, Citric Acid, Dimethicone, Glycerin, Glyceryl Stearate Se, Hydrogenated Coco-Glycerides, Panthenol, Parfum, Pentylene Glycol, Phenoxyethanol, Polybutene, Sodium Cetearyl Sulfate, Sodium Citrate, Sodium Hydroxide, Sorbitan Stearate, Stearyl Alcohol, Tapioca Starch, Tocopheryl Acetate, Trisodium Edta",https://cdn1.skinsafeproducts.com/photo/AA62F62DC85479/large_1646653054.pngpng?1646653054,https://www.skinsafeproducts.com/eucerin-ph5-lotion-dry-sensitive-skin-400-ml
1801-2000.csv,"Eucerin Dermato Clean Cleansing Gel, 200 mL",Eucerin,Facial Cleansers,Facial Gels,"Acrylates-C10-30-Alkyl-Acrylate-Crosspolymer, Aqua, Coco Glucoside, Coco-Betaine, Glycerin, Glyceryl Glucoside, Sodium Benzoate, Sodium Chloride, Sodium Hyaluronate, Trisodium Edta",https://cdn1.skinsafeproducts.com/photo/22C30CC84AD137/large_1645674395.jpeg?1645674395,https://www.skinsafeproducts.com/eucerin-dermato-clean-cleansing-gel-200-ml
1801-2000.csv,"Eucerin Moisturizing Creme, Original, Dry Skin Therapy, 20 oz/567 g",Eucerin,Body,Creams,"Ceresin, Lanolin Alcohol, Methylchloroisothiazolinone, Methylisothiazolinone, Mineral Oil, Petrolatum, Water",https://cdn1.skinsafeproducts.com/photo/EF1FBDE06486B6/large_1642512536.jpeg?1642512536,https://www.skinsafeproducts.com/eucerin-moisturizing-creme-original-dry-skin-therapy-20-oz-567-g
2001-2200.csv,"Eucerin Ph5 Light Lotion, Normal To Dry Sensitive Skin, 400 mL",Eucerin,Body,Lotions,"Acrylates/C10-30 Alkyl Acrylate Crosspolymer, Alcohol Denat, Ammonium Acryloyldimethyltaurate/Vp Copolymer, Aqua, Butyrospermum Parkii Butter, C12-15 Alkyl Benzoate, Cetyl Palmitate, Citric Acid, Ethylhexylglycerin, Glycerin, Isopropyl Palmitate, Methyl Palmitate, Panthenol, Parfum, Phenoxyethanol, Propylheptyl Caprylate, Sodium Citrate, Sodium Hydroxide, Tapioca Starch",https://cdn1.skinsafeproducts.com/photo/E66C1FC7A47BEC/large_1630306678.jpeg?1630306678,https://www.skinsafeproducts.com/eucerin-ph5-light-lotion-normal-to-dry-sensitive-skin-400-ml
2001-2200.csv,"Eucerin pH5 Syndet Gel, 400 mL/418 g",Eucerin,Body,Lotions,"Aqua, Citric Acid, Coco-Glucoside, Glycerin, Glycol Distearate, Lauryl Glucoside, Methylpropanediol, Panthenol, Parfum, Peg-200 Hydrogenated Glyceryl Palmate, Peg-40 Hydrogenated Castor Oil, Polyquaternium-10, Sodium Benzoate, Sodium Chloride, Sodium Citrate, Sodium Cocoamphoacetate, Sodium Myreth Sulfate",https://cdn1.skinsafeproducts.com/photo/79FFEEA238276B/large_1625863376.pngPNG?1625863376,https://www.skinsafeproducts.com/eucerin-ph5-syndet-gel-400-ml-418-g
2001-2200.csv,"Eucerin Hydrating Cleansing Gel, 6.8 fl oz / 200 ml",Eucerin,Facial Cleansers,Facial Gels,"Acrylates/C10-30 Alkyl Acrylate Crosspolymer, Coco Glucoside (Coconut-Based Cleanser), Coco-Betaine (Coconut Or Other Plant), Glycerin, Glyceryl Glucoside, Sodium Benzoate, Sodium Chloride, Sodium Hyaluronate, Trisodium Edta, Water",https://cdn1.skinsafeproducts.com/photo/4E63FD7C495599/large_1618992105.png?1618992105,https://www.skinsafeproducts.com/eucerin-hydrating-cleansing-gel-6-8-fl-oz-200-ml
2001-2200.csv,Eucerin Skin Calming Intensive Itch Relief Lotion,Eucerin,Body,Creams,"Acrylates/C10-30 Alkyl Acrylate Crosspolymer, Avena Sativa (Oat) Flour, Benzyl Alcohol, Caprylic/Capric Triglyceride, Caprylyl Glycol, Cetearyl Alcohol, Cetyl Alcohol, Citric Acid, Dimethicone, Glycerin (Plant Derived), Glyceryl Stearate, Isopropyl Stearate, Menthol, Myristyl Myristate, Octyldodecanol, Oenothera Biennis (Evening Primrose) Oil, Peg-40 Castor Oil, Phenoxyethanol, Polyglyceryl-3 Methylglucose Distearate, Potassium Sorbate, Sodium Cetearyl Sulfate, Sodium Citrate, Water/Aqua/Eau",https://cdn1.skinsafeproducts.com/photo/604D51DF59B6D2/large_1609279416.jpeg?1609279416,https://www.skinsafeproducts.com/eucerin-skin-calming-intensive-itch-relief-lotion
2001-2200.csv,"Eucerin Daily Hydration Cream Broad Spectrum SPF 30, 8 oz/226 g",Eucerin,Body,Creams,"1-2-Hexanediol, Acrylates/C10-30 Alkyl Acrylate Crosspolymer, Avobenzone, Benzyl Alcohol, Butylene Glycol, Cetyl Alcohol, Decylene Glycol, Dimethicone, Glycerin (Plant Derived), Glyceryl Stearate, Glycyrrhiza Inflata Root Extract, Homosalate, Hydrogenated Coco-Glycerides, Myristyl Myristate, Octisalate (Octyl Salicylate), Octocrylene 9.0%, Palmitic Acid, Phenoxyethanol, Silica Dimethyl Silylate, Sodium Hydroxide, Stearic Acid, Stearyl Alcohol, Tapioca Starch, Trisodium Edta, Water/Aqua/Eau, Xanthan Gum",https://cdn1.skinsafeproducts.com/photo/BCC03A61BC782F/large_1608043201.jpeg?1608043201,https://www.skinsafeproducts.com/eucerin-daily-hydration-body-creme-broad-spectrum-spf-30
2001-2200.csv,Eucerin Eczema Relief Body Creme,Eucerin,Body,Creams,"1-2-Hexanediol, Avena Sativa (Oat) Flour, Benzyl Alcohol, Caprylic/Capric Triglyceride, Caprylyl Glycol, Ceramide Np, Cetyl Alcohol, Cetyl Palmitate, Citric Acid, Ethylhexylglycerin, Glycerin (Plant Derived), Glyceryl Stearate, Glycyrrhiza Inflata Root Extract, Mineral Oil, Octyldodecanol, Peg-40 Stearate, Phenoxyethanol, Piroctone Olamine, Ricinus Communis (Castor) Seed Oil, Water/Aqua/Eau",https://cdn1.skinsafeproducts.com/photo/260B41CDF9865E/large_1607387895.jpeg?1607387895,https://www.skinsafeproducts.com/eucerin-eczema-relief-body-creme
2001-2200.csv,Eucerin Eczema Relief Body Cream,Eucerin,Body,Creams,"1-2-Hexanediol, Avena Sativa (Oat) Flour, Benzyl Alcohol, Caprylic/Capric Triglyceride, Caprylyl Glycol, Ceramide Np, Cetyl Alcohol, Cetyl Palmitate, Citric Acid, Ethylhexylglycerin, Glycerin (Plant Derived), Glyceryl Stearate, Glycyrrhiza Inflata Root Extract, Mineral Oil, Octyldodecanol, Peg-40 Stearate, Phenoxyethanol, Piroctone Olamine, Ricinus Communis (Castor) Seed Oil, Water/Aqua/Eau",https://cdn1.skinsafeproducts.com/photo/DA40F8344ABF7C/large_1607387114.jpeg?1607387114,https://www.skinsafeproducts.com/eucerin-eczema-relief-body-cream
2001-2200.csv,"Eucerin pH5 Skin-Protection Syndet Sustituto del Jabon, 100 g",Eucerin,Cleansers,Bar Soaps,"Benzyl Alcohol, Benzyl Salicylate, Cetearyl Alcohol, Ci 77891, Citric Acid, Cocoamidopropyl Betaine (Coconut Derivative), Diammonium Citrate, Disodium Lauryl Sulfosuccinate, Glyceryl Stearate, Hexyl Cinnamal, Hydroxyisohexyl 3-Cyclohexene Carboxaldehyde, Lanolin Alcohol, Limonene, Linalool, Octyldodecanol, Paraffin, Parfum, Peg 150, Sodium Cocoyl Isethionate, Triticum Vulgare (Wheat) Starch, Water\Aqua\Eau",https://cdn1.skinsafeproducts.com/photo/01E56259E4DAF4/large_1515597611.pngPNG?1515597611,https://www.skinsafeproducts.com/eucerin-ph5-skin-protection-syndet-sustituto-del-jabon-100-g
2001-2200.csv,"Eucerin pH5 Skin Protection Crema Liquida,",Eucerin,Face,Lotions,"Aluminum Starch Octenylsuccinate, Cetyl Alcohol, Cetyl Palmitate, Citric Acid, Dimethicone, Ethylhexylglycerin, Glycerin, Mineral Oil, Panthenol, Parfum, Pentylene Glycol, Phenoxyethanol, Polybutene, Sodium Carbomer, Sodium Citrate, Sorbitan Stearate, Tocopheryl Acetate, Water\Aqua\Eau",https://cdn1.skinsafeproducts.com/photo/ADA60F31CF3050/large_1491253916.jpegjpg?1491253916,https://www.skinsafeproducts.com/eucerin-ph5-skin-protection-crema-liquida
2001-2200.csv,"Eucerin DermoDENSIFYER Crema de Noche, 50 mL",Eucerin,Face,Nighttime Moisturizers,"Arctium Lappa Fruit Extract, Caprylic/Capric Triglyceride, Caprylyl Glycol, Cetyl Alcohol, Cetyl Palmitate, Dehydroacetic Acid, Dicaprylyl Ether, Dimethicone, Glycerin, Glyceryl Stearate Citrate, Hydrogenated Coco-Glycerides, Isopropyl Palmitate, Octyldodecanol, Pantenol, Parfum, Phenoxyethanol, Pimpinella Anisum Fruit Extract, Polymethylsilsesquioxane, Sodium Carbomer, Stearyl Alcohol, Synthetic Beeswax, Tocopherol (Multisource), Trisodium Edta, Water\Aqua\Eau",https://cdn1.skinsafeproducts.com/photo/bCeygQFAZUhxvwvwZwNERQ/large_1476915763.jpegJPG?1476915763,https://www.skinsafeproducts.com/eucerin-dermodensifyer-crema-de-noche-50-ml
2001-2200.csv,"Eucerin Hyaluron-Filler Crema de Día para piel secas, 50 mL",Eucerin,Face,Daytime Moisturizers,"1,2-Hexanediol, Acrylates/C10-30 Alkyl Acrylate Crosspolymer, African Shea Butter, Bht, Butyl Methoxydibenzoylmethane, Butylene Glycol, Carbomer, Cetyl Alcohol, Ci 77891, Dimethicone, Glycerin, Glyceryl Stearate Citrate, Glycine Soja (Soybean) Extract, Hydrogenated Coco-Glycerides, Methylpropanediol, Mica, Octisalate, Octocrylene, Parfum, Phenoxyethanol, Silica, Sodium Hyaluronate, Stearyl Alcohol, Trisodium Edta, Water\Aqua\Eau",https://cdn1.skinsafeproducts.com/photo/tHanzALeVC5ZZ2wBpbo2Nw/large_1476924344.jpegJPG?1476924344,https://www.skinsafeproducts.com/eucerin-hyaluron-filler-crema-de-dia-para-piel-secas-50-ml
2001-2200.csv,"Eucerin AtopiControl Locion, 12% Omega, 400 mL",Eucerin,Body,Lotions,"1,2-Hexanediol, Ascorbyl Palmitate, Bht, Cera Microcristalina, Ceramide 3, Citric Acid, Dimethicone, Glycerin, Glycyrrhiza Inflata Root Extract, Hydrogenated Castor Oil, Magnesium Sulfate, Methoxy Peg-22-Dodecyl Glycol Copolymer, Octyldodecanol, Oenothera Biennis Oil, Ozokerite, Parafina LíQuida (Petrolatum), Peg-2 Hydrogenated Castor Oil, Peg-45 Dodecyl Glycol Copolymer, Peg-7 Hydrogenated Castor Oil, Phenoxyethanol, Potassium Sorbate, Sodium Citrate, Sorbitan Isostearate, Tocopherol (Multisource), Vitis Vinifera (Grape) Seed Oil, Water\Aqua\Eau",https://cdn1.skinsafeproducts.com/photo/Qlt1EEcfLtiz201kSIxdEw/large_1476909365.jpegJPG?1476909365,https://www.skinsafeproducts.com/eucerin-atopicontrol-locion-12-omega-400-ml-0
2001-2200.csv,"Eucerin Daily Protection Face Lotion SPF 30, 4.0 oz",Eucerin,Face,Moisturizers with SPF,"Alumina, C12 15 Alkyl Benzoate, Ceteareth 20, Cetearyl Alcohol, Cetyl Alcohol, Cyclomethicone, Dimethicone, Dmdm Hydantoin, Ensulizole, Glycerin, Glyceryl Stearate Se, Hydrogenated Coco Glycerides, Lactic Acid, Octinoxate, Octisalate, Peg 40 Castor Oil, Phenoxyethanol, Simethicone, Sodium Cetearyl Sulfate, Sodium Hydroxide, Sodium Lactate, Titanium Dioxide, Trisodium Edta, Vp/Hexadecene Copolymer, Xanthan Gum, Zinc Oxide",https://cdn1.skinsafeproducts.com/photo/grGAoEdPZnwhLvN2eet-YQ/large_1460154709.jpegjpg?1460154709,https://www.skinsafeproducts.com/eucerin-daily-protection-moisturizing-face-lotion-spf-30-4-0-oz
201-400.csv,"Eucerin Urea Repair Plus Lotion 10%, 250 mL",Eucerin,Body,Lotions,"1,2-Hexanediol, Alanine, Aqua, Arginine, Arginine Hcl, Butyrospermum Parkii Butter, Carnitine, Ceramide Np, Cetearyl Alcohol, Citrulline, Dicaprylyl Ether, Glutamic Acid, Glycerin, Glyceryl Glucoside, Glycogen, Histidine Hci, Isopropyl Stearate, Lactic Acid, Lysine Hci, Mannitol, Pca, Phenoxyethanol, Polyglyceryl-4 Diisostearate/Polyhydroxystearate/Sebacate, Potassium Sorbate, Serine, Sodium Chloride, Sodium Lactate, Sodium Pca, Sucrose, Tapioca Starch, Threonine, Urea",https://cdn1.skinsafeproducts.com/photo/C56D7280D20EE4/large_1754909741.jpeg?1754909741,https://www.skinsafeproducts.com/eucerin-urea-repair-plus-lotion-10-250-ml
201-400.csv,"Eucerin Advanced Repair Lotion, 33.8 fl oz/1000 mL",Eucerin,Body,Lotions,"1-2-Hexanediol, Alanine, Arginine Hcl, Butyrospermum Parkii Butter, Caprylic-Capric-Triglyceride, Carnitine, Ceramide Np, Cetearyl Alcohol, Chondrus Crispus, Citrulline, Cyclomethicone, Dicaprylyl Ether, Dimethiconol, Glutamic Acid, Glycerin, Glyceryl Glucoside, Glyceryl Stearate Se, Glycogen, Histidine, Hydrogenated Coco-Glycerides, Lactic Acid, Lysine, Mannitol, Methylpropanediol, Octyldodecanol, Phenoxyethanol, Serine, Sodium Cetearyl Sulfate, Sodium Chloride, Sodium Lactate, Sodium Pca, Sucrose, Tapioca Starch, Threonine, Urea, Water",https://cdn1.skinsafeproducts.com/photo/DE54655F9F8622/large_1743171851.pngpng?1743171851,https://www.skinsafeproducts.com/eucerin-advanced-repair-lotion-33-8-fl-oz-1000-ml
201-400.csv,"Eucerin Urea Repair Plus Hand Cream, Urea + Ceramide, 2.53 oz/75 mL",Eucerin,Hand,Creams,"Alanine, Aqua, Arginine Hcl, Carnitine, Ceramide Np, Cetearyl Alcohol, Cholesterol, Decylene Glycol, Dibutyl Adipate, Dicaprylyl Ether, Dimethicone, Glycerin, Glyceryl Stearate, Glyceryl Stearate Se, Glycine, Helianthus Annuus Seed Oil, Lactic Acid, Pentylene Glycol, Phenoxyethanol, Sodium Cetearyl Sulfate, Sodium Chloride, Sodium Lactate, Sodium Pca, Stearyl Alcohol, Tapioca Starch, Urea, Xanthan Gum",https://cdn1.skinsafeproducts.com/photo/12CEF50FF73E54/large_1733043097.pngpng?1733043097,https://www.skinsafeproducts.com/eucerin-urea-repair-plus-hand-cream-urea-ceramide-2-53-oz-75-ml
201-400.csv,"Eucerin Intensive Repair Lotion, 5 fl oz/150 mL, Pack Of 3",Eucerin,Body,Lotions,"Benzyl Alcohol, Caprylic/Capric Triglyceride, Dimethicone, Glycerin, Hydrogenated Castor Oil, Isopropyl Palmitate, Lactic Acid, Magnesium Sulfate, Methoxy Peg-22/Dodecyl Glycol Copolymer, Mineral Oil, Octyldodecanol, Ozokerite, Peg-2 Hydrogenated Castor Oil, Peg-45/Dodecyl Glycol Copolymer, Peg-7 Hydrogenated Castor Oil, Sodium Lactate, Sorbitan Isostearate, Urea, Water",https://cdn1.skinsafeproducts.com/photo/39D12675A5C361/large_1731306510.pngpng?1731306510,https://www.skinsafeproducts.com/eucerin-intensive-repair-lotion-5-fl-oz-150-ml-pack-of-3
201-400.csv,"Eucerin Original Healing Enriched Creme, 2 oz/57 g",Eucerin,Body,Creams,"Aqua, Ceresin, Lanolin Alcohol, Mineral Oil, Petrolatum, Phenoxyethanol, Piroctone Olamine",https://cdn1.skinsafeproducts.com/photo/0E2F9EACEEFBE1/large_1504478851.jpegjpeg?1504478851,https://www.skinsafeproducts.com/eucerin-original-healing-enriched-creme-2-oz-57-g
201-400.csv,"Eucerin Original Healing Cream, 2 oz/57 g",Eucerin,Body,Creams,"Ceresin, Lanolin Alcohol, Mineral Oil, Petrolatum, Phenoxyethanol, Piroctone Olamine, Water",https://cdn1.skinsafeproducts.com/photo/16DDEB5159A63F/large_1715748328.pngpng?1715748328,https://www.skinsafeproducts.com/eucerin-original-healing-cream-2-oz-57-g
201-400.csv,"Eucerin Face Immersive Hydration Night Cream, 2.5 oz/71 g",Eucerin,Face,Nighttime Moisturizers,"1,2-Hexanediol, Behenyl Alcohol, Butylene Glycol, Butyrospermum Parkii (Shea) Butter, Caprylic/Capric Triglyceride, Caprylyl Glycol, Cetyl Alcohol, Citric Acid, Dimethicone, Distarch Phosphate, Glycerin, Glyceryl Stearate Citrate, Glycine Soja (Soybean) Germ Extract, Glycyrrhetinic Acid, Hydrogenated Coco-Glycerides, Hydroxypropyl Starch Phosphate, Isopropyl Palmitate, Octyldodecanol, Panthenol, Pantolactone, Phenoxyethanol, Sodium Hyaluronate, Stearyl Alcohol, Tocopherol, Trisodium Edta, Water, Xanthan Gum",https://cdn1.skinsafeproducts.com/photo/C8E6EF60896AAA/large_1707158023.jpeg?1707158023,https://www.skinsafeproducts.com/eucerin-face-immersive-hydration-night-cream-2-5-oz-71-g
201-400.csv,"Eucerin Advanced Repair Hand Cream, 2.7 oz/78 g",Eucerin,Hand,Creams,"Alanine, Arginine Hcl, Carnitine, Ceramide Np, Cetearyl Alcohol, Cholesterol, Decylene Glycol, Dibutyl Adipate, Dicaprylyl Ether, Dimethicone, Glycerin, Glyceryl Stearate, Glyceryl Stearate Se, Glycine, Helianthus Annuus (Sunflower) Seed Oil, Lactic Acid, Pentylene Glycol, Phenoxyethanol, Sodium Cetearyl Sulfate, Sodium Chloride, Sodium Lactate, Sodium Pca, Stearyl Alcohol, Tapioca Starch, Urea, Water, Xanthan Gum",https://cdn1.skinsafeproducts.com/photo/0B55E370280097/large_1711510334.pngpng?1711510334,https://www.skinsafeproducts.com/eucerin-advanced-repair-hand-cream-2-7-oz-78-g
201-400.csv,"Eucerin Face Gentle Cleansing Hydrating Micellar Water, Hyaluronic Acid, 13.5 fl oz/400 mL",Eucerin,Facial Cleansers,Micellar Water,"1,2-Hexanediol, Aqua, Arginine Hcl, Bht, Decyl Glucoside, Glycerin, Glyceryl Glucoside, Phenoxyethanol, Poloxamer 124, Sodium Chloride, Sodium Cocoamphoacetate, Sodium Hyaluronate, Trisodium Edta",https://cdn1.skinsafeproducts.com/photo/B814711F912B27/large_1707267678.jpeg?1707267678,https://www.skinsafeproducts.com/eucerin-face-gentle-cleansing-hydrating-micellar-water-hyaluronic-acid-13-5-fl-oz-400-ml
201-400.csv,"Eucerin Q10 Active Night Cream, 50 mL",Eucerin,Face,Nighttime Moisturizers,"1,2-Hexanediol, Aqua, Butylene Glycol, Butyrospermum Parkii Butter, Caprylic/Capric Triglyceride, Cetyl Alcohol, Dehydroacetic Acid, Ethylhexyl Cocoate, Glycerin, Glyceryl Stearate Citrate, Hydrogenated Coco-Glycerides, Macadamia Ternifolia Seed Oil (Macadamia), Octyldodecanol, Retinyl Palmitate, Sodium Carbomer, Stearyl Alcohol, Trisodium Edta, Ubiquinone",https://cdn1.skinsafeproducts.com/photo/CBA1782B2ECA01/large_1702363991.jpeg?1702363991,https://www.skinsafeproducts.com/eucerin-q10-active-night-cream-50-ml
