File,product_name,brand,usage_type,category,ingredients,image_url,product_url
1-200.csv,"Eucerin Roughness Relief Lotion, 16.9 fl oz/500 mL",Eucerin,Body,Lotions,"1,2-Hexanediol, Alanine, Arginine, Arginine Hcl, Butyrospermum Parkii Butter, Carnitine, Ceramide Np, Cetearyl Alcohol, Citrulline, Dicaprylyl Ether, Glutamic Acid, Glycerin, Glyceryl Glucoside, Glycogen, Histidine Hci, Isopropyl Stearate, Lactic Acid, Lysine Hci, Mannitol, Pca, Phenoxyethanol, Polyglyceryl-4 Diisostearate/Polyhydroxystearate/Sebacate, Potassium Sorbate, Serine, Sodium Chloride, Sodium Lactate, Sodium Pca, Sucrose, Tapioca Starch, Threonine, Urea, Water",https://cdn1.skinsafeproducts.com/photo/AA2159F50DFFF1/large_1707481281.pngpng?1707481281,https://www.skinsafeproducts.com/eucerin-roughness-relief-lotion-16-9-fl-oz-500-ml
1-200.csv,"Eucerin Advanced Repair Cream, Very Dry Skin, 8 oz/226 g",Eucerin,Body,Creams,"Acrylates-C10-30-Alkyl-Acrylate-Crosspolymer, Alanine, Arginine Hcl, Butyrospermum Parkii Butter, Caprylic-Capric-Triglyceride, Carnitine, Carrageenan, Ceramide Np, Cetearyl Alcohol, Cholesterol, Decylene Glycol, Dimethicone, Glycerin, Glyceryl Stearate Se, Glycine, Helianthus Annuus Seed Oil*, Hydrogenated Coco-Glycerides, Lactic Acid, Octyldodecanol, Pentylene Glycol, Phenoxyethanol, Sodium Cetearyl Sulfate, Sodium Chloride, Sodium Lactate, Sodium Pca, Tapioca Starch, Urea, Water",https://cdn1.skinsafeproducts.com/photo/68BFD7943E7ACA/large_1632087164.jpeg?1632087164,https://www.skinsafeproducts.com/eucerin-advanced-repair-cream-very-dry-skin-8-oz-226-g
1-200.csv,"Eucerin Intensive Repair Essential Oil Balm, 7 oz",Eucerin,Body,"Balms, Ointments & Salves","Arginine Hcl, Beeswax, Bis-Diglyceryl Polyacyladipate-2, Butyrospermum Parkii (Shea) Butter, C18-38 Alkyl Hydroxystearoyl Stearate, Caprylic/Capric Triglyceride, Cetearyl Alcohol, Cetyl Palmitate, Decyl Oleate, Decylene Glycol, Dicaprylyl Carbonate, Glycerin, Glycine, Helianthus Annuus (Sunflower) Seed Oil, Hydrogenated Castor Oil, Hydrogenated Coco-Glycerides, Magnesium Stearate, Magnesium Sulfate, Octyldodecanol, Polyglyceryl-3 Diisostearate, Ricinus Communis (Castor) Seed Oil, Sodium Ascorbyl Phosphate, Sodium Pca, Tocopherol, Urea, Water",https://cdn1.skinsafeproducts.com/photo/20A9CB8FEDA430/large_1635799738.jpeg?1635799738,https://www.skinsafeproducts.com/eucerin-intensive-repair-essential-oil-balm-7-oz
1-200.csv,"Eucerin Roughness Relief Lotion, Extremely Dry Rough Skin, 16.9 fl oz/500 mL",Eucerin,Body,Lotions,"1-2-Hexanediol, Alanine, Arginine Hcl, Butyrospermum Parkii Butter, Carnitine, Ceramide Np, Cetearyl Alcohol, Citrulline, Dicaprylyl Ether, Glutamic Acid, Glycerin, Glyceryl Glucoside, Glycogen, Histidine, Isopropyl Stearate, Lactic Acid, Lysine, Mannitol, Nylon-12, Phenoxyethanol, Polyglyceryl-4 Diisostearate/Polyhydroxystearate/Sebacate, Potassium Sorbate, Serine, Sodium Chloride, Sodium Lactate, Sodium Pca, Sucrose, Threonine, Urea, Water",https://cdn1.skinsafeproducts.com/photo/07F21406450357/large_1634371515.jpeg?1634371515,https://www.skinsafeproducts.com/eucerin-roughness-relief-lotion-extremely-dry-rough-skin-16-9-fl-oz-500-ml
1-200.csv,"Eucerin Hydrating Cleansing Gel, Hyaluronic Acid, 6.8 fl oz/200 mL",Eucerin,Facial Cleansers,Facial Gels,"Acrylates/C10-30 Alkyl Acrylate Crosspolymer, Coco Glucoside, Coco-Betaine, Glycerin, Glyceryl Glucoside, Sodium Benzoate, Sodium Chloride, Sodium Hyaluronate, Trisodium Edta, Water",https://cdn1.skinsafeproducts.com/photo/15FA47127A4B5C/large_1665198472.jpeg?1665198472,https://www.skinsafeproducts.com/eucerin-hydrating-cleansing-gel-hyaluronic-acid-6-8-fl-oz-200-ml
1-200.csv,"Eucerin Hydrating Foaming Cleanser, Hyaluronic Acid, 5 oz/150 mL",Eucerin,Facial Cleansers,Facial Foaming Cleansers,"Acrylates C10-30 Alkyl Acrylate Crosspolymer, Coco-Betaine, Coco-Glucoside, Glycerin, Glyceryl Glucoside, Sodium Benzoate, Sodium Chloride, Sodium Hyaluronate, Trisodium Edta, Water",https://cdn1.skinsafeproducts.com/photo/520EF596F6EE3D/large_1712743451.pngpng?1712743451,https://www.skinsafeproducts.com/eucerin-hydrating-foaming-cleanser-hyaluronic-acid-5-oz-150-ml
1-200.csv,"Eucerin Aquaphor Healing Ointment, 50 g",Eucerin,Body,"Balms, Ointments & Salves","Bisabolol, Ceresin, Glycerin, Lanolin Alcohol, Microcrystalline Wax, Mineral Oil, Panthenol",https://cdn1.skinsafeproducts.com/photo/94BB46DFE126C2/large_1625129988.pngpng?1625129988,https://www.skinsafeproducts.com/eucerin-aquaphor-healing-ointment-dry-cracked-skin-50-g
1-200.csv,"Eucerin Advanced Repair Scented Night Lotion, 13.5 fl oz/400 mL",Eucerin,Face,Nighttime Moisturizers,"Alanine, Arginine Hcl, Butyrospermum Parkii (Shea) Butter, Caprylic/Capric Triglyceride, Carnitine, Ceramide Np, Cetearyl Alcohol, Cholesterol, Chondrus Crispus Extract, Decylene Glycol, Dicaprylyl Ether, Dimethicone, Ethylhexyl Cocoate, Fragrance, Glycerin, Glyceryl Glucoside, Glyceryl Stearate Se, Glycine, Helianthus Annuus (Sunflower) Seed Oil, Hydrogenated Coco-Glycerides, Lactic Acid, Octyldodecanol, Pentylene Glycol, Phenoxyethanol, Sodium Cetearyl Sulfate, Sodium Chloride, Sodium Lactate, Sodium Pca, Tapioca Starch, Tocopherol, Urea, Water",https://cdn1.skinsafeproducts.com/photo/081C73DBD58119/large_1669954171.jpeg?1669954171,https://www.skinsafeproducts.com/eucerin-advanced-repair-night-lotion-very-dry-skin-scented-13-5-fl-oz-400-ml
1-200.csv,"Eucerin Adjunctive Soothing Cream, Dermopurifyer Oil, Control, 50 mL",Eucerin,Skin Care,Acne Care (OTC),"4-T-Butylcyclohexanol, Aqua, Behenyl Alcohol, Carbomer, Ceramide Np, Cetyl Alcohol, Dimethicone, Glycerin, Glyceryl Stearate Citrate, Glycyrrhiza Inflata Root Extract, Hydrogenated Coco-Glycerides, Isopropyl Palmitate, Panthenol, Pentylene Glycol, Phenoxyethanol, Sodium Hydroxide, Squalane, Tapioca Starch, Trisodium Edta",https://cdn1.skinsafeproducts.com/photo/33FF505B726406/large_1692245582.pngpng?1692245582,https://www.skinsafeproducts.com/eucerin-adjunctive-soothing-cream-dermopurifyer-oil-control-50-ml
1-200.csv,"Eucerin Daily Hydration Cream 2 In 1 Moisturizer + Sunscreen, SPF 30, 8 oz/226 g",Eucerin,Face,Moisturizers with SPF,"1-2-Hexanediol, Acrylates-C10-30-Alkyl-Acrylate-Crosspolymer, Benzyl Alcohol, Butylene Glycol, Cetyl Alcohol, Decylene Glycol, Dimethicone, Glycerin, Glyceryl Stearate, Glycyrrhiza Inflata Root Extract, Hydrogenated Coco-Glycerides, Myristyl Myristate, Palmitic Acid, Phenoxyethanol, Silica Dimethyl Silylate, Sodium Hydroxide, Stearic Acid, Stearyl Alcohol, Tapioca Starch, Trisodium Edta, Water, Xanthan Gum",https://cdn1.skinsafeproducts.com/photo/13A3060B9A1CC5/large_1656622430.jpeg?1656622430,https://www.skinsafeproducts.com/eucerin-daily-hydration-cream-2-in-1-moisturizer-sunscreen-spf-30-8-oz-226-g-0
1-200.csv,"Eucerin Anti-Pigment Face Day Cream, SPF 30, 50 mL",Eucerin,Face,Creams,"Alcohol Denat, Aqua, Bis-Ethylhexyloxyphenol Methoxyphenyl Triazine, Butyl Methoxydibenzoylmethane, Butylene Glycol, C12-15 Alkyl Benzoate, Carbomer, Cetyl Alcohol, Dicaprylate/Dicaprate, Dimethicone, Distarch Phosphate, Ethylhexyl Salicylate, Ethylhexyl Triazone, Glucosylrutin, Glycerin, Glyceryl Stearate, Glycyrrhiza Inflata Root Extract, Homosalate, Isobutylamido Thiazolyl Resorcinol, Isoquercitrin, Parfum, Phenoxyethanol, Phenylbenzimidazole Sulfonic Acid, Sodium Chloride, Sodium Hydroxide, Sodium Stearoyl Glutamate, Stearyl Alcohol, Tapioca Starch, Tocopherol, Trisodium Edta, Xanthan Gum",https://cdn1.skinsafeproducts.com/photo/21043DE40E9171/large_1642235921.jpeg?1642235921,https://www.skinsafeproducts.com/eucerin-anti-pigment-face-day-cream-spf-30-50-ml
1-200.csv,"Eucerin Hyaluron-Filler Moisture Booster, Ultra-Light, 1 fl oz/30 mL",Eucerin,Anti-Aging/Anti-Wrinkle,Anti-Aging,"Alcohol Denat, Aqua, Bht, Butylene Glycol, Caprylyl Glycol, Citric Acid, Glycerin, Parfum, Peg-40 Hydrogenated Castor Oil, Sodium Ascorbyl Phosphate, Sodium Hyaluronate",https://cdn1.skinsafeproducts.com/photo/DE76F1FF61FC86/large_1621851836.pngpng?1621851836,https://www.skinsafeproducts.com/eucerin-hyaluron-filler-moisture-booster-ultra-light-1-fl-oz
1-200.csv,"Eucerin Aquaphor Healing Ointment, Advanced Therapy, 14 oz/396 g",Eucerin,Body,"Balms, Ointments & Salves","Bisabolol, Ceresin, Glycerin, Lanolin Alcohol, Mineral Oil, Panthenol, Petrolatum (41%)",https://cdn1.skinsafeproducts.com/photo/szkGPIWOJZQDAexagco-UQ/large_1430859506.jpeg?1430859506,https://www.skinsafeproducts.com/aquaphor-healing-ointment-14-ounc
1001-1200.csv,"Eucerin Aquaphor Lip Repair Healing Ointment, 10 mL",Eucerin,Lip Care,"Lip Balms, Gels, Moisturizers & Oils","Beeswax, Bis-Diglyceryl Polyacyladipate-2, Bisabolol, Butyrospermum Parkii (Shea) Butter, C18-38 Alkyl Hydroxystearoyl Stearate, C20-40 Alkyl Stearate, Caprylic/Capric Triglyceride, Glycerin, Hydrogenated Castor Oil, Magnesium Stearate, Magnesium Sulfate, Octyldodecanol, Panthenol, Polyglyceryl-3 Diisostearate, Ricinus Communis Seed Oil, Sodium Ascorbyl Phosphate, Tocopherol, Tocopheryl Acetate, Water",https://cdn1.skinsafeproducts.com/photo/C25FAE53FCE154/large_1740118639.pngpng?1740118639,https://www.skinsafeproducts.com/eucerin-aquaphor-lip-repair-healing-ointment-10-ml
1001-1200.csv,"Eucerin Atocontrol Face Cream, 50 mL",Eucerin,Face,Creams,"Ascorbyl Palmitate, Ceramide Np, Cetyl Alcohol, Citric Acid, Decylene Glycol, Dimethicone, Ethylhexylglycerin, Glycerin, Glyceryl Stearate, Glycyrrhiza Inflata Root Extract, Oenothera Biennis Oil, Peg-40 Stearate, Pentaerythrityl Tetraisostearate, Phenoxyethanol, Sodium Citrate, Tocopherol, Triisostearin, Vitis Vinifera Seed Oil, Water",https://cdn1.skinsafeproducts.com/photo/578471F24E014E/large_1641815168.pngpng?1641815168,https://www.skinsafeproducts.com/eucerin-atocontrol-face-cream-50-ml
1001-1200.csv,"Eucerin Aquaphor Healing Ointment, 396 g",Eucerin,Body,"Balms, Ointments & Salves","Bisabolol, Ceresin, Glycerin, Lanolin Alcohol, Mineral Oil/Huile MinéRale, Panthenol, Petrolatum",https://cdn1.skinsafeproducts.com/photo/86B8421D1011F3/large_1714470274.pngpng?1714470274,https://www.skinsafeproducts.com/eucerin-aquaphor-healing-ointment-396-g
1201-1400.csv,"Eucerin Even Brighter Pigment Reducing Night Cream, 50 ml",Eucerin,Face,Creams,"1,2-Hexanediol, 4-Butylresorcinol, Acrylates/C10-30 Alkyl Acrylate Crosspolymer, African Shea Butter, Bht, Butylene Glycol, Caprylic/Capric Triglyceride, Cetyl Alcohol, Cyclomethicone, Diethylhexyl Syringylidenemalonate, Dimethicone, Ethylhexylglycerin, Glycerin, Glyceryl Glucoside, Glyceryl Stearate Citrate, Glycyrrhetinic Acid, Hydrogenated Coco-Glycerides, Isopropyl Palmitate, Lauroyl Lysine, Methylpropanediol, Octocrylene, Panthenol, Parfum, Phenoxyethanol, Sodium Carbomer, Stearyl Alcohol, Trisodium Edta, Water\Aqua\Eau",https://cdn1.skinsafeproducts.com/photo/32A1650633BC40/large_1519768873.jpegjpg?1519768873,https://www.skinsafeproducts.com/eucerin-even-brighter-pigment-reducing-night-cream-50-ml
1201-1400.csv,Eucerin Original Healing Lotion 8.4 fl oz,Eucerin,Body,Lotions,"Aluminum Stearates, Bht, Cetyl Palmitate, Citric Acid, Glyceryl Lanolate, Isopropyl Myristate, Isopropyl Palmitate, Lanolin Alcohol, Magnesium Sulfate, Methylchloroisothiazolinone, Methylisothiazolinone, Mineral Oil, Peg 40 Sorbitan Peroleate, Phenoxyethanol, Polyglyceryl-3 Diisostearate, Polyglyceryl-4 Diisostearate/Polyhydroxystearate/Sebacate, Potassium Sorbate, Propylene Glycol, Sodium Citrate, Sorbitol, Water\Aqua\Eau",https://cdn1.skinsafeproducts.com/photo/5809CCF6659221/large_1513047183.jpeg?1513047183,https://www.skinsafeproducts.com/eucerin-original-healing-rich-lotion-8-4-fluid-ounce
1201-1400.csv,"Eucerin Sensitive Skin Gentle Hydrating Cleanser, 8 fl oz",Eucerin,Cleansers,Facial Cleansers,"Citric Acid, Cocamide Mea, Cocamidopropyl Betaine (Other Coconut Derived Ingredients Will Be Removed From Shopping List), Disodium Cocamphodiacetate, Glycol Distearate, Imidazolidinyl Urea, Lanolin Alcohol, Laureth 10, Peg 120 Methyl Glucose Dioleate, Peg 7 Glyceryl Cocoate, Sodium Laureth Sulfate (Sles), Water\Aqua\Eau",https://cdn1.skinsafeproducts.com/photo/D20C43CB6E898F/large_1493553232.jpeg?1493553232,https://www.skinsafeproducts.com/eucerin-sensitive-skin-gentle-hydrating-cleanser-8-fl-oz
1201-1400.csv,"Eucerin Daily Hydration Moisturizer Sunscreen Hand Creme, SPF 30, 2.7 Oz",Eucerin,Hand,Creams,"Acrylates/C10-30 Alkyl Crosspolymer, Avobenzone 3%, Benzyl Alcohol, Carbomer, Cetearyl Alcohol, Cyclomethicone, Ethylhexlyglycerin, Glycerin, Glycyrrhiza Inflata Root Extract, Homosalate 3%, Octisalate, Octocrylene 9%, Pentylene Glycol, Phenoxyethanol, Silica Dimethyl Silylate, Sodium Chloride, Sodium Hydroxide, Sodium Stearoyl Glutamate, Tapioca Starch, Trisodium Edta, Water\Aqua\Eau, Xanthan Gum",https://cdn1.skinsafeproducts.com/photo/342C7CAECAE14E/large_1482118253.jpeg?1482118253,https://www.skinsafeproducts.com/eucerin-daily-hydration-moisturizer-sunscreen-hand-creme-spf-30-2-7-oz
1201-1400.csv,"Eucerin AtopiControl Crema Forte, 40 mL",Eucerin,Face,Creams,"1,2-Hexanediol, Ascorbyl Palmitate, Bht, Caprylic/Capric Triglyceride, Ceramide Np, Cetyl Alcohol, Citric Acid, Decylene Glycol, Dimethicone, Glycerin, Glyceryl Stearate, Glycyrrhiza Inflata Root Extract, Mentoxipropanediol, Oenothera Biennis Oil, Peg-40 Stearate, Pentaerythrityl Tetraisostearate, Phenoxyethanol, Sodium Citrate, Tocopherol (Multisource), Triisostearin, Trisodium Edta, Vitis Vinifera (Grape) Seed Oil, Water\Aqua\Eau",https://cdn1.skinsafeproducts.com/photo/HJDEdQjHxa_QnoaoVLFofQ/large_1476917082.jpeg?1476917082,https://www.skinsafeproducts.com/eucerin-atopicontrol-crema-forte-40-ml
1201-1400.csv,"Eucerin Volume-Filler Serum, 30 mL",Eucerin,Face,Oils,"1,2-Hexanediol, Arginine Hcl, C10-30 Alkyl Acrylate Crosspolymer, Cetearyl Alcohol, Cyclomethicone, Dimethiconol, Ethylhexyl Cocoate, Ethylhexyl Stearate, Glycerin, Magnolia Officinalis Bark Extract, Methylpropanediol, Parfum, Phenoxyethanol, Pimpinella Anisum Fruit Extract, Polymethylsilsesquioxane, Sodium Chloride, Sodium Hyaluronate, Sodium Stearoyl Glutamate, Water\Aqua\Eau",https://cdn1.skinsafeproducts.com/photo/Bmp8DWVZA5XYc9YJrRbltQ/large_1476915345.jpegJPG?1476915345,https://www.skinsafeproducts.com/eucerin-volume-filler-serum-30-ml-0
1201-1400.csv,"Eucerin Volume-Filler Contorno de Ojos, 15 mL",Eucerin,"Eye Cream, Gel, Oils, & Serum",Creams,"1,2-Hexanediol, Arginine Hcl, Behenyl Alcohol, Bis-Ethylhexyloxyphenol Methoxyphenyl Triazine, Butyl Methoxydibenzoylmethane, Butylene Glycol Dicaprylate/Dicaprate, Carbomer, Cetyl Palmitate, Dimethicone, Ethylhexlyglycerin, Glycerin, Glyceryl Stearate Citrate, Hydrogenated Coco-Glycerides, Magnolia Officinalis Bark Extract, Methylpropanediol, Octisalate, Octyldodecanol, Phenoxyethanol, Phenylbenzimidazole Sulfonic Acid, Pimpinella Anisum Fruit Extract, Polymethylsilsesquioxane, Silica Dimethyl Silylate, Sodium Hyaluronate, Stearyl Alcohol, Synthetic Beeswax, Trisodium Edta, Water\Aqua\Eau",https://cdn1.skinsafeproducts.com/photo/VXdYoj_XMidYEsmYGAKvWw/large_1476914531.jpegJPG?1476914531,https://www.skinsafeproducts.com/eucerin-volume-filler-contorno-de-ojos-15-ml
1201-1400.csv,"Eucerin Hyaluron-Filler Crema de Noche, 50 mL",Eucerin,Anti-Aging/Anti-Wrinkle,Anti-Wrinkle,"1,2-Hexanediol, Acrylates/C10-30 Alkyl Acrylate Crosspolymer, African Shea Butter, Butylene Glycol, Caprylic/Capric Triglyceride, Caprylyl Glycol, Carbomer, Cetyl Alcohol, Dimethicone, Glycerin, Glyceryl Stearate Citrate, Glycine Soja (Soybean) Extract, Hydrogenated Coco-Glycerides, Isopropyl Palmitate, Methyl Methacrylate Crosspolymer, Octyldodecanol, Pantenol, Parfum, Phenoxyethanol, Sodium Hyaluronate, Stearyl Alcohol, Tocopherol (Multisource), Trisodium Edta, Water\Aqua\Eau",https://cdn1.skinsafeproducts.com/photo/COIJFMblVnXoy4-NS9i2kQ/large_1476913695.jpegJPG?1476913695,https://www.skinsafeproducts.com/eucerin-hyaluron-filler-crema-de-noche-50-ml
1201-1400.csv,"Eucerin pH5 Skin-Protection Locion, 400 mL",Eucerin,Body,Lotions,"Alpha-Isomethyl Ionone, Aluminum Starch Octenylsuccinate, Benzyl Alcohol, Benzyl Salicylate, Butylphenyl Methylpropional, Carbomer, Cetyl Alcohol, Cetyl Palmitate, Citric Acid, Dimethicone, Ethylhexlyglycerin, Glycerin, Hexyl Cinnamal, Limonene, Linalool, Mineral Oil, Pantenol, Parfum, Pentylene Glycol, Phenoxyethanol, Polybutene, Sodium Citrate, Sorbitan Stearate, Tocopheryl Acetate, Water\Aqua\Eau",https://cdn1.skinsafeproducts.com/photo/NNVtHpXIqVhOs-Hj6hV1Ug/large_1476911778.jpegJPG?1476911778,https://www.skinsafeproducts.com/eucerin-ph5-skin-protection-locion-400-ml
1201-1400.csv,"Eucerin pH5 Oleogel de Manos, 250 mL",Eucerin,Cleansers,Liquid or Cream Hand Soaps,"Alpha-Ionone Isomethyl, Arachidic Acid, Benzyl Alcohol, Benzyl Salicylate, Bht, Butylphenyl Methylpropional, Citric Acid, Coconut Diethanolamide (Cocamide Dea), Coumarin, Dexpanthenol, Diammonium Citrate, Glycine Soja, Hexyl Cinnamal, Lanolin Alcohol, Laureth-4, Limonene, Linalool, Mipa-Laureth Sulfate, Myristic Acid, Palmitic Acid, Panthenol, Parfum, Persea Gratissima, Poloxamer 101, Propyl Gallate, Ricinus Communis Oil, Stearic Acid, Water\Aqua\Eau",https://cdn1.skinsafeproducts.com/photo/2Mdf7Lp42csnYWPxMMlpng/large_1476891280.jpegjpg?1476891280,https://www.skinsafeproducts.com/eucerin-ph5-oleogel-de-manos-250-ml
1201-1400.csv,"Eucerin DermoPurifyer Cleanser, 200 ml",Eucerin,Cleansers,Facial Cleansers,"Citric Acid, Propylene Glycol, Salicylic Acid, Sodium Benzoate, Sodium Chloride, Sodium Cocoamphoacetate, Sodium Laureth Sulfate (Sles), Water\Aqua\Eau",https://cdn1.skinsafeproducts.com/photo/HoWUnvh-vi7c2BxUxZG1GA/large_1476719365.jpeg?1476719365,https://www.skinsafeproducts.com/eucerin-dermopurifyer-cleanser-200-ml
1201-1400.csv,"Eucerin pH5 Skin-Protection Shower Oil, 200 mL",Eucerin,Body,Oils,"Alpha-Isomethyl Ionone, Benzyl Alcohol, Benzyl Salicylate, Bht, Butylphenyl Methylpropional, Chamomilla Recutita (Matricaria) Flower Extract, Citric Acid, Coconut Diethanolamide (Cocamide Dea), Coumarin, Diammonium Citrate, Glycine Soja, Glycine Soja (Soybean) Oil, Hexyl Cinnamal, Lanolin Alcohol, Laureth-4, Limonene, Linalool, Mipa-Laureth Sulfate, Panthenol, Parfum, Poloxamer 101, Propyl Gallate, Ricinus Communis Seed Oil, Water\Aqua\Eau",https://cdn1.skinsafeproducts.com/photo/gZy-0idhQcsiBi-iLFxNmQ/large_1474307616.jpeg?1474307616,https://www.skinsafeproducts.com/eucerin-ph5-skin-protection-shower-oil-200-ml-0
1201-1400.csv,"Eucerin Original Healing Lotion, 21 fl oz.",Eucerin,Body,Lotions,"Aluminum Stearate, Bht, Cetyl Palmitate, Glyceryl Lanolate, Isopropyl Myristate, Lanolin Alcohol, Magnesium Sulfate, Methylchloroisothiazolinone, Methylisothiazolinone, Mineral Oil, Peg-40 Sorbitan Peroleate, Propylene Glycol, Sorbitol, Water\Aqua\Eau",https://cdn1.skinsafeproducts.com/photo/1MvpBqiiSlUznh9ud28U5w/large_1448207999.jpeg?1448207999,https://www.skinsafeproducts.com/eucerin-original-dry-skin-therapy-moisturizing-lotion
1201-1400.csv,"Eucerin Anti-Redness Concealing Day Cream, SPF25, 50 ml",Eucerin,Face,Creams,"4-T-Butylcyclohexanol (Trans-Isomer), Aqua, Bis-Ethylhexyloxyphenol Methoxyphenyl Triazine, Butyl Methoxydibenzoylmethane, Butyrospermum Parkii Butter, Caprylyl Glycol, Cetearyl Alcohol, Ci 77288, Ci 77891, Dimethicone, Ethylhexyl Salicylate, Glycerin, Glycyrrhiza Inflata Root Extract, Homosalate, Methylpropanediol, Octocrylene, Pentylene Glycol, Potassium Cetyl Phosphate, Sodium Acrylates/C10-30 Alkyl Acrylate Crosspolymer, Trisodium Edta, Xanthan Gum",https://cdn1.skinsafeproducts.com/photo/921D70F9322C16/large_1595246586.jpeg?1595246586,https://www.skinsafeproducts.com/eucerin-anti-redness-concealing-day-cream-spf25-50-ml
1201-1400.csv,"Eucerin Dry Skin Therapy Plus Intensive Repair Lotion, 16 Fluid Ounces",Eucerin,Body,Lotions,"Chamomilla Recutita (Matricaria) Flower Extract, Glycerin, Isohexadecane, Isopropyl Palmitate, Lanolin Alcohol, Magnesium Sulfate, Methylchloroisothiazolinone, Methylisothiazolinone, Microcrystalline Wax, Mineral Oil, Panthenol, Peg-7 Hydrogenated Castor Oil, Sodium Lactate, Urea, Water\Aqua\Eau",https://cdn1.skinsafeproducts.com/photo/3CA217E3D6A4D9/large_1576622632.jpeg?1576622632,https://www.skinsafeproducts.com/eucerin-dry-skin-therapy-plus-intensive-repair-lotion-16-fluid-ounces
1201-1400.csv,"Eucerin Redness Relief Daily Perfecting Lotion, Broad Spectrum SPF 15, 1.7 Ounce",Eucerin,Body,Lotions,"African Shea Butter, Alcohol Denat., Butylene Glycol, Chromium Hydroxide Green, Chromium Oxide Greens, Dimethicone, Ethylparaben, Glycerin, Glycyrrhiza Inflata Root Extract, Iodopropynyl Butylcarbamate, Lauroyl Lysine, Magnesium Aluminum Silicate, Methylparaben, Octinoxate, Octisalate, Phenoxyethanol, Polyglyceryl-3 Methylglucose Distearate, Propylparaben, Sorbitan Stearate, Squalane, Titanium Dioxide, Trimethoxycaprylylsilane, Ultramarines, Water\Aqua\Eau, Xanthan Gum",https://cdn1.skinsafeproducts.com/photo/20388513D1EA1A/large_1542824800.jpeg?1542824800,https://www.skinsafeproducts.com/eucerin-redness-relief-daily-perfecting-lotion-broad-spectrum-spf-15-1-7-ounce
1201-1400.csv,Eucerin Even Brighter Clinical Day Cream SPF30,Eucerin,Face,Creams,"1,2-Hexanediol, 4-Butylresorcinol, Acrylates/C10-30 Alkyl Acrylate Crosspolymer, African Shea Butter, Butyl Methoxydibenzoylmethane, Cetearyl Alcohol, Dimethicone, Glycerin, Glyceryl Glucoside, Glyceryl Stearate Citrate, Glycyrrhetinic Acid, Homosalate, Lauroyl Lysine, Methylisothiazolinone, Octisalate, Octocrylene, Parfum, Phenoxyethanol, Phenylbenzimidazole Sulfonic Acid, Piroctone Olamine, Sodium Carbomer, Trisodium Edta, Water\Aqua\Eau",https://cdn1.skinsafeproducts.com/photo/5325478585F30C/large_1495635581.jpeg?1495635581,https://www.skinsafeproducts.com/eucerin-even-brighter-clinical-day-cream-spf30
1201-1400.csv,"Eucerin Plus Intensive Repair Lotion, 16.9 oz",Eucerin,Body,Lotions,"Chamomilla Recutita (Matricaria) Flower Extract, Glycerin, Isohexadecane, Isopropyl Palmitate, Lanolin Alcohol, Magnesium Sulfate, Methylchloroisothiazolinone, Methylisothiazolinone, Microcrystalline Wax, Mineral Oil, Panthenol, Peg 7 Hydrogenated Castor Oil, Sodium Lactate, Urea, Water\Aqua\Eau",https://cdn1.skinsafeproducts.com/photo/1D3FD603D42A82/large_1484171340.jpegjpg?1484171340,https://www.skinsafeproducts.com/eucerin-plus-intensive-repair-lotion-16-9-oz
1201-1400.csv,Eucerin Hand Creme Daily Skin Balance - 2.7 oz,Eucerin,Body,Lotions,"Aluminum Starch, Aluminum Starch Octenylsuccinate, Carbomer, Cetyl Alcohol, Citric Acid, Dimethicone, Fragrance, Glycerin, Glyceryl Stearate, Hydrogenated Coco-Glycerides, Methylisothiazolinone, Mineral Oil, Octenylsuccinate, Panthenol, Peg-100 Stearate, Phenoxyethanol, Sodium Citrate, Sorbitan Stearate, Stearic Acid, Stearyl Alcohol, Tocopherol (Multisource), Water\Aqua\Eau",https://cdn1.skinsafeproducts.com/photo/SCNdiqy_sKWY7c-3LGLVjg/large_1470008591.jpeg?1470008591,https://www.skinsafeproducts.com/eucerin-hand-creme-daily-skin-balance-2-7-oz
1201-1400.csv,"Eucerin Sensitive Skin Experts Redness Relief Soothing Night Creme, 1.7 oz",Eucerin,Face,Nighttime Moisturizers,"Ammonium Acryloyldimethyltaurate/Vp Copolymer, Benzyl Alcohol, Butylene Glycol, C12-15 Alkyl Benzoate, Caprylic/Capric Triglyceride, Carbomer, Cetearyl Alcohol, Dicaprylyl Carbonate, Dimethicone, Dmdm Hydantoin, Ethylparaben, Glycerin, Glyceryl Stearate Citrate, Glycyrrhiza Inflata Root Extract, Methylparaben, Myristyl Myristate, Octyldodecanol, Panthenol, Phenoxyethanol, Sodium Hydroxide, Squalane, Tapioca Starch",https://cdn1.skinsafeproducts.com/photo/YQGLixNoNcIM0wCZ67QA3g/large_1463581932.jpeg?1463581932,https://www.skinsafeproducts.com/eucerin-sensitive-skin-experts-redness-relief-soothing-night-creme-1-7-oz
1201-1400.csv,"Eucerin Ph 5 Moisturising Lotion, 400 mL",Eucerin,Face,Lotions,"Aqua, Benzyl Alcohol, C15-19 Alkane, Caprylic/Capric Triglyceride, Caprylyl Glycol, Carbomer, Cetyl Alcohol, Cetyl Palmitate, Citric Acid, Dexpanthenol, Dimethicone, Glycerin, Glyceryl Stearate Se, Hydrogenated Coco-Glycerides, Panthenol, Pantolactone, Pentylene Glycol, Phenoxyethanol, Polybutene, Sodium Cetearyl Sulfate, Sodium Citrate, Sodium Hydroxide, Sorbitan Stearate, Stearyl Alcohol, Tapioca Starch, Tocopherol, Tocopheryl Acetate, Trisodium Edta",https://cdn1.skinsafeproducts.com/photo/82AA25BE206475/large_1758186465.pngpng?1758186465,https://www.skinsafeproducts.com/eucerin-ph-5-moisturising-lotion-400-ml
1201-1400.csv,"Eucerin Urea Repair Intensive Body Emulsion, 250 mL",Eucerin,Body,Lotions,"1,2-Hexanediol, Alanine, Aqua, Arginine, Arginine Hcl, Butyrospermum Parkii Butter, Carnitine, Ceramide Np, Cetearyl Alcohol, Citrulline, Dicaprylyl Ether, Glutamic Acid, Glycerin, Glyceryl Glucoside, Glycogen, Histidine Hci, Isopropyl Stearate, Lactic Acid, Lysine Hci, Mannitol, Pca, Phenoxyethanol, Polyglyceryl-4 Diisostearate/Polyhydroxystearate/Sebacate, Potassium Sorbate, Serine, Sodium Chloride, Sodium Lactate, Sodium Pca, Sucrose, Tapioca Starch, Threonine, Urea",https://cdn1.skinsafeproducts.com/photo/A0D908D9E9839B/large_1758168659.pngpng?1758168659,https://www.skinsafeproducts.com/eucerin-urea-repair-intensive-body-emulsion-250-ml
1201-1400.csv,"Eucerin Hyaluron Mist Spray, 150 mL",Eucerin,Face,Mists,"1-2-Hexanediol, Aqua, Arginine Hcl, Butylene Glycol, Citric Acid, Glycerin, Glyceryl Glucoside, Panthenol, Pantolactone, Phenoxyethanol, Sodium Citrate, Sodium Hyaluronate, Sodium Hydroxide, Trisodium Edta",https://cdn1.skinsafeproducts.com/photo/6C48995069122D/large_1757752446.pngpng?1757752446,https://www.skinsafeproducts.com/eucerin-hyaluron-mist-spray-150-ml
