File,product_name,brand,usage_type,category,ingredients,image_url,product_url
1401-1600.csv,"Eucerin Daily Replenishing Body Lotion, 16.9 fl oz",Eucerin,Body,Lotions,"Bht, Caprylic/Capric Triglyceride, Caprylyl Glycol, Carbomer, Cetearyl Alcohol, Cholesterol, Dimethicone, Glycerin, Glyceryl Stearate Se, Helianthus Annuus Seed Oil, Octyldodecanol, Palmitic Acid, Panthenol, Pentylene Glycol, Petrolatum, Phenoxyethanol, Sodium Hydroxide, Stearic Acid, Tocopheryl Acetate, Trisodium Edta, Water\Aqua\Eau",https://cdn1.skinsafeproducts.com/photo/FF6D26748ED9DE/large_1548338248.pngPNG?1548338248,https://www.skinsafeproducts.com/eucerin-daily-replenishing-body-lotion-16-9-fl-oz-0
1401-1600.csv,"Eucerin Skin Calming Lotion, 16.9 fl oz",Eucerin,Body,Lotions,"1,2-Hexanediol, Benzyl Alcohol, Caprylic/Capric Stearic Triglyceride, Carbomer, Cetyl Alcohol, Cetyl Palmitate, Colloidal Oatmeal, Decylene Glycol, Dimethicone, Glycerin, Glyceryl Stearate, Methylpropanediol, Mineral Oil, Octyldodecanol, Peg-40 Stearate, Phenoxyethanol, Piroctone Olamine, Polyglyceryl-2 Caprate, Water\Aqua\Eau",https://cdn1.skinsafeproducts.com/photo/9B55B254C38D61/large_1537910898.jpegJPG?1537910898,https://www.skinsafeproducts.com/eucerin-skin-calming-lotion-16-9-fl-oz
1401-1600.csv,"Eucerin Dry Skin Replenishing Face Cream 5% Urea Plus Lactate, Fragrance-Free, 1.7 fl oz",Eucerin,Face,Creams,"1,2-Hexanediol, Arginine Hcl, Biosaccharide Gum-1, Caprylic/Capric Triglyceride, Cetyl Alcohol, Dimethicone, Glycerin, Glyceryl Stearate, Lactic Acid, Pentaerythrityl Tetraisostearate, Phenoxyethanol, Potassium Cetyl Phosphate, Sodium Lactate, Triisostearin, Urea, Water\Aqua\Eau, Xanthan Gum",https://cdn1.skinsafeproducts.com/photo/A39296DFC589F8/large_1526048632.jpegJPG?1526048632,https://www.skinsafeproducts.com/eucerin-dry-skin-replenishing-face-cream-5-urea-plus-lactate-fragrance-free-1-7-fl-oz
1401-1600.csv,"Eucerin DermoPure Oil Control Agua Micelar, 200 mL",Eucerin,Facial Cleansers,Micellar Water,"1,2-Hexanediol, Arginine Hcl, Decyl Glucoside (Coconut Derivatives), Glycerin, Glyceryl Glucoside, Phenoxyethanol, Poloxamer 124, Sodium Chloride, Sodium Cocoamphoacetate, Sodium Hyaluronate, Trisodium Edta, Water\Aqua\Eau",https://cdn1.skinsafeproducts.com/photo/8AB1844CBF4428/large_1516473509.pngPNG?1516473509,https://www.skinsafeproducts.com/eucerin-dermopure-oil-control-agua-micelar-200-ml
1401-1600.csv,"Eucerin Advanced Cleansing pH5 Buffer Beauty Bar, 3.5 oz",Eucerin,Cleansers,Bar Soaps,"Cetearyl Alcohol, Citric Acid, Cocamidopropyl Betaine (Other Coconut Derived Ingredients Will Be Removed From Shopping List), Diammonium Citrate, Disodium Lauryl Sulfosuccinate, Glyceryl Stearate, Lanolin Alcohol, Octyldodecanol, Paraffin, Peg-150, Sodium Cocoyl Isethionate, Titanium Dioxide, Triticum Vulgare (Wheat) Starch, Water\Aqua\Eau",https://cdn1.skinsafeproducts.com/photo/7A8090B6DA30B6/large_1490308333.jpegjpg?1490308333,https://www.skinsafeproducts.com/eucerin-advanced-cleansing-ph5-buffer-beauty-bar-3-5-oz
1401-1600.csv,"Eucerin Repair Crema de Pies 10% Urea, 100 mL",Eucerin,Feet,Creams,"Aluminum Starch Octenylsuccinate, Caprylic/Capric Triglyceride, Carbomer, Cera Microcristalina, Cetearyl Alcohol, Dimethicone, Ethylhexyl Cocoate, Glycerin, Hydrogenated Coco-Glycerides, Mineral Oil, Octyldodecanol, Parafina LíQuida (Petrolatum), Peg-40 Castor Oil, Phenoxyethanol, Sodium Cetearyl Sulfate, Sodium Lactate, Sorbitan Stearate, Urea, Water\Aqua\Eau, ÁCido LáCtico",https://cdn1.skinsafeproducts.com/photo/GsRpMFap_xjEZqHW48NSMQ/large_1476923609.jpegJPG?1476923609,https://www.skinsafeproducts.com/eucerin-repair-crema-de-pies-10-urea-100-ml
1401-1600.csv,Eucerin Smoothing Repair Dry Skin Lotion,Eucerin,Body,Lotions,"1,2 Hexanediol, African Shea Butter, Alanine, Arginine Hcl, Caprylic/Capric Triglyceride, Carnitine, Carrageenan, Ceramide 3, Cetearyl Alcohol, Citrulline, Cyclomethicone, Dicaprylyl Ether, Dimethiconol, Glutamic Acid, Glycerin, Glyceryl Glucoside, Glyceryl Stearate Se, Glycogen, Histidine Hci, Hydrogenated Coco Glycerides, Lactic Acid, Lysine Hcl, Mannitol, Methylpropanediol, Octyldodecanol, Phenoxyethanol, Serine, Sodium Cetearyl Sulfate, Sodium Chloride, Sodium Lactate, Sucrose, Tapioca Starch, Threonine, Urea",https://cdn1.skinsafeproducts.com/photo/XOM8om1AEVLpoXPQ-yz8Rg/large_1449168498.jpeg?1449168498,https://www.skinsafeproducts.com/eucerin-smoothing-repair-dry-skin-lotion-9f01a3cd-0fb1-4cba-80f7-70dbe433f510
1401-1600.csv,"Eucerin Q10 Anti-Wrinkle Face Creme, 1.7 oz",Eucerin,Anti-Aging/Anti-Wrinkle,Anti-Wrinkle,"1,2-Hexanediol, African Shea Butter, Beta-Carotene, Biosaccharide Gum-1, Biotin, Butylene Glycol, Caprylic/Capric Triglyceride, Carbomer, Cetyl Alcohol, Dehydroacetic Acid, Ethylhexyl Cocoate, Glycerin, Glyceryl Stearate Citrate, Hydrogenated Coco-Glycerides, Octyldodecanol, Phenoxyethanol, Sodium Ascorbyl Phosphate, Sodium Hydroxide, Stearyl Alcohol, Tocopherol (Multisource), Tocopheryl Acetate, Trisodium Edta, Ubiquinone, Water\Aqua\Eau, Zea Mays (Corn) Oil",https://cdn1.skinsafeproducts.com/photo/A7189CD8C206AC/large_1513528777.pngPNG?1513528777,https://www.skinsafeproducts.com/eucerin-q10-anti-wrinkle-sensitive-skin-creme-1-7-oz
1401-1600.csv,"Eucerin Hyaluron-Filler 3x Effect Day Cream, SPF 15, 50 mL",Eucerin,Anti-Aging/Anti-Wrinkle,Anti-Wrinkle,"1,2-Hexanediol, Aqua, Bis-Ethylhexyloxyphenol Methoxyphenyl Triazine, Butyl Methoxydibenzoylmethane, Butylene Glycol, Butylene Glycol Dicaprylate/Dicaprate, Butyrospermum Parkii Butter, Cetyl Alcohol, Ci 77891, Ethylhexyl Salicylate, Ethylhexyl Triazone, Glycerin, Glyceryl Stearate Citrate, Glycine Soja Germ Extract, Glycyrrhetinic Acid, Hydrogenated Coco-Glycerides, Hydroxypropyl Starch Phosphate, Methylpropanediol, Mica, Parfum, Pentaerythrityl Tetra-Di-T-Butyl Hydroxyhydrocinnamate, Phenoxyethanol, Phenylbenzimidazole Sulfonic Acid, Silica, Sodium Hyaluronate, Sodium Hydroxide, Stearyl Alcohol, Trisodium Edta, Xanthan Gum",https://cdn1.skinsafeproducts.com/photo/3117AF112903AA/large_1757566171.pngpng?1757566171,https://www.skinsafeproducts.com/eucerin-hyaluron-filler-3x-effect-day-cream-spf-15-50-ml
1401-1600.csv,"Eucerin Even Pigment Perfector, 30 mL",Eucerin,Skin Treatments,Dark Spot Corrector & Pigment Corrector,"Alcohol Denat., Aqua, Ascorbyl Phosphate, Butylene Glycol, Ceteary Alcohol, Cetearyl Isononanoate, Citric Acid, Dehydroxanthan Gum, Diisopropyl Adipate, Dimethicone, Distarch Phosphate, Ethylhexylglycerin, Gellan Gum, Glucosylrutin, Glycerin, Glyceryl Stearate, Glycyrrhiza Inflata Root Extract, Hydroxypropyl Starch Phosphate, Isobutylamido Thiazolyl Resorcinol, Isopropyl Palmitate, Isoquercetin, Parfum, Phenoxyethanol, Propylheptyl Caprylate, Sodium Chloride, Sodium Hyaluronate, Sodium Stearoyl Glutamate, Trisodium Edta, Xanthan Gum",https://cdn1.skinsafeproducts.com/photo/63309F980B24B1/large_1757066199.pngpng?1757066199,https://www.skinsafeproducts.com/eucerin-even-pigment-perfector-30-ml
1401-1600.csv,"Eucerin Dermo Pure Cleansing Gel, 400 ml",Eucerin,Facial Cleansers,Facial Gels,"Propylene Glycol, Aqua, Citric Acid, Salicylic Acid, Sodium Benzoate, Sodium Chloride, Sodium Cocoamphoacetate, Sodium Laureth Sulfate",https://cdn1.skinsafeproducts.com/photo/EBDCEF67AB42B2/large_1621964432.jpeg?1621964432,https://www.skinsafeproducts.com/eucerin-dermo-pure-cleansing-gel-400-ml
1401-1600.csv,"Eucerin Urea Repair Cleansing Fluid, 400 mL",Eucerin,Skin Care,Cleansers,"Aqua, Glycerin, Lactic Acid, Lauryl Glucoside, Peg-40 Hydrogenated Castor Oil, Polyquaternium-10, Sodium Benzoate, Sodium Chloride, Sodium Cocoamphoacetate, Sodium Lactate, Sodium Myreth Sulfate, Sodium Salicylate, Sorbitol, Urea",https://cdn1.skinsafeproducts.com/photo/328870D99535A4/large_1753786625.pngpng?1753786625,https://www.skinsafeproducts.com/eucerin-urea-repair-cleansing-fluid-400-ml
1401-1600.csv,"Eucerin Original Moisturizing Cream, 20 oz/567 g",Eucerin,Body,Creams,"Ceresin, Lanolin Alcohol, Methylchloroisothiazolinone, Methylisothiazolinone, Mineral Oil, Petrolatum, Water",https://cdn1.skinsafeproducts.com/photo/C119EF4F7C1AD2/large_1657010076.jpeg?1657010076,https://www.skinsafeproducts.com/eucerin-original-moisturizing-cream-20-oz-567-g
1401-1600.csv,"Eucerin Dermo Pure Hydra Soothing Compensating Cream, 50 mL",Eucerin,Face,Creams,"4-T-Butylcyclohexanol (Trans-Isomer), Aqua, Behenyl Alcohol, Carbomer, Ceramide Np, Cetyl Alcohol, Dimethicone, Glycerin, Glyceryl Stearate Citrate, Glycyrrhiza Inflata Root Extract, Hydrogenated Coco-Glycerides, Isopropyl Palmitate, Panthenol, Pentylene Glycol, Phenoxyethanol, Sodium Hydroxide, Squalane, Tapioca Starch, Trisodium Edta",https://cdn1.skinsafeproducts.com/photo/F9514DA3B8C3E8/large_1752747307.pngpng?1752747307,https://www.skinsafeproducts.com/eucerin-dermo-pure-hydra-soothing-compensating-cream-50-ml
1401-1600.csv,"Eucerin Dermatoclean Cleansing Gel, Hyaluron, 200 mL",Eucerin,Facial Cleansers,Facial Gels,"Acrylates-C10-30-Alkyl-Acrylate-Crosspolymer, Aqua, Coco Glucoside, Coco-Betaine, Glycerin, Glyceryl Glucoside, Sodium Benzoate, Sodium Chloride, Sodium Hyaluronate, Trisodium Edta",https://cdn1.skinsafeproducts.com/photo/297AE43A89FBA5/large_1752485519.pngpng?1752485519,https://www.skinsafeproducts.com/eucerin-dermatoclean-cleansing-gel-hyaluron-200-ml
1401-1600.csv,"Eucerin pH5 Moisturizing Body Lotion, 400 mL",Eucerin,Body,Lotions,"Aqua, Benzyl Alcohol, C15-19 Alkane, Caprylic/Capric Triglyceride, Caprylyl Glycol, Carbomer, Cetyl Alcohol, Cetyl Palmitate, Citric Acid, Dimethicone, Glycerin, Glyceryl Stearate Se, Hydrogenated Coco-Glycerides, Panthenol, Pantolactone, Parfum, Pentylene Glycol, Phenoxyethanol, Polybutene, Sodium Cetearyl Sulfate, Sodium Citrate, Sodium Hydroxide, Sorbitan Stearate, Stearyl Alcohol, Tapioca Starch, Tocopherol, Tocopheryl Acetate",https://cdn1.skinsafeproducts.com/photo/5C7963D7A77BF9/large_1752211657.jpeg?1752211657,https://www.skinsafeproducts.com/eucerin-ph5-moisturizing-body-lotion-400-ml
1401-1600.csv,"Eucerin Ph 5 Moisturizing Lotion, 400 mL",Eucerin,Body,Lotions,"Aqua, Citric Acid, Glycerin, Isopropyl Stearate, Magnesium Sulfate, Panthenol, Pantolactone, Paraffinum Liquidum, Parfum, Phenoxyethanol, Polyglyceryl-2 Dipolyhydroxystearate, Polyglyceryl-3 Diisostearate, Potassium Sorbate, Sodium Citrate, Tocopheryl Acetate",https://cdn1.skinsafeproducts.com/photo/1FA7BB12BD5426/large_1752206777.pngpng?1752206777,https://www.skinsafeproducts.com/eucerin-ph-5-moisturizing-lotion-400-ml
1401-1600.csv,"Eucerin pH5 Body Lotion, 1000 mL",Eucerin,Body,Lotions,"Aqua, Benzyl Alcohol, C15-19 Alkane, Caprylic/ Capric Triglyceride, Caprylyl Glycol, Carbomer, Cetyl Alcohol, Cetyl Palmitate, Citric Acid, Dimethicone, Glycerin, Glyceryl Stearate Se, Hydrogenated Coco-Glycerides, Panthenol, Pantolactone, Parfum, Pentylene Glycol, Phenoxyethanol, Polybutene, Sodium Cetearyl Sulfate, Sodium Citrate, Sodium Hydroxide, Sorbitan Stearate, Stearyl Alcohol, Tapioca Starch, Tocopherol, Tocopheryl Acetate",https://cdn1.skinsafeproducts.com/photo/03F1F03D18D29C/large_1752137378.pngpng?1752137378,https://www.skinsafeproducts.com/eucerin-ph5-body-lotion-1000-ml
1401-1600.csv,"Eucerin Atopi Control Hand Intensiv-Creme, 75 mL",Eucerin,Hand,Creams,"Aqua, Benzyl Alcohol, Butyrospermum Parkii Butter, Caprylic/Capric Triglyceride, Caprylyl Glycol, Ceramide Np, Cetyl Alcohol, Cetyl Palmitate, Citric Acid, Colloidal Oatmeal, Decylene Glycol, Ethylhexylglycerin, Glycerin, Glyceryl Stearate, Glyceryl Stearate Se, Glycine, Glycyrrhiza Inflata Root Extract, Hydrogenated Coco-Glycerides, Menthoxypropanediol, Methylpropanediol, Octyldodecanol, Oleic Acid, Phenoxyethanol, Phytosphingosine, Sodium Cetearyl Sulfate, Sodium Citrate, Sodium Pca, Stearyl Alcohol",https://cdn1.skinsafeproducts.com/photo/37DC2DC27D64C3/large_1751530624.pngpng?1751530624,https://www.skinsafeproducts.com/eucerin-atopi-control-hand-intensiv-creme-75-ml
1401-1600.csv,"Eucerin Anti-Pigment Skin Perfecting Serum, 30 mL",Eucerin,Skin Treatments,Serums,"Alcohol Denat, Aqua, Caprylic/Capric Triglyceride, Carbomer, Cetyl Alcohol, Dibutyl Adipate, Dicaprylyl Carbonate, Dimethicone, Ethylhexylglycerin, Glycerin, Isobutylamido Thiazolyl Resorcinol, Parfum, Phenoxyethanol, Propylheptyl Caprylate, Sodium Chloride, Sodium Hyaluronate, Sodium Hydroxide, Sodium Stearoyl Glutamate, Tocopherol, Trisodium Edta",https://cdn1.skinsafeproducts.com/photo/4D3DEF1ADCAD5D/large_1750242294.pngpng?1750242294,https://www.skinsafeproducts.com/eucerin-anti-pigment-skin-perfecting-serum-30-ml
1401-1600.csv,"Eucerin PH 5 Soft Body Cream, 450 mL",Eucerin,Body,Creams,"Alcohol Denat, Aqua, C12-15 Alkyl Benzoate, Caprylic/Capric Triglyceride, Caprylyl Glycol, Carbomer, Citric Acid, Dimethicone, Glycerin, Glyceryl Stearate, Glyceryl Stearate Se, Octyldodecanol, Panthenol, Parfum, Pentylene Glycol, Phenoxyethanol, Sodium Cetearyl Sulfate, Sodium Citrate, Sodium Hydroxide, Tocopheryl Acetate, Triisostearin",https://cdn1.skinsafeproducts.com/photo/F733AF68CB7AD2/large_1750241514.pngpng?1750241514,https://www.skinsafeproducts.com/eucerin-ph-5-soft-body-cream-450-ml
1401-1600.csv,"Eucerin Hyaluron-Filler Epigenetic Serum, 30 mL",Eucerin,Skin Treatments,Serums,"Alcohol Denat, Aqua, Butylene Glycol, Caprylic/Capric Triglyceride, Cetearyl Alcohol, Citric Acid, Dibutyl Adipate, Diethylhexyl Syringylidenemalonate, Dihydromyricetin, Distarch Phosphate, Ethylhexylglycerin, Gellan Gum, Glycerin, Glyceryl Stearate, Glyceryl Stearate Citrate, Glycine Soja Germ Extract, Glycyrrhetinic Acid, Lauroyl Lysine, Octyldodecanol, Parfum, Phenoxyethanol, Propylheptyl Caprylate, Ricinus Communis Seed Oil, Sodium Hyaluronate, Sodium Hydroxide, Sodium Metabisulfite (Sodium Disulfite), Succinoglycan, Tocopherol, Trisodium Ethylenediamine Disuccinate, Xanthan Gum",https://cdn1.skinsafeproducts.com/photo/E40C3CBBE3713C/large_1750234578.pngpng?1750234578,https://www.skinsafeproducts.com/eucerin-hyaluron-filler-epigenetic-serum-30-ml
1601-1800.csv,"Eucerin Ph5 Light Gel Cream, 200 mL",Eucerin,Face,Creams,"Alcohol Denat, Aqua, Butyrospermum Parkii Butter, Caprylyl Glycol, Cetyl Alcohol, Citric Acid, Coco-Caprylate/Caprate, Ethylhexylglycerin, Glycerin, Glyceryl Stearate, Glyceryl Stearate Citrate, Helianthus Annuus Seed Oil, Hydroxyacetophenone, Hydroxypropyl Starch Phosphate, Isopropyl Palmitate, Panthenol, Pantolactone, Parfum, Phenoxyethanol, Sodium Citrate, Xanthan Gum",https://cdn1.skinsafeproducts.com/photo/D3E5CB8FC36A36/large_1747126166.pngpng?1747126166,https://www.skinsafeproducts.com/eucerin-ph5-light-gel-cream-200-ml
1601-1800.csv,"Eucerin Atopi Control Hand Intensive Cream, 75 mL",Eucerin,Hand,Creams,"Aqua, Benzyl Alcohol, Butyrospermum Parkii Butter/Butyrospermum Parkii (Shea) Butter, Caprylic/Capric Triglyceride, Capryly Glycol, Ceramide Np, Cetyl Alcohol, Cetyl Palmitate, Citric Acid, Colloidal Oatmeal, Decylene Glycol, Ethylhexylglycerin, Glycerin, Glyceryl Stearate, Glyceryl Stearate Se, Glycine, Glycyrrhiza Inflata Root Extract, Hydrogenated Coco-Glycerides, Menthoxypropanediol, Methylpropanediol, Octyldodecanol, Oleic Acid, Phenoxyethanol, Phytosphingosine, Sodium Cetearyl Sulfate, Sodium Citrate, Sodium Pca, Stearyl Alcohol",https://cdn1.skinsafeproducts.com/photo/2EF8E5DD504AE6/large_1745227982.jpeg?1745227982,https://www.skinsafeproducts.com/eucerin-atopi-control-hand-intensive-cream-75-ml
1601-1800.csv,"Eucerin Hyaluron-Filler Epigenetic Serum, Epicelline, 30 mL",Eucerin,Skin Treatments,Serums,"Alcohol Denat, Aqua, Butylene Glycol, Caprylic/Capric Triglyceride, Cetearyl Alcohol, Citric Acid, Dibutyl Adipate, Diethylhexyl Syringylidenemalonate, Dihydromyricetin, Distarch Phosphate, Ethylhexylglycerin, Gellan Gum, Glycerin, Glyceryl Stearate, Glyceryl Stearate Citrate, Glycine Soja Germ Extract, Glycyrrhetinic Acid, Lauroyl Lysine, Octyldodecanol, Parfum, Phenoxyethanol, Propylheptyl Caprylate, Ricinus Communis Seed Oil, Sodium Hyaluronate, Sodium Hydroxide, Sodium Metabisulfite (Sodium Disulfite), Succinoglycan, Tocopherol, Trisodium Ethylenediamine Disuccinate, Xanthan Gum",https://cdn1.skinsafeproducts.com/photo/9D4F76F1581DF9/large_1744796669.pngpng?1744796669,https://www.skinsafeproducts.com/eucerin-hyaluron-filler-epigenetic-serum-epicelline-30-ml
1601-1800.csv,"Eucerin Lip Active, SPF 20, 5 mL",Eucerin,Lip Care,"Lip Balms, Gels, Moisturizers & Oils","Aqua, Aroma, Ascorbyl Palmitate, Bis-Diglyceryl Polyacyladipate-2, Butyl Methoxydibenzoylmethane, Butyrospermum Parkii Butter, Cera Alba, Citric Acid, Ethylhexyl Triazone, Hydrogenated Castor Oil, Octyldodecanol, Panthenol, Pantolactone, Polyglyceryl-4 Isostearate, Ricinus Communis Seed Oil, Simmondsia Chinensis Seed Oil, Sodium Citrate, Tocopherol, Tocopheryl Acetate",https://cdn1.skinsafeproducts.com/photo/753FFE5F4F3A86/large_1744094563.pngpng?1744094563,https://www.skinsafeproducts.com/eucerin-lip-active-spf-20-5-ml
1601-1800.csv,"Eucerin AtopiControl Calming Hydro-Lotion, 400 mL",Eucerin,Face,Creams,"Alcohol Denat, Aqua, Caprylic/Capric Triglyceride, Ceramide Np, Citric Acid, Decylene Glycol, Dicaprylyl Carbonate, Gellan Gum, Glycerin, Glycine, Glycyrrhiza Inflata Root Extract, Hydroxyacetophenone, Hydroxypropyl Guar, Octyldodecanol, Oleic Acid, Phytosphingosine, Sodium Cetearyl Sulfate, Sodium Hyaluronate, Sodium Pca, Tapioca Starch, Tocopherol, Vitis Vinifera Seed Oil, Xanthan Gum",https://cdn1.skinsafeproducts.com/photo/61366543CC7286/large_1738842042.pngpng?1738842042,https://www.skinsafeproducts.com/eucerin-atopicontrol-calming-hydro-lotion-400-ml
1601-1800.csv,"Eucerin AtopiControl Hand Cream, 75 mL",Eucerin,Hand,Creams,"Aqua, Benzyl Alcohol, Butyrospermum Parkii Butter, Caprylic/Capric Triglyceride, Caprylyl Glycol, Ceramide Np, Cetyl Alcohol, Cetyl Palmitate, Citric Acid, Colloidal Oatmeal, Decylene Glycol, Ethylhexylglycerin, Glycerin, Glyceryl Stearate, Glyceryl Stearate Se, Glycine, Glycyrrhiza Inflata Root Extract, Hydrogenated Coco-Glycerides, Menthoxypropanediol, Octyldodecanol, Oleic Acid, Phenoxyethanol, Phytosphingosine, Sodium Cetearyl Sulfate, Sodium Citrate, Sodium Pca, Stearyl Alcohol",https://cdn1.skinsafeproducts.com/photo/722FBF10ED7F0B/large_1738841497.pngpng?1738841497,https://www.skinsafeproducts.com/eucerin-atopicontrol-hand-cream-75-ml
1601-1800.csv,"Eucerin Atopi Control Rich Calming Lotion, 400 mL",Eucerin,Body,Lotions,"1,2-Hexanediol, Aqua, Ascorbyl Palmitate, Bht, Ceramide Np, Citric Acid, Dimethicone, Glycerin, Glycyrrhiza Inflata Root Extract, Hydrogenated Castor Oil, Magnesium Sulfate, Methoxy Peg-22-Dodecyl Glycol Copolymer, Octyldodecanol, Oenothera Biennis Oil, Ozokerite, Paraffinum Liquidum, Peg-2 Hydrogenated Castor Oil, Peg-45 Dodecyl Glycol Copolymer, Peg-7 Hydrogenated Castor Oil, Phenoxyethanol, Potassium Sorbate, Sodium Citrate, Sorbitan Isostearate, Tocopherol, Vitis Vinifera Seed Oil",https://cdn1.skinsafeproducts.com/photo/181BFCCA91D004/large_1738837191.pngpng?1738837191,https://www.skinsafeproducts.com/eucerin-atopi-control-rich-calming-lotion-400-ml
1601-1800.csv,"Eucerin Atopi Control Calming Balm, 400 mL",Eucerin,Face,Balms,"Aqua, Ascorbyl Palmitate, Behenyl Alcohol, Butyrospermum Parkii Butter, Caprylic/Capric Triglyceride, Ceramide Np, Cetearyl Alcohol, Citric Acid, Decylene Glycol, Distarch Phosphate, Ethylhexylglycerin, Glycerin, Glyceryl Stearate Se, Glycine, Glycyrrhiza Inflata Root Extract, Helianthus Annuus Seed Oil, Hydroxyacetophenone, Hydroxypropyl Starch Phosphate, Octyldodecanol, Oenothera Biennis Oil, Oleic Acid, Phenoxyethanol, Phytosphingosine, Polyglyceryl-3 Methylglucose Distearate, Sodium Cetearyl Sulfate, Sodium Citrate, Sodium Pca, Tocopherol, Trisodium Ethylenediamine Disuccinate, Vitis Vinifera Seed Oil, Xanthan Gum",https://cdn1.skinsafeproducts.com/photo/97411C2EE44966/large_1738836612.pngpng?1738836612,https://www.skinsafeproducts.com/eucerin-atopi-control-calming-balm-400-ml
1601-1800.csv,"Eucerin Dermo Purifyer Oil Control Cleansing Gel, 200 mL",Eucerin,Facial Cleansers,Facial Gels,"Propylene Glycol, Aqua, Citric Acid, Salicylic Acid, Sodium Benzoate, Sodium Chloride, Sodium Cocoamphoacetate, Sodium Laureth Sulfate",https://cdn1.skinsafeproducts.com/photo/3ED7ED8F264BB8/large_1738833853.pngpng?1738833853,https://www.skinsafeproducts.com/eucerin-dermo-purifyer-oil-control-cleansing-gel-200-ml
1601-1800.csv,"Eucerin Atopi Control Calming Balm, 200 mL",Eucerin,Body,"Balms, Ointments & Salves","Aqua, Ascorbyl Palmitate, Behenyl Alcohol, Butyrospermum Parkii Butter, Caprylic/Capric Triglyceride, Ceramide Np, Cetearyl Alcohol, Citric Acid, Decylene Glycol, Distarch Phosphate, Ethylhexylglycerin, Glycerin, Glyceryl Stearate Se, Glycine, Glycyrrhiza Inflata Root Extract, Helianthus Annuus Seed Oil, Hydroxyacetophenone, Hydroxypropyl Starch Phosphate, Octyldodecanol, Oenothera Biennis Oil, Oleic Acid, Phenoxyethanol, Phytosphingosine, Polyglyceryl-3 Methylglucose Distearate, Sodium Cetearyl Sulfate, Sodium Citrate, Sodium Pca, Tocopherol, Trisodium Ethylenediamine Disuccinate, Vitis Vinifera Seed Oil, Xanthan Gum",https://cdn1.skinsafeproducts.com/photo/C9D14D712DC42D/large_1738826608.pngpng?1738826608,https://www.skinsafeproducts.com/eucerin-atopi-control-calming-balm-200-ml
1601-1800.csv,"Eucerin Anti-Pigment Cleansing Gel, 2% Exfoliating AHA Complex, 200 mL",Eucerin,Facial Cleansers,Facial Gels,"Alcohol Denat, Aqua, Coco-Betaine, Dehydroxanthan Gum, Glycerin, Glyceryl Glucoside, Glycolic Acid, Lactic Acid, Sodium Benzoate, Sodium Chloride, Sodium Cocoamphoacetate, Sodium Hydroxide",https://cdn1.skinsafeproducts.com/photo/8B0106DE75FF2F/large_1736923615.pngpng?1736923615,https://www.skinsafeproducts.com/eucerin-anti-pigment-cleansing-gel-2-exfoliating-aha-complex-200-ml
1601-1800.csv,"Eucerin Atopicontrol Hand Intensive Cream, 75 mL",Eucerin,Hand,Creams,"Aqua, Benzyl Alcohol, Butyrospermum Parkii Butter, Caprylic/Capric Triglyceride, Caprylyl Glycol, Ceramide Np, Cetyl Alcohol, Cetyl Palmitate, Citric Acid, Colloidal Oatmeal, Decylene Glycol, Glycerin, Glyceryl Stearate, Glycyrrhiza Inflata Root Extract, Hydrogenated Coco-Glycerides, Menthoxypropanediol, Octyldodecanol, Paraffinum Liquidum, Peg-40 Stearate, Phenoxyethanol, Sodium Citrate, Stearyl Alcohol",https://cdn1.skinsafeproducts.com/photo/D4854EBDEBF9A0/large_1721984554.pngpng?1721984554,https://www.skinsafeproducts.com/eucerin-atopicontrol-hand-intensive-cream-75-ml
1601-1800.csv,"Eucerin Dermo Purifyer Oil Control Post - Acne Marks Reduction Triple Effect Serum, 40 mL",Eucerin,Skin Care,Acne Care (OTC),"Alcohol Denat, Ammonium Acryloyldimethyltaurate/Vp Copolymer, Aqua, Carbomer, Citric Acid, Decylene Glycol, Glucosylrutin, Glycerin, Glycyrrhiza Inflata Root Extract, Isobutylamido Thiazolyl Resorcinol, Isoquercitrin, Panthenol, Pantolactone, Parfum, Salicylic Acid, Sodium Hydroxide, Tapioca Starch, Trisodium Edta",https://cdn1.skinsafeproducts.com/photo/9D95B4DFB24BBA/large_1719397838.pngpng?1719397838,https://www.skinsafeproducts.com/eucerin-dermo-purifyer-oil-control-post-acne-marks-reduction-triple-effect-serum-40-ml
1601-1800.csv,"Eucerin Anti - Age Hyaluron - Filler Booster, Vitamin C, 8 mL",Eucerin,Skin Treatments,Serums,"1,2-Hexanediol, Acrylic Acid/Vp Crosspolymer, Aqua, Ascorbic Acid, Bht, Dibutyl Adipate, Dimethicone, Distarch Phosphate, Glycerin, Glyceryl Stearate, Glycyrrhiza Inflata Root Extract, Isopropyl Palmitate, Methylpropanediol, Parfum, Peg-40 Stearate, Phenoxyethanol, Piroctone Olamine, Sodium Cetearyl Sulfate, Sodium Hyaluronate, Sorbitan Stearate, Squalane, Trisodium Edta, Xanthan Gum",https://cdn1.skinsafeproducts.com/photo/99E50057749619/large_1718881277.pngpng?1718881277,https://www.skinsafeproducts.com/eucerin-anti-age-hyaluron-filler-booster-vitamin-c-8-ml
1601-1800.csv,"Eucerin Anti-Aging Hyaluron-Filler Day Cream, SPF 15, 50 mL",Eucerin,Face,Daytime Moisturizers,"1,2-Hexanediol, Aqua, Bis-Ethylhexyloxyphenol Methoxyphenyl Triazine, Butyl Methoxydibenzoylmethane, Butylene Glycol, Butylene Glycol Dicaprylate/Dicaprate, Butyrospermum Parkii Butter, Cetyl Alcohol, Ci 77891, Ethylhexyl Salicylate, Ethylhexyl Triazone, Glycerin, Glyceryl Stearate Citrate, Glycine Soja Germ Extract, Glycyrrhetinic Acid, Hydrogenated Coco-Glycerides, Hydroxypropyl Starch Phosphate, Methylpropanediol, Mica, Parfum, Pentaerythrityl Tetra-Di-T-Butyl Hydroxyhydrocinnamate, Phenoxyethanol, Phenylbenzimidazole Sulfonic Acid, Silica, Sodium Hyaluronate, Sodium Hydroxide, Stearyl Alcohol, Trisodium Edta, Xanthan Gum",https://cdn1.skinsafeproducts.com/photo/C5CA5369180A1B/large_1713520591.pngpng?1713520591,https://www.skinsafeproducts.com/eucerin-anti-aging-hyaluron-filler-day-cream-spf-15-50-ml
1801-2000.csv,"Eucerin Anti-Pigment Tinted Day Cream, Medium, SPF 30, 50 mL",Eucerin,Face,Tinted Moisturizers,"Alcohol Denat, Alumina, Aqua, Arachidic Acid, Behenyl Alcohol, Bis-Ethylhexyloxyphenol Methoxyphenyl Triazine, Butyl Methoxydibenzoylmethane, Butylene Glycol Dicaprylate/Dicaprate, C12-15 Alkyl Benzoate, Carrageenan, Cetearyl Alcohol, Ci 77491, Ci 77492, Ci 77891, Cocoglycerides, Copernicia Cerifera Cera, Dibutyl Adipate, Diethylamino Hydroxybenzoyl Hexyl Benzoate, Ethylhexyl Salicylate, Ethylhexyl Triazone, Glycerin, Glycyrrhiza Inflata Root Extract, Hydroxyacetophenone, Hydroxypropyl Methylcellulose, Isobutylamido Thiazolyl Resorcinol, Myristic Acid, Oleic Acid, Palmitic Acid, Parfum, Phenoxyethanol, Phenylbenzimidazole Sulfonic Acid, Silica, Silica Dimethyl Silylate, Sodium Chloride, Sodium Hydroxide, Sodium Stearoyl Glutamate, Stearic Acid, Tapioca Starch, Tocopherol, Trisodium Edta, Xanthan Gum",https://cdn1.skinsafeproducts.com/photo/0ABDFFD1BF7A72/large_1707995494.pngpng?1707995494,https://www.skinsafeproducts.com/eucerin-anti-pigment-tinted-day-cream-medium-spf-30-50-ml
