File,product_name,brand,usage_type,category,ingredients,image_url,product_url
201-400.csv,"Eucerin 10% Urea Repair Lotion, 250 mL",Eucerin,Body,Lotions,"1-2-Hexanediol, Alanine, Aqua, Arginine, Arginine Hcl, Butyrospermum Parkii Butter, Carnitine, Ceramide Np, Cetearyl Alcohol, Citrulline, Dicaprylyl Ether, Glutamic Acid, Glycerin, Glyceryl Glucoside, Glycogen, Histidine, Isopropyl Stearate, Lactic Acid, Lysine, Mannitol, Pca, Phenoxyethanol, Polyglyceryl-4 Diisostearate/Polyhydroxystearate/Sebacate, Potassium Sorbate, Serine, Sodium Chloride, Sodium Lactate, Sodium Pca, Sucrose, Threonine, Urea",https://cdn1.skinsafeproducts.com/photo/478B86D5D8F7CC/large_1695229612.jpeg?1695229612,https://www.skinsafeproducts.com/eucerin-10-urea-repair-lotion-250-ml
201-400.csv,"Eucerin Advanced Repair Lotion,16 fl oz",Eucerin,Body,Lotions,"1-2-Hexanediol, Alanine, Arginine Hcl, Butyrospermum Parkii Butter, Caprylic-Capric-Triglyceride, Carnitine, Ceramide Np, Cetearyl Alcohol, Chondrus Crispus, Citrulline, Cyclomethicone, Dicaprylyl Ether, Dimethiconol, Glutamic Acid, Glycerin, Glyceryl Glucoside, Glyceryl Stearate Se, Glycogen, Histidine, Hydrogenated Coco-Glycerides, Lactic Acid, Lysine, Mannitol, Methylpropanediol, Octyldodecanol, Phenoxyethanol, Serine, Sodium Cetearyl Sulfate, Sodium Chloride, Sodium Lactate, Sodium Pca, Sucrose, Tapioca Starch, Threonine, Urea, Water",https://cdn1.skinsafeproducts.com/photo/DA6B139806DF35/large_1671789207.jpegjpg?1671789207,https://www.skinsafeproducts.com/eucerin-advanced-repair-lotion-16-fl-oz
201-400.csv,"Eucerin Skin Calming Itch Soothing Cream, Fragrance Free, 14 oz/396 g",Eucerin,Body,Creams,"1-2-Hexanediol, Benzyl Alcohol, Caprylic-Capric-Triglyceride, Carbomer, Cetyl Alcohol, Cetyl Palmitate, Colloidal Oatmeal, Decylene Glycol, Dimethicone, Glycerin, Glyceryl Stearate, Methylpropanediol, Mineral Oil, Octyldodecanol, Peg-40 Stearate, Phenoxyethanol, Piroctone Olamine, Polyglyceryl-2 Caprate, Water",https://cdn1.skinsafeproducts.com/photo/4CBAA2AC79E753/large_1648791107.pngpng?1648791107,https://www.skinsafeproducts.com/eucerin-skin-calming-itch-soothing-cream-fragrance-free-14-oz-396-g
201-400.csv,"Eucerin Intensive Repair Lotion, Very Dry & Flaky Skin, Fragrance Free, 16.9 fl oz/500 mL",Eucerin,Body,Lotions,"Benzyl Alcohol, Caprylic/Capric Triglyceride, Dimethicone, Glycerin, Hydrogenated Castor Oil, Isopropyl Palmitate, Lactic Acid, Magnesium Sulfate, Methoxy Peg-22/Dodecyl Glycol Copolymer, Mineral Oil, Octyldodecanol, Ozokerite, Peg-2 Hydrogenated Castor Oil, Peg-45/Dodecyl Glycol Copolymer, Peg-7 Hydrogenated Castor Oil, Sodium Lactate, Sorbitan Isostearate, Urea, Water",https://cdn1.skinsafeproducts.com/photo/A22F6389A885E9/large_1638422267.pngpng?1638422267,https://www.skinsafeproducts.com/eucerin-intensive-repair-lotion-very-dry-flaky-skin-fragrance-free-16-9-fl-oz-500-ml
201-400.csv,"Eucerin Original Healing Lotion, 8.4 fl oz/250 mL (Pack of 3)",Eucerin,Body,Lotions,"Aluminum Stearates, Cetyl Palmitate, Citric Acid, Isopropyl Palmitate, Lanolin Alcohol, Magnesium Sulfate, Mineral Oil, Phenoxyethanol, Polyglyceryl-3 Diisostearate, Polyglyceryl-4 Diisostearate/Polyhydroxystearate/Sebacate, Potassium Sorbate, Propylene Glycol (1,2-Propanediol), Sodium Citrate, Sorbitol, Water",https://cdn1.skinsafeproducts.com/photo/41AE905D2BB53C/large_1634371594.jpeg?1634371594,https://www.skinsafeproducts.com/eucerin-original-healing-lotion-fragrance-free-extremely-dry-compromised-skin-8-4-fl-oz-250-ml-pack-of-3
201-400.csv,"Eucerin Dermaloclean Toner, hyaluron, Sensitive Skin, 200 mL",Eucerin,Toners & Astringents,Toners,"1-2-Hexanediol, Aqua, Citric Acid, Cocamidopropyl Betaine (Coconut Derived), Decyl Glucoside (Plant Source), Dipropylene Glycol, Glycerin, Glyceryl Glucoside, Phenoxyethanol, Sodium Chloride, Sodium Citrate, Sodium Hyaluronate, Trisodium Edta",https://cdn1.skinsafeproducts.com/photo/43AE1FF36AAFBA/large_1630381169.pngpng?1630381169,https://www.skinsafeproducts.com/eucerin-dermaloclean-hyaluron-toner-sensitive-200-ml
201-400.csv,"Eucerin Complete Repair Lotion, 500 mL",Eucerin,Body,Lotions,"Benzyl Alcohol, Caprylic/Capric Triglyceride, Dimethicone, Glycerin, Hydrogenated Castor Oil, Isopropyl Palmitate, Lactic Acid, Magnesium Sulfate, Methoxy Peg-22/Dodecyl Glycol Copolymer, Mineral Oil, Octyldodecanol, Ozokerite, Peg-2 Hydrogenated Castor Oil, Peg-45/Dodecyl Glycol Copolymer, Peg-7 Hydrogenated Castor Oil, Sodium Lactate, Sorbitan Isostearate, Urea, Water",https://cdn1.skinsafeproducts.com/photo/AF49F7D0B2027F/large_1608414765.jpeg?1608414765,https://www.skinsafeproducts.com/eucerin-complete-repair-lotion-500-ml
201-400.csv,"Eucerin Very Dry Skin Advanced Repair Hand Cream, 2.7 oz/78 g",Eucerin,Hand,Creams,"Alanine, Arginine Hcl, Carnitine, Ceramide Np, Cetearyl Alcohol, Cholesterol, Decylene Glycol, Dibutyl Adipate, Dicaprylyl Ether, Dimethicone, Glycerin, Glyceryl Stearate, Glycine, Helianthus Annuus Seed Oil*, Lactic Acid, Pentylene Glycol, Phenoxyethanol, Sodium Cetearyl Sulfate, Sodium Chloride, Sodium Lactate, Sodium Pca, Stearyl Alcohol, Tapioca Starch, Urea, Water, Xanthan Gum",https://cdn1.skinsafeproducts.com/photo/0DD670E1EE60D3/large_1610651607.jpeg?1610651607,https://www.skinsafeproducts.com/eucerin-very-dry-skin-advanced-repair-hand-cream-2-7-oz-78-g
201-400.csv,"Eucerin Daily Protection Face Lotion SPF 30, 4 fl oz/118 ml",Eucerin,Face,Lotions,"1-2-Hexanediol, Alumina, C12-15 Alkyl Benzoate, Ceteareth-20, Cetearyl Alcohol, Cetyl Alcohol, Cyclomethicone, Dimethicone, Ensulizole, Glycerin Solution, Glyceryl Stearate Se, Hydrogenated Coco-Glycerides, Lactic Acid, Methylpropanediol, Octinoxate 7.5%,, Octisalate 4.5%, Peg-40 Castor Oil, Phenoxyethanol, Simethicone, Sodium Cetearyl Sulfate, Sodium Hydroxide, Sodium Lactate, Titanium Dioxide 2.4%, Triethoxycaprylylsilane, Trisodium Edta, Vp-Hexadecene Copolymer, Water, Xanthan Gum, Zinc Oxide 4.8%",https://cdn1.skinsafeproducts.com/photo/53DB20E2848ABF/large_1590960064.jpeg?1590960064,https://www.skinsafeproducts.com/eucerin-daily-protection-face-lotion-spf-30-4-fl-oz-118-ml
201-400.csv,"Eucerin Advanced Repair Lotion, Fragrance Free, 16.9 fl oz",Eucerin,Body,Lotions,"1,2-Hexanediol, African Shea Butter, Alanine, Algae Extract, Arginine Hcl, Caprylic/Capric Triglyceride, Carnitine, Ceramide 3, Cetearyl Alcohol, Citrulline, Cyclomethicone, Dicaprylyl Ether, Dimethiconol, Glutamic Acid, Glycerin, Glyceryl Glucoside, Glyceryl Stearate Se, Glycogen, Histidine, Hydrogenated Coco-Glycerides, Lactic Acid, Lysine, Mannitol, Methylpropanediol, Octyldodecanol, Penoxyethanol, Serine, Sodium Cetearyl Sulfate, Sodium Chloride, Sodium Lactate, Sucrose, Tapioca Starch, Threonine, Urea, Water\Aqua\Eau",https://cdn1.skinsafeproducts.com/photo/F8F934DB94F2B5/large_1551993557.pngPNG?1551993557,https://www.skinsafeproducts.com/eucerin-advanced-repair-lotion-unscented-16-9-fl-oz
201-400.csv,"Eucerin Complete Repair Locion, 10% Urea, 400 mL - Nuevo",Eucerin,Body,Lotions,"1,2-Hexanediol, African Shea Butter, Alanine, Arginine Hcl, Carnitine, Ceramide 3, Cetearyl Alcohol, Citrulline, Dicaprylyl Ether, Glutamic Acid, Glycerin, Glyceryl Glucoside, Glycogen, Histidine, Isopropyl Stearate, Lactic Acid, Lysine, Mannitol, Nylon-12, Phenoxyethanol, Polyglyceryl-4 Diisostearate/ Polyhydroxystearate/Sebacate, Potassium Sorbate, Serine, Sodium Chloride, Sodium Lactate, Sucrose, Threonine, Urea, Water\Aqua\Eau",https://cdn1.skinsafeproducts.com/photo/f9Twd-ZPhzE1KPBQMH_CWQ/large_1476897833.jpegjpg?1476897833,https://www.skinsafeproducts.com/eucerin-complete-repair-locion-10-urea-400-ml-nuevo
201-400.csv,"Eucerin Daily Hydration Lotion, SPF 15, 16.9 fl oz/500 mL",Eucerin,Body,Lotions,"Avobenzone, Benzyl Alcohol, C12-15 Alkyl Benzoate, Caprylyl Glycol, Carbomer, Cetearyl Alcohol, Citric Acid, Dimethicone, Glycerin (Plant Derived), Glyceryl Stearate, Homosalate, Octisalate, Octocrylene, Peg-40 Stearate, Pentylene Glycol, Phenoxyethanol, Sodium Citrate, Sodium Hydroxide, Water/Aqua/Eau",https://cdn1.skinsafeproducts.com/photo/2433AA714B3DD8/large_1597969736.jpegjpeg?1597969736,https://www.skinsafeproducts.com/eucerin-daily-hydration-broad-spectrum-spf-15-body-lotion
201-400.csv,Eucerin Roughness Relief Body Lotion,Eucerin,Body,Lotions,"1,2-Hexanediol, Alanine, Arginine Hcl, Butyrospermum Parkii (Shea) Butter, Carnitine, Ceramide-3, Cetearyl Alcohol, Citrulline, Dicaprylyl Ether, Glutamic Acid, Glycerin, Glyceryl Glucoside, Glycogen, Histidine Hcl, Isopropyl Stearate, Lactic Acid, Lysine Hcl, Mannitol, Nylon-12, Phenoxyethanol, Polyglyceryl-4 Diisostearate/Polyhydroxystearate/Sebacate, Potassium Sorbate, Serine, Sodium Chloride, Sodium Lactate, Sodium Pca, Sucrose, Threonine, Urea, Water/Aqua/Eau",https://cdn1.skinsafeproducts.com/photo/92C83D9E6897F0/large_1595193935.jpeg?1595193935,https://www.skinsafeproducts.com/eucerin-roughness-relief-body-lotion
201-400.csv,"Eucerin Repairing Hand Cream 5% Urea, 75ml",Eucerin,Hand,Creams,"Alanine, Aqua, Arginine Hcl, Carnitine, Ceramide Np, Cetearyl Alcohol, Cholesterol, Decylene Glycol, Dibutyl Adipate, Dicaprylyl Ether, Dimethicone, Glycerin, Glyceryl Stearate, Glycine, Helianthus Annuus Seed Oil, Lactic Acid, Pentylene Glycol, Phenoxyethanol, Sodium Cetearyl Sulfate, Sodium Chloride, Sodium Lactate, Sodium Pca, Stearyl Alcohol, Tapioca Starch, Urea, Xanthan Gum",https://cdn1.skinsafeproducts.com/photo/9C74AF549FDBDA/large_1595319954.jpeg?1595319954,https://www.skinsafeproducts.com/eucerin-repairing-hand-cream-5-urea-75ml
201-400.csv,Eucerin Original Healing Rich Creme,Eucerin,Body,Creams,"Ceresin, Lanolin Alcohol, Mineral Oil, Petrolatum, Phenoxyethanol, Piroctone Olamine, Water",https://cdn1.skinsafeproducts.com/photo/D22F034985DB08/large_1598377116.jpegjpg?1598377116,https://www.skinsafeproducts.com/eucerin-original-healing-cream-16-oz
201-400.csv,"Eucerin Urearepair 5% Urea Regenerating Hand Cream, 30 ml",Eucerin,Hand,Creams,"Alanine, Arginine Hcl, Carnitine, Ceramide Np, Cetearyl Alcohol, Cholesterol, Decylene Glycol, Dibutyl Adipate, Dicaprylyl Ether, Dimethicone, Glycerin, Glyceryl Stearate, Glycine, Helianthus Annuus Seed Oil, Lactic Acid, Pentylene Glycol, Phenoxyethanol, Sodium Cetearyl Sulfate, Sodium Chloride, Sodium Lactate, Sodium Pca, Stearyl Alcohol, Tapioca Starch, Urea, Water\Aqua\Eau, Xanthan Gum",https://cdn1.skinsafeproducts.com/photo/7C0836BF1F0350/large_1579760551.jpeg?1579760551,https://www.skinsafeproducts.com/eucerin-urearepair-5-urea-regenerating-hand-cream-30-ml
201-400.csv,"Eucerin Roughness Relief Cream, 16 oz",Eucerin,Body,Creams,"Alanine, Arginine Hbi, Arginine Hcl, Caprylic/Capric Triglyceride, Carbomer, Carnitine, Ceramide Np, Cetearyl Alcohol, Cholesterol, Dimethicone, Distarch Phosphate, Ethylhexyl Cocoate, Glycerin, Glyceryl Stearate, Glycine, Helianthus Annuus (Sunflower) Seed Oil, Hydrogenated Coco-Glycerides, Hydrogenated Cocoglycerides, Lactic Acid, Octyldodecanol, Phenoxyethanol, Sodium Cetearyl Sulfate, Sodium Chloride, Sodium Lactate, Sodium Pca, Sorbitan Stearate, Urea, Water\Aqua\Eau",https://cdn1.skinsafeproducts.com/photo/CAE26AE1704DCB/large_1594662844.jpegjpeg?1594662844,https://www.skinsafeproducts.com/eucerin-roughness-relief-cream-16-ounce
201-400.csv,Eucerin DermatoCLEAN Micellar Cleansing Fluid 200ml,Eucerin,Facial Cleansers,Facial Gels,"1,2-Hexanediol, Alcohol, Arginine Hcl, Decyl Glucoside (Plant Source), Glycerin, Glyceryl Glucoside, Phenoxyethanol, Poloxamer 124, Sodium Chloride, Sodium Cocoamphoacetate, Sodium Hyaluronate, Trisodium Edta, Water\Aqua\Eau",https://cdn1.skinsafeproducts.com/photo/C95F7BBCD58654/large_1550919670.jpeg?1550919670,https://www.skinsafeproducts.com/eucerin-dermatoclean-micellar-cleansing-fluid-200ml
201-400.csv,"Eucerin Dry Skin Replenishing Face Cream Night 5% Urea With Lactate, 50Ml",Eucerin,Face,Nighttime Moisturizers,"1,2-Hexanediol, African Shea Butter, Arginine Hcl, Bht, Caprylic/Capric Triglyceride, Ceramide 3, Ethylhexyl Cocoate, Glycerin, Helianthus Annuus Seed Oil, Hydrogenated Castor Oil, Isopropyl Palmitate, Isopropyl Stearate, Lactic Acid, Magnesium Sulfate, Phenoxyethanol, Polyglyceryl-2 Dipolyhydroxystearate, Polyglyceryl-3 Diisostearate, Sodium Lactate, Sodium Starch Octenylsuccinate, Squalene, Trisodium Edta, Urea, Water\Aqua\Eau",https://cdn1.skinsafeproducts.com/photo/0C0B7F6C94F9BA/large_1538232406.jpeg?1538232406,https://www.skinsafeproducts.com/eucerin-dry-skin-replenishing-face-cream-night-5-urea-with-lactate-50ml
201-400.csv,Eucerin Skin Calming Lotion,Eucerin,Body,Lotions,"1,2-Hexanediol, Benzyl Alcohol, Caprylic/Capric Triglyceride, Carbomer, Cetyl Alcohol, Cetyl Palmitate, Colloidal Oatmeal, Decylene Glycol, Dimethicone, Glycerin, Glyceryl Stearate, Methylpropanediol, Mineral Oil, Octyldodecanol, Peg-40 Stearate, Phenoxyethanol, Piroctone Olamine, Polyglyceryl-2 Caprate, Water\Aqua\Eau",https://cdn1.skinsafeproducts.com/photo/5E677A1C4EEE7A/large_1595203299.jpeg?1595203299,https://www.skinsafeproducts.com/eucerin-skin-calming-body-lotion-16-9-ounce
201-400.csv,"Eucerin Complete Repair Locion,10% Urea, 400 mL",Eucerin,Body,Lotions,"Benzyl Alcohol, Caprylic/Capric Triglyceride, Cera Microcrystallina, Dimethicone, Glycerin, Hydrogenated Castor Oil, Isopropyl Palmitate, Lactic Acid, Magnesium Sulfate, Methoxy Peg-22-Dodecyl Glycol Copolymer, Octyldodecanol, Ozokerite, Peg-2 Hydrogenated Castor Oil, Peg-45 Dodecyl Glycol Copolymer, Peg-7 Hydrogenated Castor Oil, Sodium Lactate, Sorbitan Isostearate, Urea, Water\Aqua\Eau",https://cdn1.skinsafeproducts.com/photo/TmXgNHAU0RhT2si622cVng/large_1476896568.jpeg?1476896568,https://www.skinsafeproducts.com/eucerin-complete-repair-locion-10-urea-400-ml-1
201-400.csv,"Eucerin Hyaluron-Filler Contorno de Ojos, 15 mL",Eucerin,Eyes,Anti-Wrinkle Treatments,"1,2-Hexanediol, Aluminum Starch Octenylsuccinate, Behenyl Alcohol, Bis-Ethylhexyloxyphenol Methoxyphenyl Triazine, Butylene Glycol, Carbomer, Cetyl Palmitate, Dicaprylate/Dicaprate, Diethylamino Hydroxybenzoyl Hexyl Benzoate, Dimethicone, Ethylhexlyglycerin, Ethylhexyl Triazone, Glycerin, Glyceryl Stearate Citrate, Glycine Soja (Soybean) Extract, Hydrogenated Coco-Glycerides, Methyl Methacrylate Crosspolymer, Methylpropanediol, Octyldodecanol, Phenoxyethanol, Sodium Hyaluronate, Stearyl Alcohol, Synthetic Beeswax, Trisodium Edta, Water\Aqua\Eau",https://cdn1.skinsafeproducts.com/photo/cqnvQiP_5U-LqJI8go_63g/large_1476737805.jpeg?1476737805,https://www.skinsafeproducts.com/eucerin-hyaluron-filler-contorno-de-ojos-15-ml
201-400.csv,"Eucerin Original Healing Lotion, 16.9 fl oz.",Eucerin,Body,Lotions,"Aluminum Stearates, Cetyl Palmitate, Citric Acid, Diisostearoyl Polyglyceryl-3 Dimer Dilinoleate, Isopropyl Palmitate, Lanolin Alcohol, Magnesium Sulfate, Mineral Oil, Phenoxyethanol, Polyglyceryl-4 Diisostearate/Polyhydroxystearate/Sebacate, Potassium Sorbate, Propylene Glycol (1,2-Propanediol), Sodium Citrate, Sorbitol, Water\Aqua\Eau",https://cdn1.skinsafeproducts.com/photo/LlvXdhN_fJ5fCOkZNDIvxQ/large_1465398031.jpegjpg?1465398031,https://www.skinsafeproducts.com/eucerin-original-healing-rich-lotion-16-9-fluid-ounces
201-400.csv,"Eucerin Daily Protection Moisturizing Body Lotion SPF 15, 16.9 Ounce (Pack of 3)",Eucerin,Body,Lotions,"Algae Extract, Arginine Hcl, Benzyl Alcohol, Butylene Glycol, C18-36 Acid Triglycerides, Caprylic/Capric Triglyceride, Carbomer, Cetearyl Alcohol, Citric Acid, Dimethicone, Disodium Edta, Glycerin, Glyceryl Stearate Se, Homosalate, Lactic Acid, Methylparaben, Octinoxate, Octisalate, Octyldodecanol, Peg-40 Castor Oil, Phenoxyethanol, Potassium Sorbate, Propylparaben, Sodium Cetearyl Sulfate, Sodium Citrate, Sodium Lactate, Titanium Dioxide, Tocopheryl Acetate, Trimethoxycaprylylsilane, Urea, Water\Aqua\Eau",https://cdn1.skinsafeproducts.com/photo/wxZv33jPpcvGMzybBJIqKA/large_1439777663.jpeg?1439777663,https://www.skinsafeproducts.com/eucerin-daily-protection-moisturizing-body-lotion-spf-15-16-9-ounce-pack-of-3
201-400.csv,"Eucerin Daily Replenishing Moisturizing Lotion, 16.9 Ounce (Pack of 3)",Eucerin,Body,Lotions,"Bht, Butylparaben, Caprylic/Capric Triglyceride, Carbomer, Cetearyl Alcohol, Cholesterol, Dimethicone, Disodium Edta, Ethylparaben, Glycerin, Glyceryl Stearate Se, Helianthus Annuus (Sunflower) Seed Oil, Isobutylparaben, Lanolin Alcohol, Methylparaben, Octyldodecanol, Panthenol, Petrolatum, Phenoxyethanol, Propylparaben, Sodium Hydroxide, Stearic Acid, Tocopheryl Acetate",https://cdn1.skinsafeproducts.com/photo/8W3PlYoyyKTRCXZqJ8QBvg/large_1426040670.jpeg?1426040670,https://www.skinsafeproducts.com/eucerin-daily-replenishing-moisturizing-lotion-16-9-ounce-pack-of-3
201-400.csv,"Eucerin Hyaluron-Filler + Elasticity Night Cream, 50 mL",Eucerin,Face,Nighttime Moisturizers,"1,2-Hexanediol, 1-Methylhydantoin-2-Imide, Aqua, Arctium Lappa Fruit Extract, Argania Spinosa Kernel Oil, Butylene Glycol, Butyrospermum Parkii Butter, Caprylic/Capric Triglyceride, Caprylyl Glycol, Cetearyl Alcohol, Citric Acid, Creatine, Dimethicone, Glycerin, Glyceryl Stearate Citrate, Hydrogenated Coco-Glycerides, Hydroxypropyl Starch Phosphate, Isobutylamido Thiazolyl Resorcinol, Panthenol, Pantolactone, Parfum, Pentaerythrityl Tetra-Di-T-Butyl Hydroxyhydrocinnamate, Phenoxyethanol, Sodium Hyaluronate, Sodium Hydroxide, Tapioca Starch, Tocopherol, Trisodium Edta, Xanthan Gum",https://cdn1.skinsafeproducts.com/photo/082A0014C5E673/large_1755153051.jpeg?1755153051,https://www.skinsafeproducts.com/eucerin-hyaluron-filler-elasticity-night-cream-50-ml
201-400.csv,"Eucerin Tinted Sensitive Mineral Tinted Sunscreen Lotion, SPF 35, 1.7 fl oz/50 mL",Eucerin,Face,Tinted Moisturizers,"Propylene Glycol, 1,2-Hexanediol, Bis-Octyldodecyl Dimer Dilinoleate/Propanediol Copolymer, Butyloctyl Salicylate, C12-15 Alkyl Benzoate, Caprylyl Glycol, Cera Alba, Cetyl Peg/Ppg-10/1 Dimethicone, Ci 77492, Cyclopentasiloxane, Diethylhexyl Syringylidenemalonate, Dimethicone, Ethylhexyl Methoxycrylene, Ethylhexyl Pelargonate, Glycyrrhetinic Acid, Glycyrrhiza Inflata Root Extract, Hydroxyacetophenone, Isopropyl Palmitate, Jojoba Esters, Peg-12 Dimethicone, Polyester-27, Polyglyceryl-6 Polyricinoleate, Silica, Simmondsia Chinensis Seed Oil, Sodium Ascorbyl Phosphate, Sodium Chloride, Tocopherol, Triethoxycaprylylsilane, Zinc Oxide",https://cdn1.skinsafeproducts.com/photo/75547733E4A82F/large_1754731036.pngpng?1754731036,https://www.skinsafeproducts.com/eucerin-tinted-sensitive-mineral-tinted-sunscreen-lotion-spf-35-1-7-fl-oz-50-ml
201-400.csv,"Eucerin Lip Active Lip Balm, SPF 20, 0.17 oz/4.8 g",Eucerin,Lip Care,"Lip Balms, Gels, Moisturizers & Oils","Aqua, Aroma, Ascorbyl Palmitate, Bis-Diglyceryl Polyacyladipate-2, Butyl Methoxydibenzoylmethane, Butyrospermum Parkii Butter, Cera Alba, Citric Acid, Ethylhexyl Triazone, Helianthus Annuus Seed Cera, Helianthus Annuus Seed Oil, Hydrogenated Castor Oil, Octyldodecanol, Panthenol, Pantolactone, Polyglyceryl-4 Isostearate, Ricinus Communis Seed Oil, Simmondsia Chinensis Seed Oil, Sodium Citrate, Tocopherol, Tocopheryl Acetate",https://cdn1.skinsafeproducts.com/photo/092075EE70C5F4/large_1750831091.pngpng?1750831091,https://www.skinsafeproducts.com/eucerin-lip-active-lip-balm-spf-20-0-17-oz-4-8-g
201-400.csv,"Eucerin Hyaluron-Filler Volume Lift Eye Cream, SPF 15, 15 mL",Eucerin,"Eye Cream, Gel, Oils, & Serum",Creams,"1,2-Hexanediol, Aqua, Arginine Hcl, Behenyl Alcohol, Bis-Ethylhexyloxyphenol Methoxyphenyl Triazine, Butyl Methoxydibenzoylmethane, Butylene Glycol Dicaprylate/Dicaprate, Carbomer, Cetyl Palmitate, Dimethicone, Ethylhexyl Salicylate, Ethylhexylglycerin, Glycerin, Glyceryl Stearate Citrate, Hydrogenated Coco-Glycerides, Magnolia Officinalis Bark Extract, Octyldodecanol, Phenoxyethanol, Phenylbenzimidazole Sulfonic Acid, Pimpinella Anisum Fruit Extract, Polymethylsilsesquioxane, Sodium Hyaluronate, Sodium Hydroxide, Stearyl Alcohol, Synthetic Beeswax, Trisodium Edta",https://cdn1.skinsafeproducts.com/photo/474F58287BACF2/large_1725617393.jpeg?1725617393,https://www.skinsafeproducts.com/eucerin-hyaluron-filler-volume-lift-eye-cream-spf-15-15-ml
201-400.csv,"Eucerin Dark Spot Corrector Radiant Tone Night Cream,1.7 oz/48 g",Eucerin,Face,Nighttime Moisturizers,"Alcohol Denat, Butyrospermum Parkii (Shea) Butter, Cetearyl Alcohol, Cetearyl Isononanoate, Citric Acid, Distarch Phosphate, Fragrance, Glucosylrutin, Glycerin, Glyceryl Stearate Citrate, Glycyrrhiza Inflata Root Extract, Hydrogenated Coco-Glycerides, Isobutylamido Thiazolyl Resorcinol, Isopropyl Palmitate, Isoquercitrin, Lauroyl Lysine, Methylpropanediol, Panthenol, Pantolactone, Phenoxyethanol, Squalane, Tocopherol, Trisodium Ethylenediamine Disuccinate, Water, Xanthan Gum",https://cdn1.skinsafeproducts.com/photo/DFC311AADE23F8/large_1746157631.pngpng?1746157631,https://www.skinsafeproducts.com/eucerin-dark-spot-corrector-radiant-tone-night-cream-1-7-oz-48-g
201-400.csv,"Eucerin Radiant Tone Eye Cream, 0.5 oz/14 g",Eucerin,"Eye Cream, Gel, Oils, & Serum",Creams,"Alcohol Denat, Butyrospermum Parkii (Shea) Butter, Caprylic/Capric Triglyceride, Cetearyl Alcohol, Cetyl Palmitate, Citric Acid, Cocoglycerides, Diisopropyl Adipate, Ethylhexylglycerin, Glycerin, Glyceryl Stearate, Glycyrrhiza Inflata Root Extract, Iron Oxides, Isobutylamido Thiazolyl Resorcinol, Isopropyl Palmitate, Lauroyl Lysine, Phenoxyethanol, Pimpinella Anisum (Anise) Fruit Extract, Sodium Hyaluronate, Sodium Hydroxide, Sodium Stearoyl Glutamate, Synthetic Fluorphlogopite, Tin Oxide, Titanium Dioxide, Trisodium Edta, Water, Xanthan Gum",https://cdn1.skinsafeproducts.com/photo/BF15280D3C4748/large_1744244567.jpeg?1744244567,https://www.skinsafeproducts.com/eucerin-radiant-tone-eye-cream-0-5-oz-14-g
201-400.csv,"Eucerin Radiant Tone Dual Serum, 1 fl oz/30 mL",Eucerin,Skin Treatments,Serums,"Alcohol Denat, Butylene Glycol, Cetearyl Alcohol, Cetearyl Isononanoate, Citric Acid, Dehydroxanthan Gum, Diisopropyl Adipate, Dimethicone, Distarch Phosphate, Ethylhexylglycerin, Fragrance, Gellan Gum, Glucosylrutin, Glycerin, Glyceryl Stearate, Glycine Soja (Soybean) Oil, Glycyrrhiza Inflata Root Extract, Hydroxypropyl Starch Phosphate, Isobutylamido Thiazolyl Resorcinol, Isopropyl Palmitate, Isoquercitrin, Phenoxyethanol, Propylheptyl Caprylate, Sodium Ascorbyl Phosphate, Sodium Chloride, Sodium Hyaluronate, Sodium Stearoyl Glutamate, Tocopherol, Trisodium Edta, Water, Xanthan Gum",https://cdn1.skinsafeproducts.com/photo/3481A7094BB7AA/large_1743517228.jpeg?1743517228,https://www.skinsafeproducts.com/eucerin-radiant-tone-dual-serum-1-fl-oz-30-ml
201-400.csv,"Eucerin Radiant Tone Cleansing Gel, 2% Aha Complex, 6.8 fl oz/200 mL",Eucerin,"Exfoliators, Polishes, & Scrubs",Exfoliators,"Alcohol Denat, Coco-Betaine, Dehydroxanthan Gum, Glycerin, Glyceryl Glucoside, Glycolic Acid, Lactic Acid, Sodium Benzoate, Sodium Chloride, Sodium Cocoamphoacetate, Sodium Hydroxide, Water",https://cdn1.skinsafeproducts.com/photo/F42B2D36DE0012/large_1741488723.jpeg?1741488723,https://www.skinsafeproducts.com/eucerin-radiant-tone-cleansing-gel-2-aha-complex-6-8-fl-oz-200-ml
201-400.csv,"Eucerin Aquaphor Healing Ointment, 50 g, Pack of 3",Eucerin,Body,"Balms, Ointments & Salves","Bisabolol, Ceresin, Glycerin, Lanolin Alcohol, Mineral Oil/ Huile MinéRale, Panthenol, Petrolatum",https://cdn1.skinsafeproducts.com/photo/F44D31CD50DEBD/large_1740557786.pngpng?1740557786,https://www.skinsafeproducts.com/eucerin-aquaphor-healing-ointment-50-g-pack-of-3
201-400.csv,"Eucerin Face Immersive Hydration Gel-Cream, 1.7 oz/48 g",Eucerin,Anti-Aging/Anti-Wrinkle,Anti-Wrinkle,"Alcohol Denat, Behenyl Alcohol, Carrageenan, Cetearyl Isononanoate, Cetyl Alcohol, Citric Acid, Dehydroxanthan Gum, Distarch Phosphate, Fragrance, Gellan Gum, Glycerin, Glycine Soja (Soybean) Oil, Isopropyl Palmitate, Lactic Acid, Lauroyl Lysine, Panthenol, Pantolactone, Phenoxyethanol, Sodium Hyaluronate, Squalene, Tocopherol, Water, Xanthan Gum",https://cdn1.skinsafeproducts.com/photo/E490BAADEDB2A2/large_1737952664.pngpng?1737952664,https://www.skinsafeproducts.com/eucerin-face-immersive-hydration-gel-cream-1-7-oz-48-g
201-400.csv,"Eucerin Hyaluron-Filler + Elasticity Day Cream, SPF 15, 50 mL",Eucerin,Anti-Aging/Anti-Wrinkle,Anti-Aging,"Acrylates/C10-30 Alkyl Acrylate Crosspolymer, Aqua, Arctium Lappa Fruit Extract, Ascorbyl Palmitate, Benzyl Alcohol, Bht, Bis-Ethylhexyloxyphenol Methoxyphenyl Triazine, Butyl Methoxydibenzoyl Methane, Butylene Glycol, Butylene Glycol Dicaprylate/Dicaprate, Caprylic/Capric Triglyceride, Caprylyl Glycol, Carbomer, Cetearyl Alcohol, Dicaprylyl Ether, Dimethicone, Distarch Phosphate, Ethylhexyl Salicylate, Ethylhexyl Triazone, Glycerin, Glyceryl Stearate Citrate, Glycine Soja Oil, Hydrogenated Cocoglycerides, Hydrogenated Palm Glycerides Citrate, Lecithin, Methylpropanediol, Octyldodecanol, Parfum, Pentylene Glycol, Silybum Marianum Fruit Extract, Sodium Hyaluronate, Sodium Hydroxide, Tocopherol, Trisodium Edta",https://cdn1.skinsafeproducts.com/photo/1F9E392B0BA228/large_1733310377.pngpng?1733310377,https://www.skinsafeproducts.com/eucerin-hyaluron-filler-elasticity-day-cream-spf-15-50-ml
201-400.csv,"Eucerin Ultra Sensitive Soothing Care, Normal To Combination Skin, 50 mL",Eucerin,Face,Lotions,"4-T-Butylcyclohexanol (Trans-Isomer), Ammonium Acryloyldimethyltaurate/Vp Copolymer, Aqua, Arginine Hcl, Caprylyl Glycol, Cetearyl Alcohol, Glycerin, Methylpropanediol, Pentylene Glycol, Sodium Carbomer, Squalane, Tapioca Starch",https://cdn1.skinsafeproducts.com/photo/53B86AC1F0AD3E/large_1570972663.jpeg?1570972663,https://www.skinsafeproducts.com/eucerin-ultra-sensitive-soothing-care-normal-to-combination-skin-50-ml
