File,product_name,brand,usage_type,category,ingredients,image_url,product_url
801-1000.csv,"Innisfree Super Volcanic Pore Clay Mask, Volcanic Clusters + Aha, 3.38 fl oz/100 mL",Innisfree,Skin Treatments,Facial Masks,"1,2-Hexanediol, Aluminum Hydroxide, Bentonite, Butylene Glycol, Caprylic/Capric Triglyceride, Cetearyl Alcohol, Disodium Edta, Ethylhexylglycerin, Glycerin, Glyceryl Stearate, Hydrogenated Vegetable Oil, Iron Oxides Ci 77491, Ci 77492, Ci 77499, Juglans Regia (Walnut) Shell Powder, Kaolin, Lactic Acid, Lactic Acid/Glycolic Acid Copolymer, Mannitol, Menthoxypropanediol, Microcrystalline Cellulose, Peg-100 Stearate, Polyacrylate-13, Polyisobutene, Polysorbate 20, Polysorbate 60, Polyvinyl Alcohol, Pvp, Silica, Sorbitan Isostearate, Sorbitan Stearate, Stearic Acid, Tetrasodium Pyrophosphate, Titanium Dioxide (Ci 77891), Tocopherol, Trehalose, Triethoxycaprylylsilane, Volcanic Ash, Water/Aqua/Eau, Xanthan Gum, Zea Mays (Corn) Starch",https://cdn1.skinsafeproducts.com/photo/8252FC9B0050C3/large_1709356916.pngpng?1709356916,https://www.skinsafeproducts.com/innisfree-super-volcanic-pore-clay-mask-volcanic-clusters-aha-3-38-fl-oz-100-ml
801-1000.csv,"Innisfree Green Tea Seed Serum, 2.70 fl oz/80 mL",Innisfree,Skin Treatments,Serums,"1,2-Hexanediol, 3-O-Ethyl Ascorbic Acid, Acrylates/C10-30 Alkyl Acrylate Crosspolymer, Alcohol Denat, Allantoin, Betaine, Butylene Glycol, Camellia Sinensis Leaf Extract, Camellia Sinensis Seed Oil, Caprylyl Glycol, Ceratonia Siliqua (Carob) Gum, Cetearyl Olivate, Citric Acid, Dextrin, Dipotassium Glycyrrhizate, Disodium Edta, Epigallocatechin Gallate, Ethoxydiglycol, Ethylhexylglycerin, Fragrance / Parfum, Glycerin, Hyaluronic Acid, Hydrogenated Lecithin, Hydrolyzed Hyaluronic Acid, Hydroxyethyl Acrylate/Sodium Acryloyldimethyl Taurate Copolymer, Lactic Acid, Lactobacillus Ferment Lysate, Limonene, Linalool, Niacinamide, Panthenol, Poloxamer 235, Poloxamer 338, Propanediol, Saccharide Isomerate, Sodium Acetylated Hyaluronate, Sodium Citrate, Sodium Hyaluronate, Sodium Hyaluronate Crosspolymer, Sorbitan Isostearate, Sorbitan Olivate, Squalane, Sucrose, Theobroma Cacao (Cocoa) Extract, Tocophersolan, Trehalose, Tromethamine, Water / Aqua / Eau",https://cdn1.skinsafeproducts.com/photo/9D3A6A7996F60E/large_1684903637.pngpng?1684903637,https://www.skinsafeproducts.com/innisfree-green-tea-seed-serum-2-70-fl-oz-80-ml
801-1000.csv,"Innisfree Pore Clearing Clay Mask, 3.38 fl oz/100 mL",Innisfree,Skin Treatments,Facial Masks,"1,2-Hexanediol, Aluminum Hydroxide, Bentonite, Butylene Glycol, Caprylic/Capric Triglyceride, Cetearyl Alcohol, Disodium Edta, Ethylhexylglycerin, Glycerin, Glyceryl Stearate, Hydrogenated Vegetable Oil, Iron Oxides (Ci 77499, Ci 77492, Ci 77491), Juglans Regia (Walnut) Shell Powder, Kaolin, Lactic Acid, Lactic Acid/Glycolic Acid Copolymer, Mannitol, Menthoxypropanediol, Microcrystalline Cellulose, Peg-100 Stearate, Polyacrylate-13, Polyisobutene, Polysorbate 20, Polysorbate 60, Polyvinyl Alcohol, Pvp, Silica, Sorbitan Isostearate, Sorbitan Stearate, Stearic Acid, Tetrasodium Pyrophosphate, Titanium Dioxide (Ci 77891), Tocopherol, Trehalose, Triethoxycaprylylsilane, Volcanic Ash, Water/Aqua/Eau, Xanthan Gum, Zea Mays (Corn) Starch",https://cdn1.skinsafeproducts.com/photo/96BFFD2A4D7352/large_1629800178.pngpng?1629800178,https://www.skinsafeproducts.com/innisfree-pore-clearing-clay-mask-3-38-fl-oz-100-ml
801-1000.csv,"Innisfree Gentle Care For Sensitive Skin Cream, 1.25 fl oz / 40 ml",Innisfree,Face,Creams,"1,2-Hexanediol, Butyrospermum Parkii (Shea) Butter, Carbomer, Cetearyl Alcohol, Madecassoside, Pentaerythrityl Tetraethylhexanoate, Polyglyceryl-3 Methylglucose Distearate, Potassium Hydroxide, Propanediol, Water / Aqua / Eau, Xanthan Gum",https://cdn1.skinsafeproducts.com/photo/E919E63B661318/large_1622603679.jpeg?1622603679,https://www.skinsafeproducts.com/innisfree-gentle-care-for-sensitive-skin-cream-1-25-fl-oz-40-ml
801-1000.csv,"Innisfree Green Tea Energy Facial Sheet Mask, 0.74 fl oz/22 mL",Innisfree,Skin Treatments,Facial Masks,"1,2-Hexanediol, Arginine, Butylene Glycol, Camellia Sinensis Leaf Extract, Carbomer, Centella Asiatica Extract, Chamomilla Recutita (Matricaria) Flower Extract, Cucumis Melo Seed Extract, Diethylhexyl Sodium Sulfosuccinate, Dipropylene Glycol, Disodium Edta, Ethylhexylglycerin, Glycerin, Glyceryl Caprylate, Glyceryl Polymethacrylate, Iris Florentina Root Extract, Paeonia Suffruticosa Root Extract, Polyglyceryl-10 Laurate, Pyrus Communis (Pear) Fruit Extract, Rosa Damascena Flower Water, Sodium Hyaluronate, Vetiveria Zizanoides Root Oil, Water/Aqua/Eau, Xanthan Gum",https://cdn1.skinsafeproducts.com/photo/84EDFCF78B09A1/large_1743866965.jpeg?1743866965,https://www.skinsafeproducts.com/innisfree-green-tea-energy-facial-sheet-mask-0-74-fl-oz-22-ml
