File,product_name,brand,usage_type,category,ingredients,image_url,product_url
201-400.csv,"Innisfree Volcanic BHA Pore Cleansing Foam, 5.07 fl oz/150 mL",Innisfree,Facial Cleansers,Facial Foaming Cleansers,"Butylene Glycol, Citric Acid, Cocamidopropyl Betaine, Fragrance/Parfum, Glycerin, Glyceryl Stearate, Glycolic Acid, Hydrated Silica, Lactic Acid, Lactic Acid/Glycolic Acid Copolymer, Lauric Acid, Lauryl Glucoside, Madecassoside, Myristic Acid, Palmitic Acid, Peg-100 Stearate, Peg-32, Polyquaternium-10, Polyquaternium-7, Potassium Hydroxide, Salicylic Acid, Silica, Sodium Benzoate, Sodium Chloride, Sodium Metaphosphate, Stearic Acid, Volcanic Ash, Water/Aqua/Eau, Zinc Pca",https://cdn1.skinsafeproducts.com/photo/9D25FD7A8630C1/large_1739743509.jpeg?1739743509,https://www.skinsafeproducts.com/innisfree-volcanic-bha-pore-cleansing-foam-5-07-fl-oz-150-ml
201-400.csv,"Innisfree Hydrate + Glow Hyaluronic Cream, Green Tea Seed, 1.69 fl oz/50 mL",Innisfree,Face,Creams,"1,2-Hexanediol, Allantoin, Butylene Glycol, Butylene Glycol Dicaprylate/Dicaprate, Camellia Sinensis Leaf Extract, Camellia Sinensis Seed Extract, Camellia Sinensis Seed Oil, Carbomer, Ceramide Np, Cetearyl Alcohol, Cholesterol, Dextrin, Ethylhexylglycerin, Glycerin, Glyceryl Caprylate, Glyceryl Polymethacrylate, Glyceryl Stearate, Hyaluronic Acid, Hydrogenated Lecithin, Hydrolyzed Hyaluronic Acid, Hydroxyethyl Acrylate/Sodium Acryloyldimethyl Taurate Copolymer, Lactic Acid, Lactobacillus Ferment Lysate, Madecassoside, Methyl Trimethicone, Panthenol, Pentaerythrityl Tetraethylhexanoate, Phytosphingosine, Polyglyceryl-3 Methylglucose Distearate, Polymethylsilsesquioxane, Propanediol, Sodium Acetylated Hyaluronate, Sodium Hyaluronate, Sodium Hyaluronate Crosspolymer, Sodium Metaphosphate, Sodium Stearoyl Glutamate, Sorbitan Isostearate, Squalane, Stearyl Dimethicone, Theobroma Cacao (Cocoa) Extract, Tocopherol, Tromethamine, Water / Aqua / Eau, Xanthan Gum",https://cdn1.skinsafeproducts.com/photo/623806FD33E3A7/large_1735618483.pngpng?1735618483,https://www.skinsafeproducts.com/innisfree-hydrate-glow-hyaluronic-cream-green-tea-seed-1-69-fl-oz-50-ml
401-600.csv,"Innisfree Retinol Cica Focusing Patch, 9 Count",Innisfree,Skin Care,Skin Treatments,"1,2-Hexanediol, Adenosine, Allantoin, Asiatic Acid, Asiaticoside, Bht, Cellulose Gum, Centella Asiatica Flower/Leaf/Stem Extract, Dipotassium Glycyrrhizate, Disodium Edta, Ethylhexylglycerin, Glycerin, Glycine Soja (Soybean) Oil, Hyaluronic Acid, Madecassic Acid, Madecassoside, Polyglyceryl-10 Laurate, Propanediol, Retinol, Salicylic Acid, Sodium Hyaluronate, Trehalose, Water/Aqua/Eau",https://cdn1.skinsafeproducts.com/photo/02E17ABD3AD337/large_1711397172.jpeg?1711397172,https://www.skinsafeproducts.com/innisfree-retinol-cica-focusing-patch-9-count
401-600.csv,"Innisfree Retinol Cica Moisture Recovery Serum, 1.01 fl oz/30 mL",Innisfree,Skin Treatments,Serums,"1,2-Hexanediol, Acetyl Tetrapeptide-11, Adenosine, Allantoin, Ammonium Acryloyldimethyltaurate/Vp Copolymer, Asiatic Acid, Asiaticoside, Betacarotene, Betaglucan, Bht, Butylene Glycol, Camellia Sinensis Seed Extract, Caprylic/Capric Triglyceride, Ceramide Np, Cholesterol, Daucus Carota Sativa (Carrot) Root Extract, Dibutyl Adipate, Ethylhexylglycerin, Glycerin, Glycine Soja (Soybean) Oil, Helianthus Annuus (Sunflower) Seed Oil, Hyaluronic Acid, Hydrogenated Lecithin, Madecassic Acid, Mannitol, Niacinamide, Phytosphingosine, Propanediol, Retinol, Salicylic Acid, Sodium Methyl Stearoyl Taurate, Stearyl Glycyrrhetinate, Tocopherol, Tocopheryl Acetate, Water / Aqua / Eau",https://cdn1.skinsafeproducts.com/photo/6888B5532352AE/large_1671155870.jpeg?1671155870,https://www.skinsafeproducts.com/innisfree-retinol-cica-moisture-recovery-serum-1-01-fl-oz-30-ml
401-600.csv,"Innisfree Intensive Hydrating Facial Serum, Green Tea, 2.70 fl oz/80 mL",Innisfree,Skin Treatments,Serums,"1,2-Hexanediol, 3-O-Ethyl Ascorbic Acid, Acrylates/C10-30 Alkyl Acrylate Crosspolymer, Alcohol Denat, Allantoin, Betaine, Butylene Glycol, Camellia Sinensis Leaf Extract, Camellia Sinensis Seed Oil, Caprylyl Glycol, Ceratonia Siliqua (Carob) Gum, Cetearyl Olivate, Citric Acid, Dextrin, Dipotassium Glycyrrhizate, Disodium Edta, Epigallocatechin Gallate, Ethoxydiglycol, Ethylhexylglycerin, Fragrance / Parfum, Glycerin, Hyaluronic Acid, Hydrogenated Lecithin, Hydrolyzed Hyaluronic Acid, Hydroxyethyl Acrylate/Sodium Acryloyldimethyl Taurate Copolymer, Lactic Acid, Lactobacillus Ferment Lysate, Limonene, Linalool, Niacinamide, Panthenol, Poloxamer 235, Poloxamer 338, Propanediol, Saccharide Isomerate, Sodium Acetylated Hyaluronate, Sodium Citrate, Sodium Hyaluronate, Sodium Hyaluronate Crosspolymer, Sorbitan Isostearate, Sorbitan Olivate, Squalane, Sucrose, Theobroma Cacao (Cocoa) Extract, Tocophersolan, Trehalose, Tromethamine, Water / Aqua / Eau",https://cdn1.skinsafeproducts.com/photo/662644AFDA5823/large_1669019843.jpegjpg?1669019843,https://www.skinsafeproducts.com/innisfre-intensive-hydrating-faceial-serum-green-tea-2-70-fl-oz-80-ml
401-600.csv,"Innisfree Daily Mild Sunscreen, 1.69 fl oz/50 mL",Innisfree,Face,Moisturizers with SPF,"1,2-Hexanediol, Aloe Barbadensis Leaf Extract, Behenyl Alcohol, Bis-Ethylhexyloxyphenol Methoxyphenyl Triazine, Butylene Glycol, C12-20 Alkyl Glucoside, C14-22 Alcohols, C20-22 Alcohols, C20-22 Alkyl Phosphate, Caprylyl/Capryl Glucoside, Carbomer, Cetearyl Alcohol, Cetearyl Glucoside, Cetearyl Olivate, Dibutyl Adipate, Dicaprylyl Carbonate, Diethylamino Hydroxybenzoyl Hexyl Benzoate, Ethylhexyl Triazone, Ethylhexylglycerin, Fragrance / Parfum, Fructooligosaccharides, Glycerin, Glyceryl Stearate, Methylpropanediol, Pentylene Glycol, Polyisobutene, Polymethylsilsesquioxane, Pullulan, Saccharide Hydrolysate, Sodium Acrylate/Sodium Acryloyldimethyl Taurate Copolymer, Sorbitan Oleate, Sorbitan Olivate, Tocopherol, Tromethamine, Water / Aqua / Eau",https://cdn1.skinsafeproducts.com/photo/0B82FCAC45F4B8/large_1611133823.pngpng?1611133823,https://www.skinsafeproducts.com/innisfree-daily-mild-sunscreen-1-69-fl-oz-50-ml
401-600.csv,"Innisfree Bija Trouble Facial Foam, 150 mL",Innisfree,Cleansers,Foaming Cleansers,"Butylene Glycol, Cocamidopropyl Betaine (Coconut Derived), Dextrin, Disodium Edta, Fragrance / Parfum, Glycerin, Glyceryl Stearate, Lactic Acid, Lauric Acid, Menthol, Myristic Acid, Palmitic Acid, Peg-100 Stearate, Peg-32, Potassium Hydroxide, Rosa Centifolia Flower Extract, Salicylic Acid, Sodium Benzoate, Sodium Chloride, Sodium Hydroxide, Stearic Acid, Theobroma Cacao (Cocoa) Extract, Torreya Nucifera Seed Oil, Water / Aqua / Eau",https://cdn1.skinsafeproducts.com/photo/008D4702357D8A/large_1611132517.pngpng?1611132517,https://www.skinsafeproducts.com/innisfree-bija-trouble-facial-foam-150-ml
401-600.csv,"Innisfree Olive Real Cleansing Foam, 5.07 fl oz",Innisfree,Cleansers,Foaming Cleansers,"Butylene Glycol, Cocamidopropyl Betaine (Coconut Derived), Disodium Edta, Fragrance / Parfum, Glycerin, Glyceryl Stearate, Lactic Acid, Myristic Acid, Olea Europaea (Olive) Fruit Oil, Olive Oil Peg-8 Esters, Palmitic Acid, Peg-100 Stearate, Peg-32, Polyquaternium-7, Potassium Hydroxide, Sodium Benzoate, Sodium Chloride, Stearic Acid, Water / Aqua / Eau",https://cdn1.skinsafeproducts.com/photo/EC4BDC406411A0/large_1611130832.pngpng?1611130832,https://www.skinsafeproducts.com/innisfree-olive-real-cleansing-foam-5-07-fl-oz
401-600.csv,"Innisfree Olive Real Cleansing Oil, 5.07 fl oz/150 mL",Innisfree,Cleansers,Facial Cleansers,"Camellia Japonica Leaf Extract, Camellia Sinensis Leaf Extract, Caprylic/Capric Triglyceride, Citrus Aurantium Dulcis (Orange) Peel Oil, Citrus Medica Limonum (Lemon) Peel Oil, Citrus Unshiu Peel Extract, Hydrogenated Poly(C6-14 Olefin), Hydrogenated Polyisobutene, Olea Europaea (Olive) Fruit Oil, Opuntia Coccinellifera Fruit Extract, Orchid Extract, Peg-20 Glyceryl Triisostearate, Peg-8 Isostearate, Pentaerythrityl Tetraethylhexanoate, Pentaerythrityl Tetraisostearate, Polyglyceryl-10 Dioleate, Tocopheryl Acetate",https://cdn1.skinsafeproducts.com/photo/908E8037C8CED0/large_1580393520.jpeg?1580393520,https://www.skinsafeproducts.com/innisfree-olive-real-cleansing-oil-5-07-fl-oz-150-ml
401-600.csv,"Innisfree Olive Real Oil Mist Ex, 80 mL",Innisfree,Face,Oils,"1,2-Hexanediol, Betaine, Butylene Glycol, Camellia Japonica Leaf Extract, Camellia Sinensis Leaf Extract, Citrus Unshiu Peel Extract, Disodium Edta, Ethylhexylglycerin, Fragrance, Glycerin, Olea Europaea (Olive) Fruit Oil, Opuntia Coccinellifera Fruit Extract, Orchid Extract, Peg/Ppg-17/6 Copolymer, Sodium Chloride, Tocopherol, Tocopheryl Acetate, Water",https://cdn1.skinsafeproducts.com/photo/B7B7F6AAC64E04/large_1611128049.pngpng?1611128049,https://www.skinsafeproducts.com/innisfree-olive-real-oil-mist-ex-80-ml
401-600.csv,"Innisfree Olive Real Power Cream Ex, 50 mL",Innisfree,Moisturizers,Face,"Behenyl Alcohol, Beta-Glucan, Biosaccharide Gum-1, Butylene Glycol, Butylene Glycol Dicaprylate/Dicaprate, Butyrospermum Parkii (Shea) Butter, Camellia Japonica Leaf Extract, Camellia Sinensis Leaf Extract, Cetearyl Alcohol, Cetyl Ethylhexanoate, Citrus Unshiu Peel Extract, Copernicia Cerifera (Carnauba) Wax, Dextrin, Dimethicone, Disodium Edta, Ethylhexylglycerin, Fragrance, Glycerin, Glyceryl Caprylate, Glyceryl Stearate, Hydrogenated Olive Oil Lauryl Esters, Hydroxypropyl Bispalmitamide Mea, Limnanthes Alba (Meadowfoam) Seed Oil, Olea Europaea (Olive) Fruit Oil, Oleanolic Acid, Opuntia Coccinellifera Fruit Extract, Orchid Extract, Peg-100 Stearate, Pentaerythrityl Tetraethylhexanoate, Phenoxyethanol, Polyacrylate-13, Polyglyceryl-3 Methylglucose Distearate, Polyisobutene, Polysorbate 20, Propanediol, Sorbitan Isostearate, Squalane, Stearyl Behenate, Theobroma Cacao (Cocoa) Extract, Tocopherol, Tocopheryl Acetate, Water",https://cdn1.skinsafeproducts.com/photo/2933B22A7AFF96/large_1611127666.pngpng?1611127666,https://www.skinsafeproducts.com/innisfree-olive-real-power-cream-ex-50-ml
401-600.csv,"Innisfree The Minimum Sun Cream SPF25 PA++, 1.35 fl oz",Innisfree,Face,Moisturizers with SPF,"1,2-Hexanediol, Aluminum Hydroxide, Ammonium Acryloyldimethyltaurate/Vp Copolymer, Butylene Glycol, Cetearyl Alcohol, Cetearyl Glucoside, Cetyl Ethylhexanoate, Madecassoside, Portulaca Oleracea Extract, Potassium Cetyl Phosphate, Sodium Stearoyl Glutamate, Stearic Acid, Titanium Dioxide, Water, Xanthan Gum",https://cdn1.skinsafeproducts.com/photo/61AAA43426F59C/large_1580393556.jpeg?1580393556,https://www.skinsafeproducts.com/innisfree-the-minimum-sun-cream-spf25-pa-1-35-fl-oz
401-600.csv,"Innisfree My Makeup Cleanser Melting Balm, 80 mL",Innisfree,Cleansers,Facial Cleansers,"1,2-Hexanediol, Acorus Calamus Root Extract, Aloe Barbadensis Leaf Extract, Butylene Glycol, Camellia Sinensis Leaf Extract, Cetearyl Olivate, Cetyl Ethylhexanoate, Ethylhexylglycerin, Fragrance / Parfum, Hippophae Rhamnoides Oil, Polyglyceryl-3 Cocoate, Silica Dimethyl Silylate, Sorbitan Olivate, Trihydroxystearin, Water/Aqua/Eau",https://cdn1.skinsafeproducts.com/photo/664E72C493BB79/large_1573319354.jpeg?1573319354,https://www.skinsafeproducts.com/innisfree-my-makeup-cleanser-melting-balm-80-ml
401-600.csv,"Innisfree My Real Squeeze Mask Sheet, Choose Type - 5 Pack (#rice)",Innisfree,Skin Treatments,Facial Masks,"1,2-Hexanediol, Aloe Barbadensis Leaf Juice, Butylene Glycol, Camellia Japonica Leaf Extract, Camellia Sinensis Leaf Extract, Caprylic/Capric Triglyceride, Carbomer, Centella Asiatica Extract, Cetyl Ethylhexanoate, Chamomilla Recutita (Matricaria) Flower Extract, Citrus Unshiu Peel Extract, Dimethicone, Disodium Edta, Ethylhexylglycerin, Fragrance, Glycerin, Glyceryl Caprylate, Glyceryl Stearate, Opuntia Coccinellifera Fruit Extract, Orchid Extract, Oryza Sativa (Rice) Extract, Paeonia Suffruticosa Root Extract, Peg-100 Stearate, Polyglyceryl-3 Methylglucose Distearate, Rice Water, Sodium Hyaluronate, Tromethamine, Xanthan Gum",https://cdn1.skinsafeproducts.com/photo/3AD025F12F1F63/large_1572104681.jpeg?1572104681,https://www.skinsafeproducts.com/innisfree-my-real-squeeze-mask-sheet-choose-type-5-pack-rice
401-600.csv,"Innisfree It's Real Squeeze Mask Sheet, Lime, 1 Ounce",Innisfree,Skin Treatments,Facial Masks,"Alcohol, Betaine, Butylene Glycol, Camellia Japonica Leaf Extract, Camellia Sinensis (Green Tea) Leaf Extract, Citrus Aurantifolia (Lime) Juice, Citrus Paradisi (Grapefruit) Fruit Extract, Citrus Unshiu Peel Extract, Disodium Edta, Ethylhexylglycerin, Fragrance, Glycerin, Lemon, Niacinamide, Opuntia Coccinellifera Fruit Extract, Orchid Extract, Peg-60 Hydrogenated Castor Oil, Phenoxyethanol, Sodium Hyaluronate, Water\Aqua\Eau, Xanthan Gum",https://cdn1.skinsafeproducts.com/photo/045F5233D6DC3B/large_1559367381.jpeg?1559367381,https://www.skinsafeproducts.com/innisfree-it-s-real-squeeze-mask-sheet-lime-1-ounce
401-600.csv,"Innisfree Refreshing Cleansing Oil, Apple Seed, 5.07 fl oz",Innisfree,Cleansers,Facial Cleansers,"Butylene Glycol, C12-15 Alkyl Benzoate, Camellia Japonica Leaf Extract, Camellia Sinensis (Green Tea) Leaf Extract, Caprylic/Capric Triglyceride, Cetyl Ethylhexanoate, Citrus Unshiu Peel Extract, Coco-Caprylate/Caprate, Cocos Nucifera (Coconut), Ethylhexylglycerin, Fragrance, Glycerin, Glyceryl Isostearate, Hydrogenated Poly(C6-14 Olefin), Hydrogenated Polyisobutene, Opuntia Coccinellifera Fruit Extract, Orchid Extract, Pentaerythrityl Tetraethylhexanoate, Pentaerythrityl Tetraisostearate, Phenoxyethanol, Polyglyceryl-10 Dioleate, Pyrus Malus (Apple) Fruit Extract, Pyrus Malus (Apple) Seed Oil, Tocopheryl Acetate, Triethylhexanoin, Water\Aqua\Eau",https://cdn1.skinsafeproducts.com/photo/1A1FD5CD32B8E2/large_1540326864.jpeg?1540326864,https://www.skinsafeproducts.com/innisfree-refreshing-cleansing-oil-apple-seed-5-07-fl-oz
601-800.csv,"Innisfree It's Real Squeeze Mask, Bamboo, 5pcs",Innisfree,Skin Treatments,Facial Masks,"Alcohol, Aloe Barbadensis (Aloe Vera) Leaf Juice, Bambusa Vulgaris Extract, Betaine, Butylene Glycol, Camellia Japonica Leaf Extract, Camellia Sinensis (Green Tea) Leaf Extract, Citrus Limonum (Lemon) Extract, Citrus Paradisi (Grapefruit) Fruit Extract, Disodium Edta, Ethylhexyl Glycerin, Fragrance, Glycerin, Opunita Coccenellefera Fruit Extract, Orchid Extract, Peg-60 Hydrogenated Castor Oil, Phenoxyethanol, Sodium Hyaluronate, Water\Aqua\Eau, Xanthan Gum",https://cdn1.skinsafeproducts.com/photo/NjjvjALhlrI7WpsFCfuwkQ/large_1477233572.jpeg?1477233572,https://www.skinsafeproducts.com/innisfree-it-s-real-squeeze-mask-bamboo-5pcs
601-800.csv,"Innisfree Green Tea Caffeine Bright-Eye Serum, 0.33 fl oz/10 mL",Innisfree,Skin Treatments,Serums,"1,2-Hexanediol, Adenosine, Arginine, Boron Nitride, Butylene Glycol, Caffeine, Camellia Sinensis Leaf Extract, Carbomer, Citric Acid, Cyclodextrin, Dimethicone, Dimethiconol, Disodium Edta, Ethylhexylglycerin, Glycerin, Glyceryl Caprylate, Hyaluronic Acid, Hydrolyzed Hyaluronic Acid, Hydroxypropyl Cyclodextrin, Maltodextrin, Niacinamide, Pca Dimethicone, Phenyl Trimethicone, Polyacrylate Crosspolymer-6, Polysilicone-11, Polysorbate 20, Propanediol, Sodium Acetylated Hyaluronate, Sodium Hyaluronate, Sodium Hyaluronate Crosspolymer, Sodium Polyacryloyldimethyl Taurate, Squalane, Synthetic Fluorphlogopite, Tin Oxide, Titanium Dioxide (Ci 77891), Tocopherol, Tromethamine, Water / Aqua / Eau",https://cdn1.skinsafeproducts.com/photo/B1DC9390B3AB22/large_1704945537.pngpng?1704945537,https://www.skinsafeproducts.com/innisfree-green-tea-caffeine-bright-eye-serum-0-33-fl-oz-10-ml
601-800.csv,"innisfree Caffeine Bright-Eye Serum, Green Tea",Innisfree,Skin Treatments,Serums,"1,2-Hexanediol, Adenosine, Arginine, Boron Nitride, Butylene Glycol, Caffeine, Camellia Sinensis Leaf Extract, Carbomer, Citric Acid, Cyclodextrin, Dimethicone, Dimethiconol, Disodium Edta, Ethylhexylglycerin, Glycerin, Glyceryl Caprylate, Hyaluronic Acid, Hydrolyzed Hyaluronic Acid, Hydroxypropyl Cyclodextrin, Maltodextrin, Niacinamide, Pca Dimethicone, Phenyltrimethicone, Polyacrylate Crosspolymer-6, Polysilicone-11, Polysorbate 20, Propanediol, Sodium Acetylated Hyaluronate, Sodium Hyaluronate, Sodium Hyaluronate Crosspolymer, Sodium Polyacryloyldimethyl Taurate, Squalane, Synthetic Fluorphlogopite, Tin Oxide, Titanium Dioxide (Ci 77891), Tocopherol, Tromethamine, Water/Aqua/Eau",https://cdn1.skinsafeproducts.com/photo/8E544689E4B304/large_1693246293.jpeg?1693246293,https://www.skinsafeproducts.com/innisfree-caffeine-bright-eye-serum-green-tea
601-800.csv,"Innisfree Firming Energy Essence With Fermented Soybean, 150 mL",Innisfree,Anti-Aging/Anti-Wrinkle,Anti-Aging,"1,2-Hexanediol, Adenosine, Arbutin, Avena Sativa (Oat) Kernel Extract, Betaine, Disodium Edta, Ethylhexylglycerin, Hydroxypropyl Cyclodextrin, Lactobacillus/Soybean Seed Ferment Extract, Phenoxyethanol, Polyglycerin-3, Ppg-13 Decyltetradeceth-24, Propanediol, Sodium Polyacrylate, Water",https://cdn1.skinsafeproducts.com/photo/96FAE67736CBC0/large_1590553715.pngPNG?1590553715,https://www.skinsafeproducts.com/innisfree-firming-energy-essence-with-fermented-soybean-150-ml
601-800.csv,"Innisfree Cherry Blossom Glow Jelly Cream, Cherry Blossom + B3+, 1.69 fl oz/50 mL",Innisfree,Face,Creams,"1,2-Hexanediol, Ammonium Acryloyldimethyltaurate/Beheneth-25 Methacrylate Crosspolymer, Betaine, Carbomer, Dipropylene Glycol, Ethylhexylglycerin, Fragrance/Parfum, Glycerin, Niacinamide, Propanediol, Prunus Yedoensis Leaf Extract, Sodium Metaphosphate, Tocopherol, Tromethamine, Water/Aqua/Eau",https://cdn1.skinsafeproducts.com/photo/2B305BB46DCD9B/large_1710320602.pngpng?1710320602,https://www.skinsafeproducts.com/innisfree-cherry-blossom-glow-jelly-cream-cherry-blossom-b3-1-69-fl-oz-50-ml
601-800.csv,"Innisfree Retinol Cica Repair Ampoule, 1.01 fl oz/30 mL",Innisfree,Face,Moisturizing Serums,"1,2-Hexanediol, Acetyl Tetrapeptide-11, Adenosine, Allantoin, Ammonium Acryloyldimethyltaurate/Vp Copolymer, Asiatic Acid, Asiaticoside, Beta-Carotene, Beta-Glucan, Bht, Butylene Glycol, Camellia Sinensis Seed Extract, Caprylic/Capric Triglyceride, Ceramide Np, Cholesterol, Daucus Carota Sativa (Carrot) Root Extract, Dibutyl Adipate, Ethylhexylglycerin, Glycerin, Glycine Soja (Soybean) Oil, Helianthus Annuus (Sunflower) Seed Oil, Hyaluronic Acid, Hydrogenated Lecithin, Madecassic Acid, Mannitol, Niacinamide, Phytosphingosine, Propanediol, Retinol, Salicylic Acid, Sodium Methyl Stearoyl Taurate, Stearyl Glycyrrhetinate, Tocopherol, Tocopheryl Acetate, Water / Aqua / Eau",https://cdn1.skinsafeproducts.com/photo/9DE3388EDB0FEF/large_1709369195.pngpng?1709369195,https://www.skinsafeproducts.com/innisfree-retinol-cica-repair-ampoule-1-01-fl-oz-30-ml
601-800.csv,"Innisfree Hyaluronic Face Serum, Green Tea Seed, 2.70 fl oz/80 mL",Innisfree,Skin Treatments,Serums,"1,2-Hexanediol, 3-0-Ethyl Ascorbic Acid, Acrylates/C10-30 Alkylacrylate Crosspolymer, Allantoin, Betaine, Butylene Glycol, Camellia Sinensis Leaf Extract, Camellia Sinensis Seed Oil, Ceratonia Siliqua (Carob) Gum, Cetearyl Olivate, Citric Acid, Dextrin, Dipotassium Glycyrrhizate, Ethylhexylglycerin, Glycerin, Glyceryl Oleate, Hyaluronic Acid, Hydrogenated Lecithin, Hydrolyzed Hyaluronic Acid, Hydroxyethyl Acrylate/Sodium Acryloyldimethyl Taurate Copolymer, Lactic Acid, Lactobacillus Ferment Lysate, Lauryl Glucoside, Lecithin, Myristyl Glucoside, Niacinamide, Panthenol, Polyglyceryl-6 Laurate, Propanediol, Saccharide Isomerate, Sodium Acetylated Hyaluronate, Sodium Citrate, Sodium Hyaluronate, Sodium Hyaluronate Crosspolymer, Sodium Metaphosphate, Sorbitan Isostearate, Sorbitan Olivate, Squalane, Sucrose, Theobroma Cacao (Cocoa) Extract, Tocopherol, Tromethamine, Water/Aqua/Eau, Xanthan Gum, Xylitol",https://cdn1.skinsafeproducts.com/photo/3817F4FD053103/large_1705993983.pngpng?1705993983,https://www.skinsafeproducts.com/innisfree-hyaluronic-face-serum-green-tea-seed-2-70-fl-oz-80-ml
601-800.csv,"Innisfree Hydrating Energy Mask, Green Tea, 0.74 fl oz/22 mL",Innisfree,Skin Treatments,Facial Masks,"1,2-Hexanediol, Arginine, Butylene Glycol, Camellia Sinensis Leaf Extract, Carbomer, Centella Asiatica Extract, Certified Organic Cucumis Melo (Melon) Seed Extract, Chamomilla Recutita (Matricaria) Flower Extract, Diethylhexyl Sodium Sulfosuccinate, Dipropylene Glycol, Disodium Edta, Ethylhexylglycerin, Glycerin, Glyceryl Caprylate, Glyceryl Polymethacrylate, Iris Florentina Root Extract, Paeonia Suffruticosa Root Extract, Polyglyceryl-10 Laurate, Pyrus Communis (Pear) Fruit Extract, Rosa Damascena Flower Water, Sodium Hyaluronate, Vetiveria Zizanoides Root Oil, Water / Aqua / Eau, Xanthan Gum",https://cdn1.skinsafeproducts.com/photo/507867332CC32D/large_1705041511.pngpng?1705041511,https://www.skinsafeproducts.com/innisfree-hydrating-energy-mask-green-tea-0-74-fl-oz-22-ml
601-800.csv,"Innisfree Heartleaf Energy Mask, 0.74 fl oz/22 mL",Innisfree,Skin Treatments,Facial Masks,"1,2-Hexanediol, Arginine, Butylene Glycol, Carbomer, Centella Asiatica Extract, Chamomilla Recutita (Matricaria) Flower Extract, Cucumis Melo Seed Extract, Diethylhexyl Sodium Sulfosuccinate, Dipropylene Glycol, Disodium Edta, Ethylhexylglycerin, Glycerin, Glyceryl Caprylate, Glyceryl Polymethacrylate, Houttuynia Cordata Extract, Iris Florentina Root Extract, Paeonia Suffruticosa Root Extract, Polyglyceryl-10 Laurate, Pyrus Communis (Pear) Fruit Extract, Rosa Damascena Flower Water, Sodium Hyaluronate, Vetiveria Zizanoides Root Oil, Water/Aqua/Eau, Xanthan Gum",https://cdn1.skinsafeproducts.com/photo/4FDA6E60C3E4E8/large_1705124000.pngpng?1705124000,https://www.skinsafeproducts.com/innisfree-heartleaf-energy-mask-0-74-fl-oz-22-ml
601-800.csv,"Innisfree Hydrating Cleansing Foam, Green Tea Amino, 5.29 oz/150 g",Innisfree,Cleansers,Foaming Cleansers,"1,2-Hexanediol, Acorus Calamus Root Extract, Acrylates/Stearyl Methylacrylate Copolymer, Arginine, Aspartic Acid, Butylene Glycol, Camellia Sinensis Leaf Extract, Ceramide Np, Disodium Edta, Ethylhexylglycerin, Glutamic Acid, Glycerin, Glyceryl Stearate, Glycol Distearate, Hyaluronic Acid, Hydrolyzed Corn Starch, Lauric Acid, Lauryl Glucoside, Lauryl Hydroxysultaine, Myristic Acid, Palmiticacid, Pinus Densiflora Leaf Extract, Polyquaternium-22, Potassium Cocoyl Glycinate, Potassium Hydroxide, Propanediol, Stearicacid, Tetrasodium Edta, Tremella Fuciformis Sporocarp Extract, Water/Aqua/Eau, Xanthan Gum",https://cdn1.skinsafeproducts.com/photo/46C68B5E884C74/large_1701080279.pngpng?1701080279,https://www.skinsafeproducts.com/innisfree-hydrating-cleansing-foam-green-tea-amino-5-29-oz-150-g
801-1000.csv,"Innisfree Soft Cleansing Foam, Apple Seed, 5.29 oz/150 g",Innisfree,Facial Cleansers,Facial Foaming Cleansers,"1,2-Hexanediol, Butylene Glycol, Caprylic/Capric Triglyceride, Coco-Caprylate/Caprate, Disodium Edta, Fragrance / Parfum, Glycerin, Glyceryl Stearate, Glycol Distearate, Hydrated Silica, Lauric Acid, Lauryl Hydroxysultaine, Myristic Acid, Palmitic Acid, Polyquaternium-22, Potassium Hydroxide, Pyrus Malus (Apple) Fruit Extract, Pyrus Malus (Apple) Seed Oil, Stearic Acid, Water / Aqua / Eau",https://cdn1.skinsafeproducts.com/photo/C3DC928D0F06D9/large_1658406179.pngpng?1658406179,https://www.skinsafeproducts.com/innisfree-soft-cleansing-foam-apple-seed-5-29-oz-150-g
801-1000.csv,"Innisfree Pore Clearing Clay Peel Off Mask, 3.38 fl oz",Innisfree,Skin Treatments,Facial Masks,"Alcohol, Aluminum Hydroxide, Ammonium Acryloyldimethyltaurate/Vp Copolymer, Bentonite, Butylene Glycol, Disodium Edta, Glycerin, Glyceryl Caprylate, Lactic Acid/Glycolic Acid Copolymer, Menthoxypropanediol, Peg-60 Hydrogenated Castor Oil, Peg-75, Polysorbate-20, Polyvinyl Alcohol, Pvp, Red Iron Oxide, Silica, Sodium Hydroxypropyl Starch Phosphate, Titanium Dioxide (Ci 77981), Triethoxycaprylylsilane, Volcanic Ash, Water\Aqua\Eau, Xanthan Gum",https://cdn1.skinsafeproducts.com/photo/8E84F9A4875F7E/large_1581453930.pngpng?1581453930,https://www.skinsafeproducts.com/innisfree-pore-clearing-clay-peel-off-mask-3-38-fl-oz
801-1000.csv,"Innisfree Hydrate + Soften Lotion, Green Tea + Hyaluronic, 5.74 fl oz/170 mL",Innisfree,Body,Lotions,"1,2-Hexanediol, Arginine, Aspartic Acid, Butylene Glycol, C12-20 Alkyl Glucoside, C14-22 Alcohols, Camellia Sinensis Leaf Extract, Carbomer, Diisostearyl Malate, Ethylhexylglycerin, Gluconolactone, Glutamic Acid, Glycerin, Hyaluronic Acid, Hydrolyzed Hyaluronic Acid, Lactobacillus Ferment Lysate, Niacinamide, Panthenol, Pentaerythrityl Tetraethylhexanoate, Propanediol, Sodium Acetylated Hyaluronate, Sodium Hyaluronate, Sodium Hyaluronate Crosspolymer, Sodium Metaphosphate, Sodium Stearoyl Glutamate, Tocopherol, Tromethamine, Water/Aqua/Eau",https://cdn1.skinsafeproducts.com/photo/ADF56A57187A98/large_1709353149.pngpng?1709353149,https://www.skinsafeproducts.com/innisfree-green-tea-lotion-hyaluronic-5-74-fl-oz-170-ml
801-1000.csv,"Innisfree Green Tea Seed Hyaluronic Acid Tone, 5.41 fl oz/160 mL",Innisfree,Toners & Astringents,Toners,"1,2-Hexanediol, Acrylates/Stearyl Methacrylate Copolymer, Butylene Glycol, Camellia Sinensis Leaf Extract, Camellia Sinensis Seed Oil, Caprylic/Capric Triglyceride, Cellulose Gum, Ceramide Np, Disodium Edta, Ethylhexylglycerin, Fragrance / Parfum, Glycerin, Hyaluronic Acid, Hydrolyzed Hyaluronic Acid, Lactic Acid, Lactobacillus Ferment Lysate, Limonene, Linalool, Panthenol, Polyglycerin-3, Ppg-13 Decyltetradeceth-24, Propanediol, Sodium Acetylated Hyaluronate, Sodium Hyaluronate, Sodium Hyaluronate Crosspolymer, Squalane, Tocopherol, Trehalose, Tremella Fuciformis Sporocarp Extract, Water / Aqua / Eau, Xanthan Gum",https://cdn1.skinsafeproducts.com/photo/50BF5E4DA919A2/large_1706405110.jpeg?1706405110,https://www.skinsafeproducts.com/innisfree-green-tea-seed-hyaluronic-acid-tone-5-41-fl-oz-160-ml
