File,product_name,brand,usage_type,category,ingredients,image_url,product_url
2201-2296.csv,"Paula's Choice Plumping Moisturizer, Pro-Collagen Peptide, 0.05 fl oz/1.5 mL",Paula's Choice,Face,Gels,"1,2-Hexanediol, Acetyl Sh-Hexapeptide-5 Amide Acetate, Acrylates/C10-30 Alkyl Acrylate Crosspolymer, Ammonium Acryloyldimethyltaurate/Vp Copolymer, Butylene Glycol, Cyanocobalamin, Dimethicone, Gigartina Stellata Extract, Glycerin, Hydroxyacetophenone, Hydroxypropyltrimonium Hyaluronate, Lecithin, Oligopeptide-1, Pentylene Glycol, Phenoxyethanol, Propanediol, Pyrus Malus (Apple) Fruit Extract, Sodium Acrylates Copolymer, Sodium Phytate, Squalane, Tridecapeptide-1, Water (Aqua/Eau)",https://cdn1.skinsafeproducts.com/photo/B46F0F04C4D62E/large_1734867758.pngpng?1734867758,https://www.skinsafeproducts.com/paula-s-choice-plumping-moisturizer-pro-collagen-peptide-0-05-fl-oz-1-5-ml
2201-2296.csv,"Paula's Choice Resist Skin Restoring Moisturizer, SPF 50, 0.5 fl oz",Paula's Choice,Face,Moisturizers with SPF,"4-T-Butylcyclohexanol, Acrylates/C10-30 Alkyl Acrylate Crosspolymer, African Shea Butter, Allantoin, Aloe Barbadensis (Aloe Vera) Leaf Juice, Atractylodes Macrocephala Root Powder, Avena Sativa (Oat) Kernel Extract, Avobenzone 3%, Butylene Glycol, Capryloyl Glycine, Caprylyl Glycol, Cetearyl Alcohol, Cetearyl Glucoside, Coffea Arabica (Coffee) Seed Extract, Cyclopentasiloxane, Diethylhexyl Syringylidenemalonate, Dimethicone, Dimethiconol, Disodium Edta, Ethylhexylglycerin, Glycerin, Glyceryl Stearate, Glycyrrhiza Glabra (Licorice) Root Extract, Hexylene Glycol, Homosalate 5%, Hydrogenated Starch Hydrolysate, Mahonia Aquifolium Root Extract, Maltooligosyl Glucoside, Niacinamide, Octinoxate 7.50%, Octisalate, Oxybenzone 5%, Peg-100 Stearate, Pentylene Glycol, Phenoxyethanol, Portulaca Oleracea Extract, Potassium Cetyl Phosphate, Pyrus Malus (Apple) Fruit Extract, Sarcosine, Silica, Sodium Hydroxide, Tocopherol (Multisource), Vp/Eicosene Copolymer, Water (Aqua), Xanthan Gum",https://cdn1.skinsafeproducts.com/photo/F474CF8053AC2C/large_1558459732.jpegJPG?1558459732,https://www.skinsafeproducts.com/paula-s-choice-resist-skin-restoring-moisturizer-spf-50-0-5-fl-oz
401-600.csv,"Paula's Choice Weightless Body Treatment 2% BHA with Salicylic Acid + Antioxidants, 7 fl oz/210 fl oz",Paula's Choice,"Exfoliators, Polishes, & Scrubs",Exfoliators,"Allantoin, Bisabolol, Butylene Glycol, C13-14 Isoparaffin, Camellia Oleifera (Green Tea) Leaf Extract, Caprylic/Capric Triglyceride, Caprylyl Glycol, Cetyl Alcohol, Chamomilla Recutita Flower Extract, Cyclohexasiloxane, Cyclopentasiloxane, Dimethicone, Dimethiconol, Disodium Edta, Epilobium Angustifolium Extract, Ethylhexylglycerin, Hexylene Glycol, Laureth-7, Peg-40 Stearate, Phenoxyethanol, Polyacrylamide, Ppg-14 Butyl Ether, Pvm/Ma Decadiene Crosspolymer, Salicylic Acid, Sodium Hydroxide, Sorbitan Stearate, Tocopheryl Acetate, Vanilla Planifolia Fruit Extract, Water",https://cdn1.skinsafeproducts.com/photo/46D878F1452B1D/large_1690965057.pngpng?1690965057,https://www.skinsafeproducts.com/paula-s-choice-weightless-body-treatment-2-bha-with-salicylic-acid-antioxidants-7-fl-oz-210-fl-oz
401-600.csv,"Paula's Choice Omega+ Complex Lightweight Face Moisturizer, 1.7 fl oz/50 mL",Paula's Choice,Face,Creams,"Alanine, Anastatica Hierochuntica Extract, Aqua, Arginine, Betaine, Boerhavia Diffusa Root Extract, Borago Officinalis Seed Oil, Butylene Glycol, Butyrospermum Parkii (Shea) Butter, C13-15 Alkane, Carbomer, Ceramide Ap, Ceramide Eop, Ceramide Np, Ceteareth-6 Olivate, Cholesterol, Decyl Oleate, Ethylhexylglycerin, Euterpe Oleracea Sterols, Glutamic Acid, Glycerin, Glyceryl Stearate, Glycine, Hydrogenated Olive Oil, Lecithin, Limnanthes Alba (Meadowfoam) Seed Oil, Linoleic Acid, Linolenic Acid, Linum Usitatissimum (Linseed) Seed Oil, Lysine Hcl, Olea Europaea (Olive) Fruit Oil, Oleic Acid, Passiflora Edulis (Passion Fruit) Seed Oil, Pca, Phenoxyethanol, Phytic Acid, Phytosphingosine, Polyglyceryl-4 Laurate, Proline, Psidium Guajava (Guava) Fruit Extract, Pullulan, Salvia Hispanica (Chia) Seed Oil, Sclerotium Gum, Serine, Sodium Lactate, Sodium Lauroyl Lactylate, Sodium Pca, Sodium Polyacrylate Starch, Squalane, Threonine, Xanthan Gum",https://cdn1.skinsafeproducts.com/photo/578A886E4D5973/large_1683009558.pngpng?1683009558,https://www.skinsafeproducts.com/paula-s-choice-omega-complex-lightweight-face-moisturizer-1-7-fl-oz-50-ml
401-600.csv,Paula's Choice Retinol Skin-Smoothing Body Treatment,Paula's Choice,Skin Treatments,Firming Treatments,"Butylene Glycol, Butyrospermum Parkii, Caprylic/Capric Triglyceride, Carnosine, Cera Alba, Cetearyl Alcohol, Cetearyl Ethylhexanoate, Cetyl Alcohol, Cetyl Palmitate, Chlorphenesin, Cyclopentasiloxane, Decylene Glycol, Dicaprylyl Carbonate, Dimethicone, Dimethicone/Vinyl Dimethicone Crosspolymer, Dimethiconol, Disodium Edta, Glycerin, Glyceryl Stearate, Magnesium Aluminum Silicate, Oenothera Biennis Oil, Panthenol, Peg-100 Stearate, Phenoxyethanol, Retinol, Sodium Hydroxide, Tetrahexyldecyl Ascorbate, Tocopheryl Acetate, Vitis Vinifera Oil, Water, Xanthan Gum",https://cdn1.skinsafeproducts.com/photo/28AFD97E89CEE1/large_1614122931.pngpng?1614122931,https://www.skinsafeproducts.com/paula-s-choice-retinol-skin-smoothing-body-treatment
401-600.csv,"Paula's Choice Defense Essential Glow Moisturizer SPF 30, 2 oz",Paula's Choice,Face,Moisturizers with SPF,"Acrylates Copolymer, Actinidia Chinensis (Kiwi) Fruit Extract, Alumina, Aluminum Stearate, Argania Spinosa (Argan) Kernel Oil, Ascorbyl Glucoside, Bisabolol, Butylene Glycol, C12-15 Alkyl Benzoate, C13-14 Isoparaffin, Caprylic/Capric Triglyceride, Caprylyl Glycol, Ceteareth-20, Cetearyl Alcohol, Citric Acid, Dimethicone, Ethylhexylglycerin, Glycerin, Glyceryl Stearate, Glycine Soja (Soybean) Sterols, Glycyrrhiza Glabra (Licorice) Root Extract, Isononyl Isononanoate, Laureth-7, Lecithin, Linoleic Acid, Magnesium Ascorbyl Phosphate, Niacinamide, Phenoxyethanol, Phospholipids, Polyacrylamide, Polyhydroxystearic Acid, Potassium Cetyl Phosphate, Pullulan, Resveratrol, Sclerotium Gum, Sodium Gluconate, Tetrapeptide-30, Titanium Dioxide, Tocopherol, Tocopheryl Acetate, Triethoxycaprylylsilane, Water, Xanthan Gum, Xanthophyll, Zinc Oxide",https://cdn1.skinsafeproducts.com/photo/770D6A21BDF672/large_1601263860.jpeg?1601263860,https://www.skinsafeproducts.com/paula-s-choice-defense-essential-glow-moisturizer-spf-30-2-oz
401-600.csv,"Paula's Choice Softening Cream Cleanser, 16 fl oz",Paula's Choice,Cleansers,Facial Cleansers,"Acrylates/C10-30 Alkyl Acrylate Crosspolymer, Beta-Glucan, Butylene Glycol, C12-15 Alkyl Benzoate, Caprylyl Glycol, Chamomilla Recutita (Matricaria) Flower Extract, Chlorphenesin, Cocamidopropyl Betaine (Coconut Derived), Disodium Cocoamphodiacetate, Disodium Edta, Ethylhexylglycerin, Glycine Soja (Soybean) Oil, Hexylene Glycol, Hydrogenated Polydecene, Laureth-4, Mineral Oil (Paraffinum Liquidum), Peg-7 Glyceryl Cocoate, Phenoxyethanol, Polysorbate 80, Sodium Hydroxide, Water (Aqua)",https://cdn1.skinsafeproducts.com/photo/68056DFF1B814C/large_1578749647.jpeg?1578749647,https://www.skinsafeproducts.com/paula-s-choice-softening-cream-cleanser-16-fl-oz
401-600.csv,"Paula's Choice BOOST 10% Azelaic Acid Booster Cream Gel, .17 oz",Paula's Choice,Skin Treatments,Serums,"Adenosine, Allantoin, Azelaic Acid, Bisabolol, Boerhavia Diffusa Root Extract, Butylene Glycol, C12-15 Alkyl Benzoate, Caprylic/Capric Triglyceride, Cetearyl Alcohol, Cyclopentasiloxane, Dimethicone, Glycerine, Glyceryl Stearate, Glycyrrhiza Glabra (Licorice) Root Extract, Methyl Glucose Sesquistearate, Phenoxyethanol, Propanediol, Salicylic Acid, Sclerotium Gum, Water (Aqua), Xanthan Gum",https://cdn1.skinsafeproducts.com/photo/EC2AC2FC1B5C18/large_1593127726.jpeg?1593127726,https://www.skinsafeproducts.com/paula-s-choice-boost-10-azelaic-acid-booster-cream-gel-17-oz
401-600.csv,Paula's Choice-SKIN Perfecting 8% AHA Gel Exfoliant- Travel Size Bottle,Paula's Choice,"Exfoliators, Polishes, & Scrubs",Exfoliators,"Aloe Barbadensis (Aloe Vera) Leaf Juice, Butylene Glycol, Camellia Oleifera (Green Tea) Leaf Extract, Chamomilla Recutita (Matricaria) Flower Extract, Glycolic Acid, Hydroxyethylcellulose, Panthenol, Phenoxyethanol, Polyquaternium-10, Propylene Glycol, Sodium Benzoate, Sodium Hyaluronate, Sodium Hydroxide, Water\Aqua\Eau",https://cdn1.skinsafeproducts.com/photo/84FF2B05F67BF7/large_1567500086.jpeg?1567500086,https://www.skinsafeproducts.com/paula-s-choice-skin-perfecting-8-aha-gel-exfoliant-travel-size-bottle
401-600.csv,"Paula's Choice Resist Intensive Repair Cream, 1.7 oz",Paula's Choice,Face,Creams,"Adenosine, Behenyl Alcohol, Benzoic Acid, Butylene Glycol, C12-15 Alkyl Benzoate, Camellia Oleifera (Green Tea) Leaf Extract, Caprylic/Capric Triglyceride, Carbomer, Ceramide Ng, Cetearyl Alcohol, Cetearyl Glucoside, Chlorphenesin, Citrullus Vulgaris (Watermelon) Fruit Extract, Dimethicone, Dipentaerythrityl Hexacaprylate/Hexacaprate, Disodium Edta, Ethylhexyl Stearate, Glycerin, Glyceryl Stearate, Glycine Soja (Soybean) Sterols, Glycyrrhiza Glabra (Licorice) Root Extract, Lecithin, Lens Esculenta (Lentil) Fruit Extract, Linoleic Acid, Linolenic Acid, Magnesium Aluminum Silicate, Magnesium Ascorbyl Phosphate, Neopentyl Glycol Dicaprylate/Dicaprate, Niacinamide, Palmitoyl Hexapeptide-12, Palmitoyl Tetrapeptide-7, Palmitoyl Tripeptide-1, Peg-10 Phytosterol, Peg-100 Stearate, Petrolatum, Phenoxyethanol, Phenyl Trimethicone, Polysorbate 20, Pyrus Malus (Apple) Fruit Extract, Retinol, Retinyl Palmitate, Sclerotium Gum, Simmondsia Chinensis (Jojoba) Seed Oil, Sodium Hyaluronate, Sodium Hydroxide, Sodium Lactate, Sorbic Acid, Tocopherol (Multisource), Tribehenin, Tridecyl Stearate, Tridecyl Trimellitate, Water (Aqua)",https://cdn1.skinsafeproducts.com/photo/E634FDA0F28C0B/large_1554064499.jpegjpg?1554064499,https://www.skinsafeproducts.com/paula-s-choice-resist-intensive-repair-cream-1-7-oz
601-800.csv,Paula's Choice Resist Advanced Replenishing Toner,Paula's Choice,Skin Care,Toners & Astringents,"Acetyl Glucosamine, Acrylates/C10-30 Alkyl Acrylate Crosspolymer, Aminomethyl Propanol, Ascorbyl Palmitate, Benzoic Acid, Beta Vulgaris (Beet) Root Extract, Butylene Glycol, Caprylic/Capric Triglyceride, Carnosine, Chlorphenesin, Cucurbita Pepo (Pumpkin) Seed Extract, Cyclopentasiloxane, Dimethiconol, Disodium Edta, Epigallocatechin Gallate, Ethylhexlyglycerin, Ferulic Acid, Genistein, Glycereth-26, Glycerin, Glycyrrhiza Glabra (Licorice) Root Extract, Hydrogenated Lecithin, Hydrolyzed Corn Starch, Laurdimonium Hydroxypropyl Hydrolyzed Soy Protein, Laureth-23, Laureth-4, Lecithin, Linoleic Acid, Linolenic Acid, Oenothera Biennis (Evening Primrose) Oil, Oleic Acid, Palmitic Acid, Phenoxyethanol, Phospholipids, Polysorbate 20, Quercetin, Sodium Benzoate, Sodium Hyaluronate, Sorbic Acid, Sphingolipids, Tocopherol (Multisource), Xanthan Gum",https://cdn1.skinsafeproducts.com/photo/6UphD_qeCTr7GiZDtgnNwQ/large_1465439909.jpeg?1465439909,https://www.skinsafeproducts.com/paula-s-choice-resist-advanced-replenishing-toner
601-800.csv,"Paula's Choice Calm Rescue & Repair Intensive Moisturizer, 0.5 fl oz/15 mL",Paula's Choice,Face,Creams,"Acetyl Hexapeptide-8, Acrylates/C10-30 Alkyl Acrylate Crosspolymer, Albatrellus Confluens (Mushroom) Extract, Allantoin, Alpha-Glucan Oligosaccharide, Arachidyl Alcohol, Arachidyl Glucoside, Behenyl Alcohol, Butylene Glycol, C13-15 Alkane, Caprylyl Glycol, Cetearyl Alcohol, Cetyl Alcohol, Citric Acid, Ethylhexylglycerin, Galactorarabinan, Glycerin, Glycogen, Helianthus Annuus (Sunflower) Seed Oil, Hexylene Glycol, Hydrogenated Lecithin, Inulin, Laminaria Digitata Extract, Maltodextrin, Myristyl Myristate, Opuntia Ficus-Indica Stem Extract, Phenoxyethanol, Potassium Sorbate, Propanediol, Schizophyllan, Sodium Phytate, Stearic Acid, Tocopherol, Water, Xanthan Gum, Yeast Extract",https://cdn1.skinsafeproducts.com/photo/5F9EAD0363298E/large_1717223744.pngpng?1717223744,https://www.skinsafeproducts.com/paula-s-choice-calm-rescue-repair-intensive-moisturizer-0-5-fl-oz-15-ml
601-800.csv,"Paula's Choice Clinical 0.3% Retinol + 2% Bakuchiol Treatment, Peptides + Vitamin C, 0.17 fl oz/5 m L",Paula's Choice,Anti-Aging/Anti-Wrinkle,Anti-Wrinkle,"Allantoin, Arachidyl Alcohol, Arachidyl Glucoside, Arctium Lappa, Avena Sativa (Oat) Kernel Extract, Bakuchiol, Behenyl Alcohol, Benzoic Acid, Butylene Glycol, C12-15 Alkyl Benzoate, Caprylyl Glycol, Ceramide Ng, Cetearyl Alcohol, Coco-Glucoside, Dimethicone, Dimethicone Crosspolymer, Dipeptide-2, Dipotassium Glycyrrhizate, Disodium Edta, Ethylhexylglycerin, Glycerin, Glyceryl Polymethacrylate, Glyceryl Stearate, Glycine Soja Sterols, Glycyrrhiza Glabra (Licorice) Root Extract, Hesperidin Methyl Chalcone, Hydrolyzed Soy Protein, Hydroxyethyl Acrylate/Sodium Acryloyldimethyl Taurate Copolymer, Isononyl Isononanoate, Lecithin, Magnesium Aluminum Silicate, N-Hydroxysuccinimide, Palmitoyl Hexapeptide-12, Palmitoyl Tetrapeptide-7, Palmitoyl Tripeptide-1, Peg-10 Phytosterol, Peg-75 Shea Butter Glycerides, Peg-8, Pentaerythrityl Tetraisostearate, Pentylene Glycol, Phenoxyethanol, Polygonum Cuspidatum Root Extract, Polysorbate 20, Retinol, Salix Alba Extract, Sodium Acrylates Copolymer, Sodium Hyaluronate, Sodium Hydroxide, Tetrahexyldecyl Ascorbate, Tocopheryl Acetate, Tribehenin, Water",https://cdn1.skinsafeproducts.com/photo/3185780D8F0243/large_1719467085.pngpng?1719467085,https://www.skinsafeproducts.com/paula-s-choice-clinical-0-3-retinol-2-bakuchiol-treatment-peptides-vitamin-c-0-17-fl-oz-5-m-l
601-800.csv,"Paula's Choice Omega+ Complex Eye Cream, Chia+Flaxseed, 0.17 fl oz/5 mL",Paula's Choice,"Eye Cream, Gel, Oils, & Serum",Creams,"Adenosine, Alanine, Ammonium Acryloyldimethyltaurate/Vp Copolymer, Anastatica Hierochuntica Extract, Arctostaphylos Uva Ursi Leaf Extract, Arginine, Ascorbyl Palmitate, Betaine, Borago Officinalis Seed Oil, Butylene Glycol, Caprylic/Capric Triglyceride, Carbomer, Ceramide Ap, Ceramide Eop, Ceramide Np, Cetyl Palmitate, Chlorphenesin, Cholesterol, Citric Acid, Ethylhexylglycerin, Euterpe Oleracea (Acai) Sterols, Glutamic Acid, Glycerin, Glycine, Glycyrrhiza Glabra, Hydrogenated Olive Oil, Lecithin, Limnanthes Alba Seed Oil, Linoleic Acid, Linolenic Acid, Linum Usitatissimum (Linseed) Seed Oil, Lysine Hci, Morus Alba (White Mulberry) Root Extract, Neopentyl Glycol Diheptanoate, Niacinamide, Nylon-12, Olea Europaea Fruit Oil, Oleic Acid, Passiflora Edulis Seed Oil, Pca, Persea Gratissima (Avocado) Oil, Phenoxyethanol, Phytic Acid, Phytosphingosine, Phytosterols, Proline, Propanediol, Propylene Glycol Dibenzoate, Pullulan, Salvia Hispanica (Chia) Seed Oil, Sclerotium Gum, Scutellaria Baicalensis Root Extract, Serine, Silica, Sodium Citrate, Sodium Hyaluronate, Sodium Lactate, Sodium Lauroyl Lactylate, Sodium Pca, Sodium Stearoyl Glutamate, Sorbitan Oleate, Squalane, Threonine, Tocopheryl Acetate, Water, Xanthan Gum",https://cdn1.skinsafeproducts.com/photo/86034D2470CB3A/large_1719463223.pngpng?1719463223,https://www.skinsafeproducts.com/paula-s-choice-omega-complex-eye-cream-chia-flaxseed-0-17-fl-oz-5-ml
601-800.csv,"Paula's Choice Resist Triple Active Total Repair Serum, 0.17 fl oz/5 mL",Paula's Choice,Skin Treatments,Serums,"1,2-Hexanediol, Acrylates/C10-30 Alkyl Acrylate Crosspolymer, Bht, Caprylic/Capric Triglyceride, Caprylyl Glycol, Castanea Sativa (Chestnut) Leaf Extract, Cetyl Alcohol, Dilauryl Thiodipropionate, Glycerin, Hexylresorcinol, Hydroxyacetophenone, Hydroxystearic Acid, Isopropyl Myristate, Niacinamide, Oryza Sativa (Rice) Bran Oil, Pentaerythrityl Tetra-Di-T-Butyl Hydroxyhydrocinnamate, Retinyl Propionate, Sodium Hydroxide, Sodium Phytate, Tocotrienols, Water/Aqua/Eau",https://cdn1.skinsafeproducts.com/photo/C8E2ECE7EC420D/large_1719462893.pngpng?1719462893,https://www.skinsafeproducts.com/paula-s-choice-resist-triple-active-total-repair-serum-0-17-fl-oz-5-ml
601-800.csv,"Paula's Choice 5% Vitamin C Sheer Moisturizer, SPF 50, 2 fl oz/60 mL",Paula's Choice,Face,Creams,"3-O-Ethyl Ascorbic Acid, Acetyl Zingerone, Acrylates/C10-30 Alkyl Acrylate Crosspolymer, Ascorbyl Glucoside, Avobenzone, Diethylhexyl Syringylidenemalonate, Dimethicone, Dimethicone/Vinyl Dimethicone Crosspolymer, Entada Phaseoloides Bark/Seed Extract, Ethylhexylglycerin, Glycerin, Hydrogenated Lecithin, Iron Oxides (Ci 77491, Ci 77492, Ci 77499), Laureth-4, Octinoxate, Octisalate, Octocrylene, Phenoxyethanol, Porphyra Umbilicalis Extract, Potassium Sorbate, Propanediol, Ricinus Communis (Castor) Seed Oil, Silica, Sodium Benzoate, Sodium Hydroxide, Tetrahexyldecyl Ascorbate, Titanium Dioxide, Tocopherol, Water, Xanthan Gum",https://cdn1.skinsafeproducts.com/photo/3D4AA402887142/large_1718540992.pngpng?1718540992,https://www.skinsafeproducts.com/paula-s-choice-5-vitamin-c-sheer-moisturizer-spf-50-2-fl-oz-60-ml
601-800.csv,"Paula's Choice Resist Youth-Extending Daily Hydrating Fluid, SPF 50, 0.5 oz / 15 mL",Paula's Choice,Face,Moisturizers with SPF,"Avobenzone, Benzyl Alcohol, Camellia Oleifera Leaf Extract, Camellia Sinensis Leaf Extract, Chamomilla Recutita (Matricaria) Flower Extract, Diethylhexyl Syringylidenemalonate, Dimethicone, Dimethicone/Vinyl Dimethicone Crosspolymer, Glycerin, Hydrogenated Lecithin, Hydroxyethyl Acrylate/Sodium Acryloyldimethyl Taurate Copolymer, Lycium Barbarum Fruit Extract, Oat Bran Extract, Octinoxate, Octisalate, Octocrylene, Peucedanum Graveolens (Dill) Extract, Phenoxyethanol, Potassium Sorbate, Punica Granatum Fruit Extract, Sambucus Nigra Fruit Extract, Silica, Sodium Benzoate, Sodium Carbomer, Titanium Dioxide, Tocopherol, Vitis Vinifera (Grape) Seed Extract, Water, Xanthan Gum",https://cdn1.skinsafeproducts.com/photo/B40B55B6BED33D/large_1717826964.pngpng?1717826964,https://www.skinsafeproducts.com/paula-s-choice-resist-youth-extending-daily-hydrating-fluid-spf-50-0-5-oz-15-ml
601-800.csv,"Paula's Choice Resist Barrier Repair Advanced Moisturizer, Tripeptide -5 & Ceramides, 0.5 oz/15 mL",Paula's Choice,Face,Creams,"2,3-Butanediol, Adenosine, Caprylyl Glycol, Ceramide Ap, Ceramide As, Ceramide Eop, Ceramide Np, Ceramide Ns, Cholesterol, Citrullus Lanatus (Watermelon) Seed Oil, Cocoglycerides, Dicaprylyl Carbonate, Ethylhexyl Stearate, Ethylhexylglycerin, Glycerin, Glyceryl Stearate, Hexylene Glycol, Hydrogenated Lecithin, Hydroxyacetophenone, Palmitoyl Tripeptide-5, Phenoxyethanol, Polyquaternium-51, Saponified Butyrospermum Parkii (Shea) Butter, Sodium Hyaluronate, Sodium Pca, Sodium Phytate, Sodium Polyacrylate, Sodium Stearoyl Glutamate, Squalane, Tocopherol, Trehalose, Triacetin (Glyceryl Triacetate), Urea, Water, Xanthan Gum",https://cdn1.skinsafeproducts.com/photo/E01972FD31D2E9/large_1710048326.pngpng?1710048326,https://www.skinsafeproducts.com/paula-s-choice-resist-barrier-repair-advanced-moisturizer-tripeptide-5-ceramides-0-5-oz-15-ml
601-800.csv,"Paula's Choice Moisture Boost Hydrating Treatment Cream, Ceramide + Niacinamide, 2 fl oz/60 mL",Paula's Choice,Face,Creams,"Acrylates/C10-30 Alkyl Acrylate Crosspolymer, Aminomethyl Propanol, Avena Sativa (Oat) Kernel Extract, Benzoic Acid, Bht, Butylene Glycol, Ceramide Np, Cetearyl Alcohol, Cetearyl Glucoside, Cetyl Alcohol, Chlorphenesin, Cholesterol, Decarboxy Carnosine Hcl, Dimethicone, Dipentaerythrityl Hexacaprylate/Hexacaprate, Disodium Edta, Ethylhexyl Stearate, Ethylhexylglycerin, Glucose, Glycerin, Hydrogenated Lecithin, Hydrolyzed Jojoba Protein, Hydroxyethyl Acrylate/Sodium Acryloyldimethyl Taurate Copolymer, Lactic Acid, Lactose, Linoleic Acid, Linolenic Acid, Magnesium Ascorbyl Phosphate, Myristyl Myristate, Neopentyl Glycol Dicaprylate/Dicaprate, Niacinamide, Oleic Acid, Palmitic Acid, Petrolatum, Phenoxyethanol, Phenyl Trimethicone, Polyglyceryl-3 Beeswax, Polysorbate 60, Potassium Sorbate, Simmondsia Chinensis (Jojoba) Seed Oil, Sodium Hyaluronate, Sorbic Acid, Squalene, Stearic Acid, Tocopherol, Tridecyl Stearate, Tridecyl Trimelitate, Water/Aqua/Eau, Whey Protein/Lactis Proteinum/Proteine Du Petit-Lait",https://cdn1.skinsafeproducts.com/photo/767A70AA5B6FAF/large_1707298807.pngpng?1707298807,https://www.skinsafeproducts.com/paula-s-choice-moisture-boost-hydrating-treatment-cream-ceramide-niacinamide-2-fl-oz-60-ml
601-800.csv,"Paula's Choice Defense Nightly Reconditioning Moisturizer, Wild Cherry + Flaxseed, 0.5 fl oz/15 mL",Paula's Choice,Face,Nighttime Moisturizers,"Adenosine Phosphate, Alaria Esculenta Extract, Allantoin, Almond/Borage/Linseed/Olive Acids/Glycerides, Butylene Glycol, C12-15 Alkyl Benzoate, Caprylic/Capric Triglyceride, Ceramide Ng, Cetearyl Olivate, Cocoyl Proline, Copper Gluconate, Eclipta Prostrata Extract, Ethylhexyl Palmitate, Ethylhexylglycerin, Glycerin, Helianthus Annuus (Sunflower) Seed Oil, Hydrolyzed Algae Extract, Hydrolyzed Eruca Sativa (Arugula) Leaf, Hydrolyzed Vegetable Protein, Hydroxyethyl Acrylate/Sodium Acryloyldimethyl Taurate Copolymer, Isoamyl Cocoate, Isoamyl Laurate, Leuconostoc/Radish Root Ferment Filtrate, Magnesium Aspartate, Medicago Sativa (Alfalfa) Extract, Melia Azadirachta Leaf Extract, Microcrystalline Cellulose, Moringa Oleifera Seed Oil, Opuntia Ficus-Indica Stem Extract, Palmitoyl Dipeptide-10, Palmitoyl Hexapeptide-12, Peg-10 Phytosterol, Pentylene Glycol, Phenoxyethanol, Polyglyceryl-10 Caprylate/Caprate, Potassium Azeloyl Diglycinate, Potassium Sorbate, Prunus Serotina (Wild Cherry) Fruit Extract, Sclerocarya Birrea (Marula) Seed Oil, Sesamum Indicum, Sodium Citrate, Sodium Gluconate, Sodium Hyaluronate, Sorbitan Olivate, Tocopherol, Trehalose, Tribehenin, Water (Aqua), Xanthan Gum, Zinc Gluconate",https://cdn1.skinsafeproducts.com/photo/8B340D959F407F/large_1706678479.pngpng?1706678479,https://www.skinsafeproducts.com/paula-s-choice-defense-nightly-reconditioning-moisturizer-wild-cherry-flaxseed-0-5-fl-oz-15-ml
601-800.csv,"Paula's Skin Perfect Liquid Exfoliant, 6% Mandelic Acid + 2% Lactic Acid, 3 fl oz/88 mL",Paula's Choice,"Exfoliators, Polishes, & Scrubs",Exfoliators,"1,2-Hexanediol, 2,3-Butanediol, Achillea Millefolium (Yarrow) Extract, Akebia Quinata Extract, Arginine, Butylene Glycol, Caprylyl Glycol, Citric Acid, Hydroxyacetophenone, Lactic Acid, Lactobacillus Ferment Lysate, Mandelic Acid, Myrica Cerifera (Bayberry) Fruit Extract, Pentylene Glycol, Prunus Lannesiana Flower Extract, Saccharide Isomerate, Saccharomyces Lysate, Sodium Benzoate, Sodium Citrate, Sodium Hydroxide, Sodium Phytate, Water/Aqua/Eau, Xanthan Gum",https://cdn1.skinsafeproducts.com/photo/C3E81095915DEA/large_1706178187.pngpng?1706178187,https://www.skinsafeproducts.com/paula-s-skin-perfect-liquid-exfoliant-6-mandelic-acid-2-lactic-acid-3-fl-oz-88-ml
601-800.csv,"Paula's Choice The Unscrub, 0.5 fl oz/15 mL",Paula's Choice,"Exfoliators, Polishes, & Scrubs",Scrubs,"C13-14 Isoparaffin, Camellia Oleifera (Green Tea) Leaf Extract, Caprylic /Capric Triglyceride, Caprylyl Glycol, Chamomilla Recutita (Matricaria) Flower Extract, Citric Acid, Decyl Glucoside, Disodium Edta, Ethylhexylglycerin, Glycerin, Glyceryl Stearate, Jojoba Esters, Laureth-7, Methyl Gluceth-20, Methyl Glucose Sesquistearate, Peg-20 Methyl Glucose Sesquistearate, Phenoxyethanol, Polyacrylamide, Ppg-20 Methyl Glucose Ether, Sapindus Mukurossi Peel Extract (Soapberry Peel Extract), Stearyl Alcohol, Tocopheryl Acetate, Water (Aqua), Xanthan Gum",https://cdn1.skinsafeproducts.com/photo/F02EA8438D3091/large_1700642200.pngpng?1700642200,https://www.skinsafeproducts.com/paula-s-choice-the-unscrub-0-5-fl-oz-15-ml
601-800.csv,"Paula's Choice 1% Bha Sensitive Skin Exfoliant, Salicylic Acid + Allantion, 1 fl oz/30 mL",Paula's Choice,"Exfoliators, Polishes, & Scrubs",Exfoliators,"Albatrellus Confluens (Mushroom) Extract, Allantoin, Alpha Glucan Oligosaccharide, C15-19 Alkane, Caprylyl Glycol, Citric Acid, Dicaprylyl Carbonate, Ethylhexylglycerin, Galactoarabinan, Glycerin, Glycine Soja Oil, Hexylene Glycol, Hydroxyethyl Acrylate/Sodium Acryloyldimethyl Taurate Copolymer, Inulin, Laminaria Digitata Extract, Maltodextrin, Methylpropanediol, Opuntia Ficus-Indica Stem Extract, Phenoxyethanol, Propanediol, Salicylic Acid, Schizophyllan, Sodium Hydroxide, Sorbitan Isostearate, Tocopherol, Water",https://cdn1.skinsafeproducts.com/photo/E890C29EA815E6/large_1699419479.pngpng?1699419479,https://www.skinsafeproducts.com/paula-s-choice-1-bha-sensitive-skin-exfoliant-salicylic-acid-allantion-1-fl-oz-30-ml
601-800.csv,"Paula's Choice 25% Vitamin c + Glutathione Clinical Serum, 1 fl oz/30 mL",Paula's Choice,Skin Treatments,Serums,"Acrylates/C10-30 Alkyl Acrylate Crosspolymer, Aqua/Water/Eau, Ascorbic Acid, Ascorbyl Glucoside, C9-12 Alkane, Caprylic/Capric Triglyceride, Caprylyl Glycol, Cetyl Alcohol, Coco Caprylate/Caprate, Dimethicone, Ergothioneine, Ethylhexylglycerin, Glucose, Glutathione, Glycerin, Hexylene Glycol, Hydrogenated Lecithin, Hydroxyethyl Acrylate/Sodium Acryloyldimethyl Taurate Copolymer, Lysine Carboxymethyl Cysteinate, Mannitol, Organic Helianthus Annuus Sunflower Seed Extract, Oryza Sativa (Rice) Bran Extract, Phenoxyethanol, Polyglyceryl-6 Polyricinoleate, Polyquaternium-51, Polysorbate 60, Pyrus Malus (Apple) Fruit Extract, Rosmarinus Officinalis (Rosemary) Leaf Extract, Silica, Sodium Citrate, Sodium Pca, Sodium Phytate, Sorbitan Isostearate, Tetrahexyldecyl Ascorbate, Tocopherol, Trehalose, Triacetin, Urea, Vanilla Planifolia Fruit Extract, Xanthan Gum",https://cdn1.skinsafeproducts.com/photo/15AA181041541F/large_1695286219.pngpng?1695286219,https://www.skinsafeproducts.com/paula-s-choice-25-vitamin-c-glutathione-clinical-serum-1-fl-oz-30-ml
