File,product_name,brand,usage_type,category,ingredients,image_url,product_url
1-200.csv,"Bioderm Sensibio Micellar Cleansing Oil, 5 fl oz/150 mL",Bioderma,Facial Cleansers,Facial Cleansing Oil,"Aqua/Water/Eau, Benzotriazolyl Dodecyl P-Cresol, Brassica Campestris (Rapeseed) Seed Oil, Caprylic/Capric Triglyceride, Ethylhexyl Palmitate, Helianthus Annuus (Sunflower) Seed Oil, Laminaria Ochroleuca Extract, Polyglyceryl-4 Oleate, Propanediol, Sodium Pca, Stearyl Glycyrrhetinate, Tocopherol",https://cdn1.skinsafeproducts.com/photo/282387A9C6DEFF/large_1722421138.pngpng?1722421138,https://www.skinsafeproducts.com/bioderm-sensibio-micellar-cleansing-oil-5-fl-oz-150-ml
1-200.csv,"Bioderma Sensibio Foaming Gel, 16.7 fl oz/500 mL",Bioderma,Cleansers,Foaming Cleansers,"Ascorbyl Palmitate, Citric Acid, Coco-Glucoside, Fructooligosaccharides, Glyceryl Oleate, Hydrogenated Palm Glycerides Citrate, Laureth-2, Lecithin, Mannitol, Peg-90 Glyceryl Isostearate, Propanediol, Rhamnose, Sodium Citrate, Sodium Cocoamphoacetate, Sodium Lauroyl Sarcosinate (Multisource), Tocopherol (Vitamin E), Water/Aqua/Eau, Xylitol (Derived From Birch Trees Or Corn)",https://cdn1.skinsafeproducts.com/photo/F741EC7E21D1B8/large_1598476638.jpegjpg?1598476638,https://www.skinsafeproducts.com/bioderma-sensibio-foaming-gel
1-200.csv,"Bioderma Make Up Removing Micelle Solution, 16.7 fl oz/500 mL",Bioderma,Facial Cleansers,Micellar Water,"Aqua/Water/Eau, Cetrimonium Bromide, Cucumis Sativus (Cucumber) Fruit Extract, Disodium Edta, Fructooligosaccharides, Mannitol, Peg-6 Caprylic/Capric Glycerides, Propylene Glycol (1,2-Propanediol), Rhamnose, Xylitol",https://cdn1.skinsafeproducts.com/photo/5230A5E120FB0C/large_1712039152.pngpng?1712039152,https://www.skinsafeproducts.com/bioderma-make-up-removing-micelle-solution-16-7-fl-oz-500-ml
1-200.csv,"Bioderma Purifying Cleansing Foaming Gel Tube, 3.3 fl oz/ 100 mL",Bioderma,Body,Creams,"Aqua/Water/Eau, Copper Sulfate, Disodium Edta, Fragrance (Parfum), Fructooligosaccharides, Ginkgo Biloba Leaf Extract, Lactic Acid, Laureth-2, Mannitol, Methylpropanediol, Peg-90 Glyceryl Isostearate, Potassium Sorbate, Propylene Glycol, Rhamnose, Sodium Chloride, Sodium Cocoamphoacetate, Sodium Hydroxide, Sodium Laureth Sulfate, Xylitol, Zinc Sulfate",https://cdn1.skinsafeproducts.com/photo/B029ADD0E80A8D/large_1701116948.jpeg?1701116948,https://www.skinsafeproducts.com/bioderma-purifying-cleansing-foaming-gel-tube-3-3-fl-oz-100-ml
1-200.csv,"Bioderma Sensibio Defensive Serum, Hyaluronic Acid + Antioxidant Complex, 1 fl oz/30 mL",Bioderma,Skin Treatments,Serums,"1,2-Hexanediol, Aqua/Water/Eau, Biosaccharide Gum-1, Butylene Glycol, C15-19 Alkane, C20-22 Alcohols, C20-22 Alkyl Phosphate, Caprylyl Glycol, Carnosine, Cellulose, Citric Acid, Glycerin, Glycine Soja (Soybean) Oil, Hydrolyzed Hyaluronic Acid, Maltodextrin, Mannitol, Palmitoyl Tetrapeptide-10, Pentylene Glycol, Polyacrylate Crosspolymer-6, Rhamnose, Salvia Miltiorrhiza Root Extract, Sodium Hydroxide, Squalane, Tocopherol, Xanthan Gum, Xylitol",https://cdn1.skinsafeproducts.com/photo/721379B749C6E2/large_1698001982.jpeg?1698001982,https://www.skinsafeproducts.com/bioderma-sensibio-defensive-serum-hyaluronic-acid-antioxidant-complex-1-fl-oz-30-ml
1-200.csv,Bioderma Sebium Foaming Gel Pump,Bioderma,Facial Cleansers,Facial Gels,"Aqua/Eau/Water, Copper Sulfate, Disodium Edta, Fructooligosaccharides, Ginkgo Biloba Leaf Extract, Lactic Acid, Laureth-2, Mannitol, Methylpropanediol, Peg-90 Glyceryl Isostearate, Perfume, Potassium Sorbate, Propylene Glycol, Rhamnose, Sodium Chloride, Sodium Cocamphoacetate, Sodium Cocoamphoacetate, Sodium Hydroxide, Sodium Laureth Sulfate (Sles), Xylitol, Zinc Sulfate",https://cdn1.skinsafeproducts.com/photo/AB09EB0802B3DA/large_1609267581.jpeg?1609267581,https://www.skinsafeproducts.com/bioderma-sebium-purifying-cleansing-foaming-gel-cleanser-500-ml
1001-1200.csv,"Bioderma Sebium Gel Moussant Cleansing Foaming Gel, 1.5 fl oz/45 mL",Bioderma,Facial Cleansers,Facial Gels,"Propylene Glycol, Aqua/Water/Eau, Copper Sulfate, Disodium Edta, Fragrance (Parfum), Fructooligosaccharides, Ginkgo Biloba Leaf Extract, Lactic Acid, Mannitol, Methylpropanediol, Potassium Sorbate, Rhamnose, Sodium Chloride, Sodium Cocoamphoacetate, Sodium Hydroxide, Sodium Laureth Sulfate, Xylitol, Zinc Sulfate",https://cdn1.skinsafeproducts.com/photo/D489C011B803D0/large_1748949752.pngpng?1748949752,https://www.skinsafeproducts.com/bioderma-sebium-gel-moussant-cleansing-foaming-gel-1-5-fl-oz-45-ml
1001-1200.csv,"Bioderma Sebium Active Foaming Gel, 6.7 fl oz/200 mL",Bioderma,Cleansers,Foaming Cleansers,"Aqua/Water/Eau, Caprylyl/Capryl Glucoside, Cellulose, Cellulose Gum, Citric Acid, Coco-Glucoside, Fragrance (Parfum), Fructooligosaccharides, Fructose, Glucose, Glycerin, Glyceryl Oleate, Glycolic Acid, Hydrogenated Palm Glycerides Citrate, Inulin, Mannitol, Propanediol, Rhamnose, Salicylic Acid, Sodium Citrate, Sodium Hydroxide, Sodium Metabisulfite, Tocopherol, Xanthan Gum, Xylitol, Zinc Gluconate",https://cdn1.skinsafeproducts.com/photo/85ED393F20D8AC/large_1745987856.pngpng?1745987856,https://www.skinsafeproducts.com/bioderma-sebium-active-foaming-gel-6-7-fl-oz-200-ml
1001-1200.csv,"Bioderma Smoothing Moisturising Care Radiance Booster, SPF 30, 1.33 fl oz/40 mL",Bioderma,Face,Lotions,"Aqua/Water/Eau, Arachidyl Alcohol, Arachidyl Glucoside, Arginine, Behenyl Alcohol, Brassica Campestris (Rapeseed) Sterols, Butyl Methoxydibenzoylmethane, C30-45 Alkyl Cetearyl Dimethicone Crosspolymer, Cetyl Alcohol, Cyclohexasiloxane, Cyclopentasiloxane, Dimethicone, Dipropylene Glycol, Disodium Edta, Ethylhexyl Salicylate, Fragrance (Parfum), Glycerin, Hdi/Trimethylol Hexyllactone Crosspolymer, Hexyldecanol, Hydroxyethyl Acrylate/ Sodium Acryloyldimethyl Taurate Copolymer, Mannitol, Mica (Ci 77019), Niacinamide, Octocrylene, Peg-8 Laurate, Pentylene Glycol, Phenylbenzimidazole Sulfonic Acid, Polymethylsilsesquioxane, Polysorbate 60, Pyrus Malus (Apple) Seed Extract, Red 33 (Ci 17200), Rhamnose, Salicylic Acid, Sodium Hydroxide, Sorbitan Isostearate, Styrene/Acrylates Copolymer, Titanium Dioxide (Ci 77891), Tocopherol, Tocopheryl Acetate, Xylitol",https://cdn1.skinsafeproducts.com/photo/D17B1A48D3DE88/large_1716180218.pngpng?1716180218,https://www.skinsafeproducts.com/bioderma-hydrabio-perfecteur-smoothing-moisturising-care-radiance-booster-spf-30-1-33-fl-oz-40-ml
1201-1400.csv,"Bioderma Atoderm PP Ultra-Nourishing Balm, 200 ml.",Bioderma,Body,"Balms, Ointments & Salves","1,2-Hexanediol, Acrylates/C10-30 Alkyl Acrylate Crosspolymer, Ammonium Acryloyldimethyltaurate/Vp Copolymer, Caprylic/Capric Triglyceride, Caprylyl Glycol, Dimethicone, Disodium Edta, Ethylhexyl Stearate, Fructooligosaccharides, Glycerin, Glyceryl Behenate, Glyceryl Dibehenate, Laminaria Ochroleuca Extract, Mannitol, Mineral Oil, Niacinamide, Oleyl Alcohol, Pentylene Glycol, Peumus Boldus Leaf Extract, Rhamnose, Sodium Hydroxide, Sucrose Stearate, Tribehenin, Water\Aqua\Eau, Xanthan Gum, Xylitol (Source Unknown), Zanthoxylum Alatum Fruit Extract, Zanthoxylum Bungeanum Fruit Extract",https://cdn1.skinsafeproducts.com/photo/D4203FCB9B3929/large_1488074426.jpeg?1488074426,https://www.skinsafeproducts.com/bioderma-atoderm-pp-ultra-nourishing-balm-200-ml-0
1201-1400.csv,"Bioderma ABCDerm H2O Micelle Solution, 3.33 oz",Bioderma,Facial Cleansers,Micellar Water,"Allantoin, Cetrimonium Bromide, Citric Acid, Disodium Edta, Disodium Phosphate, Peg-6 Caprylic/Capric Glycerides, Perfume, Water\Aqua\Eau",https://cdn1.skinsafeproducts.com/photo/D7B2311C144888/large_1570655186.jpeg?1570655186,https://www.skinsafeproducts.com/bioderma-abcderm-h2o-micelle-solution-3-33-oz
1201-1400.csv,"Bioderma Sebium H2O Micellar Water + Sebium Pore Refiner Cream, 16.7 fl oz",Bioderma,Facial Cleansers,Micellar Water,"Cetrimonium Bromide, Citric Acid, Copper Sulfate, Disodium Edta, Fructooligosaccharides, Ginkgo Biloba Leaf Extract, Mannitol, Peg-6 Caprylic/Capric Glycerides, Perfume, Propylene Glycol (1,2-Propanediol), Rhamnose, Sodium Citrate, Water\Aqua\Eau, Xylitol (Source Unknown), Zinc Gluconate",https://cdn1.skinsafeproducts.com/photo/AA2C397022E65E/large_1564262956.jpeg?1564262956,https://www.skinsafeproducts.com/bioderma-sebium-h2o-micellar-water-sebium-pore-refiner-cream-16-7-fl-oz
1201-1400.csv,"Bioderma Hydrabio H2O Micelle Solution, 500ml/16.7 fl oz",Bioderma,Facial Cleansers,Facial Washes,"Brassica Campestris (Rapeseed) Sterols, Cetrimonium Bromide, Disodium Edta, Glycerin, Hexyldecanol, Mannitol, Niacinamide, Peg-6 Caprylic/Capric Glycerides, Perfume, Pyrus Malus (Apple) Seed Extract, Rhamnose, Sodium Hydroxide, Tocopherol (Multisource), Water\Aqua\Eau, Xylitol (Source Unknown)",https://cdn1.skinsafeproducts.com/photo/098E874643C0EE/large_1566495102.pngPNG?1566495102,https://www.skinsafeproducts.com/bioderma-hydrabio-h2o-moisturising-make-up-removing-micelle-solution-500ml
1201-1400.csv,Bioderma Hydrabio Moisturizing Toning Lotion,Bioderma,Skin Care,Toners & Astringents,"Allantoin, Brassica Campestris (Rapeseed) Sterols, Cetrimonium Bromide, Citric Acid, Disodium Edta, Fructooligosaccharides, Glycerin, Hexyldecanol, Mannitol, Niacinamide, Perfume, Polysorbate 20, Pyrus Malus (Apple) Fruit Extract, Pyrus Malus (Apple) Seed Extract, Rhamnose, Sodium Hydroxide, Tocopherol, Water\Aqua\Eau, Xylitol, Xylitol (Source Unknown)",https://cdn1.skinsafeproducts.com/photo/KKcaArrxxf4Zyzm31XxRuA/large_1464496287.jpeg?1464496287,https://www.skinsafeproducts.com/bioderma-hydrabio-moisturizing-toning-lotion
1201-1400.csv,"Bioderma Cicabio Baume Lavant, 6.7 fl oz/200 mL",Bioderma,Facial Cleansers,Facial Washes,"Acetyl Dipeptide-1 Cetyl Ester, Acrylates/C10-30 Alkyl Acrylate Crosspolymer, Aqua/Water/Eau, Benzotriazolyl Dodecyl P-Cresol, Butylene Glycol, Butyrospermum Parkii (Shea) Oil, Caprylic/Capric Triglyceride, Caprylyl Glycol, Caprylyl/Capryl Glucoside, Citric Acid, Disodium Cocoyl Glutamate, Fructooligosaccharides, Glycerin, Helianthus Annuus (Sunflower) Seed Oil, Mannitol, Methylpropanediol, Pentylene Glycol, Propanediol, Rhamnose, Saccharide Isomerate, Sodium Citrate, Sodium Hydroxide, Squalane, Tocopherol, Xanthan Gum, Xylitol, Zinc Gluconate",https://cdn1.skinsafeproducts.com/photo/7E550148FF08B6/large_1755928308.pngpng?1755928308,https://www.skinsafeproducts.com/bioderma-cicabio-baume-lavant-6-7-fl-oz-200-ml
1201-1400.csv,"Bioderma Sensibio AR+SOS Spray, 70 mL",Bioderma,Face,Mists,"1-Methylhydantoin-2-Imide, Aqua/Water/Eau, Butylene Glycol, Citric Acid, Glycerin, Hydrogenated Starch Hydrolysate, Maltooligosyl Glucoside, Mannitol, Pentylene Glycol, Rhamnose, Sodium Citrate, Triethyl Citrate, Xylitol",https://cdn1.skinsafeproducts.com/photo/EC9AFD0951DCE8/large_1754135091.pngpng?1754135091,https://www.skinsafeproducts.com/bioderma-sensibio-ar-sos-spray-70-ml
1401-1600.csv,"Bioderma Sensibio AR+ Bi-Serum, 1 fl oz/30 mL",Bioderma,Skin Treatments,Serums,"1-Methylhydantoin-2-Imide, 12-Hexanediol, Aqua/Water/Eau, Bakuchiol, C15-19 Alkane, Citric Acid, Dicaprylyl Carbonate, Dipotassium Glycyrrhizate, Glutamylamidoethyl Indole, Glycerin, Helianthus Annuus (Sunflower) Seed Oil, Hydrogenated Starch Hydrolysate, Maltooligosyl Glucoside, Mannitol, Natto Gum, O-Cymen-5-Ol, Pentylene Glycol, Polyglyceryl-10 Laurate, Propanediol, Rhamnose, Sodium Chloride, Sodium Citrate, Squalane, Tocopherol, Triethyl Citrate, Trisodium Ethylenediamine Disuccinate, Xanthan Gum, Xylitol",https://cdn1.skinsafeproducts.com/photo/10F73400F5C2EB/large_1751516799.pngpng?1751516799,https://www.skinsafeproducts.com/bioderma-sensibio-ar-bi-serum-1-fl-oz-30-ml
1401-1600.csv,"Bioderma Sensibio Micellar Cleansing Oil, 0.16 fl oz/5 mL",Bioderma,Facial Cleansers,Facial Cleansing Oil,"Aqua/Water/Eau, Benzotriazolyl Dodecyl P-Cresol, Brassica Campestris (Rapeseed) Seed Oil, Caprylic/Capric Triglyceride, Ethylhexyl Palmitate, Helianthus Annuus (Sunflower) Seed Oil, Laminaria Ochroleuca Extract, Polyglyceryl-4 Oleate, Propanediol, Sodium Pca, Stearyl Glycyrrhetinate, Tocopherol",https://cdn1.skinsafeproducts.com/photo/5BFE9821841D32/large_1741591729.pngpng?1741591729,https://www.skinsafeproducts.com/bioderma-sensibio-micellar-cleansing-oil-0-16-fl-oz-5-ml
1401-1600.csv,"Bioderma Atoderm Intensive Baume Ultra-Rich Soothing Balm, 16.9 fl oz/500 mL",Bioderma,Body,"Balms, Ointments & Salves","1,2-Hexanediol, Acrylates/C10-30 Alkyl Acrylate Crosspolymer, Aqua/Water/Eau, Behenyl Alcohol, Beta-Sitosterol, Canola/Canola Oil/Huile De Colza, Caprylic/ Capric Triglyceride, Caprylyl Glycol, Carbon, Ceramide Ap, Ceramide Eop, Ceramide Np, Cholesterol, Citric Acid, Ethylhexylglycerin, Fructooligosaccharides, Glycerin, Helianthus Annuus (Sunflower) Seed Oil, Hydroxyethyl Acrylate/Sodium Acryloyldimethyl Taurate Copolymer, Laminaria Ochroleuca Extract, Mannitol, Palmitamide Mea, Paraffinum Liquidum/Mineral Oil/Huile Minerale, Pentylene Glycol, Phytosphingosine, Polysorbate 60, Rhamnose, Sodium Citrate, Sodium Hydroxide, Sodium Lauroyl Lactylate, Sorbitan Isostearate, Sucrose Stearate, Tocopherol, Xanthan Gum, Xylitol, Zinc Gluconate",https://cdn1.skinsafeproducts.com/photo/E6B4FD092562E2/large_1739430297.pngpng?1739430297,https://www.skinsafeproducts.com/bioderma-atoderm-intensive-baume-ultra-rich-soothing-balm-16-9-fl-oz-500-ml
1401-1600.csv,"Bioderma Photoderm Lait Ultra, SPF 50+, 3.3 fl oz/100 mL",Bioderma,Face,Moisturizers with SPF,"1,2-Hexanediol, Aqua/Water/Eau, Bis-Ethylhexyloxyphenol Methoxyphenyl Triazine, Brassica Campestris/Aleurites Fordii Oil Copolymer, Butyl Methoxydibenzoylmethane, C12-15 Alkyl Benzoate, C20-22 Alcohols, C20-22 Alkyl Phosphate, Caprylic/Capric Triglyceride, Caprylyl Glycol, Cellulose Gum, Citric Acid, Dibutyl Adipate, Dicaprylyl Carbonate, Diethylhexyl Butamido Triazone, Diisopropyl Sebacate, Ectoin, Ethylhexyl Triazone, Fructooligosaccharides, Glycerin, Laminaria Ochroleuca Extract, Mannitol, Microcrystalline Cellulose, O-Cymen-5-Ol, Polyglyceryl-6 Behenate, Polyglyceryl-6 Stearate, Propanediol, Propylheptyl Caprylate, Rhamnose, Sodium Citrate, Sodium Hydroxide, Tocopherol, Xanthan Gum, Xylitol",https://cdn1.skinsafeproducts.com/photo/2DAE45063591AC/large_1721199880.pngpng?1721199880,https://www.skinsafeproducts.com/bioderma-photoderm-lait-ultra-spf-50-3-3-fl-oz-100-ml
1401-1600.csv,"Bioderma Sensibio Soothing Micellar Cleansing Foaming Gel, 6.7 fl oz/200 mL",Bioderma,Facial Cleansers,Facial Foaming Cleansers,"Aqua/Water/Eau, Ascorbyl Palmitate, Citric Acid, Coco-Glucoside, Fructooligosaccharides, Glyceryl Oleate, Hydrogenated Palm Glycerides Citrate, Laureth-2, Lecithin, Mannitol, Peg-90 Glyceryl Isostearate, Propanediol, Rhamnose, Sodium Citrate, Sodium Cocoamphoacetate, Sodium Lauroyl Sarcosinate, Tocopherol, Xylitol",https://cdn1.skinsafeproducts.com/photo/9570961C17F337/large_1707304355.pngpng?1707304355,https://www.skinsafeproducts.com/bioderma-sensibio-soothing-micellar-cleansing-foaming-gel-6-7-fl-oz-200-ml
1401-1600.csv,"Bioderma Atoderm Creme Ultra-Nourishing Cream, Normal To Dry Sensitive Skin, 500 mL/16.9 fl oz",Bioderma,Body,Creams,"1,2 Hexanediol, Acrylates/C10-30 Alkyl Acrylate Crosspolymer, Anhydroxylitol, Aqua/Water/Eau, Brassica Campestris (Rapeseed) Seed Oil, Caprylic/Capric Triglyceride, Caprylyl Glycol, Cetearyl Alcohol, Cetearyl Glucoside, Fructooligosaccharides, Glucose, Glycerin, Helianthus Annuus (Sunflower) Seed Oil, Laminaria Ochroleuca Extract, Mannitol, Niacinamide, Paraffinum Liquidum/Mineral Oil/Huile Minerale, Pentylene Glycol, Rhamnose, Sodium Citrate, Sodium Polyacrylate, Tocopherol, Xylitol, Xylitylglucoside",https://cdn1.skinsafeproducts.com/photo/F3CA754D698FE1/large_1697727590.pngpng?1697727590,https://www.skinsafeproducts.com/bioderma-atoderm-creme-ultra-nourishing-cream-normal-to-dry-sensitive-skin-500-ml-16-9-fl-oz
1401-1600.csv,"Bioderma Atoderm Intensive Gel Creme, 6.7 fl oz/200 mL",Bioderma,Body,Gels,"1,2-Hexanediol, Aqua/Water/Eau, Caprylic/Capric Triglyceride, Caprylyl Glycol, Dipotassium Glycyrrhizate, Fructooligosaccharides, Glycerin, Hydrogenated Polydecene, Laminaria Ochroleuca Extract, Mannitol, Niacinamide, Pentylene Glycol, Polyquaternium-51, Polysorbate 20, Rhamnose, Sodium Citrate, Sodium Polyacrylate, Xylitol",https://cdn1.skinsafeproducts.com/photo/3E9E70720A25C2/large_1693481735.pngpng?1693481735,https://www.skinsafeproducts.com/bioderma-atoderm-intensive-gel-creme-6-7-fl-oz-200-ml
1401-1600.csv,"Bioderma Photoderm Moisturising Lotion, SPF 50+, 6.7 fl oz/200 mL",Bioderma,Face,Moisturizers with SPF,"1,2-Hexanediol, Aqua/Water/Eau, Bis-Ethylhexyloxyphenol Methoxyphenyl Triazine, Brassica Campestris/Aleurites Fordii Oil Copolymer, Butyl Methoxydibenzoylmethane, C12-15 Alkyl Benzoate, C20-22 Alcohols, C20-22 Alkyl Phosphate, Caprylic/Capric Triglyceride, Caprylyl Glycol, Cellulose Gum, Citric Acid, Dibutyl Adipate, Dicaprylyl Carbonate, Diethylhexyl Butamido Triazone, Diisopropyl Sebacate, Ectoin, Ethylhexyl Triazone, Fructooligosaccharides, Glycerin, Laminaria Ochroleuca Extract, Mannitol, Microcrystalline Cellulose, O-Cymen-5-Ol, Polyglyceryl-6 Behenate, Polyglyceryl-6 Stearate, Propanediol, Propylheptyl Caprylate, Rhamnose, Sodium Citrate, Sodium Hydroxide, Tocopherol, Xanthan Gum, Xylitol",https://cdn1.skinsafeproducts.com/photo/E48409B0606E1A/large_1687413729.pngpng?1687413729,https://www.skinsafeproducts.com/bioderma-photoderm-moisturising-lotion-spf-50-6-7-fl-oz-200-ml
1401-1600.csv,"Bioderma Cicabio Pommade Insulating Soothing Repairing Ointment, 1.3 fl oz/40 mL",Bioderma,Face,OIntments,"Acetyl Dipeptide-1 Cetyl Ester, Aqua/Water/Eau, Asiatic Acid, Asiaticoside, Butylene Glycol, Caprylic/Capric Triglyceride, Capryloyl Glycine, Copper Sulfate, Fructooligosaccharides, Glycerin, Hydroxyethylcellulose, Laminaria Ochroleuca Extract, Laureth-3, Madecassic Acid, Mannitol, Paraffinum Liquidum/ Mineral Oil/Huile Minerale, Polyglyceryl-4 Diisostearate/ Polyhydroxystearate/Sebacate, Potassium Sorbate, Propanediol, Rhamnose, Sodium Citrate, Sodium Hyaluronate, Sodium Hydroxide, Vitis Vinifera (Grape) Vine Extract, Xylitol, Zinc Stearate, Zinc Sulfate",https://cdn1.skinsafeproducts.com/photo/01678D2649F24C/large_1676022710.jpegjpg?1676022710,https://www.skinsafeproducts.com/bioderma-cicabio-pommade-insulating-soothing-repairing-ointment-1-3-fl-oz-40-ml
1401-1600.csv,"Bioderma Atoderm Intensive Gel-Creme, Ultra-Soothing Cooling Care, 16.7 fl oz/500 ml",Bioderma,Body,Gels,"1,2-Hexanediol, Aqua/Water/Eau, Caprylic/Capric Triglyceride, Caprylyl Glycol, Dipotassium Glycyrrhizate, Fructooligosaccharides, Glycerin, Hydrogenated Polydecene, Laminaria Ochroleuca Extract, Mannitol, Niacinamide, Pentylene Glycol, Polyquaternium-51, Polysorbate 20, Rhamnose, Sodium Citrate, Sodium Polyacrylate, Xylitol",https://cdn1.skinsafeproducts.com/photo/2F1856FD53DE2A/large_1638945673.pngpng?1638945673,https://www.skinsafeproducts.com/bioderma-atoderm-intensive-gel-creme-ultra-soothing-cooling-care-16-7-fl-oz-500-ml
1401-1600.csv,"Bioderma Atoderm Intensive Baume, Ultra-Soothing Balm, 6.7 fl oz/200 mL",Bioderma,Body,"Balms, Ointments & Salves","1,2-Hexanediol, Acrylates/C10-30 Alkyl Acrylate Crosspolymer, Aqua/Water/Eau, Behenyl Alcohol, Beta-Sitosterol, Canola Oil (Huile De Colza), Caprylic/Capric Triglyceride, Caprylyl Glycol, Carbomer, Ceramide Ap, Ceramide Eop, Ceramide Np, Cholesterol, Citric Acid, Ethylhexylglycerin, Fructooligosaccharides, Glycerin, Helianthus Annuus (Sunflower) Seed Ol, Hydroxyethyl Acrylate/Sodium Acryloyldimethyl Taurate Copolymer, Laminaria Ochroleuca Extract, Mannitol, Palmitamide Mea, Paraffinum Liquidum/ Mineral Oil/Huile Minerale, Pentylene Glycol, Phytosphingosine, Polysorbate 60, Rhamnose, Sodium Citrate, Sodium Horoxide, Sodium Lauroyl Lactylate, Sorbitan Isostearate, Sucrose Stearate, Tocopherol, Xanthan Gum, Xylitol, Zinc Gluconate",https://cdn1.skinsafeproducts.com/photo/CBA46F54A4B108/large_1630310241.pngpng?1630310241,https://www.skinsafeproducts.com/bioderma-atoderm-intensive-baume-ultra-soothing-balm-6-7-fl-oz-200-ml
1401-1600.csv,"Bioderma Sensibio Tolerance, 40 mL/1.33 fl oz",Bioderma,Skin Treatments,Serums,"Acetyl Tetrapeptide-15, Aqua/Water/Eau, Capryloyl Glycine, Cocoglycerides, Dehydroxanthan Gum, Glycerin, Glyceryl Stearate, Isostearyl Isostearate, Mannitol, Rhamnose, Sclerotium Gum, Silica, Sodium Citrate, Sodium Hydroxide, Sodium Pca, Undecylenoyl Glycine, Xylitol",https://cdn1.skinsafeproducts.com/photo/4609B25925F766/large_1611608936.pngPNG?1611608936,https://www.skinsafeproducts.com/bioderma-sensibio-tolerance-40-ml-1-33-fl-oz
1401-1600.csv,Bioderma Sensibio Rich Soothing Cream,Bioderma,Face,Creams,"1,2-Hexanediol, Acrylates/C10-30 Alkyl Acrylate Crosspolymer, Caprylic/Capric Triglyceride, Caprylyl Glycol, Disodium Edta, Fructooligosaccharides, Glycerin, Glycol Palmitate, Glycol Stearate, Glycyrrhetinic Acid, Laminaria Ochroleuca Extract, Mannitol, Mineral Oil (Paraffinum Liquidum), Peg-2 Stearate, Pentylene Glycol, Persea Gratissima (Avocado) Oil Unsaponifiables, Rhamnose, Sodium Hydroxide, Triceteareth-4 Phosphate, Tridecyl Trimellitate, Water (Aqua), Xanthan Gum, Xylitol",https://cdn1.skinsafeproducts.com/photo/66736B8DC646C3/large_1569782873.jpeg?1569782873,https://www.skinsafeproducts.com/bioderma-sensibio-rich-soothing-cream
1401-1600.csv,"BioDerma Atoderm Creme, 200 mL",Bioderma,Body,Creams,"Acrylates/C10-30 Alkyl Acrylate Crosspolymer, Anhydroxylitol, Caprylic/Capric Triglyceride, Caprylyl Glycol, Cetearyl Isononanoate, Cetyl Alcohol, Cyclohexasiloxane, Cyclopentasiloxane, Disodium Edta, Fructooligosaccharides, Glucose, Glycerin, Glyceryl Stearate, Laminaria Ochroleuca Extract, Mannitol, Mineral Oil, Myreth-3 Myristate, Niacinamide, Palmitic Acid, Peg-100 Stearate, Pentylene Glycol, Rhamnose, Sodium Dehydroacetate, Sodium Hydroxide, Steareth-21, Stearic Acid, Water\Aqua\Eau, Xylitol (Source Unknown), Xylitylglucoside",https://cdn1.skinsafeproducts.com/photo/40AFA6A36C72A4/large_1501436465.pngpng?1501436465,https://www.skinsafeproducts.com/bioderma-atoderm-creme-200-ml
1601-1800.csv,"Bioderma Pigmentbio Daily Care Cream, 1.3 fl oz/40 mL",Bioderma,Skin Treatments,Spot Treatments,"Propylene Glycol, Acacia Decurrens Flower Wax, Andrographis Paniculata Leaf Extract, Aqua/Water/Eau, Ascorbyl Glucoside, Azelaic Acid, Bis-Ethylhexyloxyphenol Methoxyphenyl Triazine, Butyl Methoxydibenzoylmethane, Butyrospermum Parkii (Shea) Oil, C20-22 Alcohols, C20-22 Alkyl Phosphate, Caprylic/Capric Triglyceride, Decyl Glucoside, Dicaprylyl Carbonate, Dimethicone, Dimethicone/Vinyl Dimethicone Crosspolymer, Dipropylene Glycol, Fragrance (Parfum), Fructooligosaccharides, Glycerin, Glycyrrhiza Glabra (Licorice) Root Extract, Hd/Trimethylol Hexyllactone Crosspolymer, Helianthus Annuus (Sunflower) Seed Wax, Hydrogenated Castor Oil, Jojoba Esters, Laminaria Ochroleuca Extract, Lysine, Mannitol, Methylene Bis-Benzotriazolyl Tetramethylbutylphenol [Nano], Niacinamide, Octocrylene, Pentylene Glycol, Polyglycerin-3, Polymethylsilsesquioxane, Rhamnose, Saccharide Isomerate, Salicylic Acid, Silica, Sodium Citrate, Sodium Hydroxide, Tocopherol, Tocopheryl Acetate, Xanthan Gum, Xylitol",https://cdn1.skinsafeproducts.com/photo/103551685CBC0E/large_1739337449.pngpng?1739337449,https://www.skinsafeproducts.com/bioderma-pigmentbio-daily-care-cream-1-3-fl-oz-40-ml
1601-1800.csv,"Bioderma Sensibio H2O Micellar Water, 16.7 fl oz/500 mL",Bioderma,Facial Cleansers,Micellar Water,"Propylene Glycol, Aqua/Water/Eau, Cetrimonium Bromide, Cucumis Sativus (Cucumber) Fruit Extract, Disodium Edta, Fructooligosaccharides, Mannitol, Peg-6 Caprylic/Capric Glycerides, Rhamnose, Xylitol",https://cdn1.skinsafeproducts.com/photo/1B0BB40CA98A7A/large_1738292216.pngpng?1738292216,https://www.skinsafeproducts.com/bioderma-sensibio-h2o-micellar-water-16-7-fl-oz-500-ml
1601-1800.csv,"Bioderma Gentle Cleansing Gel, 33.8 fl oz/1 L",Bioderma,Cleansers,Liquid Cleansers & Soaps,"Anhydroxylitol, Aqua/Water/Eau, Capryloyl Glycine, Citric Acid, Coco-Betaine, Coco-Glucoside, Copper Sulfate, Disodium Edta, Fragrance (Parfum), Fructooligosaccharides, Glucose, Glycerin, Glyceryl Oleate, Hydrogenated Palm Glycerides Citrate, Mannitol, Methylpropanediol, Nacinamide, Rhamnose, Sodium Laureth Sulfate, Sodium Lauroyl Sarcosinate, Tocopherol, Xylitol, Xylitylglucoside",https://cdn1.skinsafeproducts.com/photo/6D6AA84F5F62FA/large_1733822321.pngpng?1733822321,https://www.skinsafeproducts.com/bioderma-gentle-cleansing-gel-33-8-fl-oz-1-l
1601-1800.csv,"Bioderma Sensibio DS+ Soothing Purifying Cleansing Foaming Gel, 6.7 fl oz/200 mL",Bioderma,Cleansers,Foaming Cleansers,"1,2-Hexanediol, Acrylates/C10-30 Alkyl Acrylate Crosspolymer, Aqua/Water/Eau, Caprylic/Capric Triglyceride, Caprylyl Glycol, Citric Acid, Coco-Betaine, Coco-Glucoside, Dipotassium Glycyrrhizate, Fructooligosaccharides, Glyceryl Oleate, Hydrogenated Palm Glycerides Citrate, Hydroxyacetophenone, Laminaria Ochroleuca Extract, Mannitol, Piroctone Olamine, Pyridoxine Hcl, Rhamnose, Sodium Citrate, Sodium Hydroxide, Sodium Laureth Sulfate, Sodium Lauroyl Sarcosinate, Tocopherol, Undecyl Alcohol, Xylitol, Zinc Gluconate",https://cdn1.skinsafeproducts.com/photo/FD2459156BC541/large_1733820984.pngpng?1733820984,https://www.skinsafeproducts.com/bioderma-sensibio-ds-soothing-purifying-cleansing-foaming-gel-6-7-fl-oz-200-ml
1801-2000.csv,Bioderma Ultra Nourishing Cleansing Oil,Bioderma,Facial Cleansers,Facial Cleansing Oil,"Aqua/Water/Eau, Ascorbyl Palmitate, Citric Acid, Coco-Glucoside, Fragrance (Parfum), Fructooligosaccharides, Glycerin, Glyceryl Oleate, Hydrogenated Palm Glycerides Citrate, Laureth-2, Lauryl Glucoside, Lecithin, Mannitol, Niacinamide, Peg-7 Glyceryl Cocoate, Peg-90 Glyceryl Isostearate, Polysorbate 20, Rhamnose, Sodium Cocoamphoacetate, Tocopherol, Xylitol",https://cdn1.skinsafeproducts.com/photo/40DE724E371F4E/large_1711712885.jpeg?1711712885,https://www.skinsafeproducts.com/bioderma-ultra-nourishing-cleansing-oil
