File,product_name,brand,usage_type,category,ingredients,image_url,product_url
1801-2000.csv,"Bioderma Hydrabio Hyalu+Serum, 1 fl oz/30 mL",Bioderma,Skin Treatments,Serums,"1,2-Hexanediol, Adenosine, Aqua/Water/Eau, Brassica Campestris (Rapeseed) Sterols, Butylene Glycol, Caprylyl Glycol, Carnosine, Citric Acid, Fragrance (Parfum), Fructooligosaccharides, Glycerin, Hexyldecanol, Hydrolyzed Hyaluronic Acid, Niacinamide, Pentylene Glycol, Peumus Boldus Leaf Extract, Polysorbate 20, Propanediol, Pyrus Malus (Apple) Seed Extract, Saccharide Isomerate, Sodium Citrate, Sodium Hyaluronate, Tocopherol, Xanthan Gum",https://cdn1.skinsafeproducts.com/photo/97A9BA6B4BE8B4/large_1703227517.pngpng?1703227517,https://www.skinsafeproducts.com/bioderma-hydrabio-hyalu-serum-1-fl-oz-30-ml
1801-2000.csv,"Bioderma Sensibio DS+ Soothing Purifying Cream, 1.3 fl oz/40 mL",Bioderma,Face,Creams,"Aqua/Water/Eau, Caprylic/Capric Triglyceride, Carbomer, Cetyl Alcohol, Climbazole, Cocos Nucifera (Coconut) Oil, Dimethicone, Fructooligosaccharides, Glycyrrhetinic Acid, Laminaria Ochroleuca Extract, Mannitol, Phenoxyethanol, Piroctone Olamine, Propylene Glycol, Rhamnose, Sclerotium Gum, Sodium Hydroxide, Sorbitan Sesquioleate, Undecylenic Glycerides, Xylitol",https://cdn1.skinsafeproducts.com/photo/7E8169391F3F82/large_1699255474.pngpng?1699255474,https://www.skinsafeproducts.com/bioderma-sensibio-ds-soothing-purifying-cream-1-3-fl-oz-40-ml
1801-2000.csv,"Bioderma Atoderm Ultra-Nourishing Anti-Irritation Cleansing Oil, 33.8 fl oz/1 L",Bioderma,Facial Cleansers,Facial Cleansing Oil,"Aqua/Water/Eau, Ascorbyl Palmitate, Citric Acid, Coco-Glucoside, Fragrance (Parfum), Fructooligosaccharides, Glycerin, Glyceryl Oleate, Hydrogenated Palm Glycerides Citrate, Laureth-2, Lauryl Glucoside, Lecithin, Mannitol, Niacinamide, Peg-7 Glyceryl Cocoate, Peg-90 Glyceryl Isostearate, Polysorbate 20, Rhamnose, Sodium Cocoamphoacetate, Tocopherol, Xylitol",https://cdn1.skinsafeproducts.com/photo/68EBBFE0230C7A/large_1696937672.pngpng?1696937672,https://www.skinsafeproducts.com/bioderma-atoderm-ultra-nourishing-anti-irritation-cleansing-oil-33-8-fl-oz-1-l
1801-2000.csv,"Bioderma Photoderm Dark Spots Pregnancy Mask, Clarifying Gel-Cream Anti Recurrence, SPF 50+, 1.3 fl oz/40 mL",Bioderma,Skin Treatments,Spot Treatments,"Aqua/Water/Eau, Bis-Ethylhexyloxyphenol Methoxyphenyl Triazine, C20-22 Alcohols, C20-22 Alkyl Phosphate, Caprylic/Capric Triglyceride, Caprylyl Glycol, Corn Starch Modified, Decyl Glucoside, Dibutyl Adipate, Diethylamino Hydroxybenzoyl Hexyl Benzoate, Diethylhexyl Butamido Triazone, Diisopropyl Sebacate, Ectoin, Fructooligosaccharides, Glabridin, Iron Oxides (Ci 77492), Laminaria Ochroleuca Extract, Lysine, Magnesium Chloride, Mannitol, Methylene Bis-Benzotriazolyl Tetramethylbutylphenol [Nano], Pentylene Glycol, Polyacrylate Crosspolymer-6, Potassium Cetyl Phosphate, Propanediol, Propylene Glycol, Rhamnose, Silica, Sodium Hydroxide, Sodium Lauroyl Glutamate, Titanium Dioxide (Ci 77891), Titanium Dioxide [Nano], Tocopheryl Acetate, Xanthan Gum, Xylitol",https://cdn1.skinsafeproducts.com/photo/E649311561F9B0/large_1673259153.pngpng?1673259153,https://www.skinsafeproducts.com/bioderma-photoderm-dark-spots-pregnancy-mask-clarifying-gel-cream-anti-recurrence-spf-50-1-3-fl-oz-40-ml
1801-2000.csv,"Bioderma Sensibio H2O Make-Up Removing Micelle Solution, Sensitive Skin, 28.7 fl oz/850 mL",Bioderma,Facial Cleansers,Micellar Water,"Aqua/Water/Eau, Cetrimonium Bromide, Cucumis Sativus (Cucumber) Fruit Extract, Disodium Edta, Fructooligosaccharides, Mannitol, Peg-6 Caprylic/Capric Glycerides, Propylene Glycol, Rhamnose, Xylitol",https://cdn1.skinsafeproducts.com/photo/DFA8E277998C7E/large_1623839804.pngpng?1623839804,https://www.skinsafeproducts.com/bioderma-sensibio-h2o-make-up-removing-micelle-solution-sensitive-skin-28-7-fl-oz-850-ml
2001-2200.csv,Pigmentbio C-Concentrate,Bioderma,Skin Treatments,Serums,"Ammonium Acryloyldimethyltaurate/Vp Copolymer, Andrographis Paniculata Leaf Extract, Aqua/Water/Eau, Ascorbyl Glucoside, Azelaic Acid, Caprylic/Capric Triglyceride, Dipropylene Glycol, Fragrance, Fructooligosaccharides, Glycerin, Glycolic Acid, Glycyrrhiza Glabra (Licorice) Root Extract, Laminaria Ochroleuca Extract, Lysine, Mannitol, Niacinamide, Pentylene Glycol, Propanediol, Propylheptyl Caprylate, Rhamnose, Saccharide Isomerate, Salicylic Acid, Sodium Citrate, Sodium Hydroxide, Sodium Metabisulfite, Sorbitan Sesquioleate, Tocopherol, Tocopheryl Acetate, Xanthan Gum, Xylitol",https://cdn1.skinsafeproducts.com/photo/DE7A863F599F39/large_1616599661.pngpng?1616599661,https://www.skinsafeproducts.com/pigmentbio-c-concentrate
2001-2200.csv,Bioderma Sebium Exfoliating Gel,Bioderma,"Exfoliators, Polishes, & Scrubs",Exfoliators,"Cellulose Acetate, Fragrance (Parfum), Fructooligosaccharides, Ginkgo Biloba Leaf Extract, Glycolic Acid, Lauryl Glucoside, Mannitol, Propylene Glycol, Rhamnose, Salicylic Acid, Sodium Citrate, Sodium Hydroxide, Sodium Laureth Sulfate (Sles), Water/Aqua/Eau, Xanthan Gum, Xylitol (Derived From Birch Trees Or Corn)",https://cdn1.skinsafeproducts.com/photo/E1AC49ADFE1A99/large_1608590256.jpeg?1608590256,https://www.skinsafeproducts.com/bioderma-sebium-exfoliating-gel
2001-2200.csv,"Bioderma Hydrabio Gel Creme Light Moisturizing Care, 1.33 fl oz",Bioderma,Body,Lotions,"Ammonium Acryloyldimethyltaurate/Vp Copolymer, Brassica Campestris (Rapeseed) Sterols, C12-20 Alkyl Glucoside, C14-22 Alcohols, C30-45 Alkyl Cetearyl Dimethicone Crosspolymer, Carbomer, Cyclopentasiloxane, Dipropylene Glycol, Disodium Edta, Glycerin, Hdi/Trimethylol Hexyllactone Crosspolymer, Hexyldecanol, Isododecane, Malachite Extract, Mannitol, Niacinamide, Peg/Ppg-18/18 Dimethicone, Pentylene Glycol, Perfume, Polymethylsilsesquioxane, Pyrus Malus (Apple) Seed Extract, Rhamnose, Salicylic Acid, Sodium Hydroxide, Squalane, Steareth-21, Tocopherol (Multisource), Tocopheryl Acetate, Water\Aqua\Eau, Xylitol (Source Unknown)",https://cdn1.skinsafeproducts.com/photo/F657C9A0A14D37/large_1579457949.jpegjpg?1579457949,https://www.skinsafeproducts.com/bioderma-hydrabio-gel-creme-light-moisturizing-care-1-33-fl-oz
2001-2200.csv,"Bioderma Sensibio H20 Anti-Redness Make-Up Removing Micelle Water, 8.3 fl oz",Bioderma,Facial Cleansers,Micellar Water,"Aloe Barbadensis (Aloe) Leaf Extract, Camellia Sinensis (Green Tea) Leaf Extract, Cetrimonium Bromide, Citric Acid, Cucumis Sativus (Cucumber) Fruit Extract, Disodium Edta, Fructooligosaccharides, Ginkgo Biloba Leaf Extract, Lecithin, Mannitol, Peg-6 Caprylic/Capric Glycerides, Propylene Glycol (1,2-Propanediol), Rhamnose, Sodium Hydroxide, Water\Aqua\Eau, Xylitol (Source Unknown)",https://cdn1.skinsafeproducts.com/photo/296647147ED4D3/large_1570906632.jpegjpg?1570906632,https://www.skinsafeproducts.com/bioderma-sensibio-h20-anti-redness-make-up-removing-micelle-water-8-3-fl-oz
2001-2200.csv,"Bioderma Sensibio H2O Solution, 16.7 fl oz",Bioderma,Facial Cleansers,Micellar Water,"Cetrimonium Bromide, Cucumis Sativus (Cucumber) Fruit Extract, Disodium Edta, Fructooligosaccharides, Mannitol, Peg-6 Caprylic/Capric Glycerides, Propylene Glycol, Rhamnose, Water\Aqua\Eau, Xylitol (Source Unknown)",https://cdn1.skinsafeproducts.com/photo/C96162D224351A/large_1549988342.pngPNG?1549988342,https://www.skinsafeproducts.com/bioderma-sensibio-h2o-solution-16-7-fl-oz
201-400.csv,"Bioderma Soothing Micellar Cleansing Foaming Gel, 3.33 fl oz/100 mL",Bioderma,Facial Cleansers,Facial Gels,"Aqua/Water/Eau, Ascorbyl Palmitate, Citric Acid, Coco-Glucoside, Fructooligosaccharides, Glyceryl Oleate, Hydrogenated Palm Glycerides Citrate, Laureth-2, Lecithin, Mannitol, Peg-90 Glyceryl Isostearate, Propanediol, Rhamnose, Sodium Citrate, Sodium Cocoamphoacetate, Sodium Lauroyl Sarcosinate, Tocopherol, Xylitol",https://cdn1.skinsafeproducts.com/photo/E461410FAABD78/large_1586736643.jpeg?1586736643,https://www.skinsafeproducts.com/bioderma-soothing-micellar-cleansing-foaming-gel-3-33-fl-oz-100-ml
201-400.csv,"Bioderma Sensibio Micellar Cleansing Oil, 5 fl oz/150 mL",Bioderma,Facial Cleansers,Facial Cleansing Oil,"Aqua/Water/Eau, Benzotriazolyl Dodecyl P-Cresol, Brassica Campestris (Rapeseed) Seed Oil, Caprylic/Capric Triglyceride, Ethylhexyl Palmitate, Helianthus Annuus (Sunflower) Seed Oil, Laminaria Ochroleuca Extract, Polyglyceryl-4 Oleate, Propanediol, Sodium Pca, Stearyl Glycyrrhetinate, Tocopherol",https://cdn1.skinsafeproducts.com/photo/71F16ACD7CB35E/large_1696455969.jpeg?1696455969,https://www.skinsafeproducts.com/bioderma-sensibio-micellar-cleansing-oil-5-fl-oz-150-ml
201-400.csv,"Bioderma Sensibio Foaming Gel, 6.67 fl oz",Bioderma,Cleansers,Foaming Cleansers,"Aqua/Water/Eau, Ascorbyl Palmitate, Citric Acid, Coco-Glucoside, Fructooligosaccharides, Glyceryl Oleate, Hydrogenated Palm Glycerides Citrate, Laureth-2, Lecithin, Mannitol, Peg-90 Glyceryl Isostearate, Propanediol, Rhamnose, Sodium Citrate, Sodium Cocoamphoacetate, Sodium Lauroyl Sarcosinate, Tocopherol, Xylitol",https://cdn1.skinsafeproducts.com/photo/A5BD450EA27B34/large_1578215877.jpeg?1578215877,https://www.skinsafeproducts.com/bioderma-sensibio-foaming-gel-6-7-fl-oz
201-400.csv,"Bioderma Atoderm Intensive Baume, 6.67 fl oz",Bioderma,Body,Creams,"2-Hexanediol, Acrylates/C10-30 Alkyl Acrylate Crosspolymer, Behenyl Alcohol, Beta Sitosterol, Canola Oil, Caprylyl Glycol, Carbomer, Ceramide Ap, Ceramide Eop, Ceramide Np, Cholesterol, Citric Acid, Disodium Edta, Ethylhexylglycerin, Glycerin, Helianthus Annuus (Sunflower) Seed Oil, Hydroxyethyl Acrylate/Sodium Acryloyldimethyl Taurate Copolymer, Mannitol, Mineral Oil, Palmitamide Mea, Pentylene Glycol, Phytosphingosine, Polysorbate 60, Rhamnose, Sodium Hydroxide, Sodium Lauroyl Lactylate, Sorbitan Isostearate, Sucrose Stearate, Tocopherol (Multisource), Water\Aqua\Eau, Xanthan Gum, Xylitol (Source Unknown), Zinc Gluconate",https://cdn1.skinsafeproducts.com/photo/D0ED10BBCBC50F/large_1546185284.jpeg?1546185284,https://www.skinsafeproducts.com/bioderma-atoderm-intensive-baume-6-67-fl-oz
201-400.csv,"Bioderma Sensibio Rich Cream, 40 mL",Bioderma,Body,Creams,"1,2-Hexanediol, Acrylates/C10-30 Alkyl Acrylate Crosspolymer, Caprylic/Capric Triglyceride, Caprylyl Glycol, Disodium Edta, Fructooligosaccharides, Glycerin, Glycol Palmitate, Glycol Stearate, Glycyrrhetinic Acid, Laminaria Ochroleuca Extract, Mannitol, Mineral Oil, Peg-2 Stearate, Pentylene Glycol, Persea Gratissima (Avocado) Oil Unsaponifiables, Rhamnose, Sodium Hydroxide, Triceteareth-4 Phosphate, Tridecyl Trimellitate, Water (Aqua), Xanthan Gum, Xylitol (Source Unknown)",https://cdn1.skinsafeproducts.com/photo/F244E5FF795A97/large_1611608640.pngPNG?1611608640,https://www.skinsafeproducts.com/bioderma-sensibio-rich-cream-40-ml
201-400.csv,"Bioderma Atoderm Intensive Balm, 16.7 Fl oz.",Bioderma,Body,Creams,"1,2-Hexanediol, Acrylates/C10-30 Alkyl Acrylate Crosspolymer, Behenyl Alcohol, Beta Sitosterol, Canola Oil, Caprylyl Glycol, Carbomer, Ceramide Ap, Ceramide Eop, Ceramide Np, Cholesterol, Citric Acid, Disodium Edta, Ethylhexylglycerin, Glycerin, Helianthus Annuus (Sunflower) Seed Oil, Hydroxyethyl Acrylate/Sodium Acryloyldimethyl Taurate Copolymer, Mannitol, Mineral Oil, Palmitamide Mea, Pentylene Glycol, Phytosphingosine, Polysorbate 60, Rhamnose, Sodium Hydroxide, Sodium Lauroyl Lactylate, Sorbitan Isostearate, Sucrose Stearate, Tocopherol (Multisource), Water\Aqua\Eau, Xanthan Gum, Xylitol (Source Unknown), Zinc Gluconate",https://cdn1.skinsafeproducts.com/photo/F560AC59771343/large_1513111873.jpeg?1513111873,https://www.skinsafeproducts.com/bioderma-atoderm-intensive-balm-16-7-fl-oz
201-400.csv,"Bioderma Sensibio Eye Contour Gel, 35 mL/0.5 fl oz",Bioderma,Eyes,Puffiness Treatments,"1,2-Hexanediol, Acrylates/C10-30 Alkyl Acrylate Crosspolymer, Butylene Glycol Cocoate, Caffeine, Caprylic/Capric Triglyceride, Caprylyl Glycol, Dimethicone, Disodium Edta, Ethylcellulose, Fructooligosaccharides, Glycerin, Glycyrrhetinic Acid, Isostearyl Alcohol, Laminaria Ochroleuca Extract, Mannitol, Pentylene Glycol, Polyethylene, Rhamnose, Sodium Hyaluronate, Sodium Hydroxide, Tridecyl Trimellitate, Water\Aqua\Eau, Xylitol (Source Unknown)",https://cdn1.skinsafeproducts.com/photo/ZBK_7VOulgPJ1EWPx-FLjA/large_1464496141.jpeg?1464496141,https://www.skinsafeproducts.com/bioderma-sensibio-eye-contour-gel
201-400.csv,"Bioderma Atoderm Soothing Lipid - Replenishing Cleansing Oil, 16.9 fl oz/500 mL",Bioderma,Facial Cleansers,Facial Cleansing Oil,"Aqua/Water/Eau, Citric Acid, Coco-Glucoside, Fragrance (Parfum), Fructooligosaccharides, Glycerin, Glyceryl Oleate, Hydrogenated Palm Glycerides Citrate, Laureth-2, Lauryl Glucoside, Mannitol, Niacinamide, Peg-7 Glyceryl Cocoate, Polysorbate 20, Rhamnose, Sodium Cocoamphoacetate, Tocopherol, Xylitol",https://cdn1.skinsafeproducts.com/photo/E767441DD7982B/large_1728667443.jpeg?1728667443,https://www.skinsafeproducts.com/bioderma-atoderm-soothing-lipid-replenishing-cleansing-oil-16-9-fl-oz-500-ml
2201-2296.csv,"Bioderma Moisturising Make - Up Removing Micelle Solution, 3.33 fl oz/100 mL",Bioderma,Facial Cleansers,Micellar Water,"Aqua/Water/Eau, Brassica Campestris (Rapeseed) Sterols, Cetrimonium Bromide, Disodium Edta, Fragrance (Parfum), Glycerin, Hexyldecanol, Mannitol, Niacinamide, Peg-6 Caprylic/Capric Glycerides, Pyrus Malus (Apple) Seed Extract, Rhamnose, Sodium Hydroxide, Tocopherol, Xylitol",https://cdn1.skinsafeproducts.com/photo/E7CE22CF331C77/large_1719814033.pngpng?1719814033,https://www.skinsafeproducts.com/bioderma-moisturising-make-up-removing-micelle-solution-3-33-fl-oz-100-ml
2201-2296.csv,"BIoderma Hydrabio H2O Cleansing & Make-Up Removing Micellar Towelettes, 25 Ct, Pack Of 2",Bioderma,Cleansers,"Cloths, Towelettes, & Wipes","Allantoin, Aqua/Water/Eau, Cetrimonium Bromide, Disodium Edta, Fructooligosaccharides, Mannitol, Parfum, Pentylene Glycol, Polysorbate 20, Rhamnose, Xylitol",https://cdn1.skinsafeproducts.com/photo/6DB75BFB6E6B3C/large_1628227604.pngpng?1628227604,https://www.skinsafeproducts.com/bioderma-hydrabio-h2o-facial-cleansing-wipes-25-ct-pack-of-2
401-600.csv,"Bioderma Atoderm Lips Restorative Balm, 0.5 fl oz/15 mL",Bioderma,Lip Care,"Lip Balms, Gels, Moisturizers & Oils","Arachidyl Propionate, Beeswax (Cera Alba), Bht, Butyrospermum Parkii (Shea) Butter, Caprylic/Capric Triglyceride, Ethyl Linoleate, Ethyl Linolenate, Ethyl Oleate, Fragrance (Parfum), Laminaria Ochroleuca Extract, Lauryl Pca, Lecithin, Microcrystalline Wax (Cera Microcristallina), Mineral Oil (Paraffinum Liquidum), Octyldodecanol, Paraffin, Retinyl Palmitate, Synthetic Wax, Tocopherol, Tocopheryl Acetate",https://cdn1.skinsafeproducts.com/photo/09CD57B00FB74D/large_1605291018.jpeg?1605291018,https://www.skinsafeproducts.com/bioderma-atoderm-lip-balm-moisturizing-and-nourishing-lip-balm-restores-for-very-dry-lips
401-600.csv,Bioderma Hydrabio Moisturizing Serum For Face and Neck - 1.33 fl. oz.,Bioderma,Skin Treatments,Serums,"Brassica Campestris (Rapeseed) Sterols, Caprylic/Capric Triglyceride, Chlorphenesin, Cyclopentasiloxane, Dimethicone, Disodium Edta, Fragrance, Fructooligosaccharides, Glycerin, Hexyldecanol, Laminaria Ochroleuca Extract, Mannitol, Niacinamide, Peg/Ppg-18/18 Dimethicone, Phenoxyethanol, Pyrus Malus (Apple) Seed Extract, Rhamnose, Sodium Hyaluronate, Sodium Polyacrylate, Tocopherol (Multisource), Trideceth-6, Water\Aqua\Eau, Xylitol",https://cdn1.skinsafeproducts.com/photo/40E82DCDB13C3C/large_1569782681.jpeg?1569782681,https://www.skinsafeproducts.com/bioderma-hydrabio-moisturizing-serum-for-face-and-neck-1-33-fl-oz
401-600.csv,"Bioderma Atoderm Ultra-Nourishing Anti-Irritation Shower Oil, 6.67 fl oz (200 mL)",Bioderma,Body,Oils,"Ascorbyl Palmitate, Citric Acid, Coco-Glucoside, Fructooligosaccharides, Glycerin, Glyceryl Oleate, Hydrogenated Palm Glycerides Citrate, Laureth-2, Lauryl Glucoside, Lecithin, Mannitol, Niacinamide, Peg-7 Glyceryl Cocoate, Peg-90 Glyceryl Isostearate, Perfume, Polysorbate 20, Rhamnose, Sodium Cocoamphoacetate, Tocopherol (Multisource), Water\Aqua\Eau, Xylitol (Source Unknown)",https://cdn1.skinsafeproducts.com/photo/6C9343053783AB/large_1578603336.jpeg?1578603336,https://www.skinsafeproducts.com/bioderma-atoderm-ultra-nourishing-anti-irritation-shower-oil-6-67-fl-oz-200-ml
401-600.csv,Bioderma Hydrabio Gel Creme Light Moisturising Care 1.35 oz,Bioderma,Body,Creams,"Ammonium Acryloyldimethyltaurate/Vp Copolymer, Brassica Campestris (Rapeseed) Sterols, C12-20 Alkyl Glucoside, C14-22 Alcohols, C30-45 Alkyl Cetearyl Dimethicone Crosspolymer, Carbomer, Cyclopentasiloxane, Dipropylene Glycol, Disodium Edta, Glycerin, Hdi/Trimethylol Hexyllactone Crosspolymer, Hexyldecanol, Isododecane, Malachite Extract, Mannitol, Niacinamide, Peg/Ppg-18/18 Dimethicone, Pentylene Glycol, Perfume, Polymethylsilsesquioxane, Pyrus Malus (Apple) Seed Extract, Rhamnose, Salicylic Acid, Sodium Hydroxide, Squalane, Steareth-21, Tocopherol (Multisource), Tocopheryl Acetate, Water\Aqua\Eau, Xylitol (Source Unknown)",https://cdn1.skinsafeproducts.com/photo/3BEE3CEA8F890F/large_1565755209.jpeg?1565755209,https://www.skinsafeproducts.com/bioderma-hydrabio-gel-creme-light-moisturising-care-1-35-oz
601-800.csv,"Bioderma ABCDerm Foaming Gel, 33.8 fl oz",Bioderma,Cleansers,Foaming Cleansers,"Citric Acid, Coco-Betaine, Disodium Edta, Laureth-2, Methylpropanediol, Peg-90 Glyceryl Isostearate, Pentylene Glycol, Perfume, Sodium Chloride, Sodium Citrate, Sodium Laureth Sulfate (Sles), Water\Aqua\Eau",https://cdn1.skinsafeproducts.com/photo/A5346DD7DF8A41/large_1514702256.jpeg?1514702256,https://www.skinsafeproducts.com/bioderma-abcderm-foaming-gel-33-8-fl-oz
601-800.csv,"Bioderma Sensibio H2O Water, 16.7 fl. oz.",Bioderma,Facial Cleansers,Micellar Water,"Cetrimonium Bromide, Cucumis Sativus (Cucumber) Fruit Extract, Disodium Edta, Fructooligosaccharides, Mannitol, Peg-6 Caprylic/Capric Glycerides, Propylene Glycol (1,2-Propanediol), Rhamnose, Water\Aqua\Eau, Xylitol (Source Unknown)",https://cdn1.skinsafeproducts.com/photo/639584B17C7956/large_1501433653.pngPNG?1501433653,https://www.skinsafeproducts.com/bioderma-sensibio-h2o-water-16-7-fl-oz
601-800.csv,"Bioderma Sensibio H2O Water, 3.33 fl. oz.",Bioderma,Facial Cleansers,Micellar Water,"Cetrimonium Bromide, Cucumis Sativus (Cucumber) Fruit Extract, Disodium Edta, Fructooligosaccharides, Mannitol, Peg-6 Caprylic/Capric Glycerides, Propylene Glycol (1,2-Propanediol), Rhamnose, Water (Aqua), Xylitol (Source Unknown)",https://cdn1.skinsafeproducts.com/photo/3C43B95E2A1E05/large_1487533455.jpeg?1487533455,https://www.skinsafeproducts.com/bioderma-sensibio-h2o-water-3-33-fl-oz
601-800.csv,"Bioderma Atoderm Lip Moisturizing Stick, 0.14 oz",Bioderma,Lip Care,"Lip Balms, Gels, Moisturizers & Oils","African Shea Butter, Arachidyl Propionate, Beeswax (Cera Alba), Bht, Caprylic/Capric Triglyceride, Ethyl Linoleate, Ethyl Linolenate, Ethyl Oleate, Laminaria Ochroleuca Extract, Lauryl Pca, Lecithin, Microcrystalline Wax (Cera Microcristallina), Mineral Oil, Octyldodecanol, Paraffin, Perfume, Retinyl Palmitate, Synthetic Wax, Tocopherol (Multisource), Tocopheryl Acetate",https://cdn1.skinsafeproducts.com/photo/x3MTR74dKyfCfDBiM22Y0A/large_1470266431.jpegjpg?1470266431,https://www.skinsafeproducts.com/bioderma-atoderm-lip-moisturizing-stick-0-14-oz
601-800.csv,"Bioderma Hydrabio H2O Micellar Water Makeup Remover, 16.7 fl oz/500 mL",Bioderma,Facial Cleansers,Micellar Water,"Aqua/Water/Eau, Brassica Campestris (Rapeseed) Sterols, Cetrimonium Bromide, Disodium Edta, Fragrance (Parfum), Glycerin, Hexyldecanol, Mannitol, Niacinamide, Peg-6 Caprylic/Capric Glycerides, Pyrus Malus (Apple) Seed Extract, Rhamnose, Sodium Hydroxide, Tocopherol, Xylitol",https://cdn1.skinsafeproducts.com/photo/253A398820303A/large_1754116845.pngpng?1754116845,https://www.skinsafeproducts.com/bioderma-hydrabio-h2o-micellar-water-makeup-remover-16-7-fl-oz-500-ml
601-800.csv,"Bioderma Purifying Cleansing Micellar Water, 3.33 fl oz/100 mL",Bioderma,Facial Cleansers,Micellar Water,"Propylene Glycol, Aqua/Water/Eau, Cetrimonium Bromide, Citric Acid, Copper Sulfate, Disodium Edta, Fragrance (Parfum), Fructooligosaccharides, Ginkgo Biloba Leaf Extract, Mannitol, Peg-6 Caprylic/Capric Glycerides, Rhamnose, Sodium Citrate, Xylitol, Zinc Gluconate",https://cdn1.skinsafeproducts.com/photo/87706B791AD447/large_1608480695.jpeg?1608480695,https://www.skinsafeproducts.com/bioderma-purifying-cleansing-micellar-water-3-33-fl-oz-100-ml
601-800.csv,"Bioderma Hydrabio H2O Micellar Solution, 250 mL/8.33 fl. oz.",Bioderma,Cleansers,Facial Cleansers,"Brassica Campestris (Rapeseed) Sterols, Cetrimonium Bromide, Disodium Edta, Glycerin, Hexyldecanol, Mannitol, Niacinamide, Peg-6 Caprylic/Capric Glycerides, Perfume, Pyrus Malus (Apple) Seed Extract, Rhamnose, Sodium Hydroxide, Tocopherol (Multisource), Water\Aqua\Eau, Xylitol (Source Unknown)",https://cdn1.skinsafeproducts.com/photo/3AEF85EAB7E7C7/large_1530046613.jpeg?1530046613,https://www.skinsafeproducts.com/bioderma-hydrabio-h2o-micellar-cleansing-water-and-makeup-remover-solution-for-dehydrated-or-sensitive-skin-8-33-fl-oz
601-800.csv,Bioderma Sensibio Eye,Bioderma,"Eye Cream, Gel, Oils, & Serum",Gels,"1,2-Hexanediol, Acrylates/C10-30 Alkyl Acrylate Crosspolymer, Butylene Glycol Cocoate, Caffeine, Caprylic/Capric Triglyceride, Caprylyl Glycol, Dimethicone, Disodium Edta, Ethylcellulose, Fructooligosaccharides, Glycerin (Plant Derived), Glycyrrhetinic Acid, Isostearyl Alcohol, Laminaria Ochroleuca Extract, Mannitol, Pentylene Glycol, Polyehtylene, Rhamnose, Sodium Hyaluronate, Sodium Hydroxide, Tridecyl Trimellitate, Water (Aqua), Xylitol (Derived From Birch Trees Or Corn)",https://cdn1.skinsafeproducts.com/photo/5A80F2EB5E1962/large_1597950451.jpegjpg?1597950451,https://www.skinsafeproducts.com/bioderma-sensibio-eye
601-800.csv,Bioderma Sensibio Rich Cream,Bioderma,Body,Creams,"1;2-Hexanediol, Acrylates/C10-30 Alkyl Acrylate Crosspolymer, Caprylic/Capric Triglyceride, Caprylyl Glycol, Disodium Edta, Fructooligosaccharides, Glycerin (Plant Derived), Glycol Palmitate, Glycol Stearate, Glycyrrhetinic Acid, Laminaria Ochroleuca Extract, Mannitol, Mineral Oil, Peg-2 Stearate, Pentylene Glycol, Persea Gratissima (Avocado) Oil, Rhamnose, Sodium Hydroxide, Triceteareth-4 Phosphate, Tridecyl Trimellitate, Water (Aqua), Xanthan Gum, Xylitol (Derived From Birch Trees Or Corn)",https://cdn1.skinsafeproducts.com/photo/0FEE110748D4EE/large_1595475632.jpeg?1595475632,https://www.skinsafeproducts.com/bioderma-sensibio-rich-cream
601-800.csv,Bioderma Atoderm Intensive Balm,Bioderma,Body,"Balms, Ointments & Salves","1,2-Hexanediol, Acrylates/C10-30 Alkyl Acrylate Crosspolymer, Behenyl Alcohol, Beta-Sitosterol, Canola Oil (Huile De Colza), Caprylic/Capric Triglyceride, Caprylyl Glycol, Carbomer, Ceramide Ap, Ceramide Eop, Ceramide Np, Cholesterol, Citric Acid, Ethylhexylglycerin, Fructooligosaccharides, Glycerin (Plant Derived), Helianthus Annuus (Sunflower) Seed Oil, Hydroxyethyl Acrylate/Sodium Acryloyldimethyl Taurate Copolymer, Laminaria Ochroleuca Extract, Mannitol, Mineral Oil, Palmitamide Mea, Pentylene Glycol, Phytosphingosine, Polysorbate-60, Rhamnose, Sodium Citrate, Sodium Hydroxide, Sodium Lauroyl Lactylate, Sorbitan Isostearate, Sucrose Stearate, Tocopherol (Vitamin E), Water/Aqua/Eau, Xanthan Gum, Xylitol (Derived From Birch Trees Or Corn), Zinc Gluconate",https://cdn1.skinsafeproducts.com/photo/15B1192BC0EDAE/large_1595475471.jpeg?1595475471,https://www.skinsafeproducts.com/bioderma-atoderm-intensive-balm
601-800.csv,Bioderma Atoderm Cream,Bioderma,Body,Creams,"Acrylates/C10-30 Alkyl Acrylate Crosspolymer, Anhydroxylitol, Caprylic/Capric Triglyceride, Caprylyl Glycol, Cetearyl Isononanoate, Cetyl Alcohol, Cyclohexasiloxane, Cyclopentasiloxane, Disodium Edta, Fructooligosaccharides, Glucose, Glycerin (Plant Derived), Glyceryl Stearate, Laminaria Ochroleuca Extract, Mannitol, Mineral Oil, Myreth-3 Myristate, Niacinamide, Palmitic Acid, Peg-100 Stearate, Pentylene Glycol, Rhamnose, Sodium Dehydroacetate, Sodium Hydroxide, Steareth-21, Stearic Acid, Water/Aqua/Eau, Xylitol (Derived From Birch Trees Or Corn), Xylitylglucoside",https://cdn1.skinsafeproducts.com/photo/93A05A152E3F1B/large_1595475277.jpeg?1595475277,https://www.skinsafeproducts.com/bioderma-atoderm-cream
601-800.csv,Bioderma Hydrabio Brume,Bioderma,Skin Care,Skin Treatments,"Calcium Chloride, Citric Acid, Disodium Phosphate, Fructooligosaccharides, Magnesium Sulfate (Epsom Salt), Mannitol, Nitrogen, Potassium Chloride, Potassium Phosphate, Rhamnose, Sodium Bicarbonate, Sodium Chloride, Sodium Citrate, Water/Aqua/Eau, Xylitol (Derived From Birch Trees Or Corn), Zinc Sulfate",https://cdn1.skinsafeproducts.com/photo/B09CBAA54A2E23/large_1595432960.jpeg?1595432960,https://www.skinsafeproducts.com/bioderma-hydrabio-brume
601-800.csv,Bioderma Sensibio AR Cream,Bioderma,Face,Lotions,"1,2-Hexanediol, Acrylates/C10-30 Alkyl Acrylate Crosspolymer, Allantoin, Camellia Sinensis Leaf Extract, Canola Oil, Caprylic/Capric Triglyceride, Caprylyl Glycol, Citric Acid, Disodium Edta, Fructooligosaccharides, Ginkgo Biloba Leaf Extract, Glycerin (Plant Derived), Glycine Soja (Soybean) Seed Extract, Glycol Palmitate, Glycol Stearate, Glycyrrhetinic Acid, Laminaria Ochroleuca Extract, Mannitol, Mineral Oil, Peg-2 Stearate, Pentylene Glycol, Propylene Glycol (1,2-Propanediol), Rhamnose, Sodium Hydroxide, Triceteareth-4 Phosphate, Tridecyl Trimellitate, Water/Aqua/Eau, Xanthan Gum, Xylitol (Derived From Birch Trees Or Corn)",https://cdn1.skinsafeproducts.com/photo/D13910F46F4E53/large_1595185548.pngpng?1595185548,https://www.skinsafeproducts.com/bioderma-sensibio-ar-cream
