File,product_name,brand,usage_type,category,ingredients,image_url,product_url
801-1000.csv,"Bioderma Hydrabio Mist, 10 fl oz",Bioderma,Face,Mists,"Aqua/Water/Eau, Calcium Chloride, Citric Acid, Disodium Phosphate, Fructooligosaccharides, Magnesium Sulfate, Mannitol, Nitrogen, Potassium Chloride, Potassium Phosphate, Rhamnose, Sodium Bicarbonate, Sodium Chloride, Sodium Citrate, Xylitol, Zinc Sulfate",https://cdn1.skinsafeproducts.com/photo/0045D50910EFCE/large_1570147492.jpeg?1570147492,https://www.skinsafeproducts.com/bioderma-hydrabio-mist-10-fl-oz
801-1000.csv,"Bioderma Atoderm Intensive Baume Ultra-Soothing Balm, 75ml",Bioderma,Face,Balms,"1,2-Hexanediol, Acrylates/C10-30 Alkyl Acrylate Crosspolymer, Behenyl Alcohol, Beta Sitosterol, Canola Oil, Caprylyl Glycol, Carbomer, Ceramide Ap, Ceramide Eop, Ceramide Np, Cholesterol, Citric Acid, Disodium Edta, Ethylhexylglycerin, Glycerin, Helianthus Annuus (Sunflower) Seed Oil, Hydroxyethyl Acrylate/Sodium Acryloyldimethyl Taurate Copolymer, Mannitol, Mineral Oil, Palmitamide Mea, Pentylene Glycol, Phytosphingosine, Polysorbate 60, Rhamnose, Sodium Hydroxide, Sodium Lauroyl Lactylate, Sorbitan Isostearate, Sucrose Stearate, Tocopherol (Multisource), Water\Aqua\Eau, Xanthan Gum, Xylitol (Source Unknown), Zinc Gluconate",https://cdn1.skinsafeproducts.com/photo/8E67787377DCC4/large_1531988745.jpeg?1531988745,https://www.skinsafeproducts.com/bioderma-atoderm-intensive-baume-ultra-soothing-balm-75ml
801-1000.csv,"Bioderma Atoderm Creme, For Dry to Very Dry Sensitive Skin, 500 mL",Bioderma,Body,Creams,"Acrylates/C10-30 Alkyl Acrylate Crosspolymer, Anhydroxylitol, Caprylic/Capric Triglyceride, Caprylyl Glycol, Cetearyl Isononanoate, Cetyl Alcohol, Chlorphenesin, Cyclohexasiloxane, Cyclopentasiloxane, Disodium Edta, Fructooligosaccharides, Glucose, Glycerin, Glyceryl Stearate, Laminaria Ochroleuca Extract, Mannitol, Mineral Oil, Myreth-3 Myristate, Niacinamide, Palmitic Acid, Peg-100 Stearate, Pentylene Glycol, Phenoxyethanol, Rhamnose, Sodium Dehydroacetate, Sodium Hydroxide, Steareth-21, Stearic Acid, Tocopheryl Acetate, Triethanolamine, Water\Aqua\Eau, Xylitol (Source Unknown), Xylitylglucoside",https://cdn1.skinsafeproducts.com/photo/OppnnMXwhw1iKgSquVLEmA/large_1475069363.jpeg?1475069363,https://www.skinsafeproducts.com/bioderma-atoderm-creme-for-dry-to-very-dry-sensitive-skin-500-ml
801-1000.csv,"BioDerma Sensibio AR, 1.33 fl oz",Bioderma,Skin Care,Skin Treatments,"1,2-Hexanediol, Acrylates/C10-30 Alkyl Acrylate Crosspolymer, Allantoin, Arachidyl Alcohol, Arachidyl Glucoside, Behenyl Alcohol, C13-14 Isoparaffin, Camellia Sinensis (Green Tea) Leaf Extract, Canola Oil (Huile De Colza), Caprylic/Capric Triglyceride, Caprylyl Glycol, Citric Acid, Dimethicone, Dipalmitoyl Hydroxyproline, Disodium Edta, Fructooligosaccharides, Ginkgo Biloba Leaf Extract, Glycerin, Glyceryl Stearate, Glycine Soja (Soybean) Extract, Glycol Distearate, Glycol Palmitate, Glycol Stearate, Glycyrrhetinic Acid, Laminaria Ochroleuca Extract, Laureth-7, Mannitol, Methylparaben, Mineral Oil, Ozokerite, Peg-100 Stearate, Peg-2 Stearate, Pentylene Glycol, Persea Gratissima (Avocado) Oil Unsaponifiables, Phenoxyethanol, Polyacrylamide, Propylene Glycol (1,2-Propanediol), Rhamnose, Sodium Chondroitin Sulfate, Sodium Hydroxide, Tocopheryl Acetate, Triceteareth-4 Phosphate, Tridecyl Trimellitate, Water\Aqua\Eau, Xanthan Gum, Xylitol (Source Unknown)",https://cdn1.skinsafeproducts.com/photo/bIUFBjGZpiYt2oKij0CHVA/large_1471646579.jpegjpg?1471646579,https://www.skinsafeproducts.com/bioderma-sensibio-ar-1-33-fl-oz
801-1000.csv,Bioderma Sensibio Mask Tube,Bioderma,Skin Treatments,Facial Masks,"1,2-Hexanediol, Acrylates/C10-30 Alkyl Acrylate Crosspolymer, Alumina, Caprylic/Capric Triglyceride, Caprylyl Glycol, Cetearyl Isononanoate, Disodium Edta, Fructooligosaccharides, Glycerin, Glycol Palmitate, Glycol Stearate, Glycyrrhetinic Acid, Isohexadecane, Laminaria Ochroleuca Extract, Mannitol, Peg-2 Stearate, Pentylene Glycol, Rhamnose, Sodium Hydroxide, Stearic Acid, Titanium Dioxide, Triceteareth-4 Phosphate, Water\Aqua\Eau, Xanthan Gum, Xylitol (Source Unknown)",https://cdn1.skinsafeproducts.com/photo/OchAmdoPvOKC64jwt-hYdA/large_1464495965.jpeg?1464495965,https://www.skinsafeproducts.com/bioderma-sensibio-mask-tube
