File,product_name,brand,usage_type,category,ingredients,image_url,product_url
601-800.csv,"Bioderma ABCDerm Cold-Cream Nourishing Cream, 1.5 fl oz/45 mL",Bioderma,Face,Creams,"1,2-Hexanediol, Acrylates/C10-30 Alkyl Acrylate Crosspolymer, Aqua/Water/Eau, Behenyl Alcohol, Caprylyl Glycol, Cera Alba/Beeswax/Cire D'Abeille, Dicaprylyl Carbonate, Fragrance (Parfum), Glycerin, Paraffinum Liquidum/Mineral Oil/Huile Minerale, Pentylene Glycol, Prunus Amygdalus Dulcis (Sweet Almond) Oil, Sodium Citrate, Sodium Hydroxide, Sucrose Stearate, Sucrose Tetrastearate Triacetate, Tocopherol, Xantham Gum",https://cdn1.skinsafeproducts.com/photo/3A51A7F9511975/large_1690199756.pngpng?1690199756,https://www.skinsafeproducts.com/bioderma-abcderm-cold-cream-nourishing-cream-1-5-fl-oz-45-ml
801-1000.csv,Bioderma Sensibio H2O,Bioderma,Facial Cleansers,Micellar Water,"Cetrimonium Bromide, Cucumis Sativus (Cucumber) Fruit Extract, Disodium Edta, Fructooligosaccharides, Mannitol, Peg-6 Caprylic/Capric Glycerides, Propylene Glycol (1,2-Propanediol), Rhamnose, Water/Aqua/Eau, Xylitol (Derived From Birch Trees Or Corn)",https://cdn1.skinsafeproducts.com/photo/3718EBC7B1446C/large_1609284301.jpeg?1609284301,https://www.skinsafeproducts.com/bioderma-sensibio-h2o-0
801-1000.csv,Bioderma Hydrabio Cream,Bioderma,Face,Creams,"Acrylates/C10-30 Alkyl Acrylate Crosspolymer, Arachidyl Alcohol, Arachidyl Glucoside, Behenyl Alcohol, Brassica Campestris (Rapeseed) Sterols, Cetyl Palmitate, Cyclopentasiloxane, Dimethicone, Dimethicone/Vinyl Dimethicone Crosspolymer, Disodium Edta, Fragrance (Parfum), Glycerin (Plant Derived), Glyceryl Behenate, Glyceryl Dibehenate, Hdi/Trimethylol Hexyllactone Crosspolymer, Helianthus Annuus (Sunflower) Seed Oil, Hexyldecanol, Hydrogenated Polydecene, Hydroxyethyl Acrylate/Sodium Acryloyldimethyl Taurate Copolymer, Isododecane, Mannitol, Niacinamide, Pentylene Glycol, Polymethylsilsesquioxane, Polysorbate-60, Propanediol, Propylene Glycol Dicaprylate/Dicaprate, Pyrus Malus (Apple) Seed Extract, Rhamnose, Salicylic Acid, Sodium Hyaluronate, Sodium Hydroxide, Squalane, Tocopherol (Vitamin E), Tocopheryl Acetate, Tribehenin, Tridecyl Trimellitate, Water/Aqua/Eau, Xylitol (Derived From Birch Trees Or Corn)",https://cdn1.skinsafeproducts.com/photo/568E1081466452/large_1609276197.jpeg?1609276197,https://www.skinsafeproducts.com/bioderma-hydrabio-cream
801-1000.csv,Bioderma Hydrabio Gel Cream,Bioderma,Face,Creams,"Ammonium Acryloyldimethyltaurate/Vp Copolymer, Brassica Campestris (Rapeseed) Sterols, C12-20 Alkyl Glucoside, C14-22 Alcohols, C30-45 Alkyl Cetearyl Dimethicone Crosspolymer, Carbomer, Cyclopentasiloxane, Dipropylene Glycol, Disodium Edta, Fragrance (Parfum), Glycerin (Plant Derived), Hdi/Trimethylol Hexyllactone Crosspolymer, Hexyldecanol, Isododecane, Malachite Extract, Mannitol, Niacinamide, Peg/Ppg-18/18 Dimethicone, Pentylene Glycol, Polymethylsilsesquioxane, Pyrus Malus (Apple) Seed Extract, Rhamnose, Salicylic Acid, Sodium Hydroxide, Squalane, Steareth-21, Tocopherol (Vitamin E), Tocopheryl Acetate, Water/Aqua/Eau, Xylitol (Derived From Birch Trees Or Corn)",https://cdn1.skinsafeproducts.com/photo/171009EBC8E1B4/large_1609268013.jpeg?1609268013,https://www.skinsafeproducts.com/bioderma-hydrabio-gel-cream
801-1000.csv,Bioderma Atoderm Hand & Nail Cream,Bioderma,Hand,Creams,"1,2-Hexanediol, Aluminum Starch Octenylsuccinate, Ammonium Acryloyldimethyltaurate/Vp Copolymer, Butyrospermum Parkii (Shea) Butter, Caprylyl Glycol, Disodium Edta, Fragrance (Parfum), Glycerin (Plant Derived), Isononyl Isononanoate, Mannitol, Niacinamide, Palmitic Acid, Pentylene Glycol, Polyquaternium-51, Rhamnose, Sodium Hydroxide, Sorbitan Stearate, Stearic Acid, Water/Aqua/Eau, Xylitol (Derived From Birch Trees Or Corn)",https://cdn1.skinsafeproducts.com/photo/9D2E41E46653E2/large_1609267093.pngpng?1609267093,https://www.skinsafeproducts.com/bioderma-atoderm-hand-nail-cream
801-1000.csv,Bioderma Sensibio Tonic Lotion,Bioderma,Moisturizers,Face,"Allantoin, Cetrimonium Bromide, Citric Acid, Cucumis Sativus (Cucumber) Fruit Extract, Disodium Edta, Fructooligosaccharides, Glycerin (Plant Derived), Mannitol, Peg-40 Hydrogenated Castor Oil, Polysorbate 20, Propylene Glycol (1,2-Propanediol), Rhamnose, Sodium Hydroxide, Water/Aqua/Eau, Xylitol (Derived From Birch Trees Or Corn)",https://cdn1.skinsafeproducts.com/photo/25F99DEC6BF1C7/large_1609266722.jpeg?1609266722,https://www.skinsafeproducts.com/bioderma-sensibio-tonic-lotion
801-1000.csv,Bioderma Sebium Lotion,Bioderma,Face,Lotions,"Butylene Glycol, Capryloyl Glycine, Fomes Officinalis (Mushroom) Extract, Fragrance (Parfum), Fructooligosaccharides, Glycerin (Plant Derived), Mannitol, Peg-11 Methyl Ether Dimethicone, Peg-40 Hydrogenated Castor Oil, Phenoxyethanol, Polysorbate 20, Propyl Gallate, Pyridoxine Hydrochloride, Rhamnose, Salicylic Acid, Sodium Citrate, Sodium Hydroxide, Sodium Metabisulfite, Water/Aqua/Eau, Xylitol (Derived From Birch Trees Or Corn), Zinc Gluconate",https://cdn1.skinsafeproducts.com/photo/D684A5F638FB2D/large_1608590762.jpeg?1608590762,https://www.skinsafeproducts.com/bioderma-sebium-lotion
801-1000.csv,Bioderma Hydrabio Serum,Bioderma,Skin Treatments,Serums,"Brassica Campestris (Rapeseed) Sterols, Caprylic/Capric Triglyceride, Chlorphenesin, Cyclopentasiloxane, Dimethicone, Disodium Edta, Fragrance (Parfum), Fructooligosaccharides, Glycerin (Plant Derived), Hexyldecanol, Laminaria Ochroleuca Extract, Mannitol, Niacinamide, Peg/Ppg-18/18 Dimethicone, Phenoxyethanol, Pyrus Malus (Apple) Seed Extract, Rhamnose, Sodium Hyaluronate, Sodium Polyacrylate, Tocopherol (Vitamin E), Trideceth-6, Water/Aqua/Eau, Xylitol (Derived From Birch Trees Or Corn)",https://cdn1.skinsafeproducts.com/photo/8FBB25ED3422AF/large_1608590555.jpeg?1608590555,https://www.skinsafeproducts.com/bioderma-hydrabio-serum
801-1000.csv,Bioderma Sebium Pore Refiner Cream,Bioderma,Face,Creams,"1,2-Hexanediol, Butylene Glycol, C30-45 Alkyl Cetearyl Dimethicone Crosspolymer, Caprylic/Capric Triglyceride, Caprylyl Glycol, Citric Acid, Cyclohexasiloxane, Cyclopentasiloxane, Dimethicone, Dipropylene Glycol, Disodium Edta, Dodecyl Gallate, Fomes Officinalis (Mushroom) Extract, Fragrance (Parfum), Fructooligosaccharides, Ginkgo Biloba Leaf Extract, Glycerin (Plant Derived), Laminaria Ochroleuca Extract, Lauryl Peg/Ppg-18/18 Methicone, Mannitol, Methyl Methacrylate Crosspolymer, Mineral Oil, Peg/Ppg-18/18 Dimethicone, Pentylene Glycol, Propylene Glycol (1,2-Propanediol), Rhamnose, Salicylic Acid, Silica, Sodium Hydroxide, Sodium Polyacrylate, Trideceth-6, Water/Aqua/Eau, Xylitol (Derived From Birch Trees Or Corn)",https://cdn1.skinsafeproducts.com/photo/7A80E1679FAD6C/large_1608589935.jpeg?1608589935,https://www.skinsafeproducts.com/bioderma-sebium-pore-refiner-cream
801-1000.csv,Bioderma Atoderm Moisturizing Lip Stick,Bioderma,Lip Care,"Lip Balms, Gels, Moisturizers & Oils","Arachidyl Propionate, Beeswax (Cera Alba, Cire D'Abeille), Bht, Butyrospermum Parkii (Shea) Butter, Caprylic/Capric Triglyceride, Ethyl Linoleate, Ethyl Linolenate, Ethyl Oleate, Fragrance, Laminaria Ochroleuca Extract, Lauryl Pca, Lecithin, Microcrystalline Wax\Cera Microcristallina\Cire Microcristalline, Mineral Oil, Octyldodecanol, Paraffin Wax, Retinyl Palmitate, Synthetic Wax, Tocopherol (Vitamin E), Tocopheryl Acetate",https://cdn1.skinsafeproducts.com/photo/7EA8193A4CCE2C/large_1608589758.jpeg?1608589758,https://www.skinsafeproducts.com/bioderma-atoderm-moisturizing-lip-stick
801-1000.csv,Sensibio H2O (3.34 fl oz.),Bioderma,Facial Cleansers,Micellar Water,"Cetrimonium Bromide, Cucumis Sativus (Cucumber) Fruit Extract, Disodium Edta, Fructooligosaccharides, Mannitol, Peg-6 Caprylic/Capric Glycerides, Propylene Glycol (1,2-Propanediol), Rhamnose, Water (Aqua), Xylitol (Source Unknown)",https://cdn1.skinsafeproducts.com/photo/56A0FDE12030B3/large_1560991923.jpeg?1560991923,https://www.skinsafeproducts.com/sensibio-h2o-3-34-fl-oz
801-1000.csv,"Bioderma Sebium H2O Purifying Cleansing Micelle Solution, 16.7 fl oz",Bioderma,Facial Cleansers,Micellar Water,"Cetrimonium Bromide, Citric Acid, Copper Sulfate, Disodium Edta, Fructooligosaccharides, Ginkgo Biloba Extract, Mannitol, Peg-6 Caprylic/Capric Glycerides, Perfume, Propylene Glycol, Rhamnose, Sodium Citrate, Water (Aqua), Xylitol, Zinc Gluconate",https://cdn1.skinsafeproducts.com/photo/A60AE38C649B12/large_1590439704.pngPNG?1590439704,https://www.skinsafeproducts.com/bioderma-sebium-h2o-purifying-cleansing-micelle-solution-16-7-fl-oz
801-1000.csv,Hydrabio H2O (16.7 fl oz.),Bioderma,Facial Cleansers,Facial Washes,"Brassica Campestris (Rapeseed) Sterols, Cetrimonium Bromide, Disodium Edta, Glycerin, Hexyldecanol, Mannitol, Niacinamide, Peg-6 Caprylic/Capric Glycerides, Perfume, Pyrus Malus (Apple) Seed Extract, Rhamnose, Sodium Hydroxide, Tocopherol (Multisource), Water\Aqua\Eau, Xylitol (Source Unknown)",https://cdn1.skinsafeproducts.com/photo/F9A3A4AEB06753/large_1561071790.jpeg?1561071790,https://www.skinsafeproducts.com/hydrabio-h2o-16-7-fl-oz
801-1000.csv,"Bioderma Cicabio Mains Barrier Repairing Balm, 1.7 fl oz/50 mL",Bioderma,Hand,Balms,"1,2-Hexanediol, Acetyl Dipeptide-1 Cetyl Ester, Aqua/Water/Eau, Butylene Glycol, Butyrospermum Parkii (Shea) Butter, Caprylic/Capric Triglyceride, Caprylyl Glycol, Citric Acid, Dipalmitoyl Hydroxyproline, Glycerin, Glyceryl Stearate, Glycol Palmitate, Mannitol, Pentylene Glycol, Polyquaternium-51, Rhamnose, Sodium Citrate, Sodium Hyaluronate, Sodium Polyacrylate, Xylitol",https://cdn1.skinsafeproducts.com/photo/79D6CF6332FB45/large_1722376855.jpeg?1722376855,https://www.skinsafeproducts.com/bioderma-cicabio-mains-barrier-repairing-balm-1-7-fl-oz-50-ml
801-1000.csv,"Bioderma Atoderm Ultra Moisturising Cream, 16.9 fl oz/500 mL",Bioderma,Body,Creams,"Acrylates/C10-30 Alkyl Acrylate Crosspolymer, Anhydroxylitol, Aqua/Water/Eau, Caprylic/Capric Triglyceride, Caprylyl Glycol, Cetearyl Isononanoate, Cetyl Alcohol, Cyclohexasiloxane, Cyclopentasiloxane, Disodium Edta, Fructooligosaccharides, Glucose, Glycerin, Glyceryl Stearate, Laminaria Ochroleuca Extract, Mannitol, Myreth-3 Myristate, Niacinamide, Palmitic Acid, Paraffinum Liquidum / Mineral Oil / Huile Minerale, Peg-100 Stearate, Pentylene Glycol, Rhamnose, Sodium Dehydroacetate, Sodium Hydroxide, Steareth-21, Stearic Acid, Xylitol, Xylitylglucoside",https://cdn1.skinsafeproducts.com/photo/5F6277B2C3D78C/large_1669436347.pngpng?1669436347,https://www.skinsafeproducts.com/bioderma-atoderm-ultra-moisturising-cream-16-9-fl-oz-500-ml
801-1000.csv,Bioderma Sensibio Light Cream,Bioderma,Body,Creams,"1,2-Hexanediol, Acrylates/C10-30 Alkyl Acrylate Crosspolymer, Caprylic/Capric Triglyceride, Caprylyl Glycol, Cetearyl Isononanoate, Disodium Edta, Fructooligosaccharides, Glycerin, Glycol Palmitate, Glycol Stearate, Glycyrrhetinic Acid, Isohexadecane, Laminaria Ochroleuca Extract, Mannitol, Peg-2 Stearate, Pentylene Glycol, Rhamnose, Sodium Hydroxide, Triceteareth-4 Phosphate, Water\Aqua\Eau, Xanthan Gum, Xylitol (Source Unknown)",https://cdn1.skinsafeproducts.com/photo/747EF97DA8C418/large_1595874926.jpeg?1595874926,https://www.skinsafeproducts.com/bioderma-sensibio-light-cream-1-33-fl-oz
801-1000.csv,"Bioderma Atoderm PP Ultra-Nourishing Balm, 200 mL",Bioderma,Body,"Balms, Ointments & Salves","1,2-Hexanediol, Acrylates/C10-30 Alkyl Acrylate Crosspolymer, Ammonium Acryloyldimethyltaurate/Vp Copolymer, Caprylic/Capric Triglyceride, Caprylyl Glycol, Dimethicone, Disodium Edta, Ethylhexyl Stearate, Fructooligosaccharides, Glycerin, Glyceryl Behenate, Glyceryl Dibehenate, Laminaria Ochroleuca Extract, Mannitol, Mineral Oil, Niacinamide, Oleyl Alcohol, Pentylene Glycol, Peumus Boldus Leaf Extract, Rhamnose, Sodium Hydroxide, Sucrose Stearate, Tribehenin, Water\Aqua\Eau, Xanthan Gum, Xylitol (Source Unknown), Zanthoxylum Bungeanum Fruit Extract",https://cdn1.skinsafeproducts.com/photo/zNNzwhmRpZfzNf2YQJk6ug/large_1472423183.jpeg?1472423183,https://www.skinsafeproducts.com/bioderma-atoderm-pp-ultra-nourishing-balm-200-ml
801-1000.csv,"Bioderma Pigmentbio Foaming Face Cream, 6.7 fl oz/200 mL",Bioderma,Facial Cleansers,Facial Foaming Cleansers,"Acrylates/C10-30 Alkyl Acrylate Crosspolymer, Acrylates/Vinyl Isodecanoate Crosspolymer, Andrographis Paniculata Leaf Extract, Aqua/Water/Eau, Azelaic Acid, Benzoic Acid, Butyrospermum Parkii (Shea) Oil, Caprylic/Capric Triglyceride, Cellulose Acetate, Citric Acid, Coco-Glucoside, Fragrance (Parfum), Fructooligosaccharides, Glyceryl Oleate, Helianthus Annuus (Sunflower) Seed Oil, Hydrogenated Palm Glycerides Citrate, Laminaria Ochroleuca Extract, Lysine, Magnesium Laureth Sulfate, Mannitol, Methylpropanediol, Propanediol, Rhamnose, Sodium Citrate, Sodium Cocoamphoacetate, Sodium Cocoyl Glutamate, Sodium Hydroxide, Tocopherol, Xanthan Gum, Xylitol",https://cdn1.skinsafeproducts.com/photo/9FF6F7DF6BAE31/large_1678049157.jpeg?1678049157,https://www.skinsafeproducts.com/bioderma-pigmentbio-foaming-face-cream-6-7-fl-oz-200-ml
801-1000.csv,"Bioderma Sebium Mat Control Moisturiser Cream, 1 fl oz/30 mL",Bioderma,Face,Creams,"Aqua/Water/Eau, Butylene Glycol, C30-45 Alkyl Cetearyl Dimethicone Crosspolymer, Cyclohexasiloxane, Cyclopentasiloxane, Dipropylene Glycol, Disodium Edta, Dodecyl Gallate, Fomes Officinalis (Mushroom) Extract, Fragrance (Parfum), Glycerin, Hdi/ Trimethylol Hexyllactone Crosspolymer, Mannitol, Methyl Methacrylate Crosspolymer, Peg-10 Dimethicone, Peg-40 Hydrogenated Castor Oil, Phenoxyethanol, Polymethylsilsesquioxane, Pyridoxine Hcl, Rhamnose, Salicylic Acid, Sodium Chloride, Sodium Hydroxide, Vinyl Dimethicone/Methicone Silsesquioxane Crosspolymer, Xanthan Gum, Xylitol, Zinc Gluconate",https://cdn1.skinsafeproducts.com/photo/82821B1E29FDC1/large_1621945762.jpeg?1621945762,https://www.skinsafeproducts.com/bioderma-sebium-mat-control-moisturiser-cream-1-fl-oz-30-ml
801-1000.csv,Bioderma Hydrabio Moisturizing Cleansing & Makeup Removing Milk,Bioderma,Facial Cleansers,Facial Cleansing Milks,"Acrylates/C10-30 Alkyl Acrylate Crosspolymer, Aqua/Water/Eau, Brassica Campestris (Rapeseed) Sterols, Caprylic/Capric Triglyceride, Cetearyl Isononanoate, Disodium Edta, Ethylhexylglycerin, Fragrance, Fructooligosaccharides, Glycerin, Hexyldecanol, Hydroxyethyl Acrylate/Sodium Acryloyldimethyl Taurate Copolymer, Laminaria Ochroleuca Extract, Mannitol, Niacinamide, Paraffinum Liquidum/Mineral Oil/Huile Minerale, Phenoxyethanol, Polysorbate 60, Pyrus Malus (Apple) Seed Extract, Rhamnose, Sodium Hydroxide, Sorbitan Isostearate, Squalane, Tocopherol, Xylitol",https://cdn1.skinsafeproducts.com/photo/2343C29D95C1A3/large_1602358348.jpeg?1602358348,https://www.skinsafeproducts.com/bioderma-hydrabio-moisturizing-cleansing-makeup-removing-milk
801-1000.csv,"Bioderma Ultra Soothing Foaming Gel, 16.7 fl oz/500 mL",Bioderma,Cleansers,Foaming Cleansers,"Aqua/Water/Eau, Caprylyl Glycol, Citric Acid, Copper Sulfate, Disodium Edta, Fructooligosaccharides, Lauryl Glucoside, Mannitol, Niacinamide, Peg-200 Hydrogenated Glyceryl Palmate, Peg-7 Glyceryl Cocoate, Polysorbate 20, Rhamnose, Sodium Chloride, Sodium Hydroxide, Sodium Laureth Sulfate, Xylitol, Zinc Sulfate",https://cdn1.skinsafeproducts.com/photo/D4BF6B991B4760/large_1611516847.jpeg?1611516847,https://www.skinsafeproducts.com/bioderma-ultra-soothing-foaming-gel-16-7-fl-oz-500-ml
801-1000.csv,"Bioderma Sensibio Forte Cream, 1.3 fl oz/40 mL",Bioderma,Face,Butters,"1,2-Hexanediol, Allantoin, Aqua/Water/Eau, Beeswax (Cera Alba), Caprylic/Capric Triglyceride, Caprylyl Glycol, Carbomer, Cetyl Alcohol, Fructooligosaccharides, Glyceryl Stearate, Glycyrrhetinic Acid, Laminaria Ochroleuca Extract, Mannitol, Mineral Oil (Paraffinum Liquidum), Palmitic Acid, Pentylene Glycol, Propylene Glycol (1,2-Propanediol), Rhamnose, Sodium Pca, Sorbitan Sesquioleate, Stearic Acid, Tocopheryl Acetate, Triethanolamine, Xylitol",https://cdn1.skinsafeproducts.com/photo/B95CF2B56B6E44/large_1705907365.pngpng?1705907365,https://www.skinsafeproducts.com/bioderma-sensibio-forte-cream-1-3-fl-oz-40-ml
801-1000.csv,"Bioderma Atoderm Ultra Cream, 6.7 fl oz/200 mL",Bioderma,Body,Lotions,"Acrylates/C10-30 Alkyl Acrylate Crosspolymer, Anhydroxylitol, Aqua/Water/Eau, Caprylic/Capric Triglyceride, Caprylyl Glycol, Cetearyl Isononanoate, Cetyl Alcohol, Cyclohexasiloxane, Cyclopentasiloxane, Disodium Edta, Fructooligosaccharides, Glucose, Glycerin, Glyceryl Stearate, Laminaria Ochroleuca Extract, Mannitol, Myreth-3 Myristate, Niacinamide, Palmitic Acid, Paraffinum Liquidum / Mineral Oil / Huile Minerale, Peg-100 Stearate, Pentylene Glycol, Rhamnose, Sodium Dehydroacetate, Sodium Hydroxide, Steareth-21, Stearic Acid, Xylitol, Xylitylglucoside",https://cdn1.skinsafeproducts.com/photo/DE2F51DC960184/large_1696437826.jpeg?1696437826,https://www.skinsafeproducts.com/bioderma-atoderm-ultra-cream-6-7-fl-oz-200-ml
801-1000.csv,"Bioderma Photoderm Fluid Max Moisturizing Texture Reinforced Cellular Protection, Claire Light, 1.3 fl oz/40 mL",Bioderma,Moisturizers,Face,"1,2-Hexanediol, Aqua/Water/Eau, Bis-Ethylhexyloxyphenol Methoxyphenyl Triazine, C20-22 Alcohols, C20-22 Alkyl Phosphate, Caprylic/Capric Triglyceride, Caprylyl Glycol, Citric Acid, Dibutyl Adipate, Diethylamino Hydroxybenzoyl Hexyl Benzoate, Diisopropyl Sebacate, Ectoin, Ethylhexyl Salicylate, Ethylhexyl Triazone, Fructooligosaccharides, Glycine Soja (Soybean) Oil, Homosalate, Hydroxyethyl Acrylate/Sodium Acryloyldimethyl Taurate Copolymer, Iron Oxides (Ci 77492), Laminaria Ochroleuca Extract, Mannitol, Peg-8 Laurate, Pentylene Glycol, Polysorbate 60, Propylene Glycol (1,2-Propanediol), Rhamnose, Silica, Sodium Citrate, Sodium Hydroxide, Sodium Stearoyl Glutamate, Sorbitan Isostearate, Styrene/Acrylates Copolymer, Sucrose Laurate, Titanium Dioxide (Ci 77891), Tocopherol, Xanthan Gum, Xylitol",https://cdn1.skinsafeproducts.com/photo/17AB805C3862CD/large_1703585973.pngpng?1703585973,https://www.skinsafeproducts.com/bioderma-photoderm-fluid-max-moisturizing-texture-reinforced-cellular-protection-claire-light-1-3-fl-oz-40-ml
801-1000.csv,"Bioderma Sensibio Gel Moussant Smooth Micellar Clansing Foaming Gel, 1.5 fl oz/45 mL",Bioderma,Cleansers,Foaming Cleansers,"Aqua/Water/Eau, Ascorbyl Palmitate, Citric Acid, Coco-Glucoside, Fructooligosaccharides, Glyceryl Oleate, Hydrogenated Palm Glycerides Citrate, Laureth-2, Lecithin, Mannitol, Peg-90 Glyceryl Isostearate, Propanediol, Rhamnose, Sodium Citrate, Sodium Cocoamphoacetate, Sodium Lauroyl Sarcosinate, Tocopherol, Xylitol",https://cdn1.skinsafeproducts.com/photo/4F5F1D79E06EB4/large_1692182378.pngpng?1692182378,https://www.skinsafeproducts.com/bioderma-sensibio-gel-moussant-smooth-micellar-clansing-foaming-gel-1-5-fl-oz-45-ml
801-1000.csv,"Bioderma Atoderm Ultra-Rich Soap, 5.2 oz/150 g",Bioderma,Cleansers,Bar Soaps,"Aqua/Water/Eau, Butyrospermum Parkii (Shea) Oil, Fructooligosaccharides, Glycerin, Mannitol, Niacinamide, Polysorbate 20, Rhamnose, Sodium Chloride, Sodium Palm Kernelate, Sodium Palmate, Tetrasodium Edta, Tetrasodium Etidronate, Xylitol, Zinc Sulfate",https://cdn1.skinsafeproducts.com/photo/DB517AE7F944FB/large_1688545322.pngpng?1688545322,https://www.skinsafeproducts.com/bioderma-atoderm-ultra-rich-soap-intensive-pain-5-2-oz-150-g
801-1000.csv,"Bioderma Ultra-Nourishing Cream, Fragrance Free, 16.7 fl oz/500 mL",Bioderma,Body,Creams,"1,2 Hexanediol, Acrylates/C10-30 Alkyl Acrylate Crosspolymer, Anhydroxylitol, Aqua/Water/Eau, Brassica Campestris (Rapeseed) Seed Oil, Caprylic/Capric Triglyceride, Caprylyl Glycol, Cetearyl Alcohol, Cetearyl Glucoside, Fructooligosaccharides, Glucose, Glycerin, Helianthus Annuus (Sunflower) Seed Oil, Laminaria Ochroleuca Extract, Mannitol, Niacinamide, Paraffinum Liquidum/Mineral Oil/Huile Minerale, Pentylene Glycol, Rhamnose, Sodium Citrate, Sodium Polyacrylate, Tocopherol, Xylitol, Xylitylglucoside",https://cdn1.skinsafeproducts.com/photo/84032F83295296/large_1683781676.pngpng?1683781676,https://www.skinsafeproducts.com/bioderma-ultra-nourishing-cream-fragrance-free-16-7-fl-oz-500-ml
801-1000.csv,"Bioderma Sensibio DS+ Cleansing Gel, 6.7 fl oz/200 mL",Bioderma,Facial Cleansers,Facial Gels,"Ammonium Glycyrrhizate, Aqua/Water/Eau, Caprylic/Capric Triglyceride, Capryloyl Glycine, Citric Acid, Coco-Glucoside, Cocobetaine, Decylene Glycol, Disodium Edta, Fructooligosaccharides, Glyceryl Oleate, Laminaria Ochroleuca Extract, Laureth-2, Lysine Azelate, Mannitol, Peg-90 Glyceryl Isostearate, Pyridoxine Hcl, Rhamnose, Sodium Chloride, Sodium Hydroxide, Sodium Laureth Sulfate, Sodium Lauroyl Sarcosinate, Undecyl Alcohol, Xylitol, Zinc Gluconate",https://cdn1.skinsafeproducts.com/photo/0E2B87B1AB9D71/large_1654323279.jpeg?1654323279,https://www.skinsafeproducts.com/bioderma-soothing-purifying-face-and-body-cleansing-gel-6-7-fl-oz-200-ml
801-1000.csv,"Bioderma Atoderm Nutritive Nourishing Cream, Dry To Very Dry Sensitive Skin, 1.3 fl oz/40 ml",Bioderma,Face,Creams,"1,2-Hexanediol, Acrylates/C10-30 Alkyl Acrylate Crosspolymer, Aqua/Water/Eau, Ascorbyl Palmitate, Bht, Butyrospermum Parkii (Shea) Butter, Caprylic/Capric Triglyceride, Caprylyl Glycol, Cera Microcristallina/Microcrystalline Wax/Cire Microcristalline, Cetearyl Alcohol, Cetearyl Glucoside, Cetyl Palmitate, Citric Acid, Disodium Edta, Fructooligosaccharides, Glycerin, Glyceryl Polyacrylate, Glyceryl Stearate, Glycine Soja (Soybean) Oil, Glycine Soja (Soybean) Sterols, Hexyl Laurate, Hydrogenated Palm Glycerides Citrate, Hydroxyethyl Acrylate/Sodium Acryloyldimethyl Taurate Copolymer, Laminaria Ochroleuca Extract, Mannitol, Paraffin, Paraffinum Liquidum/Mineral Oil/Huile Minerale, Peg-100 Stearate, Pentylene Glycol, Persea Gratissima (Avocado) Oil, Polysorbate 60, Rhamnose, Sodium Hydroxide, Sorbitan Isostearate, Squalane, Tocopherol, Xylitol",https://cdn1.skinsafeproducts.com/photo/BF845B96D7E046/large_1641851132.jpeg?1641851132,https://www.skinsafeproducts.com/bioderma-atoderm-nutritive-nourishing-cream-dry-to-very-dry-sensitive-skin-1-3-fl-oz-40-ml
801-1000.csv,"Bioderma Atoderm Intensive Baume, 16.7 fl oz/500 mL",Bioderma,Body,Lotions,"1,2 Hexanediol, Acrylates/C10-30 Alkyl Acrylate Crosspolymer, Behenyl Alcohol, Beta-Sitosterol, Canola Oil, Caprylyl Glycol, Carbomer, Ceramide Ap, Ceramide Eop, Ceramide Np, Cholesterol, Citric Acid, Disodium Edta, Ethylhexylglycerin, Glycerin, Helianthus Annuus (Sunflower) Seed Oil, Hydroxyethyl Acrylate/Sodium Acryloyldimethyl Taurate Copolymer, Mannitol, Palmitamide Mea, Paraffinum Liquidum/Mineral Oil/Huile Minerale, Pentylene Glycol, Phytosphingosine, Polysorbate 60, Rhamnose, Sodium Hydroxide, Sodium Lauroyl Lactylate, Sorbitan Isostearate, Sucrose Stearate, Tocopheryl Acetate (Vitamin E), Water, Xanthan Gum, Xylitol, Zinc Gluconate",https://cdn1.skinsafeproducts.com/photo/6271BC21E77798/large_1631518089.pngpng?1631518089,https://www.skinsafeproducts.com/bioderma-atoderm-intensive-baume-16-7-fl-oz-500-ml
801-1000.csv,"Bioderma Atoderm Intensive Ultra-Soothing Balm, 6.67 fl oz/200 mL",Bioderma,Body,"Balms, Ointments & Salves","1,2-Hexanediol, Acrylates/C10-30 Alkyl Acrylate Crosspolymer, Aqua/Water/Eau, Behenyl Alcohol, Beta-Sitosterol, Canola Oil (Huile De Colza), Caprylyl Glycol, Carbomer, Ceramide Ap, Ceramide Eop, Ceramide Np, Cholesterol, Citric Acid, Disodium Edta, Ethylhexylglycerin, Glycerin, Helianthus Annuus (Sunflower) Seed Oil, Hydroxyethyl Acrylate/Sodium Acryloyldimethyl Taurate Copolymer, Mannitol, Palmitamide Mea, Paraffinum Liquidum/Mineral Oil/Huile Minerale, Pentylene Glycol, Phytosphingosine, Polysorbate 60, Rhamnose, Sodium Hydroxide, Sodium Lauroyl Lactylate, Sorbitan Isostearate, Sucrose Stearate, Tocopherol, Xanthan Gum, Xylitol, Zinc Gluconate",https://cdn1.skinsafeproducts.com/photo/CF90CBD04825EF/large_1628142137.pngpng?1628142137,https://www.skinsafeproducts.com/bioderma-atoderm-intensive-ultra-soothing-balm-6-67-fl-oz-200-ml
801-1000.csv,"Bioderma Atoderm Intensive Eye, 3.4 fl oz/100 ml",Bioderma,Eyes,"Eye Cream, Gel, Oils, & Serum","1,2-Hexanediol, Aqua/Water/Eau, Brassica Campestris (Rapeseed) Seed Oil, Caprylic/Capric Triglyceride, Carbomer, Ceramide Ap, Ceramide Eop, Ceramide Np, Cholesterol, Citric Acid, Dipropylene Glycol, Ethylhexylglycerin, Fructooligosaccharides, Glycerin, Glycyrrhetinic Acid, Helianthus Annuus (Sunflower) Seed Oil, Hydroxyethyl Acrylate/ Sodium Acryloyldimethyl Taurate Copolymer, Laminaria Ochroleuca Extract, Mannitol, Paraffinum Liquidum/Mineral Oil/Huile Minerale, Pentylene Glycol, Phytosphingosine, Polysorbate 60, Rhamnose, Sodium Citrate, Sodium Hyaluronate, Sodium Lauroyl Lactylate, Sorbitan Isostearate, Sucrose Stearate, Tocopherol, Xanthan Gum, Xylitol",https://cdn1.skinsafeproducts.com/photo/47C60637F6454B/large_1618402176.jpegjpg?1618402176,https://www.skinsafeproducts.com/bioderma-atoderm-intensive-eye-3-4-fl-oz-100-ml
801-1000.csv,"Bioderma Cicabio Creme, Soothing Repairing Cream, 1.33 fl oz",Bioderma,Moisturizers,Body,"Acetyl Dipeptide-1 Cetyl Ester, Aqua/Water, Asiatic Acid, Asiaticoside, Butylene Glycol, C13-14 Isoparaffin, Caprylic/Capric Triglyceride, Copper Sulfate, Ethylhexyl Palmitate, Fructooligosaccharides, Glycerin, Hydroxyethylcellulose, Laminaria Ochroleuca Extract, Laureth-3, Laureth-7, Madecassic Acid, Mannitol, Peg-30 Dipolyhydroxystearate, Polyacrylamide, Potassium Sorbate, Rhamnose, Sodium Hyaluronate, Sorbitan Stearate, Vitis Vinifera (Grape) Vine Extract, Xylitol, Zinc Oxide, Zinc Sulfate",https://cdn1.skinsafeproducts.com/photo/7C2BBB371E2598/large_1572537409.jpeg?1572537409,https://www.skinsafeproducts.com/bioderma-cicabio-creme-soothing-repairing-cream-1-33-fl-oz
