File,product_name,brand,usage_type,category,ingredients,image_url,product_url
2001-2200.csv,"Drunk Elephant Slaai Makeup Melting Butter Cleanser and Bamboo Booster, 110 g",Drunk Elephant,Facial Cleansers,Facial Washes,"Actinidia Chinensis (Kiwi) Fruit Extract, Adansonia Digitata Seed Oil, Bambusa Arundinacea Stem Extract, Borago Officinalis Seed Oil, Caprylic/Capric Triglyceride, Carthamus Tinctorius (Safflower) Seed Oil, Charcoal Powder, Citrullus Lanatus (Watermelon) Seed Oil, Ethylhexyl Palmitate, Euterpe Oleracea Fruit Oil, Fragaria Ananassa (Strawberry) Seed Extract, Glycerin, Helianthus Annuus (Sunflower) Seed Wax, Lauryl Laurate, Mannitol, Microcrystalline Cellulose, Polyglyceryl-10 Laurate, Polyglyceryl-2 Caprate, Polyglyceryl-3 Laurate, Polyhydroxystearic Acid, Potassium Sorbate, Prunus Amygdalus Dulcis (Sweet Almond) Oil, Schinziophyton Rautanenii Kernel Oil, Sclerocarya Birrea Seed Oil, Tocopherol, Vaccinium Angustifolium (Blueberry) Fruit Extract, Vaccinium Macrocarpon (Cranberry) Seed Oil, Ximenia Americana Seed Oil, Zea Mays (Corn) Starch",https://cdn1.skinsafeproducts.com/photo/3E6139430B1CBE/large_1593205647.pngPNG?1593205647,https://www.skinsafeproducts.com/drunk-elephant-slaai-makeup-melting-butter-cleanser-and-bamboo-booster-110-g
2001-2200.csv,"Drunk Elephant T.L.C. Framboos Glycolic Night Serum, 1.5 mL/.05 oz",Drunk Elephant,Skin Treatments,Serums,"Aesculus Hippocastanum (Horse Chestnut) Seed Extract, Allantoin, Aloe Barbadensis Leaf Juice, Buddleja Davidii Meristem Cell Culture, Butylene Glycol, Camellia Sinensis Leaf Extract, Caprylyl Glycol, Citric Acid, Disodium Edta, Ethylhexylglycerin, Galactoarabinan, Glycerin, Glycolic Acid, Hexylene Glycol, Hydroxyethylcellulose, Lactic Acid, Opuntia Ficus Indica Extract, Pentylene Glycol, Phenoxyethanol, Potassium Sorbate, Propanediol, Rubus Idaeus (Raspberry) Fruit Extract, Saccharomyces Cerevisiae Extract, Salicylic Acid, Sclerocarya Birrea Seed Oil, Sodium Benzoate, Sodium Hyaluronate Crosspolymer, Sodium Hydroxide, Sodium Nitrate, Vitis Vinifera (Grape) Juice Extract, Water, Xanthan Gum",https://cdn1.skinsafeproducts.com/photo/2849E8B5EAE701/large_1585715197.jpeg?1585715197,https://www.skinsafeproducts.com/drunk-elephant-t-l-c-framboos-glycolic-night-serum-1-5-ml-05-oz
2001-2200.csv,"Drunk Elephant Beste No.9 Jelly Cleanser, 1 fl oz",Drunk Elephant,Facial Cleansers,Facial Washes,"Aloe Barbadensis (Aloe) Leaf Extract, Citric Acid, Cocamidopropyl Hydroxysultaine, Coco-Glucoside, Cocoamidopropyl Betaine (Coconut Derivative), Cucumis Melo Cantalupensis Fruit Extract, Dipotassium Glycyrrhizate, Glycerin, Glycolipids, Lauryl Glucoside, Linoleic Acid, Linolenic Acid, Phenoxyethanol, Polylysine, Propanediol, Sclerocarya Birrea Seed Oil, Sodium Benzoate, Sodium Chloride, Sodium Hydroxide, Sodium Lauroyl Methyl Isethionate, Sodium Methyl Oleoyl Taurate, Tocopherol (Multisource), Water\Aqua\Eau",https://cdn1.skinsafeproducts.com/photo/917F4C5A525B17/large_1556643125.jpegJPG?1556643125,https://www.skinsafeproducts.com/drunk-elephant-beste-no-9-jelly-cleanser-1-fl-oz
2001-2200.csv,"Drunk Elephant D-Bonzi Anti-Pollution Sunshine Serum, 1 fl oz",Drunk Elephant,Skin Treatments,Serums,"Acetyl Tetrapeptide-17, Boron Nitride, Camellia Sinensis (Green Tea) Leaf Extract, Caprylic/Capric Triglyceride, Caprylyl Glycol, Colloidal Platinum, Ethylhexylglycerin, Glutamylamidoethyl Imidazole, Glycerin, Glyceryl Oleate Citrate, Hexylene Glycol, Hydrogenated Polyisobutene, Hydroxyethyl Acrylate/Sodium Acryloyldimethyl Taurate Copolymer, Iron Oxides (Ci 77491, Ci 77492, Ci 77499), Lecithin, Linoleic Acid, Linolenic Acid, Magnolia Officinalis Bark Extract, Maltodextrin, Mica, Pentylene Glycol, Phenoxyethanol, Polysorbate 60, Ribes Nigrum (Black Currant) Seed Oil, Sclerocarya Birrea Seed Oil, Sodium Benzoate, Sodium C14-16 Olefin Sulfonate, Sodium Hyaluronate Crosspolymer, Sorbic Acid, Sorbitan Isostearate, Theobroma Cacao (Cocoa) Extract, Tocopherol (Multisource), Vitis Vinifera (Grape) Seed Extract, Water\Aqua\Eau",https://cdn1.skinsafeproducts.com/photo/33DB64DBE9619F/large_1533926709.pngPNG?1533926709,https://www.skinsafeproducts.com/drunk-elephant-d-bonzi-anti-pollution-sunshine-serum-1-fl-oz
2001-2200.csv,"Drunk Elephant Beste Jelly Cleanser, 5 oz",Drunk Elephant,Cleansers,Facial Cleansers,"Aloe Barbadensis (Aloe) Leaf Extract, Citric Acid, Cocoamidopropyl Betaine (Coconut Derivative), Cucumis Melo Cantalupensis Fruit Extract, Dipotassium Glycyrrhizate, Glycerin, Phenoxyethanol, Propanediol, Sclerocarya Birrea Seed Oil, Sodium Benzoate, Sodium Cocoyl Isethionate, Sodium Lauroyl Methyl Isethionate, Sodium Methyl Oleoyl Taurate, Trisodium Ethylenediamine Disuccinate, Water\Aqua\Eau",https://cdn1.skinsafeproducts.com/photo/0039FE42A11108/large_1501466321.jpegjpg?1501466321,https://www.skinsafeproducts.com/drunk-elephant-beste-jelly-cleanser-5-oz
201-400.csv,"Drunk Elephant B-Hydra Intensive Hydration Serum, 1.69 oz/50 mL",Drunk Elephant,Face,Moisturizing Serums,"Ammonium Acryloyldimethyltaurate/Vp Copolymer, Ananas Sativus (Pineapple) Fruit Extract, Berberis Vulgaris Root Extract, Caprylyl Glycol, Chlorphenesin, Citric Acid, Citrullus Lanatus (Watermelon) Fruit Extract, Coco-Caprylate/Caprate, Coconut Alkanes, Cyclodextrin, Dipotassium Glycyrrhizate, Ethylhexylglycerin, Glycerin, Hydroxyproline, Lens Esculenta (Lentil) Fruit Extract, Niacinamide, Panthenol, Pentylene Glycol, Phenoxyethanol, Pyrus Malus (Apple) Fruit Extract, Sclerocarya Birrea Seed Oil, Sodium Hyaluronate, Sodium Hyaluronate Crosspolymer, Sodium Lactate, Sodium Pca, Trisodium Ethylenediamine Disuccinate, Water/Aqua/Eau, Wheat Amino Acids",https://cdn1.skinsafeproducts.com/photo/DD9E24BC32EB02/large_1751884298.pngpng?1751884298,https://www.skinsafeproducts.com/drunk-elephant-b-hydra-intensive-hydration-serum-1-69-oz-50-ml
201-400.csv,"Drunk Elephant Pekee Cleansing Bar, 4 oz/120 g",Drunk Elephant,Cleansers,Bar Soaps,"Cetearyl Alcohol, Disodium Lauryl Sulfosuccinate, Glycerin, Honey/Mel/Miel, Paraffin, Sclerocarya Birrea Seed Oil, Sodium Coco-Sulfate, Titanium Dioxide (Ci 77891), Triticum Vulgare (Wheat) Starch, Vaccinium Angustifolium (Blueberry) Fruit Extract, Water/Aqua/Eau",https://cdn1.skinsafeproducts.com/photo/C6775A2BA3F531/large_1744782731.pngpng?1744782731,https://www.skinsafeproducts.com/drunk-elephant-pekee-cleansing-bar-4-oz-120-g
201-400.csv,"Drunk Elephant B-Hydra Intensive Hydration Serum, Pine Apple Ceramide + Pro-Vitamin B5, 1.69 fl oz/50 mL",Drunk Elephant,Face,Moisturizing Serums,"Ammonium Acryloyldimethyltaurate/Vp Copolymer, Ananas Sativus (Pineapple) Fruit Extract, Berberis Vulgaris Root Extract, Caprylyl Glycol, Chlorphenesin, Citric Acid, Citrullus Lanatus (Watermelon) Fruit Extract, Coco-Caprylate/Caprate, Coconut Alkanes, Cyclodextrin, Dipotassium Glycyrrhizate, Ethylhexylglycerin, Glycerin, Hydroxyproline, Lens Esculenta (Lentil) Fruit Extract, Niacinamide, Panthenol, Pentylene Glycol, Phenoxyethanol, Pyrus Malus (Apple) Fruit Extract, Sclerocarya Birrea Seed Oil, Sodium Hyaluronate, Sodium Hyaluronate Crosspolymer, Sodium Lactate, Sodium Pca, Trisodium Ethylenediamine Disuccinate, Water/Aqua/Eau, Wheat Amino Acids",https://cdn1.skinsafeproducts.com/photo/647BD5E13787BA/large_1736161106.pngpng?1736161106,https://www.skinsafeproducts.com/drunk-elephant-b-hydra-intensive-hydration-serum-pine-apple-ceramide-pro-vitamin-b5-1-69-fl-oz-50-ml
401-600.csv,"Drunk Elephant The Get- Shit-Done Polypeptide Cream, 0.5 fl oz/15 mL",Drunk Elephant,Face,Creams,"1,2-Hexanediol, Acetyl Glutamine, Alanine, Arginine, Aspartic Acid, Bacillus/Folic Acid Ferment Extract, Butylene Glycol, Caprylyl Glycol, Carbomer, Cetearyl Alcohol, Cetearyl Olivate, Chlorphenesin, Coco-Caprylate/Caprate, Coconut Alkanes, Copper Palmitoyl Heptapeptide-14, Dicaprylyl Carbonate, Glycerin, Glyceryl Caprylate, Glycine, Heptapeptide-15 Palmitate, Histidine, Hydroxyethyl Acrylate/Sodium Acryloyldimethyl Taurate Copolymer, Isoleucine, Isomalt, Lactic Acid/Glycolic Acid Copolymer, Lecithin, Linoleic Acid, Linolenic Acid, Nymphaea Alba Root Extract, Palmitoyl Tetrapeptide-7, Palmitoyl Tripeptide-1, Pca, Phenoxyethanol, Phenylalanine, Phenylpropanol, Polysorbate 20, Polysorbate 60, Polyvinyl Alcohol, Proline, Sclerocarya Birrea Seed Oil, Serine, Sh-Oligopeptide-1, Sh-Oligopeptide-2, Sh-Polypeptide-1, Sh-Polypeptide-11, Sh-Polypeptide-9, Sodium Benzoate, Sodium Hyaluronate, Sodium Lactate, Sodium Pca, Sorbitan Isostearate, Sorbitan Olivate, Symphytum Officinale Callus Culture Extract, Threonine, Tocopherol, Valine, Water/Aqua/Eau, Xanthan Gum",https://cdn1.skinsafeproducts.com/photo/D3521CAD752DA4/large_1708062799.pngpng?1708062799,https://www.skinsafeproducts.com/drunk-elephant-polypeptide-cream-0-5-fl-oz-15-ml
401-600.csv,"Drunk Elephant T.L.C. Framboos Glycolic Resurfacing Night Serum, .16 fl oz/5 mL",Drunk Elephant,Skin Treatments,Serums,"Aesculus Hippocastanum (Horse Chestnut) Seed Extract, Allantoin, Aloe Barbadensis Leaf Juice, Buddleja Davidii Meristem Cell Culture, Butylene Glycol, Camellia Sinensis Leaf Extract, Caprylyl Glycol, Citric Acid, Disodium Phosphate, Ethylhexylglycerin, Galactoarabinan, Glycerin, Glycolic Acid, Hexylene Glycol, Hydroxyethylcellulose, Lactic Acid, Opuntia Ficus-Indica Extract, Pentylene Glycol, Phenoxyethanol, Potassium Sorbate, Propanediol, Rubus Idaeus (Raspberry) Fruit Extract, Saccharomyces Cerevisiae Extract, Salicylic Acid, Sclerocarya Birrea Seed Oil, Sodium Benzoate, Sodium Carbonate, Sodium Chloride, Sodium Hyaluronate Crosspolymer, Sodium Hydroxide, Sodium Phosphate, Tartaric Acid, Tetrasodium Glutamate Diacetate, Vitis Vinifera (Grape) Juice Extract, Water/Aqua/Eau, Xanthan Gum",https://cdn1.skinsafeproducts.com/photo/4C3F47CA754CAE/large_1701851366.pngpng?1701851366,https://www.skinsafeproducts.com/drunk-elephant-t-l-c-framboos-glycolic-resurfacing-night-serum-16-fl-oz-5-ml
401-600.csv,"Drunk Elephant Protini Powerpeptide Resurf Serum, 1 fl oz",Drunk Elephant,Skin Treatments,Serums,"Acetyl Glutamine, Adenosine, Alanine, Arginine, Aspartic Acid, Bacillus/Folic Acid Ferment Filtrate Extract, Borago Officinalis Seed Oil, Butylene Glycol, Camellia Sinensis Seed Oil, Caprylic/Capric Triglyceride, Caprylyl Glycol, Carbomer, Chlorphenesin, Citric Acid, Coco-Caprylate/Caprate, Coconut Alkanes, Copper Palmitoyl Heptapeptide-14, Dextran, Dicaprylyl Carbonate, Ethylhexylglycerin, Glycerin, Glyceryl Caprylate, Glycine, Glycine Max (Soybean) Seed Extract, Glycine Soja (Soybean) Sterols, Heptapeptide-15 Palmitate, Histidine, Hydroxypropyl Cyclodextrin, Isoleucine, Isomalt, Lactic Acid, Lactic Acid/Glycolic Acid Copolymer, Lecithin, Linoleic Acid, Linolenic Acid, Nymphaea Alba Root Extract, Oryza Sativa (Rice) Bran Oil, Palmitoyl Hexapeptide-12, Palmitoyl Tetrapeptide-7, Palmitoyl Tripeptide-1, Palmitoyl Tripeptide-38, Panthenol, Pca, Pentylene Glycol, Phenoxyethanol, Phenylalanine, Phenylpropanol, Phospholipids, Phytosphingosine, Polysorbate 20, Polyvinyl Alcohol, Proline, Propanediol, Pyrus Malus (Apple) Fruit Extract, Sclerocarya Birrea Seed Oil, Serine, Sh-Oligopeptide-1, Sh-Oligopeptide-2, Sh-Polypeptide-1, Sh-Polypeptide-11, Sh-Polypeptide-9, Sodium Benzoate, Sodium Hyaluronate, Sodium Hyaluronate Crosspolymer, Sodium Hydroxide, Sodium Lactate, Sodium Pca, Squalane, Symphytum Officinale Callus Culture Extract, Threonine, Tocopherol, Tocotrienols, Tremella Fuciformis Polysaccharide, Tripeptide-1, Valine, Water/Aqua/Eau, Xanthan Gum",https://cdn1.skinsafeproducts.com/photo/55DD256C7AAE25/large_1620898456.pngpng?1620898456,https://www.skinsafeproducts.com/drunk-elephant-protini-powerpeptide-resurf-serum-1-fl-oz
401-600.csv,"Drunk Elephant Protini Polypeptide Cream, 50 mL/4.69 fl oz",Drunk Elephant,Skin Care,Skin Treatments,"1, 2-Hexanediol, Acetyl Glutamine, Alanine, Arginine, Aspartic Acid, Bacillus/Soybean/ Folic Acid Ferment Extract, Butylene Glycol, Caprylyl Glycol, Carbomer, Cetearyl Alcohol, Cetearyl Olivate, Chlorphenesin, Coco-Caprylate/Caprate, Coconut Alkanes, Copper Palmitoyl Heptapeptide-14, Dicaprylyl Carbonate, Glycerin, Glyceryl Caprylate, Glycine, Heptapeptide-15 Palmitate, Histidine, Hydroxyethyl Acrylate/Sodium Acryloyldimethyl Taurate Copolymer, Isoleucine, Isomalt, Lactic Acid/Glycolic Acid Copolymer, Lecithin, Linoleic Acid, Linolenic Acid, Nymphaea Alba Root Extract, Palmitoyl Tetrapeptide-7, Palmitoyl Tripeptide-1, Pca, Phenoxyethanol, Phenylalanine, Phenylpropanol, Polysorbate 20, Polysorbate 60, Polyvinyl Alcohol, Proline, Sclerocarya Birrea Seed Oil, Serine, Sh-Oligopeptide-1, Sh-Oligopeptide-2, Sh-Polypeptide-1, Sh-Polypeptide-11, Sh-Polypeptide-9, Sodium Benzoate, Sodium Hyaluronate, Sodium Lactate, Sorbitan Isostearate, Sorbitan Olivate, Symphytum Officinale Callus Culture Extract, Threonine, Tocopherol (Multisource), Valine, Water\Aqua\Eau, Xanthan Gum",https://cdn1.skinsafeproducts.com/photo/897D6687BCEAE1/large_1534121432.jpeg?1534121432,https://www.skinsafeproducts.com/drunk-elephant-protini-polypeptide-cream-50-ml-4-69-fl-oz
401-600.csv,"Drunk Elephant Polypeptide Cream, 50 ml",Drunk Elephant,Face,Creams,"1,2-Hexanediol, Acetyl Glutamine, Alanine, Arginine, Aspartic Acid, Bacillus/Soybean/ Folic Acid Ferment Extract, Butylene Glycol, Caprylyl Glycol, Carbomer, Cetearyl Alcohol, Cetearyl Olivate, Chlorphenesin, Coco-Caprylate/Caprate, Coconut Alkanes, Copper Palmitoyl Heptapeptide-14, Dicaprylyl Carbonate, Glycerin, Glyceryl Caprylate, Glycine, Heptapeptide-15 Palmitate, Histidine, Hydroxyethyl Acrylate/Sodium Acryloyldimethyl Taurate Copolymer, Isoleucine, Isomalt, Lactic Acid/Glycolic Acid Copolymer, Lecithin, Linoleic Acid, Linolenic Acid, Nymphaea Alba Root Extract, Palmitoyl Tetrapeptide-7, Palmitoyl Tripeptide-1, Pca, Phenoxyethanol, Phenylalanine, Phenylpropanol, Polysorbate 20, Polysorbate 60, Polyvinyl Alcohol, Proline, Sclerocarya Birrea Seed Oil, Serine, Sh-Oligopeptide-1, Sh-Oligopeptide-2, Sh-Polypeptide-1, Sh-Polypeptide-11, Sh-Polypeptide-9, Sodium Benzoate, Sodium Hyaluronate, Sodium Lactate, Sodium Pca, Sorbitan Isostearate, Sorbitan Olivate, Symphytum Officinale Callus Culture Extract, Threonine, Tocopherol (Multisource), Valine, Water\Aqua\Eau, Xanthan Gum",https://cdn1.skinsafeproducts.com/photo/530E08736EC98A/large_1578444683.jpegjpeg?1578444683,https://www.skinsafeproducts.com/drunk-elephant-polypeptide-cream-50-ml
401-600.csv,"Drunk Elephant Baby Juju + Baby Pekee Travel Duo Exfoliating Face Wash & Moisturizing Bar Soap, 2 oz",Drunk Elephant,Cleansers,Bar Soaps,"Bambusa Vulgaris Leaf/Stem Extract, Cetearyl Alcohol, Disodium Lauryl Sulfosuccinate, Euterpe Oleracea Fruit Extract, Glycerin, Heilmoor Clay, Helianthus Annuus (Sunflower) Seed Oil, Honey (Mel, Miel), Lycium Barbarum Fruit Extract, Paraffin, Sclerocarya Birrea Seed Oil, Sodium Coco-Sulfate, Titanium Dioxide (Ci 77891), Triticum Vulgare (Wheat) Starch, Vaccinium Angustifolium (Blueberry) Fruit Extract, Water\Aqua\Eau",https://cdn1.skinsafeproducts.com/photo/57278AE4AE6232/large_1535690484.jpeg?1535690484,https://www.skinsafeproducts.com/drunk-elephant-baby-juju-baby-pekee-travel-duo-exfoliating-face-wash-moisturizing-bar-soap-2-oz
601-800.csv,"Drunk Elephant Lala Retro Whipped Cream, 1.69 fl oz",Drunk Elephant,Face,Creams,"Adansonia Digitata Seed Oil, Caprylic/Capric Triglyceride, Caprylyl Glycol, Carbomer, Ceteareth-20, Cetearyl Alcohol, Chlorphenesin, Citric Acid, Citrullus Lanatus (Watermelon) Seed Oil, Glycerin, Glyceryl Stearate Se, Isopropyl Isostearate, Passiflora Edulis Seed Oil, Pentylene Glycol, Phenoxyethanol, Plantago Lanceolata Leaf Extract, Polyglyceryl-6, Pseudozyma Epicola/Camellia Sinensis Seed Oil/Glucose/Glycine Soja (Soybean) Meal/Malt Extract/Yeast Extract Ferment Filtrate, Schinziophyton Rautanenii Kernel Oil, Sclerocarya Birrea Seed Oil, Sodium Hyaluronate Crosspolymer, Sodium Hydroxide, Stearic Acid, Trisodium Ethylenediamine Disuccinate, Water\Aqua\Eau, Xanthan Gum, Ximenia Americana Seed Oil",https://cdn1.skinsafeproducts.com/photo/063DAA6F817FBF/large_1491267494.jpeg?1491267494,https://www.skinsafeproducts.com/drunk-elephant-lala-retro-whipped-cream-1-69-fl-oz
601-800.csv,"Drunk Elephant Lippe, 0.13 oz",Drunk Elephant,Lip Care,"Lip Balms, Gels, Moisturizers & Oils","African Shea Butter, Beeswax, Bis-Diglyceryl Polyacyladipate-2, Camellia Oleifera Leaf Extract, Caprylic/Capric Triglyceride, Carnauba/Carnauba Wax/Cire De Carnauba, Carthamus Tinctorius (Safflower) Seed Oii, Cocos Nucifera (Coconut), Dicaprylyl Ether, Dictyopteris Membranacea Extract, Dipotassium Glycyrrhizate, Ethylhexyl Palmitate, Lauryl Alcohol, Linoleic Acid, Linolenic Acid, Magnolia Grandiflora Bark Extract, Ozokerite, Palmitoyl Tripeptide-1, Persea Gratissima (Avocado) Oil, Polyisobutene, Schinziophyton Rautanenii (Mongongo) Kernel Oil, Sclerocarya Birrea Seed Oil, Sorbitan Isostearate, Soy Lecithin, Tetrahexyldecyl Ascorbate, Tocopheryl Acetate, Tribehenin, Vaccinium Macrocarpon (Cranberry) Seed Oil",https://cdn1.skinsafeproducts.com/photo/yU8HaMZvB18H17Dw1ggF2g/large_1468963951.jpegjpg?1468963951,https://www.skinsafeproducts.com/drunk-elephant-lippe-0-13-oz
601-800.csv,"Drunk Elephant Protini Polypeptide Cream, 3.3 fl oz/100 mL",Drunk Elephant,Face,Creams,"1,2-Hexanediol, Acetyl Glutamine, Alanine, Arginine, Aspartic Acid, Bacillus/Folic Acid Ferment Filtrate Extract, Butylene Glycol, Caprylyl Glycol, Carbomer, Cetearyl Alcohol, Cetearyl Olivate, Chlorphenesin, Coco-Caprylate/Caprate, Coconut Alkanes, Copper Palmitoyl Heptapeptide-14, Dicaprylyl Carbonate, Glycerin, Glyceryl Caprylate, Glycine, Heptapeptide-15 Palmitate, Histidine, Hydroxyethyl Acrylate/Sodium Acryloyldimethyl Taurate Copolymer, Isoleucine, Isomalt, Lactic Acid/Glycolic Acid Copolymer, Lecithin, Linoleic Acid, Linolenic Acid, Nymphaea Alba Root Extract, Palmitoyl Tetrapeptide-7, Palmitoyl Tripeptide-1, Pca, Phenoxyethanol, Phenylalanine, Phenylpropanol, Polysorbate 20, Polysorbate 60, Polyvinyl Alcohol, Proline, Sclerocarya Birrea Seed Oil, Serine, Sh-Oligopeptide-1, Sh-Oligopeptide-2, Sh-Polypeptide-1, Sh-Polypeptide-11, Sh-Polypeptide-9, Sodium Benzoate, Sodium Hyaluronate, Sodium Lactate, Sodium Pca, Sorbitan Isostearate, Sorbitan Olivate, Symphytum Officinale Callus Culture Extract, Threonine, Tocopherol, Valine, Water/Aqua/Eau, Xanthan Gum",https://cdn1.skinsafeproducts.com/photo/5A4737FC70905D/large_1701252418.pngpng?1701252418,https://www.skinsafeproducts.com/drunk-elephant-protini-polypeptide-cream-3-3-fl-oz-100-ml
801-1000.csv,"Drunk Elephant Lala Retro Whipped Cream Moisturizer, 50 mL",Drunk Elephant,Body,Creams,"Adansonia Digitata Seed Oil, Caprylic/ Capric Triglyceride, Caprylyl Glycol, Carbomer, Ceramide Ap, Ceramide Eop, Ceramide Np, Ceteareth-20, Cetearyl Alcohol, Chlorphenesin, Cholesterol, Citric Acid, Citrullus Lanatus (Watermelon) Seed Oil, Ethylhexylglycerin, Glycerin, Glyceryl Stearate Se, Isopropyl Isostearate, Palmitic Acid, Passiflora Edulis Seed Oil, Pentylene Glycol, Phenoxyethanol, Phytosphingosine, Plantago Lanceolata Leaf Extract, Polyglyceryl-6 Ximenia Americana Seedate, Pseudozyma Epicola/Camellia Sinensis Seed Oil/Glucose/Glycine Soja (Soybean) Meal/Malt Extract/Yeast Extract Ferment Filtrate, Schinziophyton Rautanenii Kernel Oil, Sclerocarya Birrea Seed Oil, Sodium Hyaluronate Crosspolymer, Sodium Hydroxide, Sodium Lauroyl Lactylate, Stearic Acid, Tocopherol (Multisource), Trisodium Ethylenediamine Disuccinate, Water\Aqua\Eau, Xanthan Gum",https://cdn1.skinsafeproducts.com/photo/A1F8D9F83940F1/large_1578180444.jpegjpg?1578180444,https://www.skinsafeproducts.com/drunk-elephant-lala-retro-whipped-cream-moisturizer-50-ml
801-1000.csv,"Drunk Elephant Protini Polypeptide Cream, 1.69 fl oz",Drunk Elephant,Anti-Aging/Anti-Wrinkle,Anti-Wrinkle,"1,2-Hexanediol, Acetyl Glutamine, Alanine, Arginine, Aspartic Acid, Bacillus/Soybean/Folic Acid Ferment Extract, Butylene Glycol, Caprylyl Glycol, Carbomer, Cetearyl Alcohol, Cetearyl Olivate, Chlorphenesin, Coco-Caprylate/Caprate, Coconut Alkanes, Copper Palmitoyl Heptapeptide-14, Dicaprylyl Carbonate, Glycerin, Glyceryl Caprylate, Glycine, Heptapeptide-15 Palmitate, Histidine, Hydroxyethyl Acrylate/Sodium Acryloyldimethyl Taurate Copolymer, Isoleucine, Isomalt, Lactic Acid/Glycolic Acid Copolymer, Lecithin, Linoleic Acid, Linolenic Acid, Nymphaea Alba Root Extract, Palmitoyl Tetrapeptide-7, Palmitoyl Tripeptide-1, Pca, Phenoxyethanol, Phenylalanine, Phenylpropanol, Polysorbate 20, Polyvinyl Alcohol, Proline, Sclerocarya Birrea Seed Oil, Serine, Sh-Oligopeptide-1, Sh-Oligopeptide-2, Sh-Polypeptide-1, Sh-Polypeptide-11, Sh-Polypeptide-9, Sodium Benzoate, Sodium Hyaluronate, Sodium Lactate, Sorbitan Isostearate, Sorbitan Olivate, Symphytum Officinale Callus Culture Extract, Threonine, Tocopherol (Multisource), Valine, Water\Aqua\Eau, Xanthan Gum",https://cdn1.skinsafeproducts.com/photo/5B7FA14DE57CF3/large_1515459655.jpeg?1515459655,https://www.skinsafeproducts.com/drunk-elephant-protini-polypeptide-cream-1-69-fl-oz
801-1000.csv,"Drunk Elephant Purify + Dissolve Jelly Cleanser, Beste No.9, 2 fl oz/60 mL",Drunk Elephant,Facial Cleansers,Facial Gels,"Aloe Barbadensis Leaf Extract, Citric Acid, Cocamidopropyl Betaine, Cocamidopropyl Hydroxysultaine, Coco-Glucoside, Cucumis Melo Cantalupensis Fruit Extract, Dipotassium Glycyrrhizate, Glycerin, Glycolipids, Lauryl Glucoside, Linoleic Acid, Linolenic Acid, Phenoxyethanol, Polylysine, Propanediol, Sclerocarya Birrea Seed Oil, Sodium Benzoate, Sodium Chloride, Sodium Hydroxide, Sodium Lauroyl Methyl Isethionate, Sodium Methyl Oleoyl Taurate, Tocopherol, Water/Aqua/Eau",https://cdn1.skinsafeproducts.com/photo/FB948AA4061764/large_1724302471.pngpng?1724302471,https://www.skinsafeproducts.com/drunk-elephant-purify-dissolve-jelly-cleanser-beste-no-9-2-fl-oz-60-ml
801-1000.csv,"Drunk Elephant Ceramighty AF Eye Balm, Cushion + Strengthen, 0.5 fl oz/15 mL",Drunk Elephant,Moisturizers,Eyes,"Adenosine, Allantoin, Avena Sativa (Oat) Kernel Extract, Avena Sativa (Oat) Kernel Oil, Beta-Glucan, Caprylyl Glycol, Carbomer, Ceramide Ap, Ceramide Eop, Ceramide Np, Ceteareth-20, Cetearyl Alcohol, Chlorphenesin, Cholesterol, Citric Acid, Ethylhexylglycerin, Glycerin, Glyceryl Stearate, Linoleic Acid, Linolenic Acid, Linum Usitatissimum (Linseed) Seed Oil, Octyldodecanol, Oenothera Biennis (Evening Primrose) Oil, Palmitic Acid, Panthenol, Pentylene Glycol, Persea Gratissima (Avocado) Oil, Phenoxyethanol, Phytosphingosine, Propanediol, Quercetin, Salvia Hispanica Seed Oil, Sclerocarya Birrea Seed Butter, Sclerocarya Birrea Seed Oil, Simmondsia Chinensis (Jojoba) Seed Oil, Sodium Carbonate, Sodium Chloride, Sodium Hydroxide, Sodium Lauroyl Lactylate, Stearic Acid, Tetrasodium Glutamate Diacetate, Water/Aqua/Eau, Xanthan Gum",https://cdn1.skinsafeproducts.com/photo/8AC754949D8E6B/large_1672438233.jpeg?1672438233,https://www.skinsafeproducts.com/drunk-elephant-ceramighty-af-eye-balm-cushion-strengthen-0-5-fl-oz-15-ml
801-1000.csv,"Drunk Elephant Sili Whipped Body Lotion, 8 fl oz/240 mL",Drunk Elephant,Body,Lotions,"Astaxanthin, Brassica Oleracea Acephala Leaf Extract, Camellia Sinensis Leaf Extract, Camellia Sinensis Seed Oil, Caprylhydroxamic Acid, Caprylic/Capric Triglyceride, Caprylyl Glycol, Carbomer, Centella Asiatica Extract, Ceramide Ap, Ceramide Eop, Ceramide Np, Cetearyl Alcohol, Cetearyl Olivate, Cholesterol, Citric Acid, Dicaprylyl Carbonate, Ethylhexylglycerin, Euterpe Oleracea Fruit Oil, Glycerin, Glyceryl Stearate, Haematococcus Pluvialis Extract, Helianthus Annuus (Sunflower) Seed Oil, Hydroxyethyl Acrylate/Sodium Acryloyldimethyl Taurate Copolymer, Linoleic Acid, Linolenic Acid, Linum Usitatissimum (Linseed) Seed Oil, Lycium Barbarum Fruit Extract, Phenoxyethanol, Phytosphingosine, Polysorbate 60, Propanediol, Salvia Hispanica Seed Oil, Sclerocarya Birrea Seed Oil, Shea Butter Glycerides, Sodium Lauroyl Lactylate, Sodium Pca, Sodium Stearoyl Glutamate, Sorbitan Isostearate, Sorbitan Olivate, Squalane, Tocopherol, Vanilla Planifolia Fruit Extract, Water/Aqua/Eau, Withania Somnifera Root Extract, Xanthan Gum",https://cdn1.skinsafeproducts.com/photo/66429584356028/large_1668138438.pngpng?1668138438,https://www.skinsafeproducts.com/drunk-elephant-sili-whipped-body-lotion-8-fl-oz-240-ml
801-1000.csv,"Drunk Elephant Sweet Biome Fermented Sake Spray, Restore, 3.33 fl oz/100 mL",Drunk Elephant,Face,Spray Moisturizer,"Alanine, Arginine, Aspartic Acid, Beta Vulgaris (Beet) Root Extract, Calcium Gluconate, Carbomer, Ceramide Ap, Ceramide Eop, Ceramide Np, Cholesterol, Citric Acid, Cocos Nucifera (Coconut) Fruit Juice, Copper Gluconate, Ethylhexylglycerin, Fructooligosaccharides, Galactomyces Ferment Filtrate, Glycerin, Glycine, Histidine, Humulus Lupulus (Hops) Extract, Hyaluronic Acid, Isoleucine, Lactic Acid, Linoleic Acid, Linolenic Acid, Magnesium Aspartate, Pca, Pentylene Glycol, Phenoxyethanol, Phenylalanine, Phytosphingosine, Polysorbate 20, Potassium Lactate, Potassium Sorbate, Proline, Propanediol, Saccharomyces/Xylinum/Black Tea Ferment, Sclerocarya Birrea Seed Oil, Serine, Sodium Benzoate, Sodium Hyaluronate Crosspolymer, Sodium Hydroxide, Sodium Lactate, Sodium Lauroyl Lactylate, Sodium Pca, Tapioca Starch, Tetrasodium Glutamate Diacetate, Threonine, Tocopherol, Trehalose, Valine, Water/Aqua/Eau, Xanthan Gum, Xylitol, Zinc Gluconate",https://cdn1.skinsafeproducts.com/photo/9E858B8FB0569B/large_1631019700.jpeg?1631019700,https://www.skinsafeproducts.com/drunk-elephant-sweet-biome-fermented-sake-spray-restore-3-33-fl-oz-100-ml
