File,product_name,brand,usage_type,category,ingredients,image_url,product_url
1-200.csv,"Drunk Elephant B-Goldi Bright Drops, Fortify + Glisten, 1 fl oz/30 mL",Drunk Elephant,Skin Treatments,Dark Spot Corrector & Pigment Corrector,"Acrylates/Beheneth-25 Methacrylate Copolymer, Butylene Glycol, C12-15 Alkyl Benzoate, C9-12 Alkane, Calcium Chloride, Ceteareth-20, Cetearyl Alcohol, Citric Acid, Coco-Caprylate/Caprate, Diglucosyl Gallic Acid, Dipropylene Glycol, Ethylhexyl Olivate, Glycerin, Glyceryl Acrylate/Acrylic Acid Copolymer, Hydroxyethyl Acrylate/Sodium Acryloyldimethyl Taurate Copolymer, Iron Oxides (Ci 77491), Mica, Morus Alba Leaf Extract, Neopentyl Glycol Diheptanoate, Niacinamide, Phenoxyethanol, Plukenetia Volubilis Seed Oil, Polysorbate 60, Ppg-8-Ceteth-20, Propanediol, Quercetin, Sclerocarya Birrea Seed Oil, Sea Salt/Maris Sal/Sel Marin, Simmondsia Chinensis (Jojoba) Seed Oil, Sodium Carrageenan, Sodium Citrate, Sodium Hydroxide, Sodium Metabisulfite, Sodium Stearate, Sorbeth-30 Tetraisostearate, Sorbitan Isostearate, Sorbitan Sesquiisostearate, Squalane, Tetrasodium Glutamate Diacetate, Titanium Dioxide (Ci 77891), Tocopherol, Tocopheryl Acetate, Ubiquinone, Water/Aqua/Eau, Xanthan Gum",https://cdn1.skinsafeproducts.com/photo/BE375E7F346D7A/large_1715104662.jpegjpg?1715104662,https://www.skinsafeproducts.com/drunk-elephant-b-goldi-bright-drops-fortify-glisten-1-fl-oz-30-ml
1-200.csv,Drunk Elephant A-Gloei Virgin Marula Oil with Retinol 1 Ounce.,Drunk Elephant,Anti-Aging/Anti-Wrinkle,Anti-Wrinkle,"Ceramide Ap, Ceramide Np, Glycine Soja (Soybean) Oil, Marula Oil, Retinol, Sclerocarya Birrea Seed Oil, Tocopherol",https://cdn1.skinsafeproducts.com/photo/56BE925A2C7AE7/large_1648861756.jpeg?1648861756,https://www.skinsafeproducts.com/drunk-elephant-a-gloei-virgin-marula-oil-with-retinol-1-ounce
1-200.csv,"Drunk Elephant Virgin Marula Luxury Facial Oil, 0.5 fl oz/15 mL",Drunk Elephant,Face,Oils,Sclerocarya Birrea Seed Oil,https://cdn1.skinsafeproducts.com/photo/6283B2D3959468/large_1535690417.jpeg?1535690417,https://www.skinsafeproducts.com/drunk-elephant-virgin-marula-luxury-facial-oil-0-5-fl-oz
1-200.csv,Drunk Elephant Virgin Marula Luxury Facial Oil 1oz,Drunk Elephant,Face,Oils,Unrefined Sclerocarya Birrea (Marula) Kernel Oil,https://cdn1.skinsafeproducts.com/photo/cr765Ksn_j-JU5ukEbOMLQ/large_1454264510.jpeg?1454264510,https://www.skinsafeproducts.com/drunk-elephant-virgin-marula-luxury-facial-oil-1oz
1-200.csv,"Drunk Elephant Hydrate + Illuminate C - Luma Hydrabright Serum, Sodium Ascorbyl Phosphate & Ascorbyl Glucoside, 1 fl oz/30 mL",Drunk Elephant,Skin Treatments,Serums,"Acrylates/Beheneth-25 Methacrylate Copolymer, Ascorbyl Glucoside, C9-12 Alkane, Chondrus Crispus Extract, Citric Acid, Coco-Caprylate/Caprate, Diglucosyl Gallic Acid, Dipropylene Glycol, Gluconolactone, Glutathione, Glycerin, Isodecyl Neopentanoate, Lecithin, Neopentyl Glycol Diheptanoate, Phenoxyethanol, Phloretin, Ppg-8-Ceteth-20, Propanediol, Pullulan, Sclerocarya Birrea Seed Oil, Sclerotium Gum, Silica, Sodium Ascorbyl Phosphate, Sodium Benzoate, Sodium Citrate, Sodium Hyaluronate, Sodium Hydroxide, Sodium Metabisulfite, Sodium Polyacryloyldimethyl Taurate, Sorbeth-30 Tetraisostearate, Sorbitan Sesquiisostearate, Squalane, Tetrasodium Glutamate Diacetate, Tocopheryl Acetate, Water/Aqua/Eau, Xanthan Gum",https://cdn1.skinsafeproducts.com/photo/FFB8F0C02DDC7A/large_1730852056.jpeg?1730852056,https://www.skinsafeproducts.com/drunk-elephant-hydrate-illuminate-c-luma-hydrabright-serum-sodium-ascorbyl-phosphate-ascorbyl-glucoside-1-fl-oz-30-ml
1-200.csv,"Drunk Elephant Pekee Bar+ Juju Bar Duo, 28.3 g",Drunk Elephant,Cleansers,Bar Soaps,"Bambusa Vulgaris Leaf/Stem Extract, Benzoic Acid, Cetearyl Alcohol, Chlorphenesin, Disodium Lauryl Sulfosuccinate, Euterpe Oleracea Fruit Extract, Glycerin, Heilmoor Clay, Helianthus Annuus (Sunflower) Seed Oil, Honey/Mel/Miel, Lycium Barbarum Fruit Extract, Paraffin, Phenoxyethanol, Sclerocarya Birrea Seed Oil, Sodium Coco-Sulfate, Sorbic Acid, Titanium Dioxide (Ci 77891), Triticum Vulgare (Wheat) Starch, Vaccinium Angustifolium (Blueberry) Fruit Extract, Water/Aqua/Eau",https://cdn1.skinsafeproducts.com/photo/DA1BF2987A227D/large_1721459374.pngpng?1721459374,https://www.skinsafeproducts.com/drunk-elephant-pekee-bar-juju-bar-duo
1-200.csv,"Drunk Elephant Bouncy Brightfacial Masque Illuminateur, 1.69 fl oz/50 mL",Drunk Elephant,Skin Treatments,Facial Masks,"Acetyl Glucosamine, Allantoin, Amylopectin, Ascorbyl Palmitate, Azelaic Acid, Behenic Acid, Caprooyl Phytosphingosine, Caprooyl Sphingosine, Caprylyl Glycol, Ceramide Ap, Ceramide Eop, Ceramide Eos, Ceramide Np, Ceramide Ns, Ceteareth-25, Cetyl Alcohol, Chlorphenesin, Cholesterol, Cucurbita Pepo (Pumpkin) Seed Oil, Dextrin, Diglucosyl Gallic Acid, Dipotassium Glycyrrhizate, Ellagic Acid, Ergothioneine, Ethylhexylglycerin, Ferulic Acid, Glutathione, Glycerin, Hydroxyethyl Acrylate/Sodium Acryloyldimethyl Taurate Copolymer, Linoleic Acid, Linolenic Acid, Niacinamide, Oryza Sativa (Rice) Bran Oil, Pentylene Glycol, Phenoxyethanol, Phloretin, Polydextrose, Polysorbate 60, Pseudozyma Epicola/Camellia Sinensis Seed Oil Ferment Extract Filtrate, Punica Granatum Extract, Salicylic Acid, Salvia Hispanica Seed Oil, Sclerocarya Birrea Seed Oil, Sebacic Acid, Sodium Hyaluronate Crosspolymer, Sorbitan Isostearate, Squalane, Thioctic Acid, Tocopherol, Tocotrienols, Tremella Fuciformis Sporocarp Extract, Water/Aqua/Eau",https://cdn1.skinsafeproducts.com/photo/AD2D3051DEC5DA/large_1710301544.jpeg?1710301544,https://www.skinsafeproducts.com/drunk-elephant-bouncy-brightfacial-masque-illuminateur-1-69-fl-oz-50-ml
1-200.csv,"Drunk Elephant Refine + Moisturize Body Lotion, 8 fl oz/240 mL",Drunk Elephant,Body,Lotions,"Adansonia Digitata Seed Oil, Allantoin, Butyrospermum Parkii (Shea) Butter, Camellia Sinensis Seed Oil, Caprylyl Glycol, Cetearyl Alcohol, Cetearyl Olivate, Chlorphenesin, Citric Acid, Citrullus Lanatus (Watermelon) Seed Oil, Coco-Caprylate/Caprate, Coconut Alkanes, Cocos Nucifera (Coconut) Fruit Juice, Cocos Nucifera (Coconut) Oil, Ethylhexylglycerin, Glycolic Acid, Hydroxyethyl Acrylate/Sodium Acryloyldimethyl Taurate Copolymer, Lactic Acid, Linoleic Acid, Linolenic Acid, Niacinamide, Passiflora Edulis Seed Oil, Pentylene Glycol, Persea Gratissima (Avocado) Oil, Phenoxyethanol, Polysorbate 60, Potassium Sorbate, Propanediol, Prunus Amygdalus Dulcis (Sweet Almond) Oil, Prunus Armeniaca (Apricot) Kernel Oil, Quercetin, Schinziophyton Rautanenii Kernel Oil, Sclerocarya Birrea Seed Butter, Sclerocarya Birrea Seed Oil, Simmondsia Chinensis (Jojoba) Seed Oil, Sodium Carbonate, Sodium Chloride, Sodium Hyaluronate Crosspolymer, Sodium Hydroxide, Sodium Pca, Sorbitan Isostearate, Sorbitan Olivate, Squalane, Tapioca Starch, Tartaric Acid, Tocopherol, Vitis Vinifera (Grape) Juice Extract, Water/Aqua/Eau, Ximenia Americana Seed Oil",https://cdn1.skinsafeproducts.com/photo/1A4B36A3C3D8F6/large_1716176509.pngpng?1716176509,https://www.skinsafeproducts.com/drunk-elephant-refine-moisturize-body-lotion-8-fl-oz-240-ml
1-200.csv,"Drunk Elephant Bora Barrier Repair Cream, 1.69 oz/50 mL",Drunk Elephant,Face,Creams,"Acacia Senegal Gum, Alpha-Glucan, Astaxanthin, Beta-Sitosterol, Brassica Campestris (Rapeseed) Seed Oil, Butylene Glycol, Butyrospermum Parkii (Shea) Butter, C10-18 Triglycerides, Calophyllum Inophyllum Seed Oil, Carbomer, Ceramide Ap, Ceramide Eop, Ceramide Np, Cetearyl Alcohol, Cetearyl Olivate, Cholesterol, Citric Acid, Coco-Glucoside, Copper Gluconate, Dextrin, Epigallocatechin Gallate, Ethylhexyl Olivate, Ethylhexylglycerin, Glucosyl Ceramide, Glycerin, Glycosphingolipids, Haematococcus Pluvialis Extract, Hydroxyethyl Acrylate/Sodium Acryloyldimethyl Taurate Copolymer, Linoleic Acid, Linolenic Acid, Magnesium Ascorbyl Phosphate, Magnesium Aspartate, Moringa Oleifera Seed Oil, Oenothera Biennis (Evening Primrose) Oil, Oleic Acid, Palmitic Acid, Palmitoyl Tetrapeptide-7, Palmitoyl Tripeptide-1, Pentylene Glycol, Phenoxyethanol, Phytosphingosine, Polysorbate 60, Propanediol, Quercetin, Resveratrol, Rosa Canina Fruit Oil, Sclerocarya Birrea Seed Oil, Simmondsia Chinensis (Jojoba) Seed Oil, Sodium Hydroxide, Sodium Lactate, Sodium Lauroyl Lactylate, Sodium Pca, Sorbitan Isostearate, Sorbitan Olivate, Squalane, Stearic Acid, Tetrahexyldecyl Ascorbate, Tetrasodium Glutamate Diacetate, Tocopherol, Water/Aqua/Eau, Xanthan Gum, Zinc Gluconate",https://cdn1.skinsafeproducts.com/photo/C6342D44CACBDE/large_1712219956.pngpng?1712219956,https://www.skinsafeproducts.com/drunk-elephant-bora-barrier-repair-cream-1-69-oz-50-ml
1-200.csv,"Drunk Elephant Lippe Balm, 0.13 oz/3.7 g",Drunk Elephant,Lip Care,"Lip Balms, Gels, Moisturizers & Oils","Beeswax/Cera Alba/Cire D'Abeille, Bis-Diglyceryl Polyacyladipate-2, Butyrospermum Parkii (Shea) Butter, Camellia Sinensis Leaf Extract, Caprylic/Capric Triglyceride, Caprylyl Glycol, Carthamus Tinctorius (Safflower) Seed Oil, Cocos Nucifera (Coconut) Oil, Copernicia Cerifera (Carnauba) Wax/Cera Carnauba/Cire De Carnauba, Dicaprylyl Ether, Dictyopteris Polypodioides Extract, Dipotassium Glycyrrhizate, Ethylhexyl Palmitate, Euphorbia Cerifera (Candelilla) Wax (Candelillacera/Cire De Candelilla), Glycine Soja (Soybean) Oil, Helianthus Annuus (Sunflower) Seed Oil, Lactic Acid, Lauryl Alcohol, Linoleic Acid, Linolenic Acid, Magnolia Grandiflora Bark Extract, Oleic Acid, Ozokerite, Palmitic Acid, Palmitoyl Tripeptide-1, Persea Gratissima (Avocado) Oil, Phenoxyethanol, Polyisobutene, Rosmarinus Officinalis (Rosemary) Leaf Extract, Sclerocarya Birrea Seed Oil, Sorbitan Isostearate, Stearic Acid, Tetrahexyldecyl Ascorbate, Tocopherol, Tocopheryl Acetate, Tribehenin, Vaccinium Macrocarpon (Cranberry) Seed Oil",https://cdn1.skinsafeproducts.com/photo/482E06D2F41C47/large_1711140693.jpeg?1711140693,https://www.skinsafeproducts.com/drunk-elephant-lippe-balm-0-13-oz-3-7-g
1-200.csv,"Drunk Elephant Sugared Koffie Almond Milk Body Scrub, 9 fl oz/270 mL",Drunk Elephant,"Exfoliators, Polishes, & Scrubs",Scrubs,"Adansonia Digitata Seed Oil, Caprylic/Capric Triglyceride, Citrullus Lanatus (Watermelon) Seed Oil, Coco-Caprylate/Caprate, Coconut Alkanes, Cocos Nucifera (Coconut) Oil, Coffea Arabica (Coffee) Seed Extract, Coffea Arabica (Coffee) Seed Oil, Glycerin, Helianthus Annuus (Sunflower) Seed Oil, Hydrogenated Vegetable Oil, Passiflora Edulis Seed Oil, Polyglyceryl-3 Laurate, Prunus Amygdalus Dulcis (Sweet Almond) Fruit Extract, Prunus Amygdalus Dulcis (Sweet Almond) Oil, Prunus Amygdalus Dulcis (Sweet Almond) Seed Extract, Sclerocarya Birrea Seed Oil, Silica, Simmondsia Chinensis (Jojoba) Seed Oil, Sorbitan Oleate, Sucrose, Sweet Almond Oil Polyglyceryl-6 Esters, Water/Aqua/Eau",https://cdn1.skinsafeproducts.com/photo/2849491E29F469/large_1690669505.jpeg?1690669505,https://www.skinsafeproducts.com/drunk-elephant-sugared-koffie-almond-milk-body-scrub-9-fl-oz-270-ml
1-200.csv,"Drunk Elephant T.L.C. Glycolic Body Lotion, Marula +Shea Butters Ph 3.5, 8 fl oz /240 mL",Drunk Elephant,Body,Lotions,"Adansonia Digitata Seed Oil, Allantoin, Butyrospermum Parkii (Shea) Butter, Camellia Sinensis Seed Oil, Caprylyl Glycol, Cetearyl Alcohol, Cetearyl Olivate, Chlorphenesin, Citric Acid, Citrullus Lanatus (Watermelon) Seed Oil, Coco-Caprylate/Caprate, Coconut Alkanes, Cocos Nucifera (Coconut) Fruit Juice, Cocos Nucifera (Coconut) Oil, Ethylhexylglycerin, Glycolic Acid, Hydroxyethyl Acrylate/Sodium Acryloyldimethyl Taurate Copolymer, Lactic Acid, Linoleic Acid, Linolenic Acid, Niacinamide, Passiflora Edulis Seed Oil, Pentylene Glycol, Persea Gratissima (Avocado) Oil, Phenoxyethanol, Polysorbate 60, Potassium Sorbate, Propanediol, Prunus Amygdalus Dulcis (Sweet Almond) Oil, Prunus Armeniaca (Apricot) Kernel Oil, Quercetin, Schinziophyton Rautanenii Kernel Oil, Sclerocarya Birrea Seed Butter, Sclerocarya Birrea Seed Oil, Simmondsia Chinensis (Jojoba) Seed Oil, Sodium Carbonate, Sodium Chloride, Sodium Hyaluronate Crosspolymer, Sodium Hydroxide, Sodium Pca, Sorbitan Isostearate, Sorbitan Olivate, Squalane, Tapioca Starch, Tartaric Acid, Tocopherol, Vitis Vinifera (Grape) Juice Extract, Water/Aqua/Eau, Ximenia Americana Seed Oil",https://cdn1.skinsafeproducts.com/photo/7EC1A9451AFE1C/large_1684332000.jpeg?1684332000,https://www.skinsafeproducts.com/drunk-elephant-t-l-c-glycolic-body-lotion-marula-shea-butters-ph-3-5-8-fl-oz-240-ml
1-200.csv,Drunk Elephant A-Shaba Complex Eye Serum - Anti Aging Wrinkle Serum for Dark Circles (15 mL / 0.5 Fl Oz),Drunk Elephant,Anti-Aging/Anti-Wrinkle,Serums,"Biotin, Bis(Tripeptide-1) Copper Acetate, Boron Nitride, Caffeine, Caprylic/- Capric Triglyceride, Caprylyl Glycol, Ceramide Np, Cetearyl Olivate, Cetyl Alcohol, Cetyl Palmitate, Chlorhexidine Digluconate, Chlorphenesin, Chondrus Crispus Extract, Chrysin, Citric Acid, Coco-Caprylate/Caprate, Coconut Alkanes, Copper Lysinate/Prolinate, Dipeptide-2, Ethylhexylglycerin, Glucose, Glycerin, Glycine Soja (Soybean) Oil, Hesperidin Methyl Chalcone, Hippophae Rhamnoides Oil, Hydroxy- Ethylcellulose, Laureth-23, Lecithin, Leontopodium Alpinum Meristem Cell Culture, Mangifera Indica (Mango) Seed Butter, Methylglucoside Phosphate, N-Hydroxysuccinimide, Niacinamide, Octyldodecanol, Palmitoyl Tetrapeptide-7, Palmitoyl Tripeptide-1, Panthenol, Pentylene Glycol, Phenoxyethanol, Polysorbate 20, Potassium Sorbate, Retinol, Saccharomyces/Xylinum/Black Tea Ferment, Sclerocarya Birrea Seed Oil, Sclerotium Gum, Sodium Benzoate, Sodium Carbonate, Sodium Chloride, Sodium Citrate, Sodium Hyaluronate Crosspolymer, Sodium Hydroxide, Sorbitan Olivate, Steareth-20, Thioctic Acid, Tocopherol, Trideceth-6 Phosphate, Ubiquinone, Water/Aqua/Eau, Xanthan Gum",https://cdn1.skinsafeproducts.com/photo/F33B320BFC93E7/large_1680114767.jpeg?1680114767,https://www.skinsafeproducts.com/drunk-elephant-a-shaba-complex-eye-serum-anti-aging-wrinkle-serum-for-dark-circles-15-ml-0-5-fl-oz
1-200.csv,"Drunk Elephant C-Firma Fresh Day Serum, 0.87 fl oz/26 mL",Drunk Elephant,Skin Treatments,Serums,"Ascorbic Acid, Camellia Sinensis Leaf Extract, Caprylhydroxamic Acid, Caprylyl Glycol, Chondrus Crispus (Carrageenan) Extract, Dimethyl Isosorbide, Dipotassium Glycyrrhizate, Ethylhexylglycerin, Ferulic Acid, Gluconolactone, Glutamylamidoethyl Imidazole, Glycerin, Glycyrrhiza Glabra (Licorice) Root Extract, Lactobacillus/Pumpkin Ferment Extract, Lactobacillus/Punica Granatum Fruit Ferment Extract, Laureth-23, Leuconostoc/Radish Root Ferment Filtrate, Oryza Sativa (Rice) Bran Extract, Pentylene Glycol, Phenoxyethanol, Phyllanthus Emblica Fruit Extract, Propanediol, Sclerocarya Birrea Seed Oil, Sodium Benzoate, Sodium Hyaluronate, Sodium Hyaluronate Crosspolymer, Sorbic Acid, Tetrahydrobisdemethoxydiferuloylmethane, Tetrahydrodemethoxydiferuloylmethane, Tetrahydrodiferuloylmethane, Tocopherol, Vitis Vinifera (Grape) Juice Extract, Water/Aqua/Eau",https://cdn1.skinsafeproducts.com/photo/FCEB89030E98B0/large_1636131439.jpeg?1636131439,https://www.skinsafeproducts.com/drunk-elephant-c-firma-fresh-day-serum-0-87-fl-oz-26-ml
1-200.csv,"Drunk Elephant Protini Polypeptide Cream, 0.5 fl oz/15 mL",Drunk Elephant,Face,Creams,"1,2-Hexanediol, Acetyl Glutamine, Alanine, Arginine, Aspartic Acid, Bacillus/Folic Acid Ferment Extract, Butylene Glycol, Caprylyl Glycol, Carbomer, Cetearyl Alcohol, Cetearyl Olivate, Chlorphenesin, Coco-Caprylate/Caprate, Coconut Alkanes, Copper Palmitoyl Heptapeptide-14, Dicaprylyl Carbonate, Glycerin, Glyceryl Caprylate, Glycine, Heptapeptide-15 Palmitate, Histidine, Hydroxyethyl Acrylate/Sodium Acryloyldimethyl Taurate Copolymer, Isoleucine, Isomalt, Lactic Acid/Glycolic Acid Copolymer, Lecithin, Linoleic Acid, Linolenic Acid, Nymphaea Alba Root Extract, Palmitoyl Tetrapeptide-7, Palmitoyl Tripeptide-1, Pca, Phenoxyethanol, Phenylalanine, Phenylpropanol, Polysorbate 20, Polysorbate 60, Polyvinyl Alcohol, Proline, Sclerocarya Birrea Seed Oil, Serine, Sh-Oligopeptide-1, Sh-Oligopeptide-2, Sh-Polypeptide-1, Sh-Polypeptide-11, Sh-Polypeptide-9, Sodium Benzoate, Sodium Hyaluronate, Sodium Lactate, Sodium Pca, Sorbitan Isostearate, Sorbitan Olivate, Symphytum Officinale Callus Culture Extract, Threonine, Tocopherol, Valine, Water/Aqua/Eau, Xanthan Gum",https://cdn1.skinsafeproducts.com/photo/F77D7AF50FC7C8/large_1653840547.jpeg?1653840547,https://www.skinsafeproducts.com/drunk-elephant-protini-polypeptide-cream-0-5-fl-oz-15-ml
1-200.csv,"Drunk Elephant Wonderwild Miracle Butter, 2 fl oz/60 mL",Drunk Elephant,Body,Butters,"Aleurites Moluccanus Seed Oil, Butyrospermum Parkii (Shea) Butter, Camellia Sinensis Seed Oil, Cocos Nucifera (Coconut) Oil, Cucurbita Pepo (Pumpkin) Seed Oil, Helianthus Annuus (Sunflower) Seed Wax, Hydrogenated Vegetable Oil, Limnanthes Alba (Meadowfoam) Seed Oil, Mangifera Indica (Mango) Seed Butter, Oryza Sativa (Rice) Bran Oil, Persea Gratissima (Avocado) Oil, Rosa Canina Fruit Oil, Sclerocarya Birrea Seed Butter, Sclerocarya Birrea Seed Oil, Simmondsia Chinensis (Jojoba) Seed Oil, Theobroma Grandiflorum Seed Butter, Vitis Vinifera (Grape) Seed Oil",https://cdn1.skinsafeproducts.com/photo/127250972038D7/large_1649646587.jpeg?1649646587,https://www.skinsafeproducts.com/drunk-elephant-wonderwild-miracle-butter-meadowfoam-oil-2-fl-oz-60-ml
1-200.csv,Drunk Elephant Protini Polypeptide Cream. Protein Face Moisturizer with Amino Acids. 50 Milliliters/ 1.69 Ounce.,Drunk Elephant,Moisturizers,Face,"1,2-Hexanediol, Acetyl Glutamine, Alanine, Arginine, Aspartic Acid, Bacillus/Soybean/ Folic Acid Ferment Extract, Butylene Glycol, Caprylyl Glycol, Carbomer, Cetearyl Alcohol, Cetearyl Olivate, Chlorphenesin, Coco-Caprylate/Caprate, Coconut Alkanes, Copper Palmitoyl Heptapeptide-14, Dicaprylyl Carbonate, Glycerin, Glyceryl Caprylate, Glycine, Heptapeptide-15 Palmitate, Histidine, Hydroxyethyl Acrylate/Sodium Acryloyldimethyl Taurate Copolymer, Isoleucine, Isomalt, Lactic Acid/Glycolic Acid Copolymer, Lecithin, Linoleic Acid, Linolenic Acid, Nymphaea Alba Root Extract, Palmitoyl Tetrapeptide-7, Palmitoyl Tripeptide-1, Pca, Phenoxyethanol, Phenylalanine, Phenylpropanol, Polysorbate 20, Polysorbate 60, Polyvinyl Alcohol, Proline, Sclerocarya Birrea Seed Oil, Serine, Sh-Oligopeptide-1, Sh-Oligopeptide-2, Sh-Polypeptide-1, Sh-Polypeptide-11, Sh-Polypeptide-9, Sodium Benzoate, Sodium Hyaluronate, Sodium Lactate, Sodium Pca, Sorbitan Isostearate, Sorbitan Olivate, Symphytum Officinale Callus Culture Extract, Threonine, Tocopherol, Valine, Water/Aqua/Eau, Xanthan Gum",https://cdn1.skinsafeproducts.com/photo/E1A4986DB7BF55/large_1631565964.jpeg?1631565964,https://www.skinsafeproducts.com/drunk-elephant-protini-polypeptide-cream-protein-face-moisturizer-with-amino-acids-50-milliliters-1-69-ounce
1-200.csv,"Drunk Elephant E-Rase Milki Micellar Water, 8 fl oz/240 mL",Drunk Elephant,Facial Cleansers,Micellar Water,"Acrylates/C10-30 Alkyl Acrylate Crosspolymer, Adansonia Digitata Seed Oil, C15-19 Alkane, Carbomer, Ceramide Ap, Ceramide Eop, Ceramide Np, Cetearyl Isononanoate, Cholesterol, Citrullus Lanatus (Watermelon) Seed Oil, Dicaprylyl Carbonate, Ethylhexylglycerin, Heptyl Undecylenate, Phenoxyethanol, Phytosphingosine, Polysorbate 20, Potassium Sorbate, Propanediol, Prunus Amygdalus Dulcis (Sweet Almond) Oil, Schinziophyton Rautanenii Kernel Oil, Sclerocarya Birrea Seed Oil, Sodium Hydroxide, Sodium Lauroyl Lactylate, Tocopherol, Water/Aqua/Eau, Xanthan Gum, Ximenia Americana Seed Oil",https://cdn1.skinsafeproducts.com/photo/AEECD42CC29503/large_1625811680.pngpng?1625811680,https://www.skinsafeproducts.com/drunk-elephant-e-rase-milki-micellar-water-8-fl-oz-240-ml
1-200.csv,"Drunk Elephant Sili Body Lotion, 8 fl oz/240 mL",Drunk Elephant,Body,Lotions,"Adansonia Digitata Seed Extract, Adansonia Digitata Seed Oil, Alanine, Allantoin, Aloe Barbadensis Leaf Juice, Arginine, Ascorbyl Palmitate, Aspartic Acid, Behenic Acid, Beta-Carotene, Butyrospermum Parkii (Shea) Butter, Caprooyl Phytosphingosine, Caprooyl Sphingosine, Caprylic/Capric Triglyceride, Caprylyl Glycol, Ceramide Ap, Ceramide Eop, Ceramide Eos, Ceramide Np, Ceramide Ns, Ceteareth-25, Cetearyl Alcohol, Cetearyl Olivate, Cetyl Alcohol, Chlorphenesin, Cholesterol, Citric Acid, Citrullus Lanatus (Watermelon) Seed Oil, Coco-Caprylate/Caprate, Coconut Alkanes, Cocos Nucifera (Coconut) Oil, Ethylhexylglycerin, Glycerin, Glycine, Helianthus Annuus (Sunflower) Seed Oil, Histidine, Hydroxyethyl Acrylate/Sodium Acryloyldimethyl Taurate Copolymer, Isoleucine, Linoleic Acid, Linolenic Acid, Mangifera Indica (Mango) Pulp Extract, Moringa Oleifera Seed Oil, Musa Sapientum (Banana) Pulp Extract, Panthenol, Pca, Pentylene Glycol, Phenoxyethanol, Phenylalanine, Plukenetia Volubilis Seed Oil, Polysorbate 60, Proline, Prunus Amygdalus Dulcis (Sweet Almond) Seed Extract, Schinziophyton Rautanenii Kernel Oil, Sclerocarya Birrea Seed Butter, Sclerocarya Birrea Seed Oil, Serine, Sodium Hyaluronate Crosspolymer, Sodium Lactate, Sodium Pca, Sorbitan Isostearate, Sorbitan Olivate, Squalane, Terminalia Ferdinandiana Fruit Extract, Threonine, Tocopherol, Valine, Water/Aqua/Eau, Zea Mays (Corn) Oil",https://cdn1.skinsafeproducts.com/photo/716AAA062BC4BC/large_1619033452.jpeg?1619033452,https://www.skinsafeproducts.com/drunk-elephant-sili-body-lotion-8-fl-oz-240-ml
1-200.csv,"Drunk Elephant A-Passioni Retinol Cream, Reboot & Smooth, 1 fl oz/30 mL",Drunk Elephant,Anti-Aging/Anti-Wrinkle,Anti-Wrinkle,"Bambusa Vulgaris Leaf/Stem Extract, Brassica Oleracea Acephala Leaf Extract, Brassica Oleracea Italica (Broccoli) Extract, Caprylic/Capric Triglyceride, Caprylyl Glycol, Carbomer, Carthamus Tinctorius (Safflower) Seed Oil, Ceramide Np, Ceteareth-20, Cetearyl Alcohol, Cetyl Ethylhexanoate, Cetyl Palmitate, Chlorhexidine Digluconate, Chlorphenesin, Chrysin, Coco-Caprylate/Caprate, Coconut Alkanes, Ethylhexylglycerin, Glucosamine Hci, Glycerin, Glyceryl Stearate, Glycine Soja (Soybean) Oil, Jojoba Esters, Laureth-23, Lauric Acid, Linoleic Acid, Linolenic Acid, N-Hydroxysuccinimide, Niacinamide, Olea Europaea (Olive) Fruit Oil, Oryza Sativa (Rice Bran) Extract, Palmitoyl Hexapeptide-12, Palmitoyl Tetrapeptide-7, Palmitoyl Tripeptide-1, Passiflora Edulis Seed Oil, Pentylene Glycol, Persea Gratissima (Avocado) Oil, Phenoxyethanol, Physalis Pubescens Fruit Juice, Phytosphingosine, Phytosterols, Pisum Sativum (Pea) Extract, Polysorbate 20, Potassium Sorbate, Propanediol, Prunus Armeniaca (Apricot) Kernel Oil, Retinol, Sclerocarya Birrea Seed Oil, Simmondsia Chinensis (Jojoba) Seed Oil, Sodium Hyaluronate Crosspolymer, Sodium Hydroxide, Steareth-20, Stearic Acid, Stearyl Glycyrrhetinate, Tetrahexyldecyl Ascorbate, Tocopherol, Tocopheryl Acetate, Trehalose, Trideceth-6 Phosphate, Trisodium Ethylenediamine Disuccinate, Water/Aqua/Eau, Xanthophylls",https://cdn1.skinsafeproducts.com/photo/3564D7ED11F606/large_1622402449.jpeg?1622402449,https://www.skinsafeproducts.com/drunk-elephant-a-passioni-retinol-cream-reboot-smooth-1-fl-oz
1-200.csv,"Drunk Elephant F-Balm Electrolyte Waterfacial Masque Hydrant, 1.69 fl oz/ 50 ml",Drunk Elephant,Face,Nighttime Moisturizers,"Adenosine, Ammonium Acryloyldimethyltaurate/Vp Copolymer, Ascorbyl Palmitate, Behenic Acid, Caprooyl Phytosphingosine, Caprooyl Sphingosine, Caprylyl Glycol, Ceramide Ap, Ceramide Eop, Ceramide Eos, Ceramide Np, Ceramide Ns, Ceteareth-25, Cetyl Alcohol, Chlorphenesin, Cholesterol, Citric Acid, Coco-Caprylate/Caprate, Coconut Alkanes, Cocos Nucifera (Coconut) Water, Creatine, Ethylhexylglycerin, Ferulic Acid, Glycerin, Glyceryl Caprylate, Hydroxypropyl Methylcellulose, Hydroxytyrosol, Inositol, Linoleic Acid, Linum Usitatissimum (Linseed) Seed Oil, Magnesium Pca, Mannitol, Microcrystalline Cellulose, Niacinamide, Olive Oil Glycereth-8 Esters, Opuntia Tuna Fruit Extract, Pentylene Glycol, Phenoxyethanol, Phospholipids, Potassium Sorbate, Propanediol, Quercetin, Sclerocarya Birrea Seed Butter, Sclerocarya Birrea Seed Oil, Simmondsia Chinensis (Jojoba) Seed Oil, Sodium Benzoate, Sodium Hyaluronate, Sodium Hyaluronate Crosspolymer, Sodium Pca, Sorbitol, Squalane, Sucrose, Tocopherol, Trehalose, Water/Aqua/Eau, Xanthan Gum, Zea Mays (Corn) Oil",https://cdn1.skinsafeproducts.com/photo/D87286DAAD58E1/large_1579018675.jpeg?1579018675,https://www.skinsafeproducts.com/drunk-elephant-f-balm-electrolyte-waterfacial-masque-hydrant-1-69-fl-oz-50-ml
1-200.csv,"Drunk Elephant B-Hydra Intensive Hydration Gel, Pineapple Ceramide, 1.69 fl oz/50 mL",Drunk Elephant,Skin Treatments,Serums,"Ammonium Acryloyldimethyltaurate/Vp Copolymer, Ananas Sativus (Pineapple) Fruit Extract, Berberis Vulgaris Root Extract, Caprylyl Glycol, Chlorphenesin, Citric Acid, Citrullus Lanatus (Watermelon) Fruit Extract, Coco-Caprylate/Caprate, Coconut Alkanes, Cyclodextrin, Dipotassium Glycyrrhizate, Ethylhexylglycerin, Glycerin, Hydroxyproline, Lens Esculenta (Lentil) Fruit Extract, Niacinamide, Panthenol, Pentylene Glycol, Phenoxyethanol, Pyrus Malus (Apple) Fruit Extract, Sclerocarya Birrea Seed Oil, Sodium Hyaluronate, Sodium Hyaluronate Crosspolymer, Sodium Lactate, Sodium Pca, Trisodium Ethylenediamine Disuccinate, Water/Aqua/Eau, Wheat Amino Acids",https://cdn1.skinsafeproducts.com/photo/CD5EBCBC70D8D4/large_1535560103.jpeg?1535560103,https://www.skinsafeproducts.com/drunk-elephant-b-hydra-intensive-hydration-gel
